index,hot,title,href
1,,投资20年的进化历程与心得,http://xueqiu.com/1095402045/301368372
2,,通威股份：光伏硅料之王，高处不胜寒,http://xueqiu.com/1162446352/301218176
3,,江苏银行2024年中报简评：营收、规模、业绩增速符合预期,http://xueqiu.com/2466842102/301361225
4,,【JIN观医宏】通过美国医保谈判聊聊中国全民医疗大方向.,http://xueqiu.com/7875228039/301312839
5,,变革能力，平安的隐形护城河,http://xueqiu.com/4740762676/301258607
6,,药明康德VS凯莱英 十年财报和估值对比分析,http://xueqiu.com/1599713542/301251951
7,,一文看懂腾讯股本变化玄机！细数五年来腾讯股权激励与回购,http://xueqiu.com/1833845374/301227030
8,,刷题适度，但别过度,http://xueqiu.com/2245748859/301233806
9,,港股创新药龙头的巨大预期差,http://xueqiu.com/9518372158/301229074
10,,加盟金店能挣多少钱？,http://xueqiu.com/2227093928/300916056
11,,冰火两重天,http://xueqiu.com/6146592061/301164070
12,,优质银行股的股息最可靠,http://xueqiu.com/1707706450/301068022
13,,闲时为农 战时为兵,http://xueqiu.com/1038878653/301145024
14,,短视频让企鹅升级了吗？,http://xueqiu.com/8258019402/301043016
15,,周期的糖，不那么周期的中粮,http://xueqiu.com/6622278320/301021378
16,,把握住流动性塌陷提供的捡钱机会,http://xueqiu.com/5135726117/300895127
17,,大公司半年报解读：AI这碗饭，工业富联端得很稳,http://xueqiu.com/9241169410/300976512
18,,对不同医药细分领域业务本质的一些思考,http://xueqiu.com/3770558188/301012258
19,,白马股出清，市场才会触底！~~ 出清时间推算,http://xueqiu.com/1095402045/301024032
20,,居民到底为啥不消费,http://xueqiu.com/7024080666/301013058
