index,hot,title,href
1,11885970,罗滕：姆巴佩已成为普通球员
2,11436785,从再见爱人看懂婚姻财产分割问题
3,11315305,铭记 是最好的致敬
4,11293601,一次性讲清楚众病之王癌症
5,10717740,外交部回应一记者因间谍罪获刑
6,10564346,四平警事普法宣传上新了
7,9440309,如何看待优衣库称没有用新疆棉
8,9437053,如何看待再见爱人麦琳引争议
9,9435781,在九地试点设立外商独资医院
10,9302442,杨溢CBA首秀
11,9228814,普京向默克尔道歉
12,9185579,央视蛇年春晚主题主标识发布
13,9170295,俄军动用神秘武器
14,9110021,武汉马拉松澄清中签率相关谣言
15,9106341,登陆少年危险的爱手势舞
16,9099335,TES官宣369续约
17,9081017,WBG官宣Crisp离队
18,8989849,俄乌战场背后的各方博弈
19,8956042,俄罗斯经济保卫战
20,8951871,安以轩老公终审获刑13年
21,8924256,儿童发热该如何正确处理
22,8893159,傅首尔呼吁理性看待再见爱人
23,8712352,我是刑警叶茂生牺牲
24,8703876,杨利伟等人向志愿军烈士三鞠躬
25,8604110,男乒备战混团世界杯
26,8599767,黎以停火背后以色列有何盘算
27,8598393,乌能源设施遭大规模空袭
28,8514040,南京地铁隧道内出现野猪
29,8422242,困境中的哪吒还能自救吗
30,8110699,对话格斗女中医石铭
31,8104910,林志玲晒与儿子合照
32,7954123,大冰帮脑瘫女孩追星薛之谦
33,7870617,戴大梨李三金结婚啦
34,7867941,刀郎演唱会厦门站
35,7857809,李宇春王睿卓茶花开了
36,7813081,网友称再见爱人疑似补录
37,7789628,当貉撞见东北虎
38,7775766,张鼎pay姐订婚
39,7772628,人类幼崽穿得好像小手办
40,7769935,第11批在韩志愿军烈士遗骸安葬
41,7766034,男生拍照的意义大于照片本身
42,7744214,新版元歌试玩
43,7743630,NewJeans宣布解约
44,7739221,谁能拒绝一只糖霜小狗
45,7738566,入冬加强版情侣穿搭
46,7720437,重新开启新生活BGM
47,7719223,周密发文回应分手原因
48,7713755,大爷：完了遇上对手了
49,7704788,美人鱼的夏天有多抽象
50,7689644,为喜欢的音乐配一个视频
