index,hot,title,href
1,足球,新鹏城2-2沧州，奥斯卡第100分钟绝平，加西亚斩队史中超首球,https://www.dongqiudi.com/article/4127446
2,足球,萨尔瓦多：休整时间不占优，但我们会克服，带着必胜决心去拼,https://www.dongqiudi.com/article/4127690
3,篮球,NBA最新MVP榜：约基奇持续领跑，东契奇升至第2，AD进入前10,https://www.dongqiudi.com/article/4127688
4,足球,足坛球队身价榜：曼城12.7亿欧居首，阿森纳第二皇马第三,https://www.dongqiudi.com/article/4127670
5,足球,鲁媒：吉翔正常合练；明天彭欣力和崔康熙一起参加赛前发布会,https://www.dongqiudi.com/article/4127667
6,足球,扎心！拜仁官方晒对阵多特蒙德战绩：近11战保持不败,https://www.dongqiudi.com/article/4127666
7,足球,迈阿密国际助教：梅西将缺战纽约城，希望他在下周中复出,https://www.dongqiudi.com/article/4127662
8,篮球,网传上海男篮郭昊文涉强奸案，媒体人：他将无限期离队,https://www.dongqiudi.com/article/4127655
9,足球,糜昊伦：陕西足球已很久没有过德比战了，希望为球迷带来胜利,https://www.dongqiudi.com/article/4127632
10,足球,德天空：科贝尔肠胃不适未能及时康复，无缘对阵拜仁,https://www.dongqiudi.com/article/4127633
11,足球,津媒：长春低温天气着实让津门虎很头疼，客场比赛难度非常大,https://www.dongqiudi.com/article/4127641
12,足球,天赋异禀，今夏加盟拜仁的小将伊兰昆达上演生涯首次帽子戏法,https://www.dongqiudi.com/article/4127636
13,足球,阿尔特塔：永远喜欢和瓜帅共事的感觉；我们想要证明自己,https://www.dongqiudi.com/article/4127628
14,足球,RMC：姆巴佩可能要到8月才能在皇马完成亮相,https://www.dongqiudi.com/article/4127595
15,足球,肇俊哲：拿到一分也很提士气，感谢我的团队和远征的球迷们,https://www.dongqiudi.com/article/4127617
16,足球,塔托：拿到中超第一分却感到悲伤，我觉得我们配得上一场胜利,https://www.dongqiudi.com/article/4127616
17,篮球,赢球心情好！杜锋社媒晒与球迷的大合照，感谢大家的支持,https://www.dongqiudi.com/article/4127613
18,足球,卡拉格：利物浦输给曼联不一定是坏事，这有助于他们联赛争冠,https://www.dongqiudi.com/article/4127611
19,足球,间歇期综合症？国安上赛季间歇期之后首战仅取得1胜2负,https://www.dongqiudi.com/article/4127604
20,足球,媒体人：足协应该考虑说服沧州前锋奥斯卡归化国足,https://www.dongqiudi.com/article/4127598
