index,hot,title,href
1,5.1万,这种上海xs要求不高啊，还可以出装修钱,http://club.kdslife.com/t_11234949.html
2,5.4万,很多的发不了,http://club.kdslife.com/t_11234910.html
3,4.2万,公司前台迟到2次了，书面警告签过2次，昨天人事通知她解除合同,http://club.kdslife.com/t_11235039.html
4,3.8万,和有娃少妇相亲，并想用1800块发生点什么的故事,http://club.kdslife.com/t_11234863.html
5,3.8万,大闸蟹现在年轻人都不吃啊,http://club.kdslife.com/t_11234915.html
6,3.3万,现在自如全托管套路真深！！,http://club.kdslife.com/t_11235060.html
7,3.2万,定居青浦朱家角的香港小夫妻，这次又被香港自媒体采访了。,http://club.kdslife.com/t_11235069.html
8,3.1万,星巴克为啥降价了？,http://club.kdslife.com/t_11235097.html
9,2.9万,其实外来妹还是比较主动的，真的不难,http://club.kdslife.com/t_11234992.html
10,3.0万,星巴克是不是被瑞幸打败了？,http://club.kdslife.com/t_11234864.html
11,2.5万,上海最穷小区，里面居民停车停免费马路，且都罩子罩好,http://club.kdslife.com/t_11235006.html
12,2.6万,我现在一点出去的欲望都没有。,http://club.kdslife.com/t_11234890.html
13,2.7万,王自如舔到董明珠的心坎儿里去了,http://club.kdslife.com/t_11235117.html
14,2.6万,平安也要大裁员了,http://club.kdslife.com/t_11234884.html
15,2.4万,被移除中华老字号的品牌，老半斋也上榜了？,http://club.kdslife.com/t_11234939.html
16,2.2万,外地房价五千以下的所有城市，只要来上海大概六年回家就是富豪,http://club.kdslife.com/t_11234930.html
17,2.2万,宋庆龄幼儿园学费3900一个月，我一个月工资1w2，要上吗,http://club.kdslife.com/t_11235177.html
18,2.2万,为啥美国大片《惊奇队长2》观者寥寥,http://club.kdslife.com/t_11235094.html
19,2.3万,李佳琦双十一收入250亿,http://club.kdslife.com/t_11235162.html
20,2.3万,三巨头合作的车，果然大卖！,http://club.kdslife.com/t_11235040.html
