index,hot,title,href
1,11999109,王楚钦3:0战胜赵大成
2,11801010,欧舒丹退市
3,11798364,人民军队淬火成钢
4,11708703,新型战机已在辽宁舰放飞
5,10916204,下周二就是中秋节了
6,10613903,这辈子最蠢的想法就是快点长大
7,9451442,三千年前的家长辅导作业belike
8,9306927,苹果16 苹果石榴
9,9241756,白鹿镜头下的陆虎陈曌旭婚礼
10,9230266,孙颖莎3:1朱芊曦晋级四强
11,9157888,渐进式延迟退休方案公布
12,9128168,iPhone 16开售
13,9118442,印度不知名疾病已致16人死亡
14,9113231,中国景洪水电站泄洪系谣言
15,9111097,延迟退休年龄对照表
16,9098476,凡人歌打工姐整治泰迪哥
17,8720505,朱丹这是真内涵
18,8658825,张律小霸王结婚啦
19,8629475,李尚福被罢免全国人大代表职务
20,8513377,可自愿选择弹性提前退休
21,8506472,iPhone 16系列怎么选
22,8119001,普京撂狠话公开警告西方
23,7989152,腾讯回应办公室亲昵搂抱事件
24,7957053,美反华议员破大防
25,7819155,陈赫在欧洲机场被掉包行李箱
26,7795117,南方人是怎么吃月饼的
27,7754199,月饼大测评
28,7720394,最近流行一种很野的变装
29,7710010,周杰伦深圳演唱会
30,7709623,吴谨言洪尧官宣结婚
31,7709114,华为新手机价格引热议
32,7707038,好强的面张力
33,7702909,月亮圆了该回家了
34,7692761,林俊杰重庆抢票
35,7680407,渤海潍坊港实弹射击
36,7679866,第三视角的小徐
37,7672016,秋天的第一场公路旅行
38,7669792,偶遇杨幂室外放烟花过生日
39,7666195,月饼越来越难卖了吗
40,7660935,Cookie手势舞
41,7659234,真养鸡的人用不上特效
42,7658457,谁能拒绝一只微笑唇小咪
43,7657157,你我皆凡人 生在人世间
44,7655406,用执子之手打开情侣合照
45,7652994,我怕控制不住就会给你拥抱
46,7651274,各行各业版踢腿运镜慢动作
47,7637303,长大了吗 世界不完美吧
48,7636053,贝碧嘉将给沪浙闽等地带去强风雨
49,7631318,准备好一键开启中秋了么
50,7630697,今个高兴明个开心
