index,hot,title,href
1,4.7万,还好咯！！！,http://club.kdslife.com/t_11313602.html
2,4.2万,发财了，发财了，发财了！,http://club.kdslife.com/t_11313565.html
3,4.2万,深圳年轻子肛检后称被性侵，索赔20万,http://club.kdslife.com/t_11313623.html
4,4.0万,宇航员已崩溃,http://club.kdslife.com/t_11313881.html
5,3.5万,老外撩妹还是有优势的,http://club.kdslife.com/t_11313675.html
6,3.8万,把小姑娘逼疯的是老板还是顾客,http://club.kdslife.com/t_11313806.html
7,3.6万,对话Manner前员工：身心俱疲，公司会用各种方法克扣工时,http://club.kdslife.com/t_11313671.html
8,3.5万,夜场的xs一般衰老期是几年,http://club.kdslife.com/t_11313683.html
9,3.5万,这牌子为啥现在没人买了,http://club.kdslife.com/t_11313700.html
10,3.2万,林志玲为日本棒球比赛开球,http://club.kdslife.com/t_11313823.html
11,3.3万,天安千树怎么办哦、看了太着急了、今天是周末啊,http://club.kdslife.com/t_11313856.html
12,3.0万,小仙女高考完2天用掉老妈3个月工资,http://club.kdslife.com/t_11313911.html
13,2.9万,我要是女的，我也天天瑜伽裤出街,http://club.kdslife.com/t_11313820.html
14,2.6万,你们发现没？十几元的快餐只有男人在吃，三四十的咖啡都是女人在排队,http://club.kdslife.com/t_11313785.html
15,2.6万,现在网课老师都需要卖肉了……,http://club.kdslife.com/t_11313632.html
16,2.5万,39名阿里数学参赛选手联名要求公开姜萍的预赛答卷,http://club.kdslife.com/t_11313850.html
17,2.2万,冷知识：真实的美国佬比毛子怂多了，和tf蛮像的,http://club.kdslife.com/t_11313559.html
18,2.0万,这点鳝丝，饭店卖多少？,http://club.kdslife.com/t_11313665.html
19,2.2万,双立人进了国内就,http://club.kdslife.com/t_11313656.html
20,2.1万,曹可凡为王冠和李先生送上祝福,http://club.kdslife.com/t_11313593.html
