index,hot,title,href
1,,借楼咨询，情感贴,https://bbs.byr.cn/article/Friends/2047775
2,,把你手机号后三位留下来，一样的就搞对象吧~~~,https://bbs.byr.cn/article/Constellations/462125
3,,国院大一新生，越来越后悔来北邮，求开导...,https://bbs.byr.cn/article/GoAbroad/395033
4,,事业单位合同工跟国企一个性质吧？,https://bbs.byr.cn/article/WorkLife/1207105
5,,【校招offer决赛圈】腾讯 vs 阿里云 vs 山东邮政 vs 人寿杭研,https://bbs.byr.cn/article/Job/2201414
6,,我有办法送给省部级官员一幅山水画，并且他一定会接收,https://bbs.byr.cn/article/Talking/6406585
7,,【问题】octave不好吗？,https://bbs.byr.cn/article/Matlab/13550
8,,爱打COC部落战的北邮人快来！,https://bbs.byr.cn/article/OnlineGame/43768
