index,hot,title,href
1,16.4万,押中了，PP暴涨,http://club.kdslife.com/t_11240923.html
2,2.5万,山上生女儿的大户要提高警惕,http://club.kdslife.com/t_11240718.html
3,2.0万,转眼！！！！！！！,http://club.kdslife.com/t_11240928.html
4,1.9万,大俄最新决定！这次看看还有谁反对？,http://club.kdslife.com/t_11240779.html
5,1.8万,给斌斌看我买宝马了,http://club.kdslife.com/t_11240723.html
6,2.0万,上海一员工因一个微笑表情，谩骂同事被公司开除！法官点评亮了,http://club.kdslife.com/t_11240725.html
7,1.6万,乡亲们啊~~~~~~市区代步实在是太香了呀,http://club.kdslife.com/t_11240778.html
8,1.8万,丰田来搞事了，弯道要变直道,http://club.kdslife.com/t_11240790.html
9,1.4万,探头抓电瓶车违章了,http://club.kdslife.com/t_11240732.html
10,1.4万,辟谣了,http://club.kdslife.com/t_11240691.html
11,1.3万,白酒时代结束了，股票快出,http://club.kdslife.com/t_11240722.html
12,1.6万,卢浦大桥车祸、感觉人都掉下去了,http://club.kdslife.com/t_11240891.html
13,1.4万,经济一塌糊涂的美国，道指就要创历史新高了。,http://club.kdslife.com/t_11240705.html
14,1.4万,宝龙地产也完了？不是挺famous的吗,http://club.kdslife.com/t_11240698.html
15,1.2万,家人们第一次开新车擦了轮毂,http://club.kdslife.com/t_11240710.html
16,9965,华为明年5月全部搬青浦。。。青浦要起飞了,http://club.kdslife.com/t_11240927.html
17,1.2万,天冷了，不能两轮通勤了，封车……,http://club.kdslife.com/t_11240738.html
18,1.1万,为何现金商场都不行了,http://club.kdslife.com/t_11240729.html
19,8430,今年秋冬季节，过本命年的女生流行穿各种大红色服饰，说能带来好运和幸福，你们觉得穿红有其他意义么,http://club.kdslife.com/t_11240701.html
20,8525,现在就是股市的底部,http://club.kdslife.com/t_11240716.html
