index,hot,title,href
1,足球,曼联vs布伦特福德：马奎尔搭档埃文斯，奥纳纳、芒特出战,https://www.dongqiudi.com/article/3768181
2,足球,切尔西客战伯恩利：恩佐领衔，斯特林、加拉格尔出战,https://www.dongqiudi.com/article/3768204
3,足球,韩国U23 vs 日本U23 比赛动态,https://www.dongqiudi.com/article/3768095
4,足球,卢顿 vs 托特纳姆热刺 比赛动态,https://www.dongqiudi.com/article/3768045
5,足球,皇马vs奥萨苏纳：魔笛、贝林厄姆出战，卡马文加、门迪首发,https://www.dongqiudi.com/article/3767436
6,足球,国际米兰 vs 博洛尼亚 比赛动态,https://www.dongqiudi.com/article/3768246
7,,富勒姆vs谢菲尔德联：威廉、莱诺首发，卢克-托马斯、麦克布涅出战,https://www.dongqiudi.com/article/3768269
8,足球,亚运决赛韩国1-1日本半场数据：射门次数7-3，控球率53%-47%,https://www.dongqiudi.com/article/3768258
9,足球,又伤了，跟队记者：瓦拉内因小伤缺席曼联今晚比赛,https://www.dongqiudi.com/article/3768257
10,,埃弗顿vs伯恩茅斯：皮克福德、阿什利-扬首发，内托、索兰克出战,https://www.dongqiudi.com/article/3768255
11,足球,哈维：佩德里接近复出；让克里斯滕森出任后腰不是首选,https://www.dongqiudi.com/article/3768250
12,,半场战报：加的斯0-0赫罗纳,https://www.dongqiudi.com/article/3768235
13,足球,巴黎vs雷恩大名单：姆巴佩领衔，G-拉莫斯、登贝莱在列,https://www.dongqiudi.com/article/3768231
14,足球,亚运韩日首发总身价3080万比258万欧，平均年龄23.3比21.5岁,https://www.dongqiudi.com/article/3768229
15,,范德文收获热刺生涯首球，麦迪逊赛季第5次助攻，独...,https://n.dongqiudi.com/webapp/tops.html?id=3768224
16,体坛,实至名归！覃海洋、张雨霏共同当选杭州亚运会MVP,https://www.dongqiudi.com/article/3768223
17,体坛,第199金！亚运会女排决赛：中国女排3-0击败日本女排成功夺金,https://www.dongqiudi.com/article/3768221
18,足球,半场战报：韩国1-1日本，内野航太郎闪击，郑优营头球扳平,https://www.dongqiudi.com/article/3768019
19,足球,北伐首战面对伯恩利，你觉得结果会是？,https://n.dongqiudi.com/webapp/tops.html?id=3768213
20,,奥格斯堡vs达姆施塔特98：贝廖、凯文-姆巴布首发，斯卡克、巴德尔出战,https://www.dongqiudi.com/article/3768210
