index,hot,title,href
1,足球,曼联 vs 布伦特福德 比赛动态,https://www.dongqiudi.com/article/3768466
2,足球,伯恩利 vs 切尔西 比赛动态,https://www.dongqiudi.com/article/3768484
3,足球,韩国2-1逆转日本实现亚运男足三连冠，郑优营、曹永旭破门,https://www.dongqiudi.com/article/3768245
4,足球,半场战报：皇马1-0奥萨苏纳，贝林厄姆破门，卡瓦哈尔送助攻,https://www.dongqiudi.com/article/3768742
5,体坛,创历史！杭州亚运会中国代表团已获200金，破单届金牌数纪录,https://www.dongqiudi.com/article/3768296
6,体坛,蔡斌：我非常相信我选的球员，相信我的团队能够完成任务,https://www.dongqiudi.com/article/3768772
7,,RB莱比锡 vs 波鸿 比赛动态,https://www.dongqiudi.com/article/3768315
8,足球,尤文vs都灵：基恩、米雷蒂首发，科斯蒂奇、麦肯尼出战,https://www.dongqiudi.com/article/3768765
9,,生涯前8场西甲联赛攻入7球，贝林厄姆追平了C罗在...,https://n.dongqiudi.com/webapp/tops.html?id=3768760
10,足球,万圣节特别版球衣 | 我那2023/24赛季万圣...,https://n.dongqiudi.com/webapp/tops.html?id=3768759
11,,多特蒙德 vs 柏林联合 比赛动态,https://www.dongqiudi.com/article/3768323
12,,国际米兰vs博洛尼亚球员评分：刘易斯-弗格森8.0分，恩多耶6.1分,https://www.dongqiudi.com/article/3768753
13,,皇家马德里 vs 奥萨苏纳 比赛动态,https://www.dongqiudi.com/article/3768538
14,足球,劳资从魔鬼赛程里杀出来啦！,https://n.dongqiudi.com/webapp/tops.html?id=3768740
15,,斯图加特 vs 沃尔夫斯堡 比赛动态,https://www.dongqiudi.com/article/3768310
16,足球,半场战报：富勒姆0-0谢菲尔德联，巴沙姆严重扭伤离场,https://www.dongqiudi.com/article/3768730
17,,阿科多 vs 利雅得新月 比赛动态,https://www.dongqiudi.com/article/3768717
18,足球,和瓦尔加一起动起来,https://n.dongqiudi.com/webapp/tops.html?id=3768710
19,足球,剑南春｜国米2-2博洛尼亚，劳塔罗世界波+送点，齐尔克泽破门,https://www.dongqiudi.com/article/3768695
20,,战平博洛尼亚，来圈子说说你对本场比赛的看法吧,https://www.dongqiudi.com/article/3768693
