index,hot,title,href
1,199.6万,“双线”调查风波未完，坐拥逾20家上市公司的富士康资本帝国有多大？,https://www.huxiu.com/article/2252133.html
2,43.9万,字节跳入混战,https://www.huxiu.com/article/2214850.html
3,88.1万,中国支原体感染大爆发？也许只是假象,https://www.huxiu.com/article/2250862.html
4,18.8万,支持《完蛋！我被美女包围了！》的玩家，就是下头男吗？,https://www.huxiu.com/article/2254698.html
5,54.2万,李彦宏凭什么打动大药厂？,https://www.huxiu.com/article/2216859.html
6,15.1万,星巴克的边界与江山,https://www.huxiu.com/article/2253090.html
7,99.0万,日本索尼，凭什么骂中国电动车？,https://www.huxiu.com/article/2242198.html
8,13.9万,“线上税”正在大举收割消费者,https://www.huxiu.com/article/2256832.html
9,13.3万,年轻人的不快乐已经阻碍美国经济增长,https://www.huxiu.com/article/2256023.html
10,11.9万,美国暂停加息，有什么影响？,https://www.huxiu.com/article/2254239.html
11,11.5万,三线小城，兀自风流,https://www.huxiu.com/article/2254236.html
12,10.8万,新一轮扩容将至：江苏、山东、浙江拼“后备实力”,https://www.huxiu.com/article/2253509.html
13,33.7万,国美北京总部实拍：大量楼层黑灯，员工寥寥无几，租户有意搬出,https://www.huxiu.com/article/2251240.html
14,9.3万,云南农民，忙着发财,https://www.huxiu.com/article/2254685.html
15,29.8万,看到一万多同行倒闭后，烘焙品牌决定“集体涨价”,https://www.huxiu.com/article/2253432.html
