index,hot,title,href
1,鹭岛生活,[02-28]离异的女子是不是很难再找了,http://bbs.xmfish.com/read-htm-tid-18152838.html
2,鹭岛生活,"[02-28]一年完成三连跳,让人汗颜",http://bbs.xmfish.com/read-htm-tid-18152741.html
3,鹭岛生活,[02-28]当初喜欢的初中女同学过得不错，还有点女人味,http://bbs.xmfish.com/read-htm-tid-18152758.html
4,鹭岛生活,奇葩，医院成什么样了,http://bbs.xmfish.com/read-htm-tid-18152655.html
5,鹭岛生活,难道真的是我错了？？？,http://bbs.xmfish.com/read-htm-tid-18152664.html
6,鱼鱼爆料,海沧天竺山公园有商家私自圈地,http://bbs.xmfish.com/read-htm-tid-18152706.html
7,鹭岛生活,2021年底，8.8万卖出的房子，6万回购回来,http://bbs.xmfish.com/read-htm-tid-18152922.html
8,鹭岛生活,听说厦门房价要开始缓慢下降了？有知道内幕的吗？小区中介又倒闭了,http://bbs.xmfish.com/read-htm-tid-18152928.html
9,鹭岛生活,请教妈妈们，小孩的袜子脏，你们都怎么洗的？我怎么都洗不干净？,http://bbs.xmfish.com/read-htm-tid-18152697.html
10,鹭岛生活,厦门的初中生是不是取消晚自习了？,http://bbs.xmfish.com/read-htm-tid-18152819.html
