index,hot,title,href
1,11126176,台湾青年谈赖清德就职演说
2,10592542,鸣潮剧情
3,10456722,今年夏收夏种期间总体天气较好
4,10409309,解放军喊话台舰：不要为台独卖命
5,9522123,下下周五高考
6,9509398,和最好的朋友成了网友
7,8495637,打工人也有自己的甄嬛传
8,8480241,龙舟赛主打一个气势
9,8469083,原来世界上没有蓝色玫瑰
10,8464713,狐妖小红娘月红篇开播
11,8446010,张照洋成功求婚李斯曼
12,8385925,日本能登半岛地震致260死
13,8373000,河南辟谣小麦单产破2500公斤
14,8317426,五竹大战影子
15,8313171,亚当被刘柏辛带去嗦粉
16,8289132,台岛周边演习现场画面
17,8279565,东部战区灵魂提问
18,8264774,市监总局挂牌督办连云港鬼秤事件
19,8234365,霍启仁求婚成功
20,8197269,官方调查上访村民被送精神病院
21,8196495,章子怡戛纳电影节
22,8189788,卫龙就魔芋爽克重不足道歉
23,8141158,庆余年2开启春闱副本
24,8129633,小鬼自曝曾因长发被网暴
25,8124778,看庆余年毕彦君赖御史泪目了
26,8116276,马斯克“友妻门”最新爆料
27,8115211,赖清德必将被钉到历史的耻辱柱上
28,8088683,鸣潮全球公测开启
29,8081164,又被安徽高速的服务暖到
30,8021754,此次台岛周边联合演习有何特点
31,8009449,过度健身可能会显老
32,7978044,榴莲自由真的来了
33,7969027,朴宝蓝尸检报告公布
34,7955178,警方通报12岁失联男孩身亡
35,7954916,东部战区位台岛周边开展演习
36,7897854,当GAI第一次见周杰伦
37,7880163,台海没有所谓中间线
38,7823915,高盛CEO拉响警报
39,7792584,欧盟或对中国电动车加关税
40,7779946,这首歌好像真的要火了
41,7768638,雷军与小米高管拍全家福
42,7764668,INFJ的人生理想
43,7763356,赤道几内亚总统将访华
44,7755683,左航 老奶奶
45,7746715,模仿海来阿木唱腔
46,7737357,官方回应“精神病患者砍伤8人”
47,7734371,你太勇敢了一路走来没说苦
48,7714391,玫瑰的故事终于要来了
49,7701286,苍白的话刺痛着耳朵
50,7701051,ICE棉花期货触及涨停
