index,hot,title,href
1,79,我这情况，一年三节送岳父岳母多少钱合适-删帖,https://www.guozaoke.com/t/106350
2,76,哈哈哈，奔驰车插队的事情已经反转了,https://www.guozaoke.com/t/106433
3,74,这次冰灾堪比 08 年雪灾吧,https://www.guozaoke.com/t/106465
4,62,股灾了,https://www.guozaoke.com/t/106321
5,60,从武汉成都近3年GDP对比看，武汉已经落后成都2年。,https://www.guozaoke.com/t/106305
6,59,同学婚礼现场直接被彩礼加价,https://www.guozaoke.com/t/106315
7,52,最近的难题是卖保险的亲戚给的，买肯定是不买的，不想撕破脸又没有更好的办法,https://www.guozaoke.com/t/106310
8,52,现在大家觉得什么资产是最保值的？,https://www.guozaoke.com/t/106353
9,44,有朋友在电视机上，用过DTMB地面波卫星接受信号器的吗？,https://www.guozaoke.com/t/106393
10,44,湖北在应对大雪方面措施严重不足,https://www.guozaoke.com/t/106488
