index,hot,title,href
1,172,无臂男子免费乘武汉地铁被要求出示残疾证,https://www.guozaoke.com/t/107842
2,79,这是不是光谷有轨电车第一次压到人,https://www.guozaoke.com/t/107786
3,76,老婆怀孕1个月了，目前我们两个人住，我能为她做些什么？,https://www.guozaoke.com/t/107753
4,66,带团队碰瓷地铁的无臂男子，已经开始直播带货了,https://www.guozaoke.com/t/107864
5,60,"3月22日早上,藏龙岛美院附近发生命案,两死一伤!",https://www.guozaoke.com/t/107862
6,54,有无情感大师，指导一波！,https://www.guozaoke.com/t/107878
7,49,武汉当前最具代表性的本土互联网公司,https://www.guozaoke.com/t/107807
8,48,关于汉马人工降雨，各位国师怎么看,https://www.guozaoke.com/t/107847
9,47,中建星光城居住体验如何？,https://www.guozaoke.com/t/107917
10,47,以前觉得我的瓶颈是钱，现在觉得我的瓶颈是上幼儿园的娃。,https://www.guozaoke.com/t/107749
