index,hot,title,href
1,87,武汉出租和萝卜快跑,https://www.guozaoke.com/t/110684
2,75,千万别买大通量无桶净水器加管线机的组合,https://www.guozaoke.com/t/110782
3,73,不谈价格只谈逼格，BBA和国产新势力电车相比，谁的逼格高？,https://www.guozaoke.com/t/110785
4,71,都是差不多20万左右落地，汉DMI和奥迪A4L选哪个？,https://www.guozaoke.com/t/110717
5,62,这个天气适合干什么,https://www.guozaoke.com/t/110877
6,61,前天电脑突然蓝屏了，找了小区下的千米快修，花了660,https://www.guozaoke.com/t/110744
7,55,作为外孙要帮忙吗？,https://www.guozaoke.com/t/110811
8,54,【后续】上次介绍对象后续,https://www.guozaoke.com/t/110885
9,54,回笼深漂or留武汉,https://www.guozaoke.com/t/110689
10,53,推荐一个性价比高的宜居城市，襄阳,https://www.guozaoke.com/t/110764
