index,hot,title,href
1,足球,官方：曼城在APT案件中完全胜诉，英超违反欧盟竞争法,https://www.dongqiudi.com/article/4595455
2,足球,英超官方：法庭两项裁决对曼城有利；将继续使用现有APT规则,https://www.dongqiudi.com/article/4595490
3,体坛,覃海洋未婚妻放出录音：覃海洋亲口承认在当军人时期嫖娼出轨,https://www.dongqiudi.com/article/4595188
4,足球,波特：埃文斯的比赛就像一堂防守示范课，他懂得利用自身优势,https://www.dongqiudi.com/article/4595644
5,足球,自宣，16岁南安普顿中场迈尔斯与曼城签约,https://www.dongqiudi.com/article/4595641
6,足球,伊涅斯塔发布退役预热视频，瓜迪奥拉、博斯克等人出镜,https://www.dongqiudi.com/article/4595603
7,足球,ESPN：滕哈格已与曼联高层沟通，他相信帅位暂时是安全的,https://www.dongqiudi.com/article/4595613
8,足球,金球奖官方发布：提名萨卡！,https://n.dongqiudi.com/webapp/tops.html?id=4595611
9,体坛,体坛晚报：覃海洋未婚妻曝光其出轨嫖娼；詹姆斯父子同台,https://www.dongqiudi.com/article/4595601
10,体坛,覃海洋未婚妻再发文：希望不以包庇和逃避的方式去解决问题,https://www.dongqiudi.com/article/4595577
11,足球,谁能夺魁？2024/25赛季欧洲金靴奖哈兰德、莱万领跑,https://www.dongqiudi.com/article/4595511
12,足球,孔德棋逢对手：科纳特蒙面造型到达克莱枫丹,https://www.dongqiudi.com/article/4595571
13,足球,莱万：什琴斯尼会很快适应巴萨；我最佩服C罗的斗志,https://www.dongqiudi.com/article/4595567
14,足球,国足包机？记者发布航班图：10月11日直飞青岛，仅需11小时,https://www.dongqiudi.com/article/4595541
15,体坛,斯诺克武汉赛：斯佳辉、张安达晋级，袁思俊将战丁俊晖,https://www.dongqiudi.com/article/4595528
16,足球,跟队记者：曼城反诉成功在一定程度上也能够释放纽卡的购买力,https://www.dongqiudi.com/article/4595520
17,足球,你爸是你偶像的偶像，乔治娜社媒晒出迷你罗穿加纳乔球衣照片,https://www.dongqiudi.com/article/4595512
18,足球,波兰主帅：我认为莱万将是西甲金靴；什琴斯尼太年轻不该退役,https://www.dongqiudi.com/article/4595519
19,足球,荷兰足坛传奇名宿内斯肯斯去世，享年73岁,https://www.dongqiudi.com/article/4595507
20,体坛,乒乓球亚锦赛男单签表出炉，王楚钦和张本智和同处上半区,https://www.dongqiudi.com/article/4595508
