index,hot,title,href
1,,政府工作报告再提“战略腹地建设”，中西部地区迎来新机遇,https://www.yicai.com/news/102014455.html
2,,拜登任内最后一次国情咨文演讲火力全开，13次“不点名”提到特朗普,https://www.yicai.com/news/102019795.html
3,,部分平台娃哈哈AD钙奶售罄、纯净水发货要等1个月！农夫山泉很受伤？,https://www.yicai.com/news/102012632.html
4,,今年财政政策：发1万亿特别国债，降赤字率、增专项债,https://www.yicai.com/news/102014200.html
5,,外交部：将对瑞士、爱尔兰、匈牙利、奥地利、比利时、卢森堡6国试行免签政策,https://www.yicai.com/news/102017638.html
6,,多地出手整治电动自行车乱象，人大代表建议尽快修订技术规范,https://www.yicai.com/news/102013131.html
7,,海景房被低价抛售，多地房东的度假投资“梦碎” | 楼市地理,https://www.yicai.com/news/102014942.html
8,,她经济｜宗馥莉、刘畅、刘舒琪，看民企二代女性接班人如何“扛大旗”,https://www.yicai.com/news/102019963.html
9,,一向直营的海底捞突然官宣开放加盟，原因是这样,https://www.yicai.com/news/102013229.html
10,,父亲辞世后宗馥莉首次公开亮相：娃哈哈要比消费者预期做得更好,https://www.yicai.com/news/102017323.html
