index,hot,title,href
1,61.4万,今年的国庆消费，和我想的不一样,https://www.huxiu.com/article/3530462.html
2,56.5万,80%的AI公司，就要凉凉了,https://www.huxiu.com/article/3524312.html
3,48.7万,“股市是我的提款机”，“股神奶奶”预言中国股市上万点不是梦,https://www.huxiu.com/article/3535056.html
4,46.8万,日本面临最大危机,https://www.huxiu.com/article/3537781.html
5,43.4万,上海楼市调控，拿出了自己的王炸底牌,https://www.huxiu.com/article/3525920.html
6,42.1万,波澜壮阔的大行情会走多远？,https://www.huxiu.com/article/3527372.html
7,38.7万,健身最大的变化，就是没有变化,https://www.huxiu.com/article/3524702.html
8,38.9万,机酒大跳水，为何依然吸引不来年轻人？,https://www.huxiu.com/article/3533957.html
9,30.4万,国庆假期，做点什么？,https://www.huxiu.com/article/3531023.html
10,25.9万,房贷利率降了，提前还贷的人怎么样了？,https://www.huxiu.com/article/3533425.html
11,29.3万,年轻人整顿婚礼：不接亲、没仪式，放个短片就干饭,https://www.huxiu.com/article/3539462.html
12,32.8万,风力发电机必须有叶片？不是，我的世界观被刷新了,https://www.huxiu.com/article/3538440.html
13,23.8万,港股大逆转，还要继续冲？,https://www.huxiu.com/article/3537775.html
14,27.2万,30多年经验的老股民说A股：热市场，冷思考,https://www.huxiu.com/article/3541975.html
15,23.0万,牛市疯了：3天赚了一百万，高兴得太早，回头发现“卖飞了”,https://www.huxiu.com/article/3538448.html
