index,hot,title,href
1,1095 万热度,广电总局要求，有线电视终端系统默认设置应为开机进入全屏直播，将带来哪些影响？,https://www.zhihu.com/question/632115932
2,405 万热度,如何看待佘诗曼主演的港剧《新闻女王》口碑大爆？,https://www.zhihu.com/question/631421558
3,239 万热度,中日韩外长时隔 4 年再聚首，达成了哪些共识？有哪些积极意义？,https://www.zhihu.com/question/632058136
4,229 万热度,有没有一个演好人一身正气，演坏人又让人恨得牙痒痒的那种演员？,https://www.zhihu.com/question/346249699
5,85 万热度,如何看待韶音 OpenFit 占领「不入耳蓝牙耳机」销售额第一，「不入耳」的耳机真的更舒适吗？,https://www.zhihu.com/question/623257593
6,48 万热度,曹保平的《涉过愤怒的海》到底讲了一个什么样的故事？,https://www.zhihu.com/question/631991598
7,45 万热度,怎么从技术角度理解，国产手机充电已经 66W 了，苹果手机还是 20W ？,https://www.zhihu.com/question/630787824
8,45 万热度,国考报名增加 40 多万，考研报名人数减少 36 万，考研报名人数三年来首次下降，这说明了什么？,https://www.zhihu.com/question/632066184
9,43 万热度,特斯拉诉「上海车展事件」车主名誉权侵权，一审要求车主赔 500 万，判赔 2000 元，如何看待此事？,https://www.zhihu.com/question/632096669
10,42 万热度,你有哪些 20 岁打死不穿，30 岁穿上真香的衣服？,https://www.zhihu.com/question/630322405
11,38 万热度,2024 年房价会继续跌吗？出现哪些迹象就可以决策买房？,https://www.zhihu.com/question/629455471
12,34 万热度,如何评价BABYMONSTER的出道单曲《BATTER UP》及其MV？,https://www.zhihu.com/question/631254695
13,34 万热度,滑雪不请教练真的可以吗？,https://www.zhihu.com/question/631040074
14,34 万热度,自行车装备中哪些值得花更多钱？,https://www.zhihu.com/question/630059808
15,34 万热度,低瓦数电源即可满足使用的电脑配置，如果使用更大瓦数的电源会有什么不好？,https://www.zhihu.com/question/630911775
16,34 万热度,4 名中国留学生在加拿大车祸身亡，中国驻多伦多总领馆紧急处理，哪些信息值得关注？,https://www.zhihu.com/question/632047850
17,34 万热度,喜欢听音乐的人有必要为手机配置高档耳机吗？,https://www.zhihu.com/question/629159818
18,34 万热度,键盘abs涂层竟然比pbt键帽还耐用。这abs涂层是什么化学材料?,https://www.zhihu.com/question/628644913
19,34 万热度,为什么猫咪总喜欢先嗅嗅再吃食物?,https://www.zhihu.com/question/629883074
20,34 万热度,如果一个漫画角色的防御力和闪避能力很强，但是其它属性很弱，那么他怎么发挥自己的优势呢？,https://www.zhihu.com/question/632062771
21,34 万热度,如何给领导汇报工作?,https://www.zhihu.com/question/462926106
22,34 万热度,国内有哪些马拉松赛道更容易 PB？,https://www.zhihu.com/question/628939923
23,34 万热度,全面普及运动健身的今天，为什么身边还是有很多人没有运动习惯，运动的收益难道是被夸大了吗？,https://www.zhihu.com/question/630310181
24,33 万热度,什么情况下，手机可以或应该换电池？手机换电池还有意义吗？,https://www.zhihu.com/question/630762224
25,33 万热度,23-24 赛季英超热刺 1:2 阿斯顿维拉，如何评价这场比赛？,https://www.zhihu.com/question/632015062
26,33 万热度,如何看待一加总裁说一加12产品力超越所有骁龙8gen3手机的Pro版，产品力强悍还是吹嘘？,https://www.zhihu.com/question/632121026
27,33 万热度,回想自己的人生阅历，你最想教给孩子们的一个道理是什么？,https://www.zhihu.com/question/630517537
28,33 万热度,早餐除了牛奶，还有哪些饮品推荐？,https://www.zhihu.com/question/631256937
29,33 万热度,寒冬取暖，南方人有哪些「装备升级」？,https://www.zhihu.com/question/630536285
30,33 万热度,如何判断自己家装修到底要不要请设计师？,https://www.zhihu.com/question/628024925
31,33 万热度,2023赛季F1收官战阿布扎比大奖赛，维斯塔潘夺冠，如何评价这场比赛？,https://www.zhihu.com/question/632012346
32,32 万热度,一个长期不运动的中年人该如何重新开启自己的健身之路？,https://www.zhihu.com/question/630830342
33,32 万热度,文笔挑战，“是谁打碎了我的梦，……”，下一句你会怎么接？,https://www.zhihu.com/question/632022414
34,32 万热度,有哪些适合给小学生讲的有意思的科普知识？,https://www.zhihu.com/question/297727430
35,32 万热度,国家统计局发布「10 月份规模以上工业企业实现利润同比增长 2.7%」，哪些信息值得关注？,https://www.zhihu.com/question/632056901
36,32 万热度,北斗系统正式加入国际民航组织标准，今后可全球民航通用，这意味着什么？,https://www.zhihu.com/question/630394232
37,32 万热度,如何看待 2022 年度复旦医院排行榜？有何亮点和值得思考的地方？哪些进步/退步最大原因是什么？,https://www.zhihu.com/question/631906234
38,32 万热度,预算不到 3000 元，都有哪些标准版手机值得购买？,https://www.zhihu.com/question/632069170
39,32 万热度,哪些动漫有类似海贼王里霸气震慑的桥段？,https://www.zhihu.com/question/631878693
40,32 万热度,手机摄影功能越来越强大，为何相机还是很受欢迎？,https://www.zhihu.com/question/631455766
41,32 万热度,如果回家后一直不理猫，猫会是什么反应？,https://www.zhihu.com/question/630932220
42,32 万热度,2023 年，你是否遭遇职场危机？你是如何化解的？,https://www.zhihu.com/question/630273426
43,32 万热度,新人进公司后，发现同事们都很冷漠，工作氛围很压抑，该怎么办？,https://www.zhihu.com/question/631163973
44,32 万热度,马来西亚总理表示「12 月起对中国游客实施 30 天免签入境措施」，如何看待这一举措？,https://www.zhihu.com/question/632014933
45,31 万热度,报告称超 5 成职场人员有兼职 ，有人因做副业被降薪或被辞，有哪些信息值得关注？你有下班兼职的打算吗？,https://www.zhihu.com/question/632057144
46,31 万热度,拜登政府内部对以色列态度不一，白宫高级顾问表示「我们替以色列背了很多锅」，对此如何评价？,https://www.zhihu.com/question/632063401
47,31 万热度,长安汽车拟投资华为新设公司，打造汽车行业智能化开放平台，哪些信息值得关注？,https://www.zhihu.com/question/632014930
48,31 万热度,你心中中国最牛的古诗词是哪一首？,https://www.zhihu.com/question/625138337
49,31 万热度,想到的第一句含有“愁”字的古诗词有哪些？,https://www.zhihu.com/question/632050674
50,31 万热度,给老人买手机，买传统老人机还是智能手机？应该怎么选？,https://www.zhihu.com/question/630509877
