index,hot,title,href
1,5.4万,女人20和40岁真的没区别吗？,http://club.kdslife.com/t_11241875.html
2,4.3万,加装电梯突然停运。,http://club.kdslife.com/t_11241976.html
3,4.6万,银行女真……,http://club.kdslife.com/t_11242187.html
4,4.2万,急寻此女下落,http://club.kdslife.com/t_11241937.html
5,3.9万,上海老爷叔思路绝对可以，7000退休金月光，全中国到处走走看看,http://club.kdslife.com/t_11241994.html
6,3.8万,"刚才,这个小姑娘在麦当劳吃别人吃剩下的薯条和玉米粒！",http://club.kdslife.com/t_11242098.html
7,3.7万,酒驾新标准来了，明年3月1日起实施,http://club.kdslife.com/t_11241911.html
8,3.6万,把钱还我、我不玩了！！！,http://club.kdslife.com/t_11242063.html
9,3.4万,当年美国是怎么走出大萧条的？,http://club.kdslife.com/t_11241996.html
10,3.0万,服了，刚提的新车,http://club.kdslife.com/t_11242168.html
11,2.9万,网络出现“十不青年”,http://club.kdslife.com/t_11241968.html
12,2.8万,听说久事要抛弃公交车业务了,http://club.kdslife.com/t_11242194.html
13,2.8万,中国资产价格暴跌，怎么美元资本不来收割？,http://club.kdslife.com/t_11241984.html
14,2.5万,这个是超级顶级优秀单身美女择偶啊，估计KDS山上很难找到对应的,http://club.kdslife.com/t_11242043.html
15,2.4万,有兄弟懂吗，要离婚了收到这个后怎么操作，,http://club.kdslife.com/t_11241977.html
16,2.4万,KDS山上没工作，找不到工作的，为什么不静下心来，去考点证书呢？,http://club.kdslife.com/t_11241933.html
17,2.3万,又是一个白送房子的！,http://club.kdslife.com/t_11241874.html
18,2.2万,坚决抵制各种yy,http://club.kdslife.com/t_11242029.html
19,2.0万,一帮老头在公园下象棋和围观，穿的西装革履也是醉了,http://club.kdslife.com/t_11241973.html
20,1.9万,外卖工资单，简直压榨劳动力！,http://club.kdslife.com/t_11242181.html
