index,hot,title,href
1,足球,曼城客战西汉姆联：哈兰德、德布劳内首发，格拉利什出战,https://www.dongqiudi.com/article/4509330
2,足球,十人阿森纳1-1布莱顿，赖斯染红，哈弗茨、若昂-佩德罗建功,https://www.dongqiudi.com/article/4509298
3,足球,半场：巴萨3-0巴拉多利德，莱万破门，拉菲尼亚建功,https://www.dongqiudi.com/article/4509839
4,足球,多特客场0-0不莱梅，双方机会不多，施洛特贝克两黄变一红,https://www.dongqiudi.com/article/4509760
5,足球,多特蒙德vs云达不莱梅球员评分：泽特尔8.2分，格吕尔6.1分,https://www.dongqiudi.com/article/4509860
6,生活,喜欢上同公司的小姐姐，怎么办啊？,https://www.dongqiudi.com/article/4509848
7,足球,马竞官方：奥布拉克因消化问题无缘出战本轮比赛,https://www.dongqiudi.com/article/4509823
8,足球,半场战报：布雷斯特2-0圣埃蒂安，德尔卡斯蒂略点射破门，马赫迪-卡马拉建功,https://www.dongqiudi.com/article/4509843
9,足球,马竞客战毕包：小蜘蛛、格列兹曼首发，加拉格尔出战,https://www.dongqiudi.com/article/4509691
10,足球,云达不莱梅vs多特蒙德全场数据：射门数5-9，射正数1-4,https://www.dongqiudi.com/article/4509821
11,足球,曼联新援科内晒和拉什福德的合照，两人一起观看了U18比赛,https://www.dongqiudi.com/article/4509791
12,足球,莱万前4轮西甲4球，上一位做到的巴萨球员还是18-19赛季的梅西,https://www.dongqiudi.com/article/4509802
13,足球,刘玉建：一分对于我们保级并不解渴；进攻端要把握住绝对机会,https://www.dongqiudi.com/article/4509794
14,足球,光明的未来，送出助攻的库巴西和亚马尔都只有17岁,https://www.dongqiudi.com/article/4509784
15,足球,邮报记者：萨维尼奥膝盖有伤，曼城给了他10天的休息时间,https://www.dongqiudi.com/article/4509790
16,足球,药厂vs莱比锡：维尔茨PK西蒙斯，约纳坦-塔、谢什科出战,https://www.dongqiudi.com/article/4509574
