index,hot,title,href
1,77,电车车主才知道小米SU7 Pro版本24.56万有多香,https://www.guozaoke.com/t/108043
2,66,带团队碰瓷地铁的无臂男子，已经开始直播带货了,https://www.guozaoke.com/t/107864
3,62,中建星光城居住体验如何？,https://www.guozaoke.com/t/107917
4,60,"3月22日早上,藏龙岛美院附近发生命案,两死一伤!",https://www.guozaoke.com/t/107862
5,54,有无情感大师，指导一波！,https://www.guozaoke.com/t/107878
6,52,9号线13号线要来勒，光谷好起来了,https://www.guozaoke.com/t/108011
7,51,近距离看到了小米SU7，颜值不错，豪华感拉满，25W以内很有竞争力,https://www.guozaoke.com/t/107901
8,50,车好不好不评价，但雷军怎么好意思吹自研的？,https://www.guozaoke.com/t/107946
9,50,真的有人会为了支持鸿蒙而放弃微信？,https://www.guozaoke.com/t/107994
10,44,没有不看好小米的意思，就是来点笑话,https://www.guozaoke.com/t/108065
