index,hot,title,href
1,足球,剑南春｜曼联0-0客平维拉，B费任意球中柱，马奎尔伤退,https://www.dongqiudi.com/article/4593118
2,足球,剑南春｜切尔西1-1诺丁汉森林，马杜埃凯破门，伍德建功,https://www.dongqiudi.com/article/4593139
3,足球,云南玉昆2-0上海嘉定汇龙提前4轮冲超，约尼查世界波破门,https://www.dongqiudi.com/article/4592730
4,足球,马雷斯卡：我们理应获胜；森林门将是比赛中表现最好的球员,https://www.dongqiudi.com/article/4593299
5,足球,7轮仅打进5球，曼联进球数并列本赛季英超第二少,https://www.dongqiudi.com/article/4593313
6,足球,半场战报：斯特拉斯堡1-2朗斯，阿巴卡尔-西拉，安迪-迪乌夫、恩佐拉破门,https://www.dongqiudi.com/article/4593322
7,电竞,S14瑞士轮：Light真的尽力了，WBG与BLG同在1-2组输一局淘汰,https://www.dongqiudi.com/article/4593315
8,足球,半场战报：兰斯2-1蒙彼利埃，中村敬斗、穆内西破门，诺尔丹建功,https://www.dongqiudi.com/article/4593312
9,足球,埃文斯：教练的下课传闻确实影响了球员；我会为球队付出一切,https://www.dongqiudi.com/article/4593300
10,足球,半场战报：布雷斯特1-0勒阿弗尔，阿若克破门,https://www.dongqiudi.com/article/4593311
11,足球,艾克森告别：感谢所有成都球迷；我和家人今天会启程前往巴西,https://www.dongqiudi.com/article/4593285
12,足球,送助攻，英超官方：帕尔默当选切尔西vs森林全场最佳球员,https://www.dongqiudi.com/article/4593295
13,足球,罗伯特-桑切斯：有时当对手少一人时，比赛并不会变得更容易,https://www.dongqiudi.com/article/4593291
14,足球,马杜埃凯：未能取胜让我们沮丧；对教练来说这是个不错的开始,https://www.dongqiudi.com/article/4593273
15,篮球,强，李月汝砍下20分7篮板，帮助博德鲁姆女篮取得土超2连胜,https://www.dongqiudi.com/article/4593293
16,足球,最近三位西甲赛季前9场进球上双的球员：莱万、梅西、C罗,https://www.dongqiudi.com/article/4593282
17,足球,埃文斯：维拉表现不错球员都很优秀，为曼联效力仍是一种荣幸,https://www.dongqiudi.com/article/4593197
