index,hot,title,href
1,足球,意天空：那不勒斯考虑解雇鲁迪-加西亚，德佬已经和他会面,https://www.dongqiudi.com/article/3773931
2,足球,马特乌斯：萨内是欧洲最佳之一；早说过药厂是拜仁最大的对手,https://www.dongqiudi.com/article/3773930
3,足球,贝克汉姆回应麦克托米奈观看小贝纪录片后言论：说得好,https://www.dongqiudi.com/article/3773923
4,足球,顺藤摸瓜,https://www.dongqiudi.com/article/3773907
5,足球,{{p1}}原来陈赫也…,https://www.dongqiudi.com/article/3773900
6,足球,每体：亚马尔一瘸一拐前往国家队报到，还需接受进一步检查,https://www.dongqiudi.com/article/3773893
7,足球,每体：梅西不考虑回巴萨，沙特希望租借梅西6个月,https://www.dongqiudi.com/article/3773892
8,生活,蹲到小新亲签！,https://www.dongqiudi.com/article/3773884
9,足球,哈兰德应该首发吗,https://www.dongqiudi.com/article/3773883
10,足球,世体：巴萨不满进球被判越位，尤其是皇马类似的情况算进,https://www.dongqiudi.com/article/3773880
11,足球,英仙：吉鲁的故事，再次证明强大与年龄无关,https://www.dongqiudi.com/article/3773879
12,足球,冠军魔咒？上赛季五大联赛冠军4支球队目前都排在联...,https://n.dongqiudi.com/webapp/tops.html?id=3772787
13,足球,【小麦的福气！麦克托米奈女友身材曼妙气质出众】曼...,https://n.dongqiudi.com/webapp/tops.html?id=3772982
14,足球,TyC记者：迪巴拉膝盖副韧带扭伤，预计缺席三周左右,https://www.dongqiudi.com/article/3773870
15,足球,任航回应外界质疑，仍坚信三镇能亚冠小组出线,https://www.dongqiudi.com/article/3773868
16,足球,今天转战匈甲冠军队费伦斯瓦罗斯主场，“连吃带拿”...,https://n.dongqiudi.com/webapp/tops.html?id=3773085
17,足球,日本亚运队主帅谈决赛：球员们得到了成长，他们会越来越好,https://www.dongqiudi.com/article/3773867
18,足球,裁判专家：费兰在越位位置参与进攻，取消巴萨进球判罚准确,https://www.dongqiudi.com/article/3773866
19,足球,五大联赛奇观！上赛季冠军均无缘榜首,https://www.dongqiudi.com/article/3773865
20,足球,妈妈这句不同意，寒了孩子的心，浇灭了梦想的芽，给...,https://n.dongqiudi.com/webapp/tops.html?id=3773395
