index,hot,title,href
1,足球,点球大战山东5-4曼谷联晋级亚冠精英赛，日夫科维奇失点,https://www.dongqiudi.com/article/4465366
2,足球,U19国青0-2伊朗U19，朱鹏宇错失良机，代赫汗超远世界波,https://www.dongqiudi.com/article/4465133
3,,快来聊聊你对新赛季英超排名的预测吧！>>,https://www.dongqiudi.com/article/4464799
4,足球,TA：皇马球员对俱乐部今夏没有引进中卫感到惊讶,https://www.dongqiudi.com/article/4465484
5,足球,13.2亿欧，伯利时代切尔西转会开支已跻身英足坛历史各队前10,https://www.dongqiudi.com/article/4465415
6,足球,利雅得新月vs吉达国民：米林、内维斯首发，马赫雷斯出战,https://www.dongqiudi.com/article/4464824
7,体坛,沙特斯诺克大师赛8月30日开打，冠军奖金50万镑与世锦赛相当,https://www.dongqiudi.com/article/4465459
8,足球,哈曼：预测勒沃库森卫冕德甲；我们要看看孔帕尼能否执教拜仁,https://www.dongqiudi.com/article/4465451
9,足球,每体：德科推进路易斯-迪亚斯转会，但利物浦不愿出售他,https://www.dongqiudi.com/article/4465455
10,体坛,陈梦谈奥运混双首金：对全队来说，混双是这个周期的首要任务,https://www.dongqiudi.com/article/4465448
11,篮球,76人队记：恩比德预计将会在新赛季开始前与76人开启续约谈判,https://www.dongqiudi.com/article/4465445
12,体坛,潘展乐：宁愿这次成绩没有这么优秀，这样还能安心努力训练,https://www.dongqiudi.com/article/4465422
13,足球,Here we go！罗马诺：尼斯签下加拿大后卫邦比托，顶替托迪博,https://www.dongqiudi.com/article/4465425
14,足球,首席跟队：尤文正在和什琴斯尼协商，支付补偿金提前解约,https://www.dongqiudi.com/article/4465408
15,体坛,王楚钦：两个拍差距不会很大；奥运打三项消耗超出以前每一次,https://www.dongqiudi.com/article/4465401
16,足球,官方：伯恩茅斯签下巴萨后卫胡利安-阿劳霍，转会费1000万欧,https://www.dongqiudi.com/article/4465400
17,足球,亚冠精英赛中超球队参赛名单确定：上海双雄领衔，山东在列,https://www.dongqiudi.com/article/4465389
18,足球,罗马诺：尤文图斯将与34岁门将什琴斯尼解约,https://www.dongqiudi.com/article/4465387
19,体坛,邱贻可晒与弟子孙颖莎合影：来都来了，铁塔下还是得留个影,https://www.dongqiudi.com/article/4465384
20,足球,德天空：法兰克福的优先引援目标仍然是库列拉基斯,https://www.dongqiudi.com/article/4465371
