index,hot,title,href
1,74,有个赌徒岳父怎么应对,https://www.guozaoke.com/t/112300
2,69,考虑离婚了、 31岁,https://www.guozaoke.com/t/112351
3,66,在武汉上大学，生活费一个月多少合适？,https://www.guozaoke.com/t/112168
4,63,首付5W买车求推荐,https://www.guozaoke.com/t/112202
5,60,武汉过早吃的其实很粗糙，就是重油和碳水,https://www.guozaoke.com/t/112325
6,50,这一代年轻人赶上了好时候，不像我们70后80后,https://www.guozaoke.com/t/112157
7,49,没人觉得女乒决赛很蹊跷吗？,https://www.guozaoke.com/t/112236
8,49,聊聊历史里面的一些疑问？,https://www.guozaoke.com/t/112278
9,48,【求法律援助，可有偿】小孩在游乐场滑梯处被撞翻导致下巴肉被磕掉，缝了20多针,https://www.guozaoke.com/t/112162
10,48,交警现在贴单子这么敬业的吗,https://www.guozaoke.com/t/112228
