index,hot,title,href
1,74,武汉出租和萝卜快跑,https://www.guozaoke.com/t/110684
2,67,千万别买大通量无桶净水器加管线机的组合,https://www.guozaoke.com/t/110782
3,62,都是差不多20万左右落地，汉DMI和奥迪A4L选哪个？,https://www.guozaoke.com/t/110717
4,60,前天电脑突然蓝屏了，找了小区下的千米快修，花了660,https://www.guozaoke.com/t/110744
5,55,为什么那么多人质疑姜萍？,https://www.guozaoke.com/t/110596
6,54,回笼深漂or留武汉,https://www.guozaoke.com/t/110689
7,52,不谈价格只谈逼格，BBA和国产新势力电车相比，谁的逼格高？,https://www.guozaoke.com/t/110785
8,50,作为外孙要帮忙吗？,https://www.guozaoke.com/t/110811
9,47,推荐一个性价比高的宜居城市，襄阳,https://www.guozaoke.com/t/110764
10,45,面食里面最好吃的是哪个？,https://www.guozaoke.com/t/110617
