index,hot,title,href
1,47,各位社友活这么大了有什么值得吹嘘的经历吗？,https://www.guozaoke.com/t/106733
2,45,结婚都是男方包办吗？,https://www.guozaoke.com/t/106781
3,40,长沙旅游美食被吹的太过了，去过一次发现真没啥玩的吃的。,https://www.guozaoke.com/t/106675
4,37,武汉要发展，但为何武汉楼市还不降价？,https://www.guozaoke.com/t/106693
5,36,同学离婚了,https://www.guozaoke.com/t/106763
6,36,200个的预算，在下面这几个小区里面该怎么选择？,https://www.guozaoke.com/t/106818
7,34,准备跟老婆买个二手bba,https://www.guozaoke.com/t/106801
8,33,又到了一年的年初了， 大家都有什么flag,https://www.guozaoke.com/t/106738
9,32,是中国人不够聪明搞不了Sora吗？是社会普遍急功近利,https://www.guozaoke.com/t/106758
10,32,4年以上的绿牌和(近期不打算买电车的)蓝牌车主请回答。,https://www.guozaoke.com/t/106785
