index,hot,title,href
1,99,高校还不能自由进出,https://www.guozaoke.com/t/107322
2,75,为什么现在还有人买油车？,https://www.guozaoke.com/t/107231
3,72,领证后，女方不让碰是什么心里,https://www.guozaoke.com/t/107310
4,66,人到中年，去上海打拼，有什么建议,https://www.guozaoke.com/t/107270
5,57,有没有大龄未婚未育的女生正在失业中的？,https://www.guozaoke.com/t/107302
6,56,光谷润府如何,https://www.guozaoke.com/t/107263
7,51,想了解最早一批宋plus dmi车主目前用车体验,https://www.guozaoke.com/t/107284
8,47,工作报告，农民退休金每月涨20元,https://www.guozaoke.com/t/107254
9,46,关于癌症治疗的抉择，大家有什么好的方案吗？,https://www.guozaoke.com/t/107392
10,45,10W代步，买车怎么选？,https://www.guozaoke.com/t/107381
