index,hot,title,href
1,11874607,国足亚洲杯出局
2,11276700,女子自制冻梨翻车
3,11230643,天宫货架上新了
4,10827466,全国抢公主大战
5,10683009,C罗中国行比赛延期
6,10570152,内蒙古夹子音
7,10212551,李玉刚刚好遇见你又杀回来了
8,10163526,中东多国卷入冲突
9,9990380,辅警将全面转正系谣言
10,9838362,良田粉丝的预言成真了
11,9774879,起猛了看见雪人骑电车
12,9645084,新人销售第一次打电话
13,9602372,新疆7.1级地震已致3死5伤
14,9598430,C罗向中国球迷道歉
15,9589406,云南镇雄山体滑坡已致31人遇难
16,9585415,成都又下雪了
17,9512443,董宇辉访谈梁晓声畅聊文学
18,9456331,李蠕蠕新剧饰演翻车网红
19,9439252,张大仙：爱我别走
20,9352200,赵丽颖怼脸海报情绪直接拉满
21,9242032,25岁女孩兼职当伴娘20多次
22,9215848,孙坚搭棚子办流水席
23,9208955,李若彤穿军大衣逛北京沙河大集
24,9192590,各地文旅宣传配乐越来越离谱了
25,9174435,射雕英雄传年内上映
26,9155122,黄瀛子手劲够大
27,9087393,浪胃仙重庆探店回忆杀
28,9083383,法国男孩被遗弃后独自生存2年
29,9080362,89岁院士抖音开课被家长催更
30,9075221,晒晒你的新年美甲
31,9073102,会跳舞的小金毛
32,9058380,广东的气温变化有多快
33,9058353,第二十条信息量剧情预告
34,8965013,四郎版认错
35,8949741,好老板都哪儿去了
36,8915020,新疆乌什县7.1级地震
37,8906837,湖人交易
38,8868455,贵州一高速数十辆车相撞
39,8842340,老丈人带南方女婿回北方过年
40,8834739,这球投得准还是不准
41,8807194,外媒指控幻兽帕鲁虐待动物
42,8796461,消防员废墟下找到手拉手夫妻
43,8793600,若不是你忽然闯入我生活
44,8688710,日本议员因吃回扣道歉
45,8688648,就业思路一下就打开了
46,8679812,东北大花仍是顶流
47,8667688,河南省民政厅副厅长杨蕾被查
48,8582696,你知道物品视角吗
49,8574095,这次就成为别人的光吧
50,8525700,开颅手术遇强震医生临危不乱
