index,hot,title,href
1,11046082,iPhone 16系列全新摄像头模组
2,10934285,机票临期降价网友直呼买亏了
3,10845726,晒晒你的职业技能
4,10484152,美总统候选人参加抗议被捕
5,9672645,广东又将迎新一轮暴雨
6,9667662,欧文力挺东契奇
7,8797938,美高校两派示威者爆发冲突
8,8549672,穆雷G5出战成疑
9,8543339,南宁警方通报初中女生被多人殴打
10,8481704,兰州等地出现降雪
11,8432940,地产股集体爆发 万科涨停
12,8402865,海口交警回应将女子拽下电动车
13,8377367,今日辟谣
14,8376036,苗苗果然是北舞严选
15,8370739,九成日本人支持女性当天皇
16,8344565,蛋仔岛被淹了
17,8328089,舞蹈课被踩断腿女生发声
18,8322514,庄洁和陈麦冬亲密时爆发
19,8304503,长沙正午宛如黑夜
20,8302543,亚比囧囧囧
21,8299151,赵露思红裙
22,8297585,长沙南站就候车室严重漏雨致歉
23,8281286,郭艾伦伤愈回国
24,8280163,贺美琦曾是TFBOYS的MV女主
25,8277415,城中之城表姐的复仇
26,8249109,挑战50元约会一天
27,8246149,广西水果价格有多感人
28,8243583,网络主播杨天奇偷税被罚
29,8240790,IVE新曲MV
30,8237398,雄安新区城市雏形全面显现
31,8233077,付鹏全网账号注销
32,8226997,关雪遭亲弟弟暗杀
33,8207644,如何看待周鸿祎拍卖迈巴赫
34,8204077,侯雯元不想让钟楚曦上岛吃苦
35,8168376,五一见面吧我带胃你带钱
36,8160754,韩媒曝青岛有意申办2036年夏奥会
37,8160753,国外以物换物做美食
38,8158023,马斯克确认Model 2明年上市
39,8147688,吞噬星空铁南河下线
40,8133842,明星也在玩莫奈花园特效
41,8125592,爱德华兹隔扣杜兰特
42,7976889,雀巢回应200万瓶巴黎水被销毁
43,7948758,女子暴风雨中被卷帘门拍翻在地
44,7892744,门店回应店长为化解纠纷猛踹员工
45,7869540,Jennie造型撞脸那英
46,7844105,微暗之火拍出了人性的恶
47,7789615,马斯克：我是中国的超级粉丝
48,7777859,周深唱Super Lady
49,7760106,张雨绮抖腿代言缝纫机
50,7758012,一不小心掉进莫奈的画里
