index,hot,title,href
1,11594270,2024网络视听盛典
2,10968273,伊朗逆转日本进4强
3,10881546,2024中央一号文件公布
4,10554001,雷佳音说贾玲减重100斤非常震撼
5,10359556,TF家族音乐会放了troublemaker
6,10241383,刘德华耍枪耍到我心里了
7,9492376,山西文旅携100种面食出战
8,9451393,郭麒麟汗流浃背了
9,9324695,汉服博主给产科医生制作汉服
10,9322132,安静公主爆改天狼北顾
11,9295270,济南辟谣儿童8天没吃上早餐
12,9278501,消防栓没水致死家属控诉物业
13,9238104,警方回应男子胁迫俩女孩不让下车
14,9229002,在抖音吃到满汉全席
15,9220487,明日立春
16,9156033,龙兽医被邀请现场看春晚
17,9071252,听张新成唱半生雪燃起来了
18,9046299,动车因雨雪停电 乘客称被冻整晚
19,9026715,冯巩老师的相声百看不厌
20,9022268,龙年一起接着奏乐接着舞
21,9021361,中国广播艺术团带你重温经典名著
22,8994452,谷爱凌因决赛取消摘银
23,8972130,武铁159趟列车停运
24,8961718,梅西香港行又有球迷闯场求签名
25,8961212,手上不知道沾了点什么
26,8939139,白敬亭腼腆社恐版手势舞
27,8937578,蓝盈莹新春微笑唇妆教程
28,8897398,马面裙和簪花好搭
29,8896620,陈泽正式官宣将直播英雄联盟
30,8861483,王耀庆在东北雨姐面前变娇羞
31,8861466,前TVB演员河国荣烧炭自杀
32,8841301,胡可与儿子们的新加坡美食测评
33,8817995,刘德华自曝曾有粉丝藏床下
34,8816600,罗云熙四川话数龙说到笑场
35,8788530,“一元一串的钵钵鸡”火到台湾
36,8779084,薛之谦让我把陌生奶奶的菜买光
37,8771181,森保一同意伊东纯也退队
38,8699582,请查收你的AI全家福
39,8678185,熊出没给瑶一瑶寄新年礼物
40,8662104,香港顶流姜涛舞蹈直拍
41,8643710,小沈阳演唱会狂飙高音
42,8554488,当销冠李蠕蠕遇上新闻女王
43,8553269,湖南卫视春晚全场跳科目三
44,8486430,恭喜发财蛋仔舞
45,8401312,赵露思陈泽LOL手游直播
46,8401312,王小麦cos蔡文姬
47,8353073,TF三代新歌不回头舞台直拍
48,8301412,旭旭宝宝王者首秀2.1分
49,8292706,在暴雪时分留学生设定
50,8267764,马丽差点被贾玲撞出去2里地
