index,hot,title,href
1,足球,阿森纳vs曼城：热苏斯PK哈兰德，厄德高、福登首发,https://www.dongqiudi.com/article/3770954
2,足球,布莱顿 vs 利物浦 比赛动态,https://www.dongqiudi.com/article/3771148
3,体坛,何时破2小时？23岁基普图姆以2小时零35秒打破马拉松世界纪录,https://www.dongqiudi.com/article/3771472
4,,阿森纳vs曼城：热苏斯、德克兰-赖斯首发，哈兰德、伯纳多-席尔瓦出战,https://www.dongqiudi.com/article/3771484
5,,西汉姆联 vs 纽卡斯尔联 比赛动态,https://www.dongqiudi.com/article/3771151
6,,勒沃库森 vs 科隆 比赛动态,https://www.dongqiudi.com/article/3771219
7,,里昂3-3洛里昂，拉卡泽特， 克鲁皮梅开二度,https://www.dongqiudi.com/article/3771480
8,,拉齐奥 vs 亚特兰大 比赛动态,https://www.dongqiudi.com/article/3771140
9,足球,国足球迷见面会在大连召开，扬科维奇与9名国脚和球迷互动,https://www.dongqiudi.com/article/3771475
10,足球,实至名归！官方：阿尔瓦雷斯当选曼城九月最佳球员,https://www.dongqiudi.com/article/3771473
11,,葡体外租球员观察：马特乌斯-费尔南德斯与本菲卡一战的表现,https://www.dongqiudi.com/article/3771468
12,,马德里竞技 vs 皇家社会 比赛动态,https://www.dongqiudi.com/article/3771361
13,,福伦丹主场战胜乌德勒支，取得赛季首胜,https://www.dongqiudi.com/article/3771464
14,足球,中国香港参加世预赛大名单：陈俊乐、安永佳领衔,https://www.dongqiudi.com/article/3771459
15,足球,里程碑！埃德森迎来曼城生涯第300场比赛,https://www.dongqiudi.com/article/3771445
16,,狼队 vs 阿斯顿维拉 比赛动态,https://www.dongqiudi.com/article/3771193
17,,保·托雷斯收获了他的英超首球。,https://n.dongqiudi.com/webapp/tops.html?id=3771436
18,足球,扬科维奇答小球迷问：有信心冲击2026世界杯，将拼尽全力,https://www.dongqiudi.com/article/3771433
19,足球,恒大汽车公告：公司股票10月9日起恢复买卖,https://www.dongqiudi.com/article/3771416
20,,朗斯vs里尔：阿卜杜勒-萨梅德、凯文-丹索首发，乔纳森-戴维、安热尔-戈梅斯出战,https://www.dongqiudi.com/article/3771415
