index,hot,title,href
1,11216824,全国降温预报图变深红色了
2,10084146,贾玲爆改A到不敢眨眼
3,9713010,春节档票房破70亿元
4,9661094,福岛核污水泄漏原因：忘关阀门
5,9481179,春节返程那些令人泪目的场景
6,9332624,阿呦阿呦爱吃甜甜的糖葫芦
7,9271952,俄罗斯的扫雪车有多可爱
8,9245835,萌宠版阿呦阿呦慢动作
9,9198913,海鲜中微塑料危害健康系谣言
10,9142455,和同事一起被催婚的共鸣
11,9031596,张艺兴RB2U手势舞
12,8964252,马丽主演电影票房破180亿
13,8949106,官方通报游客退房被要求擦马桶
14,8911900,这首沉溺配上慢动作绝了
15,8883352,第二十条细节解读
16,8826677,六公主：这些行为算盗摄
17,8814708,吃不完的泡面可以还原
18,8790672,七颗猩猩全家应援热辣滚烫
19,8723495,陶姝娜醉酒告白张小彦
20,8672493,胖东来员工尝面未洗筷子锅里搅拌
21,8655490,律师谈薛之谦被指盗摄
22,8626380,这几根香蕉我是吃不起了
23,8618892,薛之谦回应盗摄
24,8471390,OpenAI 1分钟一镜到底
25,8436722,曹岩为王鹤棣加油
26,8391181,刘松仁宣布不再拍戏
27,8388885,宋晓峰兄弟的情唱哭自己
28,8353002,马思纯回应早期颜值被怀念
29,8334007,白敬亭专访
30,8328926,我们是对方特别的人
31,8312148,飞驰2给外国人的小震撼
32,8168548,胖东来回应员工未按标准试吃
33,8078745,Black Swan科目三
34,8062855,看电影就拍这个转场
35,8033305,开学当天的你
36,7910365,谢广坤得知刘能病后急麻了
37,7798674,长大以后家就只剩春节了
38,7797033,柯基爆改小公主
39,7763485,南来北往大院人情味太足了
40,7723538,过年回来看见小猫的你
41,7706128,不想开学
42,7698713,一人一张真实照片
43,7660941,东北天然大冰箱扛不住了
44,7650862,叮当见到“真玲”了
45,7625263,麦小登带老爸看刘德华路演
46,7587981,看完熊出没再多请两天假
47,7517362,照片就该这么调
48,7472506,当我穿了双旧鞋去爬山
49,7436615,苹果停止签署iOS 17.3
50,7433634,潘展乐世锦赛4天夺两金
