index,hot,title,href
1,鹭岛生活,在24小时热榜看到一个“现在男生越来越抠门”,http://bbs.xmfish.com/read-htm-tid-18134737.html
2,鹭岛生活,[01-13]楼上噪音骚扰持续近1年报警后恶意报复咋整,http://bbs.xmfish.com/read-htm-tid-18134604.html
3,鹭岛生活,岛内外房价又拉开了,http://bbs.xmfish.com/read-htm-tid-18134773.html
4,鹭岛生活,人老了的好处就是,http://bbs.xmfish.com/read-htm-tid-18134691.html
5,鹭岛生活,用优待证游鼓浪屿很丢人吗？,http://bbs.xmfish.com/read-htm-tid-18134687.html
6,鹭岛生活,腺样体肥大的6岁娃 您们说哪家医院治疗好,http://bbs.xmfish.com/read-htm-tid-18134588.html
7,谈天说地,男人结婚真的都只是为了传代吗,http://bbs.xmfish.com/read-htm-tid-18134586.html
8,鹭岛生活,[01-13]今天是一个很不寻常的日子,http://bbs.xmfish.com/read-htm-tid-18134710.html
9,鹭岛生活,亲戚给我介绍对象，昨天吃完饭后就把我拉黑了,http://bbs.xmfish.com/read-htm-tid-18134861.html
10,鹭岛生活,[01-13]漫漫经济凛冬，置业全款买漳州港比按揭买厦门好,http://bbs.xmfish.com/read-htm-tid-18134787.html
