index,hot,title,href
1,89,彩礼这个东西，想来想去我都无法理解，从哪方面来说都是敲诈勒索啊,https://www.guozaoke.com/t/113876
2,55,这个择偶要求高么,https://www.guozaoke.com/t/113861
3,52,不想找对象了，正常吗？,https://www.guozaoke.com/t/113977
4,51,路透社最新消息,https://www.guozaoke.com/t/114017
5,50,股神们也太猛了，把上交所系统搞宕机了,https://www.guozaoke.com/t/114040
6,47,自己做饭是个可以实现一定生活品质和生活情趣的技能吧？大伙同意吗？,https://www.guozaoke.com/t/113998
7,44,这波目标至少3300点,https://www.guozaoke.com/t/113928
8,43,拉胯，光谷中心城改善天花板严重减配,https://www.guozaoke.com/t/113905
9,43,iPhone16究竟会不会炸,https://www.guozaoke.com/t/113907
10,38,最近家电电脑国家补贴，大家都买了撒,https://www.guozaoke.com/t/113837
