index,hot,title,href
1,10701064,华晨宇携弟弟花傲天抖音首播
2,10585253,百度副总裁璩静已离职
3,10280325,塞尔维亚超高规格送机
4,10223599,明日或发生地磁暴
5,9642819,30秒了解中塞铁杆友谊
6,9628266,记者布达佩斯Citywalk
7,9620972,BLG战胜PSG
8,8604110,俄罗斯红场阅兵现场
9,8526473,业内预测除京沪深外均可能取消限购
10,8523992,关雪被捕入狱
11,8436102,李一桐用凉水给欧豪泡过期面
12,8424378,庆余年2定档
13,8388373,今日辟谣
14,8380139,菏泽郭有才一首诺言走红
15,8376569,韩德君发辽篮球迷助威视频
16,8375819,地磁暴对身体有何影响
17,8359989,约基奇：我可能随时退役
18,8355410,娜扎说自己花少3的短发很出圈
19,8341598,救人英雄王龙骨灰到达陵园
20,8326325,赵露思将任巴黎奥运火炬手
21,8313987,赵志远任外交部部长助理
22,8277288,胡歌新电影中面试好真实
23,8271363,1234我爱辽篮再现
24,8242739,初夏的味道
25,8229618,宋卓武死在胜利前
26,8144967,电视剧新生迎来最大反转
27,8137467,达利园回应请周口杰伦代言
28,8029933,井柏然夸刘雯素颜太好看了
29,7926825,贵州独山发生刑案嫌疑人潜逃
30,7884736,马嘉祺把张颂文演哭了
31,7837011,宁夏客货车相撞9死2伤
32,7797090,钟楚曦新剧地下恋被抓包
33,7783647,用live实况开关打开日常碎片
34,7747028,G2连追八个赛点翻盘
35,7744520,弹弹我的第一桶金
36,7736725,皇马逆转拜仁进决赛
37,7731782,我是搞笑女怎么了
38,7725232,媒体评台湾老师不让用大陆用语
39,7712914,无忧之夜众星云集
40,7710111,尹锡悦称妻子处事不够明智
41,7707477,班主任回忆学生时期的普京
42,7701882,张馨予的莫奈花园
43,7695963,为了引起crush注意发的朋友圈
44,7690423,南京浪漫晚霞
45,7681449,还得是我妈
46,7675806,西安全面取消住房限购措施
47,7672416,山东人谈山东到底穷不穷
48,7671908,如何避开消费主义陷阱
49,7669924,凯恩本赛季无缘冠军
50,7662261,金价还会再跌吗
