index,hot,title,href
1,320,跨越5000公里，7 分钟新西兰星空延时,https://www.kaiyanapp.com/detail.html?vid=325019
2,507,风湿犯了，潮人视角打开韩国宣传片,https://www.kaiyanapp.com/detail.html?vid=325033
3,549,18只手在1架钢琴上演奏「奥本海默」,https://www.kaiyanapp.com/detail.html?vid=325018
4,507,洗脑神曲！腊肠狗为你的周一加点料,https://www.kaiyanapp.com/detail.html?vid=324959
5,26,经费在燃烧，战争大场面高燃混剪,https://www.kaiyanapp.com/detail.html?vid=324967
6,204,贱出屏幕！假如泰迪熊和你玩起了捉迷藏,https://www.kaiyanapp.com/detail.html?vid=325020
7,249,致「阿兰·德龙」：永远的法兰西情人,https://www.kaiyanapp.com/detail.html?vid=325063
8,476,手工大神自制回旋镖，这玩意真能打猎？,https://www.kaiyanapp.com/detail.html?vid=324911
9,204,顶级迷幻慢摇，一种关我吊事的松弛感,https://www.kaiyanapp.com/detail.html?vid=324864
10,371,不婚不班，汶川小伙震后建 6000m² 花园,https://www.kaiyanapp.com/detail.html?vid=325049
