index,hot,title,href
1,154,结婚的问题好头疼,https://www.guozaoke.com/t/108535
2,103,华为Pura 70系列发布,https://www.guozaoke.com/t/108646
3,95,光谷实验巨无霸，巨大利空,https://www.guozaoke.com/t/108553
4,74,靴子落地，武汉中考指标到校官宣,https://www.guozaoke.com/t/108551
5,72,现在的婚恋市场越来越有意思了,https://www.guozaoke.com/t/108539
6,66,女性崛起了,https://www.guozaoke.com/t/108611
7,63,大家好，请问有人知道平安光谷春天的房子怎么样吗？,https://www.guozaoke.com/t/108550
8,57,过客们，可以说说你心中最好的中文小说吗？长短篇都可以,https://www.guozaoke.com/t/108605
9,54,水果换回安卓,https://www.guozaoke.com/t/108634
10,54,看见一个有意思的瓜_遇到这样的女孩子该怎么办??,https://www.guozaoke.com/t/108508
