index,hot,title,href
1,12038058,国台办评论台湾地区选举结果
2,11169935,亚洲杯国足vs塔吉克斯坦队
3,9668557,红鹰飞行表演队首次走出国门
4,9509576,张大仙王者开播官宣
5,9346370,廊坊文旅置顶赵丽颖视频
6,9109812,老白大哥远看陈泽直播气坏了
7,8976612,与辉同行歌曲串烧
8,8820448,郑州新密有大熊猫基地系谣言
9,8749064,卢卡申科：世界处于重大事件前夜
10,8728422,猫咪打呼噜能有多响
11,8690953,陈泽抖音粉丝破千万
12,8649367,宝宝这是被熏晕了吗
13,8647970,用喊麦为各省文旅上分
14,8645956,英国与乌克兰签署安全合作协议
15,8634657,谁能想到那是我们最后一面
16,8630388,背景太假哥任新疆巴州政协委员
17,8614062,山东人开始魔改电视剧了
18,8586007,王者李白动画让抖音画手卷起来了
19,8458142,浙江省委原书记薛驹同志逝世
20,8453126,车厘子开炫年味来了
21,8396539,学说四川话的第一天
22,8327140,87岁爷爷挑战白敬亭穿搭
23,8320249,俞敏洪家的鸡窝空了
24,8150321,四川文旅连夜摇人
25,8139264,王者李白曲水流觞斗诗名场面
26,8106874,赖美云小七的AB面
27,8068982,W盛典春夏流行风向标
28,8029252,网友喊话湖南文旅
29,8010358,郑恺上海骑行吃排骨年糕
30,7977875,下周大范围雨雪天气来袭
31,7950135,上海本帮菜单已就位
32,7949032,在滇池弹钢琴是什么体验
33,7936652,谁发明的糖葫芦错位拍照
34,7920564,河北文旅真请到赵丽颖了
35,7902415,张大仙三个奖
36,7893269,刘涛高铁播音一学就会
37,7762448,张三丰传人哈尔滨打太极
38,7715122,黑龙江达人也出手了
39,7708293,韦世豪缺席亚洲杯首战
40,7694692,陈泽到底合拍了多少人
41,7675070,美英对也门首都发动新一轮空袭
42,7487750,网友帮福建文旅放大招了
43,7465813,洛阳真的连夜换成了飞鱼服
44,7464953,晚玉复播排面拉满
45,7426000,大连冬季旅游攻略
46,7404803,山西文旅给大家喊个麦听听
47,7403975,衢州这是把周迅请来了吗
48,7402049,娱乐圈打工人一天都吃什么
49,7399935,国足vs塔吉克斯坦首发阵容
50,7399932,慧慧周短剧世界欠我一个哥
