index,hot,title,href
1,颜究员小Ma哥,"深度解析华晨宇的品牌宇宙：揭秘""火星""背后的创新设计",https://www.uisdc.com/huachenyu
2,夏花生,用好这 3 款 3D 建模工具，让你的 AI 出图质量轻松提升200%,https://www.uisdc.com/3d-tools
3,ISUX,提高三倍效率！17个腾讯高手都在用的 Figma 插件,https://www.uisdc.com/figma-ai
4,夏花生,实现纹理素材自由！8 组纹理材质类 Midjourney 关键词,https://www.uisdc.com/texture-prompt
5,夏花生,3 秒搞定！7 款超好用的免费图像去水印工具,https://www.uisdc.com/watermark-remove
6,58UXD,我把界面内容都删了，数据反而翻了3倍？,https://www.uisdc.com/transformation-design-2
7,MiuYan 周妙妍,14个排版微调技巧，瞬间提高两倍设计感！,https://www.uisdc.com/layout-design-tips-2
8,碧野青风,UI设计进阶干货！盒模型间距设计指南,https://www.uisdc.com/box-model-spacing
9,飞波,永久免费可商用！手写毛笔风格的飞波正点体 （已打包）,https://www.uisdc.com/feibo-font
10,菜心¹,大厂设计师是如何做图标的？四个章节教会你！,https://www.uisdc.com/icon-design-11
11,陈子木,超全合集！2024 年 UX/UI 设计师都必须尝试的 21 款 AI 工具,https://www.uisdc.com/2024-ai-tools-designer-must-try
12,新浪MDC,掌握这3个技巧，学会用Midjourney绘制连环漫画,https://www.uisdc.com/mj-comic
13,夏花生,自媒体小白必看！5 招教你轻松做出好看又吸睛的内容封面,https://www.uisdc.com/cover-design-2
14,百度MEUX,AIGC大厂实战！百度二十四节气卡设计升级完整复盘,https://www.uisdc.com/ai-baidu-24-solar-terms
15,张家彬,超多案例！如何让平面设计作品摆脱平庸？,https://www.uisdc.com/poster-design-39
16,夏花生,想让图像快速矢量化？3款免费工具帮你轻松搞定！,https://www.uisdc.com/jpg-to-svg
17,NIC,如何搭建日产20000张图的AIGC工具？完整流程来了！,https://www.uisdc.com/aigc-generation-tool
18,夏花生,设计素材不用愁！7组高质量劳动节主题 Midjourney 提示词,https://www.uisdc.com/midjourney-52
19,张鼎_Ending,18000字干货！写给设计师的版式设计基础知识,https://www.uisdc.com/layout-design-23
20,弗西西丁的AI练习册,爆肝整理！如何用AIGC轻松搞定春季运营海报设计？,https://www.uisdc.com/midjourney-spring-poster
21,Shirley_雪,让学习效率翻倍！设计师必备的知识库搭建指南,https://www.uisdc.com/knowledge-base-system
22,ISUX,腾讯专家7600字力作！如何用「八角行为分析法」轻松打动用户？,https://www.uisdc.com/octalysis
23,京东JellyDesign,大厂 AIGC 提速案例！京东保险UED 项目设计总结,https://www.uisdc.com/jd-ued-aigc
24,京东JellyDesign,大厂实战案例！京东物流AI问答助手体验设计完整复盘,https://www.uisdc.com/ai-q-a-assistant
25,姝斐suphie,B端和C端产品有哪些区别？高手总结了这10条！,https://www.uisdc.com/b-and-c-difference-2
26,酸梅干超人,B 端设计飞升，从学习组件设计开始,https://www.uisdc.com/b-end-component-design
27,夏花生,设计素材不用愁！6 组高质量插画类 Midjourney 提示词,https://www.uisdc.com/midjourney-51
28,柴林,产品要不要做设计改版？来看总监的分析！,https://www.uisdc.com/design-redesign
29,黑马青年,用一个实战案例，帮你学会UI设计界面优化思路！,https://www.uisdc.com/ui-interface-design-2
30,百度MEUX,如何做好标签体系设计？收下大厂高手总结！,https://www.uisdc.com/tag-design-3
31,Tomda,7000字干货！写给新手的设计系统入门指南,https://www.uisdc.com/design-system-6
32,张鼎_Ending,超详细干货！设计师应该懂的设计细节,https://www.uisdc.com/design-details-3
33,应骏,求职季福利！UI/UX作品集保姆级设计指南,https://www.uisdc.com/ui-ux-portfolio
34,言川Artie,万字教程！奶奶看了都会的 ComfyUI 入门教程,https://www.uisdc.com/comfyui-3
35,夏花生,效率翻倍！5 款不容错过的免费 AI 神器（三）,https://www.uisdc.com/aigc-tools-4
36,视研设,平面高手出品！用一篇文章教会你素材选择,https://www.uisdc.com/poster-design-36
37,NIC,超详细！写给设计师的LoRa模型训练SOP,https://www.uisdc.com/lora-model-training-sop
38,夏花生,DomoAI 6大新功能详解！可自动扣除背景，支持人物一键跳舞,https://www.uisdc.com/domoai-2
39,姝斐suphie,10个动效细节剖析，看看高手是如何做设计的！,https://www.uisdc.com/10-ui-ux-design-17
40,京东JellyDesign,如何用AIGC加速设计？来看京东3C数码年货节设计复盘（上）,https://www.uisdc.com/aigc-3c
