index,hot,title,href
1,12114015,中秋满月遇上超级月亮
2,12111229,山东泰山3:1中央海岸水手
3,12088900,央视中秋晚会
4,11974814,中秋节快乐
5,10988645,台风普拉桑将登陆浙江沿海
6,10716159,美军机过航台海 解放军跟监警戒
7,9388750,花好月圆过中秋
8,9382418,王楚然敦煌造型好惊艳
9,9302030,分享一下我的中秋快乐碎片
10,9274668,大闸蟹今年为啥卖不动了
11,9265878,孙颖莎9400分世排第一
12,9239335,一代人有一代人的中秋团圆饭
13,9191577,iOS 18还我妈生相册
14,9180655,无锡警方辟谣男子街头触电身亡
15,9154058,唐嫣李现合唱若月亮没来
16,9101982,iOS18正式版上线
17,9066411,马斯克就特朗普事件发文后删除
18,9017444,泰国坠崖案当事人官宣生子
19,8941805,中秋节团圆的N个理由
20,8886569,佛山中秋习俗“烧番塔”是啥
21,8783081,许家印香港30平房屋将被拍卖
22,8755628,托卡耶夫：俄在军事上不可战胜
23,8754529,月亮慢慢变圆事事慢慢如愿
24,8462170,本周国内油价有望大幅下调
25,8417272,贝加尔湖畔最真实的样子
26,8412945,老板喝水遭徐志胜调侃
27,8283691,陈乔恩晒粉色天空悼念乔任梁
28,8267608,中秋节为什么要吃月饼
29,8255335,美联储降息如何影响普通人
30,8142886,近距离看库里投篮
31,8059088,赵露思新中式造型
32,8037651,刘美含我不是明星
33,8011217,李大海重逢初恋白霜
34,8010413,台风贝碧嘉今夜将移入河南境内
35,7997059,对手挑衅球迷 王大雷上前理论
36,7945380,和嫦娥一起过中秋
37,7802332,就借这月光再与你对望
38,7747233,丁禹兮邓恩熙中秋合唱好甜
39,7707737,收集一本月亮集
40,7692623,被年轻人的一平米装到了
41,7688749,凡人歌带火凡人歌
42,7686222,港股地产股全线暴涨
43,7686163,模仿西部牛仔对决
44,7676860,科学家从太空传回月亮X射线图像
45,7675713,中秋高校月饼大PK
46,7667116,国际乒联第38周排名公布
47,7663762,古诗里的中秋什么样
48,7660140,台风来了都得干活才能走
49,7654149,不养狗不知道养狗的乐趣
50,7650440,现在语文都开始出mv了
