index,hot,title,href
1,3.4万,新加坡人月入也就5000新币,http://club.kdslife.com/t_11332339.html
2,3.0万,王女士是刚度吗？还是我是？,http://club.kdslife.com/t_11332772.html
3,2.9万,真的，假的？上海少妇们?,http://club.kdslife.com/t_11332683.html
4,2.9万,吴艳妮奥运首秀创奇迹！改写中国奥运百米栏尘封36年纪录,http://club.kdslife.com/t_11332614.html
5,2.5万,伊朗正与以色列展开心理战了,http://club.kdslife.com/t_11332392.html
6,2.6万,好眼力，但这么大的空档，不堵车才怪,http://club.kdslife.com/t_11332894.html
7,2.5万,为什么江西彩礼这么高,http://club.kdslife.com/t_11332267.html
8,2.4万,根本骗不完啊！,http://club.kdslife.com/t_11332381.html
9,3.2万,据说有一支小队跑到库尔斯克去跟俄罗斯交火了,http://club.kdslife.com/t_11332564.html
10,2.0万,飘唇手术就花了5万,http://club.kdslife.com/t_11332641.html
11,1.8万,大家千万要有孩子，养老院里的老人凄惨无比,http://club.kdslife.com/t_11332689.html
12,1.7万,北京将举办乌克兰电影节,http://club.kdslife.com/t_11332851.html
13,1.8万,老小区，新能源汽车也蛮作孽的,http://club.kdslife.com/t_11332473.html
14,1.7万,怀疑大爷用不好的眼光看自己，遭到小姐姐怒斥！大爷极力辩解无济于事…,http://club.kdslife.com/t_11332591.html
15,1.7万,十几年的海量数据全部清空,http://club.kdslife.com/t_11332391.html
16,1.6万,弄来只香烟缸 大家看看怎么样】】】】】】】】】】】】】,http://club.kdslife.com/t_11332472.html
17,1.6万,普通人一旦超过38岁，再找到一份工作的概率极低！,http://club.kdslife.com/t_11332453.html
18,1.6万,女方主动，且没用发生关系的情况下，也可以判强奸？,http://club.kdslife.com/t_11332431.html
19,1.6万,一手房销售,http://club.kdslife.com/t_11332513.html
20,1.6万,女人超市买东西下手真的狠啊这一车4位数要的吧,http://club.kdslife.com/t_11332605.html
