index,hot,title,href
1,427,老婆她哥拿了我们二十万，让还一万，老婆和我吵架要离婚V2,https://www.guozaoke.com/t/105593
2,357,老婆她哥拿了我们二十万，让还一万，老婆和我吵架要离婚,https://www.guozaoke.com/t/105555
3,105,武汉是不是已经躺平了， 看不到积极作为的地方,https://www.guozaoke.com/t/105541
4,70,【伦理问题】亲叔叔前几年走了，婶婶找了男人同居了,https://www.guozaoke.com/t/105689
5,58,大家会担心绝后吗,https://www.guozaoke.com/t/105698
6,57,过年可以不陪夫/妻回对方家过年吗？,https://www.guozaoke.com/t/105699
7,56,大舅哥借钱不还的主，他老婆来了，但表述有较大出入,https://www.guozaoke.com/t/105583
8,53,比亚迪超特斯拉登顶全球电车销量第一,https://www.guozaoke.com/t/105529
9,49,摸鱼贴，说说大家的真实油耗,https://www.guozaoke.com/t/105656
10,49,问大家一个关于农村宅基地的问题,https://www.guozaoke.com/t/105703
