index,hot,title,href
1,96,Sora问世在中国带来最大的争论竟是教育,https://www.mysmth.net/nForum/article/ChildEducation/2347829
2,94,贡献一个巴黎自驾被砸车玻璃的经历,https://www.mysmth.net/nForum/article/Travel/979646
3,82,新能源汽车国外好像不太想搞了,https://www.mysmth.net/nForum/article/Stock/10792006
4,60,最后一天和你在一起系个红绳遥寄相思,https://www.mysmth.net/nForum/article/Love/6286867
5,57,那些被丈母娘逼着买房才结婚的，现在都很感激丈母娘吧,https://www.mysmth.net/nForum/article/MyFamily/217637
6,54,我上午去看了一套房，下午接待了来看我的房的。,https://www.mysmth.net/nForum/article/OurEstate/2901257
7,52,增程车是油发电，电驱动车子，跟油车直接驱动车子有啥优势,https://www.mysmth.net/nForum/article/GreenAuto/1473375
8,34,相亲对象，终极二选一,https://www.mysmth.net/nForum/article/Age/20342464
9,31,看见贾玲露面，动力直接拉满,https://www.mysmth.net/nForum/article/MMJoke/1634816542
10,27,同一车次两段拼票法，已被禁止？,https://www.mysmth.net/nForum/article/Railway/1180169
