index,hot,title,href
1,11904179,央视龙年春晚
2,11103339,迪丽热巴美到窒息
3,10908396,锦绣中国年
4,10750854,沈腾接仙气马丽接地气
5,10011379,白敬亭魏大勋魏晨显眼包齐聚春晚
6,9771707,陈丽君 今晚最帅
7,9761077,王铮亮0713春晚转场好感人
8,9000999,黄渤今年没有跑步机
9,8853324,春晚开场舞好多人啊
10,8620533,刘诗诗首登春晚唐韵美人
11,8499646,沙溢春晚结束光速回家陪胡可
12,8449029,尼格买提魔术穿帮
13,8296691,被章若楠的春晚穿搭种草了
14,8289424,民政局辟谣婚车司机亲新娘风俗
15,8218024,撒贝宁现挂满分
16,8140816,动画片这个节目刀哭了
17,7830725,看个春晚撕了一副扑克牌
18,7678952,金霏陈曦演我的精神状态
19,7668051,好想拜一拜刘涛
20,7544971,仿佛进入大鱼海棠的世界
21,7524644,岳云鹏出演打工时的自己
22,7413205,西安分会场诗朗诵起鸡皮疙瘩
23,7305079,都有谁拍到百乔上春晚了
24,7239751,张若昀李白联动梦回庆余年
25,7132578,繁花剧组春晚同桌唱歌
26,7125341,谁懂啊任素汐又唱抒情歌
27,7081065,李沁关晓彤有古代大小姐那味
28,7040993,谭爷爷说上春晚不紧张
29,7033806,阿根廷队杭州行取消
30,7012997,看得我膝盖疼
31,6944027,陈伟霆朱一龙王凯同台
32,6942017,章若楠春晚演小品
33,6938821,单依纯海来阿木舞台故事感
34,6935659,今年广场舞预定周深这首歌
35,6908500,多家卫视春晚跳科目三
36,6906955,刘谦春晚带观众集体变魔术
37,6901861,小雪看百乔春晚小品的反应
38,6895988,杨幂龙腾盛世新中式红裙
39,6891752,0713终于顶峰相聚
40,6889243,群星龙年开运红妆
41,6875578,毛不易开口就暖到了
42,6864323,梅西香港行主办方退款50%
43,6863261,马凡舒每年春晚都能美我一次
44,6853310,别人穿新中式VS我穿新中式
45,6849623,长辈看见3个人就以为是TFBOYS
46,6825890,狗狗过年也要有仪式感
47,6795694,岳云鹏孙越春晚做蹲起
48,6778070,谭爷爷揭秘花花的年夜饭
49,6773412,曾舜晞春晚舞台唱粤语
50,6772390,你说公主王子过年好
