index,hot,title,href
1,阳光下的黑影,约1.2万乌军进入俄罗斯，其中有大量雇佣兵，他们都来自哪些国家？战损率如何？,https://new.qq.com/rain/a/20240815Q03W7Z00
2,聆听,顾客消费超万元，损坏一根筷子被店家索赔100元，店家这算盘打得对吗？,https://new.qq.com/rain/a/20240815Q02HTB00
3,点评校尉,俄乌两军交战“你打你的我打我的”，主力完全无纠缠，为何会出现这种局面？,https://new.qq.com/rain/a/20240815Q082J300
4,局外人,杭州地铁一“女子”被曝多次触摸旁边大爷，构成猥亵吗？大爷该如何维权？,https://new.qq.com/rain/a/20240815Q08N1100
5,商业Y观点,业主因树木疯长存隐患砍伐后被罚款，处罚合理吗？门外绿化树有隐患如何正确处理？,https://new.qq.com/rain/a/20240816Q019IC00
6,廖家的喵妈,婚姻登记拟改为无需户口簿，爹妈担心孩子冲动结婚、没人把关，你会有这种顾虑吗？,https://new.qq.com/rain/a/20240815Q02SXU00
7,陈子杨Dr,医院里哪个科室属于“人少活少钱还多”的香饽饽？想进去要什么条件？,https://new.qq.com/rain/a/20240816Q04C3J00
8,阳光下的黑影,泰国迎来37岁总理，他信之女这么年轻能稳住政局吗？,https://new.qq.com/rain/a/20240816Q01RQF00
9,神斗斗????,大学生说唱歌词暗讽农民工，为了押韵就可以随便diss吗？什么样的才算好词？,https://new.qq.com/rain/a/20240815Q0505500
10,东域记,总统亲自带队，巴勒斯坦整个领导层将前往加沙，为何此时去？行程危险吗？,https://new.qq.com/rain/a/20240816Q02MMP00
11,注册营养师刘又姣,世卫组织第二次就猴痘拉响最高级别警报，会在中国大流行吗？哪里能接种疫苗？,https://new.qq.com/rain/a/20240815Q01SDN00
12,HR大掌柜,媒体称结婚不要户口本或缓解天价彩礼现象，两者之间有必然联系吗？真能缓解吗？,https://new.qq.com/rain/a/20240816Q059K700
13,喵漫茧影,老人尼泊尔旅游后话费账单一万六，漫游收费无上限合理吗？是否该多次提醒？,https://new.qq.com/rain/a/20240816Q0700W00
14,杨多多,拜登称自己在“找工作”，你有什么妙招？美国总统卸任后还需要找工作吗？,https://new.qq.com/rain/a/20240816Q043XL00
15,奶爸老钱聊带娃,海口一对龙凤胎出生间隔11天，这有多罕见？对母亲和孩子有什么影响吗？,https://new.qq.com/rain/a/20240815Q09PNH00
16,飞跃本屯,6月中国增持119亿美债，日本减持106亿，为什么两大债主会发生背离？,https://new.qq.com/rain/a/20240816Q015F800
17,阳光下的黑影,德国通缉破坏北溪的乌克兰人，为何会被波兰放走？波兰边防卫队真的不知情？,https://new.qq.com/rain/a/20240815Q0355Z00
18,中医健康科普,条例拟规定婚前隐瞒重大疾病可撤销婚姻，哪些算重大疾病？做婚检能查清吗？,https://new.qq.com/rain/a/20240815Q06V3F00
19,神斗斗????,特勤局为特朗普增加不供给总统候选人的安全设备，是要和下任老板打好关系吗？,https://new.qq.com/rain/a/20240816Q056G300
20,注册营养师刘又姣,25岁女孩腹部抽脂永久丧失生育能力，为何抽脂能影响到卵巢功能？常见吗？,https://new.qq.com/rain/a/20240816Q079HT00
21,小ai同学,绝味食品被证监会立案，问题严重吗？为何鸭脖大王3年多市值蒸发500多亿？,https://new.qq.com/rain/a/20240816Q03EUK00
22,看见未来,我国建成全球最大新能源产业链，新能源员工待遇如何？什么专业可以从事？,https://new.qq.com/rain/a/20240815Q06ENL00
23,刘昭廷,江苏南通一废旧航母在拆除改造时发生火灾，这艘航母从哪来的？,https://new.qq.com/rain/a/20240816Q09PH900
24,咕噜噜,爱上写小说被全撕掉、手机每日被监控，打压式父母对孩子影响多大？该怎么走出阴影？,https://new.qq.com/rain/a/20240816Q05CEL00
25,清风徐吟,A股上市公司12公斤黄金在非洲被抢，去向不明，如果找不到损失是股民承担吗？,https://new.qq.com/rain/a/20240815Q04SGV00
26,唐辰同学,王自如疑似从格力离职，真实情况什么样？和限高令有关吗？,https://new.qq.com/rain/a/20240816Q07VGD00
27,周臻,一年三代车，极氪汽车迭代速度惹怒老车主，这速度在电动汽车时代会是常态吗？,https://new.qq.com/rain/a/20240815Q02U8700
28,中医健康科普,癌症晚期患者有痊愈的可能性吗？到底怎么治？,https://new.qq.com/rain/a/20240816Q014OC00
29,周臻,比高铁还快，比亚迪仰望U9飙出375公里每小时急速，冲击这种速度意义何在？,https://new.qq.com/rain/a/20240816Q09C7200
30,玉璎珞聊影视,《唐朝诡事录之西行》“通天犀”短短3年召集十多万太阴会信众，宋阿糜是怎么做到的？,https://new.qq.com/rain/a/20240815Q09Y6R00
