index,hot,title,href
1,足球,雪佛龙｜国安2-2海港，武磊梅开二度+绝平，张玉宁点射,https://www.dongqiudi.com/article/4143433
2,足球,雪佛龙｜山东泰山1-0青岛海牛，德尔加多一锤定音,https://www.dongqiudi.com/article/4143446
3,足球,新鹏城2-0河南迎队史中超首胜，加西亚双响，徐浩峰送红点,https://www.dongqiudi.com/article/4143314
4,足球,担当！王上源赛后喊话：向球迷道歉，希望给我们一点时间,https://www.dongqiudi.com/article/4143695
5,足球,梅州主帅：以这种方式输球很遗憾，接下来最重要的是球员恢复,https://www.dongqiudi.com/article/4143694
6,足球,雪上加霜，记者：法比奥大腿肌肉拉伤将缺阵几周,https://www.dongqiudi.com/article/4143693
7,足球,苏亚雷斯：面对强敌张稀哲发挥出色；法比奥对球队非常重要,https://www.dongqiudi.com/article/4143684
8,足球,澳波：不能保证每个人都有上场时间；热刺的赛程缺乏连贯性,https://www.dongqiudi.com/article/4143608
9,足球,ESPN：帕尔默打进绝杀球后，恩佐喊芒特“懦夫”、“胆小鬼”,https://www.dongqiudi.com/article/4143673
10,足球,穆斯卡特：通过全队的努力取得进球绝平对手，我感到非常满意,https://www.dongqiudi.com/article/4143672
11,足球,王上源疑似向看台做挑衅手势，妻子：他是在努力听球迷讲什么,https://www.dongqiudi.com/article/4143669
12,足球,今夏接手利物浦？阿莫里姆：我无法保证自己会留在葡体,https://www.dongqiudi.com/article/4143644
13,足球,津琴科：若被征召将回乌克兰作战；和前俄罗斯队友已不再交谈,https://www.dongqiudi.com/article/4143645
14,足球,战南通7射0正，梅州客家自22年12月以来首次中超单场0射正,https://www.dongqiudi.com/article/4143653
15,足球,亚森：今天运气太差了，希望下场比赛能拿分和进球,https://www.dongqiudi.com/article/4143647
16,足球,恩佐-费尔南德斯：我在蓝军很开心，但不喜欢球队现在的排名,https://www.dongqiudi.com/article/4143605
17,足球,加拉格尔谈击败曼联：疯狂的比赛；波叔换下我是正确的选择,https://www.dongqiudi.com/article/4143641
18,足球,意天空：克亚尔恢复合练，波贝加下周可能代表米兰预备队复出,https://www.dongqiudi.com/article/4143588
19,足球,球迷态度：如何评价国安2-2战平海港的比赛精彩程度？,https://www.dongqiudi.com/article/4143620
