index,hot,title,href
1,12201013,龙门石窟人山人海场面
2,12070182,各省招牌菜来上分了
3,11335612,75年我们正年轻
4,11046407,假期为何不能多开夜间高铁
5,10322570,秋天的第一个草莓蛋糕
6,10227326,国庆穿汉服有多惊艳
7,9146376,男生秋冬穿搭教程
8,9103870,首届中国广播电视精品创作大会
9,8983379,黄金周铁路售票超1.3亿张
10,8913647,莫雷加德3:2张本智和
11,8823873,GEN战胜WBG
12,8327306,以军机库被伊朗导弹炸出大洞
13,8247259,中国大学生飞行器设计创新大赛
14,8242325,9月谣言榜
15,8103178,国台办对屏东医院火灾表达慰问
16,8001727,TES战胜T1
17,7954271,志愿军他们来自五湖四海
18,7862228,蒋时延唐漾假夫妻变真恋人
19,7793480,一百元在叙利亚能买什么
20,7790137,和刘德华一起唱亲爱的小孩
21,7774590,哈尔滨开启人从众模式
22,7769363,石破茂因政治资金问题被检举
23,7761264,和男朋友这样拍手势舞
24,7746189,CS2首个大行动上线
25,7746077,广州CICF漫展
26,7738772,汪峰太原演唱会
27,7733990,林诗栋谈下轮对阵林德
28,7732744,滕王阁太会整活了
29,7731225,迈阿密夺队史常规赛首冠
30,7730092,网友称天猫购五粮液官方鉴定为假
31,7714197,国庆出游背景杂乱怎么拍
32,7712900,语言通胀何尝不是语言贬值
33,7684652,王楚钦梁靖崑晋级四强
34,7679256,不露脸氛围感拍照
35,7672941,国庆长沙感觉有一亿人
36,7672297,碰杯转场
37,7669950,可惜枫叶红时总多离别
38,7669212,再也不以貌取椒了
39,7662868,日本新首相“喊停”央行加息计划
40,7654574,马龙晋级中国大满贯8强
41,7653957,福建浙江部分机场航班或将调整
42,7653587,当你有个瘦子闺蜜
43,7648475,港股上演V型反转
44,7647790,地产专家：楼市银十回来了
45,7643318,为什么晚上总是有星星手势舞
46,7642177,国庆带你领略祖国大好河山
47,7642141,翻到十年前初中数学卷子
48,7639783,林德3:2高承睿
49,7637211,唐斯正式加盟尼克斯
50,7631640,秋天的第一个毛茸茸帽子
