index,hot,title,href
1,866,CISA 将 Jenkins 命令行界面 （CLI） 漏洞添加到其已知利用的漏洞目录中,https://www.anquanke.com/post/id/299287
2,840,被盗、被锁定的支付卡仍然可在数字钱包使用,https://www.anquanke.com/post/id/299290
3,725,研究人员发现了与网络犯罪集团 FIN7 有关的新基础设施,https://www.anquanke.com/post/id/299294
4,828,多款 MacOS 版微软应用程序易受库注入攻击影响,https://www.anquanke.com/post/id/299296
5,894,新型 UULoader 恶意软件  Gh0st RAT 和 Mimikatz 在东亚地区传播,https://www.anquanke.com/post/id/299299
6,898,网络犯罪分子利用热门软件搜索传播 FakeBat 恶意软件,https://www.anquanke.com/post/id/299301
7,992,"IBM 新发布针对""网络安全""和""数据分析""的 IBM SkillsBuild 证书",https://www.anquanke.com/post/id/299304
8,887,Xeon Sender Tool 利用云 API 进行大规模短信钓鱼攻击,https://www.anquanke.com/post/id/299307
9,544,网络犯罪分子利用文件共享服务推进网络钓鱼攻击,https://www.anquanke.com/post/id/299310
10,951,360零信任安全办公平台升级！构筑一体化数字安全办公空间,https://www.anquanke.com/post/id/299313
11,2345,ValleyRAT恶意软件瞄准中文用户,https://www.anquanke.com/post/id/299254
12,1870,CISA 将 Jenkins 命令行界面 （CLI） 漏洞添加到其已知利用的漏洞目录中,https://www.anquanke.com/post/id/299261
13,1986,报告发现，威胁行为者越来越多地以 macOS 为目标,https://www.anquanke.com/post/id/299263
14,2048,攻击者利用公共 .env 文件在勒索活动中破坏云帐户,https://www.anquanke.com/post/id/299266
15,1921,与 Black Basta 有联系的威胁行为者利用 SystemBC 恶意软件攻击用户,https://www.anquanke.com/post/id/299269
16,2031,数千个Oracle NetSuite电子商务网站暴露敏感客户数据,https://www.anquanke.com/post/id/299271
17,1935,Google Pixel 设备中预装的“Showcase.apk”应用程序存在安全漏洞,https://www.anquanke.com/post/id/299273
18,1664,National Public Data 确认发生了一起严重的数据泄露事件,https://www.anquanke.com/post/id/299249
19,1536,重磅！360 智能化数据安全系列产品发布 实现数据可见、可管、可用！,https://www.anquanke.com/post/id/299276
20,1262,新的 macOS 恶意软件Banshee Stealer 可窃取包括浏览器数据、加密货币钱包和浏览器扩展的数据,https://www.anquanke.com/post/id/299280
