index,hot,title,href
1,71,今生能否在中国出现像马斯克这样改变世界的天才,https://www.guozaoke.com/t/108134
2,67,出去玩没做攻略被骂了,https://www.guozaoke.com/t/108209
3,63,雷总第二工厂来武汉吧,https://www.guozaoke.com/t/108103
4,59,以后的独生女是不是会越来越少？,https://www.guozaoke.com/t/108151
5,58,明天做肠镜，后天嘎菊花,https://www.guozaoke.com/t/108143
6,54,吵架后续,https://www.guozaoke.com/t/108120
7,49,江西文旅三年白干,https://www.guozaoke.com/t/108213
8,48,你们后悔生娃生晚了吗？,https://www.guozaoke.com/t/108189
9,47,陈震关于su7的试驾，大家怎么看？,https://www.guozaoke.com/t/108097
10,47,截至2024年4月1日，中国城市轨道交通运营及在建里程统计,https://www.guozaoke.com/t/108193
