index,hot,title,href
1,1160 万热度,女子笔面试「双第一」却被判「无效」，福建通报「已成立联合调查组」，成绩无效的原因是什么？调查进展如何？,https://www.zhihu.com/question/661029623
2,642 万热度,多家上市公司否认煤油食用油混装，称不存在此行为，煤油罐车装的食用油到底流向了哪里？,https://www.zhihu.com/question/661074403
3,485 万热度,金龙鱼回应油罐车事件，公司对食用油运输有严格监管，不会使用别家的油罐车，具体情况如何？,https://www.zhihu.com/question/661162511
4,444 万热度,7月4日钓鱼网红翠翠在城市泄洪渠溺亡，钓鱼真的必须会游泳么？,https://www.zhihu.com/question/660925913
5,218 万热度,自己的哥哥是皇帝，称之为“皇兄”；如果自己的弟弟是皇帝，应该如何称呼？,https://www.zhihu.com/question/661057913
6,96 万热度,萝卜快跑无人驾驶出租车武汉街头撞倒行人，百度称配合警方处置，无人驾驶如何保证安全？责任应该怎么认定？,https://www.zhihu.com/question/661156013
7,86 万热度,女真是如何一步步发展到足以威胁明朝的？,https://www.zhihu.com/question/660594602
8,83 万热度,如何从浅入深理解 Transformer？,https://www.zhihu.com/question/471328838
9,83 万热度,我朋友的妈妈坚持让孩子上专科而不是复读，为什么？,https://www.zhihu.com/question/661083062
10,82 万热度,小镇做题家怎么破局?,https://www.zhihu.com/question/659099653
11,81 万热度,外国小伙忘拔电动车钥匙，一天后车仍在原地，直呼在中国太幸福了，你有类似经历吗？安全环境对生活有多重要？,https://www.zhihu.com/question/661035909
12,80 万热度,售价 17.99 万元起，燃油车 B 级标杆全新迈腾值得入手吗？,https://www.zhihu.com/question/661173308
13,69 万热度,你收藏的有哪些令人清醒的句子?,https://www.zhihu.com/question/661001081
14,59 万热度,融资融券佣金比例是多少呢？证券公司都一样吗？,https://www.zhihu.com/question/410228679
15,58 万热度,你这一生，最晚明白的道理是什么？,https://www.zhihu.com/question/661028667
16,57 万热度,为什么白银越来越稀有而价格却这么低？,https://www.zhihu.com/question/56864369
17,48 万热度,饿瘦和运动瘦的区别是什么？,https://www.zhihu.com/question/660795562
18,48 万热度,报告显示菲方军舰长期非法「坐滩」，已严重破坏仁爱礁珊瑚礁生态系统，具体情况如何？后续还能恢复吗？,https://www.zhihu.com/question/661060143
19,47 万热度,运动何以夺命？哪些运动易出现运动性猝死？如何预防？,https://www.zhihu.com/question/660703987
20,47 万热度,黄金树幽影如果最后BOSS换成葛德文评价会怎样？,https://www.zhihu.com/question/659855394
21,47 万热度,如何看待华为 Mate  60 系列全版本销量超千万，具有哪些标志性的意义？,https://www.zhihu.com/question/661143392
22,47 万热度,iPhone 15 Pro以上机型将支持全新 Siri，你会为了 Siri 换新手机吗？,https://www.zhihu.com/question/661031808
23,47 万热度,南宋和南明谁的灭亡更让人唏嘘？,https://www.zhihu.com/question/660660292
24,47 万热度,为什么要把家用车带上专业赛道测试？有什么价值？,https://www.zhihu.com/question/661130530
25,47 万热度,性格内向经常内耗自己怎么办？,https://www.zhihu.com/question/661086933
26,47 万热度,《红楼梦》的作者可能会是书中的谁？,https://www.zhihu.com/question/660083375
27,47 万热度,如何评价7月9日发布的真我GT6，值得入手吗？,https://www.zhihu.com/question/661146076
28,47 万热度,作为职场新人，如何快速识别自己的贵人？,https://www.zhihu.com/question/660912675
29,46 万热度,如何看待 7 月 9 日 A 股市场行情？,https://www.zhihu.com/question/661118652
30,46 万热度,那些古诗词陶冶了你的心性？,https://www.zhihu.com/question/660788145
31,46 万热度,学习基础的心理学知识，对生活有何作用？,https://www.zhihu.com/question/660987297
32,46 万热度,业内人士称油罐车混装食用油或用于分装销售及供应中小餐饮、食堂等，具体情况如何？能否对油罐车实时监测？,https://www.zhihu.com/question/661118695
33,46 万热度,如何评价电视剧《知否》中的孙秀才母子？,https://www.zhihu.com/question/308507391
34,46 万热度,准高三在家一天只能学五个小时怎么办？,https://www.zhihu.com/question/661078506
35,46 万热度,民办学校有可能办出具备一本 / 985 / 211 / 双一流实力的高校吗？,https://www.zhihu.com/question/661024154
36,46 万热度,凡尔赛文学、精装朋友圈等被热议，虚荣背后的心理机制是什么？,https://www.zhihu.com/question/660489085
37,46 万热度,说说你最近单曲循环的歌是什么？,https://www.zhihu.com/question/657426463
38,46 万热度,在电机控制中，位置环为什么常用P，PD。而不用PI?,https://www.zhihu.com/question/655437602
39,46 万热度,对于跑步新手老说，每周跑多少量合适？,https://www.zhihu.com/question/658733228
40,46 万热度,为什么有了CPU，还要研究GPU？,https://www.zhihu.com/question/660424819
41,46 万热度,在中国古代有哪些著名的交通线？,https://www.zhihu.com/question/659662103
42,46 万热度,西班牙对阵法国，你更看好哪队杀入决赛？,https://www.zhihu.com/question/661002165
43,46 万热度,现在创业有什么项目可以做起来?,https://www.zhihu.com/question/660546174
44,46 万热度,普通人还有必要学习 Python 之类的编程语言吗？,https://www.zhihu.com/question/659661272
45,46 万热度,同样是大女主复仇爽剧，为何《墨雨云间》没有《延禧攻略》火爆？,https://www.zhihu.com/question/660652476
46,46 万热度,曹雪芹对于贾敬的态度是否有矛盾？,https://www.zhihu.com/question/658151161
47,46 万热度,作为游客，你觉得南北方古建有哪些令人深刻的差异？,https://www.zhihu.com/question/658208636
48,46 万热度,中国首批孤独症辅助犬持证上岗，它们能给「星星的孩子」带来哪些帮助？生活中，你有过被小动物治愈的时刻吗？,https://www.zhihu.com/question/661036199
49,46 万热度,老爵爷谈 C 罗是否还能参加世界杯，称「再获得一两个冠军对他来说已经没有太大意义」，如何看他这评价？,https://www.zhihu.com/question/660844192
50,46 万热度,T1 中单选手 Faker 获得石油杯 FMVP，如何评价该选手在本次赛事中的表现？,https://www.zhihu.com/question/661029107
