index,hot,title,href
1,,地球上有多少种人类,http://jandan.net/p/115432
2,,更快的Wi-Fi 7已经悄然到来,http://jandan.net/p/115430
3,,高等教育危机：美国人对大学失去信任,http://jandan.net/p/115439
4,,你的身体有个自带的减肥系统,http://jandan.net/p/115420
5,,谁发明了微处理器,http://jandan.net/p/115449
6,,更多证据表明，复合维生素有助于延缓记忆力衰退,http://jandan.net/p/115426
7,,最长寿淡水鱼：能活过百岁，且越老越健康,http://jandan.net/p/115437
8,,史海钩沉：在中世纪，人们睡在柜子里,http://jandan.net/p/115446
9,,氦必不可少，但不可再生且难以回收,http://jandan.net/p/115436
10,,精子数量在世界范围内下降，科学家寻求解答,http://jandan.net/p/115418
11,,今日好价 0122,http://jandan.net/p/115434
12,,暴力电子游戏并不会导致暴力行为，甚至可能有益身心,http://jandan.net/p/115457
13,,人类免疫系统在后奥密克戎时代的进化,http://jandan.net/p/115431
14,,今日好价 0124,http://jandan.net/p/115451
15,,今日好价 0123,http://jandan.net/p/115444
16,,今日好价 0125,http://jandan.net/p/115462
17,,收藏品市场泡沫破灭，威士忌和劳力士大跌,http://jandan.net/p/115454
18,,"你的钱去哪了？揭秘""订阅陷阱""",http://jandan.net/p/115416
19,,网络上充斥着机器翻译的垃圾,http://jandan.net/p/115455
20,,科学家警告北极“僵尸病毒”可能触发新的疫情,http://jandan.net/p/115438
21,,不生病的老去是可能的吗,http://jandan.net/p/115428
22,,今日好价 0121,http://jandan.net/p/115424
23,,AlphaFold发现了数千种可能的迷幻药,http://jandan.net/p/115422
24,,防感冒防流感防新冠：如何安然度过冬季,http://jandan.net/p/115442
25,,太阳究竟有多远？,http://jandan.net/p/115447
26,,新研究揭示胎儿制造的一种蛋白可能导致孕吐,http://jandan.net/p/115429
27,,有些人喝牛奶就能降低2型糖尿病风险,http://jandan.net/p/115456
28,,神秘的鞭毛虫化石揭示了生命的奇异融合,http://jandan.net/p/115448
29,,为什么机器学习这么难,http://jandan.net/p/115453
30,,地球系统模型不足以应对未来气候变化的挑战,http://jandan.net/p/115417
