index,hot,title,href
1,12072554,马龙再现躲球名场面
2,11750898,徐卓一陈芋汐将成为同专业同学
3,11690577,中央6.49亿元支持14省救灾工作
4,11617688,国乒女团晋级四强
5,10978916,邓丽娟女子速度攀岩摘银
6,10609741,王楚钦被裁判问比分
7,9246961,吴艳妮林雨薇进入复活赛
8,9245890,举重开赛中国有望1日2金
9,9245457,国乒男团横扫韩国晋级4强
10,9235952,詹姆斯眉骨缝了四针
11,9233860,李发彬卫冕冠军
12,9197231,四川遂宁一隧道口垮塌系谣言
13,9175759,全红婵回应第三跳失误
14,9089605,张博恒来抖音直播了
15,9086558,吴艳妮：跑得太慢给自己打0分
16,9085956,潘展乐又双叒叕“告状”了
17,9048133,立秋文案
18,9006617,尼泊尔坠机致4名中国公民遇难
19,8969336,夺命书生徐卓一
20,8942732,用秋天的第一杯奶茶预热七夕
21,8921411,全红婵打破伏明霞纪录
22,8696790,8月7日奥运看点
23,8575446,印度教练看王楚钦的眼神
24,8450560,陈芋汐赛后采访忍不住落泪
25,8399594,庆功宴上的刘亦菲
26,8076789,沈腾首部犯罪电影逆鳞定档
27,7905776,全红婵回应赛后抱着陈若琳哭
28,7859396,用潘展乐三个字画出潘展乐
29,7840793,出人意料的七夕礼物
30,7839149,抖音你是会总结的
31,7804320,秋天的第一杯奶茶又来整活了
32,7798946,被斩神的少年热血燃到了
33,7783798,夏天就这么结束了
34,7774604,今日立秋
35,7755365,王楚钦发带造型大赏
36,7726273,全国省饭哪家强
37,7709676,送完七夕礼物家里干净多了
38,7698923,总以为时间慢这就立秋了
39,7690148,南宫春水打到反派自己服气
40,7653253,法律能否约束饭圈
41,7652272,当爸妈带着我的手机逛超市
42,7650482,假期带娃问题不大
43,7647818,录取通知书测评新赛道
44,7644283,华晨宇忒修斯的船改编大赛
45,7631702,入殓师的日常
46,7630569,旅行最好的纪念品是影像
47,7629251,西安暴雨
48,7627036,吴艳妮：现在我赢得起也输得起
49,7624354,MBTI七夕送礼指南
50,7621491,和你们这些双眼皮拼了
