index,hot,title,href
1,11424029,央视春晚第四次联排
2,10755847,湖北的冻雨有多严重
3,10596152,漫步二十四节气
4,10516826,立春至万象新
5,10345848,直击大雪后的武汉
6,10250681,大学生寒假饮食定律
7,9523543,春节氛围从春运回家开始
8,9511894,这些年轻人对非遗上头了
9,9466740,这些涉无偿献血信息不实
10,9415491,少爷和我开播
11,9390758,开启龙年的一百种方式
12,9356267,猫猫会制裁每个嘴硬的长辈
13,9328836,马光远称调休没必要
14,9302496,警方：被砸奇瑞没有套牌问题
15,9301781,刘能怀疑老伴出轨
16,9183004,南航回应乘客机舱被困近6小时
17,9182698,辽视春晚春节大集
18,9163394,网红狗狗金子去汪星了
19,9125187,福建高速半挂车追尾致7死
20,9052260,李玉玲语气出模仿教程了
21,9025149,小沈阳版东北民谣
22,8999232,被砸车女子再回应
23,8984628,张韶涵旺仔小乔合唱
24,8983295,年货炸食大合集来了
25,8954290,Welcome to德云社封箱
26,8945551,董宇辉立春文案
27,8933089,撒贝宁对保定羊汤爱不释手
28,8913225,刘德华自曝曾有粉丝藏床下
29,8907161,谭松韵胡姬妆造
30,8873449,梅西未进大名单
31,8854371,用这首bgm接全年好运
32,8853792,暴雪高速堵车下的暖心互助者
33,8843213,蓝亦菲去世真相好虐心
34,8811933,精神压力大可能长白头发
35,8788774,摇太阳两个半条命拼成一辈子
36,8788552,只要有你接力合唱
37,8762559,武汉多趟列车停运
38,8759819,晴雅集遭起诉索赔2400万
39,8717956,致敬武汉融雪除冰人
40,8666961,电影黑白潜行上线
41,8662670,能开出宿舍门的上下床
42,8631287,林亦扬恋爱新手开窍了
43,8607109,挑战用李玉玲语气回家过年
44,8574390,回家过年的感动瞬间
45,8563941,钉钉登陆Apple Vision Pro
46,8543200,工作日iPhone闹钟没响
47,8520663,专家谈父母逼婚
48,8465300,目击者回忆奔驰男砸车经过
49,8424551,年味就是我们心中的那份归宿
50,8420746,交换红包确认自己是欧皇体质
