index,hot,title,href
1,3.4万,居然是德籍华裔……,http://club.kdslife.com/t_11223180.html
2,2.7万,你以后就不要坐出租车,http://club.kdslife.com/t_11223184.html
3,2.6万,闲鱼卖东西碰到册佬了,http://club.kdslife.com/t_11223260.html
4,2.3万,小红书上在讨论上海朋友不是310,http://club.kdslife.com/t_11223167.html
5,2.1万,出了事情又是上海人，作孽,http://club.kdslife.com/t_11223278.html
6,1.9万,本地银行稀缺3.4%大额存单，预约开户享更多豪礼,http://club.kdslife.com/t_11223231.html
7,1.8万,好家伙现在年轻人是生猛,http://club.kdslife.com/t_11223220.html
8,2.3万,机器人做到这种程度了？！还要什么女朋友！,http://club.kdslife.com/t_11223242.html
9,1.6万,以色列和巴勒斯坦是不是同一个种族,http://club.kdslife.com/t_11223170.html
10,1.6万,上海老爷叔表示，生是市区人，死是市区鬼，郊区送给我住也不要,http://club.kdslife.com/t_11223300.html
11,1.5万,那么多阿拉伯人打不过一个以色列,http://club.kdslife.com/t_11223347.html
12,1.4万,用包占座，上海女模子据理力争,http://club.kdslife.com/t_11223291.html
13,1.3万,老乡鸡免费饭排队。,http://club.kdslife.com/t_11223271.html
14,1.4万,银行柜员工资才7K-11K,http://club.kdslife.com/t_11223202.html
15,1.2万,这个xs 可惜了,http://club.kdslife.com/t_11223185.html
16,1.6万,40岁左右的TF，你们觉得这辈子自己活通透了吗,http://club.kdslife.com/t_11223249.html
17,1.2万,现在外面偷自行车的人还多吗？,http://club.kdslife.com/t_11223275.html
18,1.2万,吴泾神盘紫竹半岛均价大幅回落！,http://club.kdslife.com/t_11223261.html
19,1.2万,靠中高端机型，销量重回国产第一，这有点太快了。。。,http://club.kdslife.com/t_11223187.html
20,1.3万,昨天还有谁是穿短袖衣服的？,http://club.kdslife.com/t_11223304.html
