index,hot,title,href
1,12022333,火影忍者须佐止水全技能爆料
2,11632313,柯冉回应签约新团队
3,11498565,青春就要充满passion
4,11464959,王者荣耀新赛季
5,10863348,海关总署副署长孙玉宁被查
6,10835045,退出价格战后宝马销量暴跌
7,9444716,山东泰山1:0成都蓉城
8,9373991,谁懂这种无忧无虑的童年
9,9365926,在厦门机场偶遇钢琴即兴合唱
10,9266793,市监局调查东北雨姐红薯粉条事件
11,9264741,蔡磊段睿愿把生命投入罕见病研究
12,9191996,央行降准降息有何影响
13,9191220,商竣程夺ATP巡回赛首冠
14,9182895,去云南大环线可享福利系谣言
15,9170599,何知南高鹏复合
16,9002006,刘美含妈妈后悔斩断女儿大学恋情
17,8979477,钟南山回应健康问题
18,8918066,山西失联40多天女童已遇难
19,8917571,赵今麦又在军训了
20,8607150,周楷恒宣布解散zooparty
21,8596310,乔任梁父母祝福陈乔恩结婚
22,8589709,和平地铁逃生冰河禁区攻略
23,8542520,灰熊将裁掉前MVP德里克罗斯
24,8502635,永劫无间s14新赛季永昼
25,8491834,甜馨参加小姨婚礼
26,8248372,我们的电子设备还安全吗
27,8217561,被王毅外长认出来是什么感受
28,8108462,和平精英地铁逃生蝴蝶刀
29,8089445,宋慧乔现身台湾
30,8055462,A股全天成交额超9700亿
31,7867014,当我下训没换军训服
32,7786315,炉石传说国服明日回归
33,7763227,李白谪仙醉月新皮肤
34,7747794,知音漫客
35,7740222,央行下调存量房贷利率
36,7720538,上过大学的喵就是不一样
37,7702362,用100张照片回忆我们
38,7699847,华为Watch GT5 Pro上手体验
39,7695095,北京下雨
40,7692783,本周的我无法安心工作
41,7672553,我们拉过勾的永远不许变
42,7664858,看泥72变
43,7663800,人在饿的时候最有活儿
44,7662820,广西军训已经next level了
45,7661884,央行回应存量房贷跨行转按揭
46,7661190,曝维尼修斯斩获2024金球奖
47,7658531,车主称小米SU7识别出现bug
48,7652378,罗德里十字韧带撕裂
49,7646690,暗区新版本风暴前夕上线
50,7646687,我国海上成功发射一箭八星
