index,hot,title,href
1,足球,Here we go！罗马诺：穆里尼奥将担任费内巴切主帅并签约两年,https://www.dongqiudi.com/article/4290305
2,足球,中国女足1-1澳大利亚女足，张琳艳破门，海曼绝平,https://www.dongqiudi.com/article/4290080
3,足球,队报：皇马将于下周一官宣姆巴佩加盟,https://www.dongqiudi.com/article/4290397
4,足球,中甲第12轮，来我懂本队直播间一起支持重庆铜梁龙！,https://www.dongqiudi.com/article/4289564
5,足球,中甲第12轮，来懂球帝本队直播间一起支持广州队！,https://www.dongqiudi.com/article/4289534
6,足球,中甲第12轮，来我懂本队直播间一起支持石家庄功夫！,https://www.dongqiudi.com/article/4289548
7,足球,中甲第12轮，来懂球帝本队直播间一起支持大连英博！,https://www.dongqiudi.com/article/4289582
8,足球,卡洛斯：皇马度过了美好的赛季，如果想当教练安切洛蒂就是榜样,https://www.dongqiudi.com/article/4290462
9,足球,罗马诺：国米还将与巴雷拉涨薪续约，合同有效期至2029年,https://www.dongqiudi.com/article/4290439
10,足球,法尔克：拜仁球员们最近经常分享孔帕尼在更衣室训话的视频,https://www.dongqiudi.com/article/4290441
11,足球,斯内德：皇马会击败多特夺冠；穆帅已告诉我将执教费内巴切,https://www.dongqiudi.com/article/4290421
12,足球,再遭绝平，女足已连续10场比赛未能战胜澳大利亚女足,https://www.dongqiudi.com/article/4290399
13,足球,法尔克：为加盟拜仁，韦德拉奥果愿意接受上场时间减少的现实,https://www.dongqiudi.com/article/4290423
14,足球,洛里：世界杯后太累身体撑不住，在热刺最后几个月我变“透明”了,https://www.dongqiudi.com/article/4290417
15,足球,法尔克：拜仁认为沃顿很适合球队，同时也关注阿马杜-奥纳纳,https://www.dongqiudi.com/article/4290415
16,足球,埃姆雷-詹：坚信多特能拿欧冠；渣叔是职业生涯最重要的教练,https://www.dongqiudi.com/article/4290296
17,足球,麦迪逊：热刺球员知道球迷想让我们输曼城，但我们踢得很出色,https://www.dongqiudi.com/article/4290406
18,足球,德天空：诺伊尔、萨内恢复球队合练，德国队还有5位球员未报道,https://www.dongqiudi.com/article/4290408
19,足球,意媒：米兰、尤文等4队有意阿姆拉巴特，紫百合要价1700万欧,https://www.dongqiudi.com/article/4290409
20,足球,洛蒂托：如今的球员只看重钱，一有成绩就理所当然的要求涨薪,https://www.dongqiudi.com/article/4290401
