index,hot,title,href
1,足球,热刺女足官方：中国女足国脚王霜加盟球队，双方签约至2026年,https://www.dongqiudi.com/article/3897522
2,足球,三战全胜零丢球！官方：滕哈格当选英超11月最佳教练,https://www.dongqiudi.com/article/3897703
3,,塔伊 vs 利雅得新月 比赛动态,https://www.dongqiudi.com/article/3898005
4,足球,孙兴慜：昨天赛后疼痛感持续因此吃了止疼药，希望情况不严重,https://www.dongqiudi.com/article/3898071
5,足球,离复出不远了？切尔西官方晒照：奇尔韦尔、查洛巴恢复了训练,https://www.dongqiudi.com/article/3898066
6,足球,记者：帕利尼亚顾问正与几家英超豪门谈转会，拜仁仍对他有意,https://www.dongqiudi.com/article/3898062
7,足球,澳波：孙兴慜和几名球员有小伤但不严重，新年前不会有人回归,https://www.dongqiudi.com/article/3898057
8,,利雅得胜利 vs 利雅得体育 比赛动态,https://www.dongqiudi.com/article/3898035
9,足球,瓜帅：球队需要经历一些困难；对菲利普斯没出场机会感到抱歉,https://www.dongqiudi.com/article/3898033
10,足球,放假也上课，前国脚郑龙、姜宁参加青岛足协C级教练员培训班,https://www.dongqiudi.com/article/3898032
11,足球,昔日枪手今何在：FIFA14小妖|埃贝西利奥,https://www.dongqiudi.com/article/3897999
12,足球,安切洛蒂：给5亿去不去沙特？我可以走过去，不用飞机,https://www.dongqiudi.com/article/3898026
13,足球,劝说斯帅留下？记者：梅西和斯卡洛尼未来几天将会面,https://www.dongqiudi.com/article/3898016
14,足球,开始书写，2023年冬天的故事,https://www.dongqiudi.com/article/3897990
15,足球,魔人布欧实锤了,https://n.dongqiudi.com/webapp/tops.html?id=3897987
16,足球,武汉三镇球迷晒晒今年的看球“成绩单”,https://www.dongqiudi.com/article/3897976
17,足球,冷静辩证的讨论为什么球员要坚持现在的战术,https://www.dongqiudi.com/article/3897970
18,足球,曼联官方：林德洛夫因伤无缘出战伯恩茅斯,https://www.dongqiudi.com/article/3897959
19,足球,廷贝尔：受伤后大家给了我很多支持；阿尔特塔很擅长指导我们,https://www.dongqiudi.com/article/3897958
20,足球,苏亚雷斯：是金子都会发光巴甲联赛颁奖典礼在圣保罗...,https://n.dongqiudi.com/webapp/tops.html?id=3897955
