index,hot,title,href
1,11357171,小满恰逢520
2,11171921,520一起分享恋爱经过
3,10082174,节气里的大美中国
4,10032075,谈恋爱应该AA吗
5,9345853,网友偶遇BLG众人深夜骑行
6,9330669,胖猫姐姐多平台账号被封
7,8172377,疯产姐妹回来了
8,8023108,还记得中考前一晚在干嘛么
9,7942871,伊朗总统遇难
10,7927074,人民日报评胖猫事件
11,7856771,辽篮胜新疆 差一场夺冠
12,7684612,汪峰承认与森林北恋情
13,7678249,新疆楼兰故城这些消息系谣言
14,7666325,已经收到520的第一束花
15,7657395,陆慷任中联部副部长
16,7653798,张元英ins评论区
17,7643098,什么视频配上这音乐都会伤感吗
18,7625576,收到了喜欢的乌梅子酱花束
19,7593230,人生小满胜万全
20,7593051,伊朗总统遗体已被送往公墓
21,7589483,费翔母亲去世
22,7583481,具惠善称离婚后几乎无家可归
23,7582875,520杨幂送我花了
24,7582113,微信已开放520元红包
25,7581015,IVE回归0一位
26,7575718,这个520小满胜万全
27,7570753,520我晒的是此生挚爱
28,7570073,赵露思24小时法国行
29,7564458,警方通报胖猫跳江事件
30,7562248,六月只要上19天班
31,7561797,520的请假理由
32,7560079,王心凌男孩礼貌又克制
33,7559363,520又要开始蹲点捡花了
34,7558421,先说谎的人氛围慢动作
35,7553233,群星520来告白
36,7552823,周翊然520手势舞好甜
37,7551813,用live绽放点亮日常碎片
38,7548160,周鸿祎的引体向上好标准
39,7545451,重庆驾驶员的技术有多高
40,7538126,专家：赖清德要对台军进行大清洗
41,7537021,好奇这个辅食是有多难吃
42,7531548,假装收到了520礼物
43,7530071,爱自己就是要吃顿好的
44,7529781,沙特国王肺部感染
45,7529107,具荷拉真的很勇敢
46,7522160,520全抖音集体撒糖
47,7521631,小满节气大有学问
48,7521627,天彭元帅翻唱
49,7502778,520就跳谁是你朋友手势舞
50,7492063,光照氛围感照片
