index,hot,title,href
1,足球,欧冠1/8决赛对阵出炉：巴萨将战那不勒斯，国米遭遇马竞,https://www.dongqiudi.com/article/3917257
2,足球,世俱杯会上场吗？德布劳内参加了球队今天的训练,https://www.dongqiudi.com/article/3918162
3,足球,记者：前沧州雄狮外援什科里奇将加盟天津津门虎,https://www.dongqiudi.com/article/3918156
4,足球,塞维利亚官方：前申花主帅弗洛雷斯执教球队，签约至2025年,https://www.dongqiudi.com/article/3918148
5,足球,记者：贝里奇回到津门虎的可能性并不大,https://www.dongqiudi.com/article/3918126
6,足球,海纳：我们会斥巨资买巨星，但我们也希望能培养自己的年轻人,https://www.dongqiudi.com/article/3918124
7,足球,英媒：瓦拉内愿意留在曼联并且为位置而战,https://www.dongqiudi.com/article/3918111
8,足球,如果没有你，得到一切又有什么意义？,https://www.dongqiudi.com/article/3918108
9,足球,马尔基尼奥斯：皇家社会现在状态火热，对阵他们就像踢决赛,https://www.dongqiudi.com/article/3918102
10,足球,纳赛尔：皇家社会是一支很出色的球队，我们很尊重他们,https://www.dongqiudi.com/article/3918082
11,足球,《天下足球》英超：阿森纳全取三分，重夺榜首之位,https://www.dongqiudi.com/article/3918076
12,足球,《天下足球》英超：“双红会”平局收场，利物浦失榜首,https://www.dongqiudi.com/article/3918070
13,足球,《天下足球》德甲：凯恩双响，拜仁走出阴影,https://www.dongqiudi.com/article/3918062
14,足球,《天下足球》意甲：国米客胜拉齐奥，扩大领先优势,https://www.dongqiudi.com/article/3918054
15,足球,谁能给他p个阿根廷球衣 感谢,https://www.dongqiudi.com/article/3918049
16,体坛,法拉利厂队首个中国籍车手，叶一飞24年将正式加入跃马大家庭,https://www.dongqiudi.com/article/3918045
17,足球,《天下足球》足球制造：传奇告别，基耶利尼正式退役,https://www.dongqiudi.com/article/3918040
18,足球,埃文斯：利物浦统治了比赛，但我们或许有最好的两次机会,https://www.dongqiudi.com/article/3918039
19,足球,《天下足球》一周十佳进球：赖因德斯连过数人破门领衔,https://www.dongqiudi.com/article/3918029
20,足球,罗哥虽然已经远离欧洲，但欧冠新闻永远少不了欧冠之王！,https://www.dongqiudi.com/article/3918052
