index,hot,title,href
1,140,媳妇迷恋上了某款社交软件，在上面装单身，各种聊是什么心态？,https://www.guozaoke.com/t/109562
2,114,在文化大道汇入主路发生剐擦，交警说武汉没有交替通行---普法贴[旺柴],https://www.guozaoke.com/t/109417
3,86,阿波罗登月的痕迹,https://www.guozaoke.com/t/109416
4,78,星光城可以对口三十七小吗,https://www.guozaoke.com/t/109420
5,75,又被说小气&斤斤计较了,https://www.guozaoke.com/t/109592
6,70,多部&委成立联合工作组，酝酿推出房地产“重大举措”,https://www.guozaoke.com/t/109590
7,69,本群有多少人在海外啊？,https://www.guozaoke.com/t/109564
8,55,武汉房价什么时候到底,https://www.guozaoke.com/t/109494
9,54,华为正式回应time.sleep(6)了，各位怎么看？,https://www.guozaoke.com/t/109554
10,50,上海3YD撞护栏起火，车门打不开,https://www.guozaoke.com/t/109482
