index,hot,title,href
1,12108436,“果菌王”被中科院专家收了
2,11482991,暑假工已入侵直播间
3,11388281,我国成功搭建6G试验网
4,11176942,一年一度吃菌子大会
5,10539833,跟着熊熊学拍照
6,10479741,这个夏天冰杯火了
7,9370428,香港警队年内换用国产手枪
8,9322283,谢欣桐小黄分手
9,9277469,Uzi说自己要凉了
10,9243835,女子180万卖掉房子120万买回
11,9238559,蜜雪冰城就拒卖冰杯事件致歉
12,9165289,长相思2口碑
13,9161926,苹果用户换机周期变长
14,8990182,重庆批发市场被淹系谣言
15,8941214,官方回应女厅官被举报论文抄袭
16,8745124,谭松韵许凯混合双怼
17,8649765,中国向美遣返1名美籍红通逃犯
18,8556708,默杀的闺蜜情好戳
19,8436803,滑稽戏演员傅子明去世
20,8355392,田小娟自曝月收入
21,8113715,北约“直接警告”中国 中方驳斥
22,7938197,打卡恋与深空地铁站
23,7881354,是时候展示台球技术了
24,7881061,广西人的农村生活好安逸
25,7873670,萝卜快跑爆单网约车何去何从
26,7871145,中方回应日护卫舰进入中国领海
27,7847575,U15国少男足4:1逆转韩国
28,7838283,当重庆人说起四川话
29,7831967,85后法官被查引关注
30,7819752,荷兰队半决赛遭争议判罚
31,7777995,萝卜快跑无人车售价20.46万
32,7762917,老鼠怕猫这是谣传
33,7762824,交班挑战
34,7757180,戴玫瑰花环反霸凌挑战
35,7755874,在中国“过两天”是多少天
36,7751486,暮色回响也没想到会被改成这样
37,7745493,小猫偷盐线索留了一地
38,7741607,淘宝直播“抢”人后遗症
39,7738986,驾校教练：教不了根本教不了
40,7731668,黄一鸣拿下路人王生涯第10冠
41,7731484,女子结账4次故意漏扫码被拘
42,7731222,我不听我不听
43,7715535,薛之谦深圳演唱会抢票
44,7704787,我家那闺女不同的家庭教育方式
45,7697790,明星版Tell Me
46,7689698,坐无人驾驶网约车是什么体验
47,7680251,到底谁能忍住不笑啊
48,7679029,一眨眼就长大了系列无人翻车
49,7678265,用AI穿越现实与二次元世界
50,7678058,童话镇慢动作
