index,hot,title,href
1,38亮,"Hello JRs!This is Paul George,ask me anything!",https://bbs.hupu.com/627623466.html
2,13亮,马布里：我和三个都交过手，乔1科2詹3,https://bbs.hupu.com/627626145.html
3,11亮,【休赛期数据014贴】火箭队3月份对手战斗力分析,https://bbs.hupu.com/627627369.html
4,14亮,马布里：我爱勒布朗，但詹姆斯的历史地位永远不如科比，乔一科二！,https://bbs.hupu.com/627625604.html
5,11亮,科比是GOAT？迈卡威：痴心妄想！,https://bbs.hupu.com/627626653.html
6,3亮,『最新重磅』哈登入股三只羊股份有限公司,https://bbs.hupu.com/627626880.html
7,4亮,库里奥运决赛末节第四记三分是蒙的吗？,https://bbs.hupu.com/627627358.html
8,3亮,不吹不黑，巅峰哈登和巅峰马努谁更强？,https://bbs.hupu.com/627627381.html
9,7亮,无论你们怎么黑，这个时代都名为勒布朗,https://bbs.hupu.com/627626329.html
10,6亮,布登霍尔泽是怎样的教练？21年的冠军教头能带领太阳冲出西部吗？,https://bbs.hupu.com/627626802.html
11,4亮,[德文布克个人集锦]德文布克中投杀神集锦,https://bbs.hupu.com/627625708.html
12,8亮,除去荣誉，塔图姆和乔治实力比较,https://bbs.hupu.com/627625731.html
13,7亮,已知mvp是提前投票决定的,https://bbs.hupu.com/627625972.html
14,50亮,2018.11.29勇士猛龙决胜剪辑版!杜兰特伦纳德对决上演正面交锋,https://bbs.hupu.com/627620038.html
15,5亮,加索尔和波什的数据对比，谁更强？,https://bbs.hupu.com/627627195.html
16,3亮,迈卡威谈GOAT：人们喜爱科比，但是他远不如乔詹！出手高效率低，表现差没人提，太痴心妄想了！,https://bbs.hupu.com/627626185.html
17,6亮,实训特伦斯戴维斯会不会是交易的前兆,https://bbs.hupu.com/627625818.html
18,3亮,雷霆当年为了波库是不是失去了麦克丹尼尔斯,https://bbs.hupu.com/627626990.html
19,5亮,【长草期经典回顾】基恩埃利斯四大囧高光之布伦森神仙指路,https://bbs.hupu.com/627625900.html
20,4亮,2025状元热门弗拉格盛赞杜克队友Kon Knueppel，球探称其为大号谢泼德,https://bbs.hupu.com/627626984.html
21,4亮,科比大部分职业生涯在联盟上一个版本，非要拿来和目前版本球员比命中率也是搞笑,https://bbs.hupu.com/627626165.html
22,5亮,下个赛季的76人根本不用怕 要是把字母给惹怒了 字母直接冲起来霸王举鼎恩比德瞬间变成傻子 什么？乔治？哈哈哈字母一个旱地拔葱瞬间让他再次变成90度哈登表示很熟悉,https://bbs.hupu.com/627625650.html
23,4亮,詹杜库只放一个人进这支美国队，放谁夺冠概率最高,https://bbs.hupu.com/627625688.html
24,4亮,不是，mini训练营有消息了吗？,https://bbs.hupu.com/627625581.html
25,11亮,因为没有人科普高级数据所以找一个科普视频。声明：本视频纯科普不喜欢勿入如果喜欢阴阳怪气搞拉踩球员本人会举报拉黑,https://bbs.hupu.com/627624049.html
26,5亮,突然发现今年奥运会男篮没有看到阿根廷，什么情况,https://bbs.hupu.com/627625683.html
27,3亮,字母6代应该是历代最好看的一代了吧,https://bbs.hupu.com/627625769.html
28,3亮,到底稳定发挥有没有什么标准，库里15年总决赛和这次奥运会的FMVP的评选标准一样吗？,https://bbs.hupu.com/627625714.html
29,50亮,韦德竟然和安东尼单挑过？,https://bbs.hupu.com/627618139.html
30,19亮,2012年雷霆湖人G4最后4:50剪辑版！终场前20秒杜兰特三分死神降临，科比在斯台普斯中心结束生涯最后一场季后赛,https://bbs.hupu.com/627624796.html
31,49亮,突然好奇一个问题，奥运会咱mvp老张有哪几场是毫无疑问的全场最佳？,https://bbs.hupu.com/627622382.html
32,3亮,3 号球衣的麦迪，复出后，离谱的七分钟看货时间,https://bbs.hupu.com/627623855.html
33,17亮,乔治说威少是他最好的队友,https://bbs.hupu.com/627625013.html
34,50亮,不论怎么评选，真正意义上的跨时代球员只有这三个人,https://bbs.hupu.com/627622042.html
35,12亮,明年独行侠，国王，森林狼这三支什么实力？,https://bbs.hupu.com/627625317.html
36,14亮,下赛季快船要是崩了。,https://bbs.hupu.com/627624949.html
37,5亮,乔治中国行在玩全明星街球派对,https://bbs.hupu.com/627625447.html
38,5亮,你们有没有想过詹杜库他们展现出来的一些体育精神和对篮球的态度，是受到了乔丹科比这些前辈的影响，你们所赞美的詹杜库的精神，也正来源于他们学习的前辈,https://bbs.hupu.com/627625382.html
39,4亮,维金斯这一出事，下赛季怕是要库里希尔德库明佳格林TJD首发了,https://bbs.hupu.com/627625485.html
40,5亮,听说新赛季2K能力值湖人的里夫斯大于绿军怀特和霍勒迪的87等于波尔津吉斯的88？,https://bbs.hupu.com/627625286.html
41,4亮,中立球迷来聊聊，到底奥运会最有价值的球员你们认为是谁，,https://bbs.hupu.com/627625446.html
42,49亮,巅峰小卡和巅峰kd你选谁？,https://bbs.hupu.com/627622041.html
43,13亮,孙兴慜：体育界的GOAT模板就是乔丹和汤姆布雷迪这样的,https://bbs.hupu.com/627624456.html
44,5亮,2000年后NBA打球最干净的十大超巨排名,https://bbs.hupu.com/627625262.html
45,3亮,CJ 换 斯图尔特+小哈达威 怎么样？,https://bbs.hupu.com/627625432.html
46,4亮,刚刚 乔治提到了他的goat 科比,https://bbs.hupu.com/627625103.html
47,15亮,明年我们有一个大隐患大家都没注意到,https://bbs.hupu.com/627622318.html
48,6亮,烤肉姐是乔治和小卡的经纪人吗,https://bbs.hupu.com/627624961.html
49,6亮,詹姆斯由奥运会开赛一直c到结束！阿里纳斯：难道拎两分钟赛段出来跟詹姆斯争mvp吗？这不现实！,https://bbs.hupu.com/627624948.html
50,6亮,哈登到了,https://bbs.hupu.com/627624719.html
51,18亮,从库里这次奥运表现，反观格林就明白他最欠缺的是什么,https://bbs.hupu.com/627623315.html
52,8亮,文班的健康取决于他未来的上限,https://bbs.hupu.com/627624781.html
53,10亮,理性讨论，大家觉得新赛季太阳需要多久磨合到最佳状态,https://bbs.hupu.com/627624629.html
54,9亮,为什么足球 乃至全世界的体育都没有一人一城？,https://bbs.hupu.com/627624708.html
55,4亮,乔丹球迷只是老了，又不是死了,https://bbs.hupu.com/627624734.html
56,5亮,快船还搞不搞四号位球员了,https://bbs.hupu.com/627624902.html
57,4亮,有没有人来清楚解释一下： 造犯规到底有没有破坏篮球运动的本质,https://bbs.hupu.com/627624994.html
58,10亮,这应该就是火箭新赛季的阵容了吧,https://bbs.hupu.com/627620288.html
59,50亮,戈贝尔在我们野球场能carry吗？,https://bbs.hupu.com/627620200.html
60,4亮,獭兔下赛季数据如果不出色，效率不高，即便夺冠也会像这赛季一样被质疑,https://bbs.hupu.com/627624823.html
