index,hot,title,href
1,足球,剑南春｜热刺2-0富勒姆登顶，孙兴慜传射，麦迪逊破门,https://www.dongqiudi.com/article/3801498
2,足球,中国女足奥预赛名单：王霜因伤落选，张琳艳、沈梦露等入围,https://www.dongqiudi.com/article/3801128
3,足球,早报：也许他就是真命天子？,https://www.dongqiudi.com/article/3801532
4,足球,这期给大家介绍的中国年轻球员是广州队张洪福的比赛...,https://n.dongqiudi.com/webapp/tops.html?id=3801599
5,足球,河内主帅：我们仔细研究过武汉三镇，力争取得最好的结果,https://www.dongqiudi.com/article/3801597
6,足球,据《体坛周报》报道，包括李明周在内的4名仁川联球...,https://n.dongqiudi.com/webapp/tops.html?id=3801594
7,足球,全场战报 | 热刺 2-0 富勒姆第2分钟，麦迪...,https://n.dongqiudi.com/webapp/tops.html?id=3801584
8,足球,意媒：尤文与萨马尔季奇达成协议，希望一月初完成转会,https://www.dongqiudi.com/article/3801579
9,足球,????《自由橙足球早报》 10.24 周二➮热刺2-...,https://n.dongqiudi.com/webapp/tops.html?id=3801573
10,足球,邮报：曼联相信大部分曼城球迷不会在悼念仪式嘲讽查尔顿爵士,https://www.dongqiudi.com/article/3801572
11,足球,谢维军：国足老大哥们训练强度大且节奏快，让我能保持好状态,https://www.dongqiudi.com/article/3801569
12,足球,埃德松：我知道夏窗拜仁对我感兴趣，未来任何事都可能发生,https://www.dongqiudi.com/article/3801567
13,足球,米体记者：托纳利将被处以10个月禁赛外加赌瘾治疗计划,https://www.dongqiudi.com/article/3801565
14,足球,安慰铁哥们，苏缘杰：有点对不住巴顿，下轮找机会给他传球,https://www.dongqiudi.com/article/3801563
15,足球,若日尼奥：我认为哈弗茨做得很好；还没考虑过自己的未来,https://www.dongqiudi.com/article/3801561
16,足球,国米战萨尔茨堡首发预测：桑切斯搭档劳塔罗，图拉姆替补,https://www.dongqiudi.com/article/3801559
17,足球,帕斯托雷：我不喜欢大巴黎对待梅西的方式，他击败法...,https://n.dongqiudi.com/webapp/tops.html?id=3801557
18,足球,拉伊奥拉弟弟：多纳鲁马当年免费走人是米兰的错,https://www.dongqiudi.com/article/3801556
19,足球,图片报：格纳布里手上仍有夹板，计划在德国杯比赛中复出,https://www.dongqiudi.com/article/3801539
20,足球,加拉塔萨雷后卫：如果我们迫使拜仁失误，我们有机会,https://www.dongqiudi.com/article/3801538
