index,hot,title,href
1,云淡,缅北“四大家族”多头目被中国警方通缉，为何通缉令由不同省份警方发布？,https://new.qq.com/rain/a/20231210Q06JR000
2,醉卧浮生,湖人击败步行者，季中锦标赛7战全胜夺冠，这个冠军含金量如何？,https://new.qq.com/rain/a/20231210Q03YDB00
3,Mr.邢,英王查尔斯影响力在衰弱，还被非洲国家联合殖民及奴隶制索赔，国王的象征意义还能撑多久？,https://new.qq.com/rain/a/20231210Q04ER200
4,病毒,东航一航班因故障高空放油返航，什么情况会空中放油？为何刚起飞就有故障？,https://new.qq.com/rain/a/20231210Q023KE00
5,老钱,青岛一保安持刀捅死外卖员，外卖不该进小区吗？保安与外卖的矛盾有多大？,https://new.qq.com/rain/a/20231210Q013JA00
6,点评校尉,广州芳村金融茶崩盘，叫价上万的茶叶，真的值吗？茶行业有多少暴利？,https://new.qq.com/rain/a/20231209Q038HB00
7,Mr.邢,张雪峰称“文科生都是服务业”，这是实话还是偏见？理工科是什么“业”？,https://new.qq.com/rain/a/20231209Q07FFS00
8,东域记,委内瑞拉和圭亚那领土争端升级，美军南方司令部已介入，如果打起来战事会如何发展？,https://new.qq.com/rain/a/20231208Q03Q8O00
9,六味地黄王,“回家就玩手机”，妻子要和高收入老公离婚，财富和陪伴，哪个更能维系婚姻？,https://new.qq.com/rain/a/20231209Q01Y8D00
10,小白马的经略观,报道称王健林拟出售一二线城市万达广场，万达还剩些什么？能渡过难关吗？,https://new.qq.com/rain/a/20231208Q01AQY00
11,云淡,女子遭捡走身份证“被结婚”，民政局拒绝撤销，万一我也碰上了该怎么办？,https://new.qq.com/rain/a/20231209Q04LRI00
12,小白马的经略观,文旅部称旅游市场缺小语种导游，小语种会更好找工作吗？学什么语言最好？,https://new.qq.com/rain/a/20231208Q01V0U00
13,之乎者也小鱼儿,王健林甩卖核心资产，王思聪签约文旅项目，“父子兵”上阵能救万达于水火吗？,https://new.qq.com/rain/a/20231208Q0336X00
14,老钱,养猪龙头企业“新希望”两年亏损150亿，拖欠养殖户款项，它还能翻盘吗？,https://new.qq.com/rain/a/20231209Q0481X00
15,老钱,美国11月就业强劲，拜登却称这表明不鼓励美联储继续加息，为何这样说？,https://new.qq.com/rain/a/20231209Q01V3M00
16,之乎者也小鱼儿,200万粉丝基金大V自认“以前的分析就是笑话”，跟着基金大V买真能赚钱吗？,https://new.qq.com/rain/a/20231209Q07CY300
17,黄河边儿,印尼火山喷发致23名登山客遇难，火山喷发没有征兆吗？能否提前预警？,https://new.qq.com/rain/a/20231207Q0A7FL00
18,六味地黄王,填志愿、选对象、找工作，你帮家人做过什么人生重大选择吗？结果怎么样？,https://new.qq.com/rain/a/20231208Q02VCO00
19,轨道交通的天蝎,郑济高铁交会速度870km/h刷新世界纪录，这意味着未来我国高铁还要提速？,https://new.qq.com/rain/a/20231209Q07KMW00
20,六味地黄王,男子癌症晚期妻子卖房治病被医生劝阻，面临绝症真的“砸锅卖铁”也得治吗？,https://new.qq.com/rain/a/20231208Q06VEL00
21,阳光下的黑影,南京一公司只招“农村人”称“城里人娇气”，城里人农村人区别还很大吗？,https://new.qq.com/rain/a/20231208Q0AI3B00
22,飞跃本屯,张朝阳称一辈子租房就有闲钱生娃，终生租房真能省钱吗？省的钱够生娃吗？,https://new.qq.com/rain/a/20231208Q07NGA00
23,兵器世界,普京访沙特见王储小萨勒曼喜出望外，击掌相庆，是什么能让普京如此开心？,https://new.qq.com/rain/a/20231207Q03CEL00
24,郭律Esq,个人网贷信息接入征信系统，网贷有哪些陷阱？征信出问题会带来哪些麻烦？,https://new.qq.com/rain/a/20231208Q00XIZ00
25,悦木Ivy陪娃成长,小学生质疑牛郎偷看织女洗澡是流氓，时代变了，古老故事还适合进课本吗？,https://new.qq.com/rain/a/20231206Q035XC00
26,灰姑娘有狠活儿,如果你在偶像演唱会现场发现Ta假唱，你会脱粉吗？会要求退票吗？,https://new.qq.com/rain/a/20231204Q0316P00
27,六味地黄王,小学生质疑牛郎偷看织女洗澡是流氓，为何我们小时候没这种疑问，现在的小孩却有？,https://new.qq.com/rain/a/20231206Q03QKU00
28,茜文,老人闲不住在小区楼顶“开垦”菜园，你有同款爸妈吗？他们为种菜有多拼？,https://new.qq.com/rain/a/20231206Q02N2U00
29,常洛闻,韩国巫师夫妇装监控操控一家庭19年，巫师在韩国是怎样的职业？政府管吗？,https://new.qq.com/rain/a/20231205Q01TWN00
30,野法吏,疑似西安一辅警因追星威胁“人肉”网民，普通人隐私这么容易被看到吗？,https://new.qq.com/rain/a/20231208Q09XBD00
