index,hot,title,href
1,50亮,永远不要把命运交给他人！如今中国女篮只能将出线希望寄于其他国家,https://bbs.hupu.com/627486755.html
2,47亮,开练！神京和史密斯轮番防守范乔丹，大防小最重要的是横移速度！,https://bbs.hupu.com/627486712.html
3,50亮,值得尊敬！南苏丹男篮奋斗史：在战乱中顽强生长，为国家尊严而战,https://bbs.hupu.com/627483920.html
4,10亮,最后一幕！樊振东致敬PJ华盛顿！,https://bbs.hupu.com/627488294.html
5,13亮,如何评价巅峰乌龟一个进攻回合三次击打卢比奥脑袋,https://bbs.hupu.com/627489762.html
6,14亮,耐克大小王只有身边全是巨星的时候，才能疯狂虐菜,https://bbs.hupu.com/627489304.html
7,14亮,詹姆斯目前领跑奥运会男篮mvp榜，大家有什么想说的？,https://bbs.hupu.com/627489191.html
8,12亮,泰森有没有在吹牛？他说李小龙打不过他,https://bbs.hupu.com/627489188.html
9,7亮,乔丹是什么时候成为联盟纯实力第一人的?,https://bbs.hupu.com/627489493.html
10,6亮,AJ格里芬训练视频,https://bbs.hupu.com/627487701.html
11,3亮,历届奥运，我们在田径上一共获得过10来块金牌了，为什么只有刘翔知名度那么大？,https://bbs.hupu.com/627489724.html
12,9亮,CC最新话题关于小贾的,https://bbs.hupu.com/627488090.html
13,11亮,乔丹诺维斯基杜兰特谁的中投更好。,https://bbs.hupu.com/627487741.html
14,4亮,这种情况下中国男篮能否赢美国？,https://bbs.hupu.com/627489450.html
15,6亮,打得不舒服对文班长期发展是好事,https://bbs.hupu.com/627488594.html
16,8亮,兄弟们乒乓球决赛这个收视率什么水平？,https://bbs.hupu.com/627488148.html
17,5亮,还有两天马卡就来了,https://bbs.hupu.com/627489055.html
18,13亮,惊魂一刻！2012年快船对阵巅峰三巨头热火，最后时刻比卢普斯三分线外踩脚险受伤！,https://bbs.hupu.com/627487742.html
19,5亮,小牛下赛季实力变强了,https://bbs.hupu.com/627489195.html
20,7亮,感觉我们中国的骄傲郑钦文很多地方感觉和科比很像,https://bbs.hupu.com/627488268.html
21,7亮,樊振东真强,https://bbs.hupu.com/627488569.html
22,6亮,奥运会篮球比赛终极大杀器--勒布朗·詹姆斯！,https://bbs.hupu.com/627488035.html
23,6亮,保罗能不能在无冠球星里排到前3？,https://bbs.hupu.com/627487881.html
24,5亮,谁是图中最好的传球手？,https://bbs.hupu.com/627488440.html
25,4亮,不懂就问，乔治的小黑子为什么越来越多了,https://bbs.hupu.com/627488903.html
26,5亮,！！！兰德尔有多大概率能来啊？？？,https://bbs.hupu.com/627487715.html
27,3亮,如果最终小史密斯的水平定格为巅峰拉沙德刘易斯的水平，大家是失望还是满意？,https://bbs.hupu.com/627489284.html
28,3亮,樊振东抱胸想起一位朋友,https://bbs.hupu.com/627488424.html
29,5亮,第一次发现原来布克和塔图姆打3D都可以很适应,https://bbs.hupu.com/627489401.html
30,5亮,乒乓球决赛这个收视率什么水平？,https://bbs.hupu.com/627488158.html
31,5亮,樊振东夺冠，皓哥在场外的表现真是让人动容，最好的师生情！！,https://bbs.hupu.com/627488452.html
32,8亮,有人看乒乓球决赛吗？瑞典这哥们挺厉害啊,https://bbs.hupu.com/627487979.html
33,6亮,登哥2012年伦敦奥运会这一扣什么水平？,https://bbs.hupu.com/627489221.html
34,4亮,动物朋友来看身高，老六183，马绍尔203，莺歌203,https://bbs.hupu.com/627488965.html
35,6亮,你儿子只有172的话，你敢让他走职业吗？,https://bbs.hupu.com/627488145.html
36,3亮,库里什么时候能爆发一下？！？不多，就爆发一场即可！最好是决赛的时候！打破质疑！,https://bbs.hupu.com/627488108.html
37,3亮,哈登和杜兰特单挑，技巧和超手投篮，谁强,https://bbs.hupu.com/627488010.html
38,3亮,替补阵容，,https://bbs.hupu.com/627488103.html
39,3亮,徐静雨：体育GOAT现在肯定是梅西,https://bbs.hupu.com/627487759.html
40,3亮,各位 如果玛卡不来勇士的话 各位给我50 不多但真,https://bbs.hupu.com/627487729.html
41,8亮,恩比德高光表现回击观众嘘声,https://bbs.hupu.com/627486936.html
42,9亮,确立核心,https://bbs.hupu.com/627486194.html
43,18亮,大家真正难以接受的,https://bbs.hupu.com/627487554.html
44,6亮,想要人前显贵，就得人后受罪：顶尖篮球联盟里成功没有捷径，强如篮球之神想突破自己也要以身入局,https://bbs.hupu.com/627485893.html
45,7亮,2024.08.04--新赛季窝火的内线搭配，申京+史密斯,https://bbs.hupu.com/627485585.html
46,31亮,郑钦文启蒙教练：她一年360天吃鸡胸肉西蓝花，凌晨4点半起床训练！,https://bbs.hupu.com/627482940.html
47,5亮,阿门汤普森，老哥们帮忙估个价呀,https://bbs.hupu.com/627486555.html
48,4亮,小本子这是要放水的节奏啊！,https://bbs.hupu.com/627486190.html
49,13亮,Brett Siegel:消息人士透露，开拓者和艾顿预计会在某个时候分道扬镳，然而艾顿目前并没有在市场上引起很大的兴趣。 ​​​,https://bbs.hupu.com/627487392.html
50,11亮,太阳这老板真是死倔,https://bbs.hupu.com/627487332.html
51,8亮,不要再管玛卡来不来了，就算来了，最重要的库里下滑严重，来了也没用，附加赛球队,https://bbs.hupu.com/627487372.html
52,26亮,太阳队新赛季有防守吗？,https://bbs.hupu.com/627485782.html
53,6亮,文班应该学学小动作，太干净是没用的,https://bbs.hupu.com/627487487.html
54,12亮,阿里纳斯：如果你认为乔丹是历史最佳球员，你绝对不会在乎谁是第二，他们更多是詹黑！,https://bbs.hupu.com/627487089.html
55,11亮,有多少人相信波特能在登哥身边重新做人的,https://bbs.hupu.com/627486918.html
56,42亮,陈梦：球迷有权利发泄情绪，我不会教育球迷你应该怎么做，我完成任务就够了,https://bbs.hupu.com/627479844.html
57,50亮,杜兰特单挑打得过乔丹？,https://bbs.hupu.com/627484033.html
58,5亮,篮球是最依赖身体天赋的运动吗,https://bbs.hupu.com/627487207.html
59,12亮,2001年巅峰卡特大战科比,https://bbs.hupu.com/627486322.html
60,21亮,从各队首发3号位三分产效分析，库明加为什么打不了小前锋？,https://bbs.hupu.com/627485847.html
