index,hot,title,href
1,10827450,高考英语
2,10795061,黑神话悟空开启全球预售
3,10731273,龙年赛龙舟 最炫中国风
4,10466409,名记：湖人8年1亿报价丹赫利
5,9879375,考完理综飘了都飘了
6,9576456,2024高考理综甲卷
7,8531088,邓静把董宇辉说哭了
8,8437636,挑战做高考数学题
9,8378382,盘点高考学生花式出考场
10,8352317,刘亦菲彭冠英新剧双向暗恋
11,8347736,金价大跌
12,8333420,“福宝在中国受虐”指控无据
13,8326724,杨坤说自己没把歌唱火
14,8322792,阿波罗8号宇航员坠机身亡
15,8291025,俄称日本已丧失真正的独立和主权
16,8290563,郑恺因为苗苗被超级加辈
17,8245189,以军轰炸加沙中部致至少210死
18,8133836,男生大四退学艺考五年仍落榜
19,8114244,牛蛙考场外制造噪音被警方拿下
20,8089421,王星越替萧蘅打抱不平
21,8081533,警方通报小米SU7致1死3伤
22,8004046,韩雪居然玩自己的梗
23,7984545,小贝饿了当妈妈了
24,7969441,电影扫黑决不放弃今日上映
25,7962375,于洋让无人机上一边去
26,7895694,金靖给秦霄贤高圆圆拍照
27,7883867,何洁直球出击尚雯婕
28,7880690,00后三农网红韩坤溺水身亡
29,7860279,张钰琪揭榜成功
30,7851536,张颂文新剧口碑
31,7842887,中国高速动车组首次进入欧洲
32,7751892,ChatGPT来交卷了
33,7750873,薛芳菲吃醋萧蘅暗爽
34,7742939,杨和苏李外新歌玛丽亚舞台好炸
35,7684444,如果爱忘了DJ古早版回忆杀
36,7683576,数学 我恨你
37,7679171,大杨哥给嘴哥拳赛加油
38,7656361,那就在盛夏里好好告别吧
39,7652565,爱自己的100种方式打卡挑战
40,7650815,丹麦首相遭殴打
41,7648466,高考作文被抖音网友拿捏了
42,7648146,嘴哥vs杨保罗 平局
43,7646934,奔跑吧泥潭掌管笑点的神
44,7629302,被Diamond舞蹈硬控了
45,7624748,来自爸爸对女儿的溺爱
46,7622785,甜粽咸粽我选一锅端
47,7622591,复刻墨雨云间名场面
48,7614954,直击高考次日
49,7605780,高考数学
50,7603646,想看看大家拍的天空
