index,hot,title,href
1,,放弃百万年薪当旅行博主后，我年入2000,https://www.36kr.com/p/2533347822348039
2,,人均年薪100万，这个岗位火了,https://www.36kr.com/p/2534503812572933
3,,武汉最新独角兽来了，100亿,https://www.36kr.com/p/2533466489906689
4,,真正毁掉一个人的，是它,https://www.36kr.com/p/2533742356407815
5,,工厂爆单、渠道淘金，谁在冲锋衣里狂赚？,https://www.36kr.com/p/2533539340641792
6,,中国公司全球化周报 | Temu明年GMV目标300亿美元，不止翻倍 / 传TikTok考虑通过投资重返印尼电商市场,https://www.36kr.com/p/2533490728888072
7,,李沐大模型公司细节曝光，项目GitHub空仓标星超500,https://www.36kr.com/p/2534606109550342
8,,中国企业，大卷美国“双十一”,https://www.36kr.com/p/2533558847940352
