index,hot,title,href
1,MiuYan 周妙妍,14个排版微调技巧，瞬间提高两倍设计感！,https://www.uisdc.com/layout-design-tips-2
2,飞波,永久免费可商用！手写毛笔风格的飞波正点体 （已打包）,https://www.uisdc.com/feibo-font
3,陈子木,超全合集！2024 年 UX/UI 设计师都必须尝试的 21 款 AI 工具,https://www.uisdc.com/2024-ai-tools-designer-must-try
4,夏花生,自媒体小白必看！5 招教你轻松做出好看又吸睛的内容封面,https://www.uisdc.com/cover-design-2
5,张家彬,超多案例！如何让平面设计作品摆脱平庸？,https://www.uisdc.com/poster-design-39
6,夏花生,想让图像快速矢量化？3款免费工具帮你轻松搞定！,https://www.uisdc.com/jpg-to-svg
7,夏花生,设计素材不用愁！7组高质量劳动节主题 Midjourney 提示词,https://www.uisdc.com/midjourney-52
8,张鼎_Ending,18000字干货！写给设计师的版式设计基础知识,https://www.uisdc.com/layout-design-23
9,弗西西丁的AI练习册,爆肝整理！如何用AIGC轻松搞定春季运营海报设计？,https://www.uisdc.com/midjourney-spring-poster
10,ISUX,腾讯专家7600字力作！如何用「八角行为分析法」轻松打动用户？,https://www.uisdc.com/octalysis
11,京东JellyDesign,大厂 AIGC 提速案例！京东保险UED 项目设计总结,https://www.uisdc.com/jd-ued-aigc
12,酸梅干超人,B 端设计飞升，从学习组件设计开始,https://www.uisdc.com/b-end-component-design
13,夏花生,设计素材不用愁！6 组高质量插画类 Midjourney 提示词,https://www.uisdc.com/midjourney-51
14,柴林,产品要不要做设计改版？来看总监的分析！,https://www.uisdc.com/design-redesign
15,黑马青年,用一个实战案例，帮你学会UI设计界面优化思路！,https://www.uisdc.com/ui-interface-design-2
16,百度MEUX,如何做好标签体系设计？收下大厂高手总结！,https://www.uisdc.com/tag-design-3
17,Tomda,7000字干货！写给新手的设计系统入门指南,https://www.uisdc.com/design-system-6
18,张鼎_Ending,超详细干货！设计师应该懂的设计细节,https://www.uisdc.com/design-details-3
19,应骏,求职季福利！UI/UX作品集保姆级设计指南,https://www.uisdc.com/ui-ux-portfolio
20,言川Artie,万字教程！奶奶看了都会的 ComfyUI 入门教程,https://www.uisdc.com/comfyui-3
21,夏花生,效率翻倍！5 款不容错过的免费 AI 神器（三）,https://www.uisdc.com/aigc-tools-4
22,视研设,平面高手出品！用一篇文章教会你素材选择,https://www.uisdc.com/poster-design-36
23,夏花生,DomoAI 6大新功能详解！可自动扣除背景，支持人物一键跳舞,https://www.uisdc.com/domoai-2
24,京东JellyDesign,如何用AIGC加速设计？来看京东3C数码年货节设计复盘（上）,https://www.uisdc.com/aigc-3c
25,京东JellyDesign,京东实战案例！CRM移动端视觉全新升级完整复盘,https://www.uisdc.com/jdl-crm
26,西城门设计,超多案例！常见的B端弹窗样式设计总结,https://www.uisdc.com/b-end-popup-window
27,Alibaba Design,钉钉AIGC实践！如何用AI一键设计工作台应用图标？,https://www.uisdc.com/aigc-dingding
28,猫仔MAoMAo,10分钟速成！Midjourney 网页版操作指南,https://www.uisdc.com/midjourney-alpha
29,快手电商设计中心,大厂实战案例！AIGC在快手电商设计中的应用,https://www.uisdc.com/aigc-kuaishou
30,菜心¹,用多个实战案例，帮你掌握配色的三个要点！,https://www.uisdc.com/color-matching-5
31,大摸鱼家_Xr,万字干货！Stable Diffusion基础入门+案例实操+参数讲解+工具模型,https://www.uisdc.com/stable-diffusion-basis
32,夏花生,Viggle 超全使用教程！AI 终于能准确控制人物姿势了！,https://www.uisdc.com/viggle
33,淘宝设计,逛淘宝一定会看的页面，我们做了哪些设计改变？,https://www.uisdc.com/taobao-design-2
34,夏花生,人人都能做音乐！Suno v3 一键生成高质量中文歌曲！,https://www.uisdc.com/suno-v3
35,ASAK设计,超全整理！8个好用的图像放大神器推荐,https://www.uisdc.com/8-image-magnification-tool
36,夏花生,效率翻倍！5 款不容错过的免费 AI 神器（二）,https://www.uisdc.com/aigc-tools-3
37,陈子木,第三波！2024年3月精选实用设计工具合集,https://www.uisdc.com/2024-3-design-resources-vol3
38,视研设,保姆级教程！海报版式日常练习步骤拆解！,https://www.uisdc.com/poster-design-35
39,夏花生,海报素材不用愁！8 组高质量空间场景类 Midjourney 提示词,https://www.uisdc.com/midjourney-50
40,ISUX,腾讯出品！7000字帮你了解图标设计进化史,https://www.uisdc.com/icon-design-10
