index,hot,title,href
1,1227 万热度,韩国两地发布紧急避难令，韩媒称「朝军在半岛西部海域发射 200 多枚炮弹」，哪些信息值得关注？,https://www.zhihu.com/question/638147003
2,412 万热度,网曝快乐8主持人「预判」中奖球号，福彩官方回应「不存在播报错误，系拼凑剪辑」，如何看待此事？,https://www.zhihu.com/question/638177299
3,330 万热度,复旦大学校友「在美国流浪」，校方称已组织救援团，当事人回应「近期想求助校友」，哪些信息值得关注？,https://www.zhihu.com/question/638175205
4,102 万热度,如何评价《繁花》中的股市大战？,https://www.zhihu.com/question/638220463
5,58 万热度,为什么化工、材料是天坑专业，难道中国化工业不需要培养精英，超越杜邦、陶氏、巴斯夫三巨头吗？,https://www.zhihu.com/question/637424853
6,57 万热度,韩国联合参谋本部称韩军当天进行了海上射击训练，半岛局势是否会进一步紧张？哪些信息值得关注？,https://www.zhihu.com/question/638181884
7,57 万热度,格力玫瑰空调被吐槽「又丑又土」，售价超万元，董明珠曾推荐称是为新婚人群准备的，如何看待此事？,https://www.zhihu.com/question/638121800
8,57 万热度,同事提出每个月500元，希望每天搭你的车上下班，你愿意吗？,https://www.zhihu.com/question/637065833
9,55 万热度,如何评价《崩坏星穹铁道》新版本角色“真理医生”，他的目的到底是什么？,https://www.zhihu.com/question/637298596
10,54 万热度,如何看待上海24年暂停活禽交易？,https://www.zhihu.com/question/637968001
11,52 万热度,哈尔滨火了，为什么叫「尔滨」?「哈尔滨」这波出圈带来了哪些启示？,https://www.zhihu.com/question/638159864
12,45 万热度,阿里云大模型「让照片跳舞」刷屏朋友圈，有哪些信息值得关注？,https://www.zhihu.com/question/637994515
13,40 万热度,外交部回应中方为什么没有发声谴责胡塞武装，哪些信息值得关注？,https://www.zhihu.com/question/637998239
14,35 万热度,媒体评南方小土豆争议，称「别让刚火出圈的哈尔滨因热梗破功」，如何评价此事？,https://www.zhihu.com/question/637951079
15,29 万热度,《繁花》后劲为什么那么大？,https://www.zhihu.com/question/637716021
16,24 万热度,谁能从生物进化角度，解释漫无目的地刷手机，根本原因是什么？,https://www.zhihu.com/question/637931257
17,23 万热度,BPD 和 NPD 是否相似？为什么 BPD 具有「高共情」能力，而 NPD 却无法共情呢？,https://www.zhihu.com/question/635488626
18,23 万热度,除了冰雪文化，还有哪些符号能成为哈尔滨旅游的另一张名片？,https://www.zhihu.com/question/637957555
19,23 万热度,有哪些适合在手机上使用的办公软件？,https://www.zhihu.com/question/636894510
20,23 万热度,双休4000元，无休6000元，你会怎么选？,https://www.zhihu.com/question/634449132
21,23 万热度,赤木晴子为什么没有主动追求流川枫？,https://www.zhihu.com/question/268829595
22,23 万热度,电视剧《繁花》第 21-22 集拍得如何？有哪些值得关注的剧情点？,https://www.zhihu.com/question/638027961
23,23 万热度,假如《战锤》里面的帝皇能够献祭百分之五十的国教高层来换取圣吉列斯的复活会怎样？,https://www.zhihu.com/question/637998375
24,23 万热度,南阳调查「公务员兼职日薪三千」，表示停薪留职期间曾参与一周专项技术工作，如何看待此事？,https://www.zhihu.com/question/638136936
25,23 万热度,特斯拉召回超 160 万辆车，自动辅助转向开启后，司机可能误用2级组合驾驶辅助功能，哪些信息值得关注？,https://www.zhihu.com/question/638175499
26,23 万热度,猫开心时有哪些常见的肢体语言？,https://www.zhihu.com/question/637964344
27,22 万热度,《天启异闻录》中各大主角的武力值如何？你会如何给他们排名？,https://www.zhihu.com/question/638121819
28,22 万热度,可变光圈会成为手机刚需吗？,https://www.zhihu.com/question/636737933
29,22 万热度,如何看待荣耀 Magic6 全系将升级搭载第二代青海湖电池 ，手机续航还有多少提升空间？,https://www.zhihu.com/question/638174339
30,22 万热度,人到中年，我们失去了什么？,https://www.zhihu.com/question/637631923
31,22 万热度,现代人在入夜很久后才睡觉，是否算违反生物钟，对健康是否有影响？,https://www.zhihu.com/question/637766097
32,22 万热度,为什么原神中角色头发制作不能“更上一层楼”？,https://www.zhihu.com/question/638062314
33,21 万热度,湘北VS山王一战，谁才是MVP？,https://www.zhihu.com/question/52263433
34,21 万热度,朝鲜称其炮击训练未对韩国产生影响，这意味着什么？,https://www.zhihu.com/question/638205911
35,21 万热度,ChatGPT 发布一周年了，回望这一年你有什么感悟？,https://www.zhihu.com/question/632702043
36,21 万热度,《山海情》和《繁花》故事背景都是九十年代，为何差别如此之大？,https://www.zhihu.com/question/637428360
37,21 万热度,如果你是《繁花》里的阿宝，可以在雪芝，汪小姐，玲子，李李中选择一个当老婆，你会选择哪个？,https://www.zhihu.com/question/637608983
38,21 万热度,婴儿太小不想回老家过年咋么办？,https://www.zhihu.com/question/637684336
39,21 万热度,预定了华为 Nova12Pro 有点后悔了怎么办，学生党求指导?,https://www.zhihu.com/question/636905605
40,21 万热度,日本记者吐槽民众给震区寄千纸鹤，「占用运输资源，对救灾毫无用处」，如何看待此事？,https://www.zhihu.com/question/638128946
41,21 万热度,韩称朝鲜向韩西部海域发射海岸炮，外交部回应「正密切关注」，哪些信息值得关注？具体情况如何？,https://www.zhihu.com/question/638176525
42,21 万热度,上海金山买房可享五年免费轨交通勤，购房者最多节省 5 万元，如何看待此事？各地花式卖房透露哪些信息？,https://www.zhihu.com/question/638145370
43,21 万热度,北京市第一中级人民法院依法受理中植企业集团有限公司破产清算案，哪些信息值得关注？,https://www.zhihu.com/question/638185478
44,21 万热度,东北冰雪旅游爆火，有哪些实用的防冻攻略可以提供给外地游客吗？还需要注意哪些健康问题？,https://www.zhihu.com/question/637960463
45,20 万热度,伊朗克尔曼恐袭事件多名嫌疑人被捕，哪些信息值得关注？,https://www.zhihu.com/question/638193179
46,20 万热度,2023 德玛西亚杯半决赛 JDG 3：0 轻取RA挺进决赛，如何评价这场比赛？,https://www.zhihu.com/question/638009151
47,20 万热度,睡稻草，麦秆是什么感受?,https://www.zhihu.com/question/637628481
48,20 万热度,哪些包包适合冬天背，和羽绒服的适配度高？,https://www.zhihu.com/question/637273366
49,20 万热度,有哪些国货护肤品你在消费降级后觉得「真香」？,https://www.zhihu.com/question/637633430
50,20 万热度,《知否》中，如果墨兰和林小娘一开始就知道梁晗的品性和梁家看上明兰的真正原因，还会不顾一切嫁给梁晗吗？,https://www.zhihu.com/question/629166323
