index,hot,title,href
1,,人类怀孕的奇异方式,http://jandan.net/p/117208
2,,女性生育的代价：加速衰老与寿命缩短,http://jandan.net/p/117184
3,,发霉啦：今天，我想要约一个妹子,http://jandan.net/p/117232
4,,恐龙到底有多大,http://jandan.net/p/117216
5,,又刷新记录：本周一是地球上最热的一天,http://jandan.net/p/117222
6,,书评：《欲望的瘟疫：古代性病史》(1901年版),http://jandan.net/p/117199
7,,科学家发现一种新糖类，可以促进头发再生,http://jandan.net/p/117197
8,,研究揭示跨性别医疗研究受操控,http://jandan.net/p/117189
9,,今日带货：24秋款蛋TEE,http://jandan.net/p/117225
10,,今日好价 0725,http://jandan.net/p/117214
11,,今日好价 0724,http://jandan.net/p/117203
12,,今日好价 0723,http://jandan.net/p/117193
13,,研究表明，所谓的适量饮酒无益于健康,http://jandan.net/p/117231
14,,一种制造116号元素的新方法打开了更重原子的大门,http://jandan.net/p/117207
15,,生物进化比达尔文想象的更快,http://jandan.net/p/117206
16,,科学家发现深海中的“暗氧”，可能影响深海采矿,http://jandan.net/p/117198
17,,你可以选择不让机场扫描你的脸,http://jandan.net/p/117205
18,,用天文技术来识别AI“深度伪造”肖像,http://jandan.net/p/117200
19,,Z世代预防痴呆的6个方法,http://jandan.net/p/117209
20,,证据明显：人类狩猎导致大型哺乳动物灭绝,http://jandan.net/p/117220
21,,橄榄油能预防宿醉吗？科学告诉你答案,http://jandan.net/p/117180
22,,科学家开发出治疗阿尔茨海默病的鼻喷剂,http://jandan.net/p/117221
23,,科学家发现一种新激素，可以增强骨骼,http://jandan.net/p/117196
24,,今日好价 0727,http://jandan.net/p/117235
25,,手机让我们成为焦虑的一代,http://jandan.net/p/117229
26,,带状疱疹疫苗或可预防老年痴呆,http://jandan.net/p/117230
27,,化石暗示侏罗纪哺乳动物生长缓慢寿命长,http://jandan.net/p/117218
28,,去咖啡因咖啡的化学解释,http://jandan.net/p/117228
29,,冰水物理或助推复杂生命起源,http://jandan.net/p/117219
30,,禁止户外广告牌的瑞士小镇,http://jandan.net/p/117227
