index,hot,title,href
1,108,关于乙肝,https://www.guozaoke.com/t/110928
2,93,光谷二初，升学率71%，光谷实验今年普高率77％，光谷实验这次有对手了！,https://www.guozaoke.com/t/110982
3,74,戾气真重，同事被外卖小哥锁喉,https://www.guozaoke.com/t/110903
4,70,29周岁的第一天，年近30还有爱情么？,https://www.guozaoke.com/t/111023
5,65,选车了选车了，太纠结了,https://www.guozaoke.com/t/110984
6,63,本人女，孕5月，昨天老公哥哥突然打电话来，要把小侄子放到我们家过暑假,https://www.guozaoke.com/t/110886
7,62,这个天气适合干什么,https://www.guozaoke.com/t/110877
8,58,删删删删删删删删删删删删删删,https://www.guozaoke.com/t/110885
9,57,如果全家都不用去公司上班，你会选择住哪个城市？,https://www.guozaoke.com/t/111007
10,57,早高峰的地铁真让人绝望,https://www.guozaoke.com/t/111025
