index,hot,title,href
1,足球,绿茵织梦，万物生长,https://www.dongqiudi.com/article/3891218
2,足球,懂球帝十周年，点击开启你的专属球迷报告,https://www.dongqiudi.com/article/3876007
3,足球,迪马团队记者：阿瑙手指骨折，但佩戴护具能够正常比赛,https://www.dongqiudi.com/article/3892185
4,足球,记者：巴萨称特狮不会缺席欧冠淘汰赛，伤缺可能不需2个月,https://www.dongqiudi.com/article/3892183
5,足球,继续写你，镜报：盘点五名与滕哈格闹翻的球员，C罗领衔,https://www.dongqiudi.com/article/3892177
6,足球,终圆梦！率领阿根廷重返巅峰，动漫回顾梅西世界杯夺冠之路,https://www.dongqiudi.com/article/3892175
7,足球,祝我懂十周年快乐呀！感谢陪伴我的这么多年，不知不...,https://n.dongqiudi.com/webapp/tops.html?id=3892170
8,足球,瓜迪奥拉：如果你现在问我，我会说我们将赢得英超冠军,https://www.dongqiudi.com/article/3892169
9,足球,唉…,https://n.dongqiudi.com/webapp/tops.html?id=3892163
10,足球,记者：特尔施特根已决定接受手术，医生说服了他,https://www.dongqiudi.com/article/3892150
11,足球,利雅得胜利客战杜尚别独立：C罗缺阵，马内、塔利斯卡替补,https://www.dongqiudi.com/article/3892088
12,足球,5场6球4助攻！官方：罗德里戈当选皇马11月最佳球员,https://www.dongqiudi.com/article/3892147
13,足球,世体：特尔施特根还未决定接受手术，还在咨询专家,https://www.dongqiudi.com/article/3892142
14,足球,世体：巴萨可能会引进门将，可考虑德赫亚和阿森霍,https://www.dongqiudi.com/article/3892128
15,足球,皇马2024/25赛季第二客场球衣曝光：木炭棕灰色，三叶草徽标,https://www.dongqiudi.com/article/3892117
16,足球,梅西：我夏天首选是回巴萨，也确实考虑过去沙特踢球,https://www.dongqiudi.com/article/3892115
17,足球,滕哈格：加纳乔倒钩靠的是我的理念；记者发文前应先来找我们,https://www.dongqiudi.com/article/3892106
18,足球,塔索蒂：把马尔蒂尼送走是错误的；莱奥的态度是他的处事方式,https://www.dongqiudi.com/article/3892103
19,足球,谢维军：做完鼻骨手术后一直保持训练，希望再次入选国足,https://www.dongqiudi.com/article/3892093
20,足球,女足前国门王飞与朱广沪合影：向老前辈学习，为培养人才努力,https://www.dongqiudi.com/article/3892091
