index,hot,title,href
1,足球,队报法甲第12轮最佳阵：姆巴佩领衔，多纳鲁马叹息之墙,https://www.dongqiudi.com/article/3848688
2,足球,罗马诺：马塞利诺将成为比利亚雷亚尔主帅，双方已经达成协议,https://www.dongqiudi.com/article/3848678
3,足球,巴尔韦德：我不知道如何阻止梅西，他是世界上最好的球员之一,https://www.dongqiudi.com/article/3848673
4,足球,TA：诺丁汉森林将利用卡塔尔风格的集装箱提高球场座位容量,https://www.dongqiudi.com/article/3848672
5,足球,开心一刻！切尔西VS曼城的幽默搞笑视频，哈哈哈笑...,https://n.dongqiudi.com/webapp/tops.html?id=3848669
6,足球,英超第12轮六强+海鸥、喜鹊、维拉、铁锤赛后报告,https://www.dongqiudi.com/article/3848656
7,足球,妻子：当我去看莫拉塔比赛时，他错过机会后球迷就恶狠狠看我,https://www.dongqiudi.com/article/3848647
8,足球,查尔顿爵士葬礼今日举行，威廉王子、弗格森等人出席,https://www.dongqiudi.com/article/3848645
9,足球,盘点中超各队“关键先生”：能改变战局的英雄都有谁？,https://www.dongqiudi.com/article/3848635
10,足球,乌拉圭新一期大名单：苏亚雷斯回归，卡瓦尼伤缺,https://www.dongqiudi.com/article/3848614
11,足球,赫罗纳是何方神圣？这么厉害,https://www.dongqiudi.com/article/3848608
12,足球,德尚：我对待姆巴佩可能有不同方式；外界对穆阿尼太苛刻了,https://www.dongqiudi.com/article/3848598
13,足球,昔日枪手今何在：盘点仍活跃在赛场的前枪手们-考古篇十二,https://www.dongqiudi.com/article/3848551
14,足球,西尔韦斯特：得给安东尼更多时间；顶替桑乔？我很看好基耶萨,https://www.dongqiudi.com/article/3848589
15,足球,记者：巴萨将签下马里U17队长迪亚洛，2024年底正式签约,https://www.dongqiudi.com/article/3848588
16,足球,马拉多纳《La Mano De Dios》（上帝...,https://n.dongqiudi.com/webapp/tops.html?id=3848583
17,足球,英媒：尽管受到曼城和皇马关注，但詹姆斯只想帮蓝军重新争冠,https://www.dongqiudi.com/article/3848582
18,足球,电讯报：前山东外援西塞正跟随英格兰第七级别球队训练,https://www.dongqiudi.com/article/3848571
19,足球,咱们就是说清华大学用我的画来迎接巴雷西访华并且得...,https://n.dongqiudi.com/webapp/tops.html?id=3848563
20,足球,奥斯梅恩：新月一直没放弃引进我；小时候有切尔西和曼联球衣,https://www.dongqiudi.com/article/3848559
