index,hot,title,href
1,11375535,歌手2024第二期竞演
2,11070812,T1战胜G2
3,10411321,4月份经济运行延续向好态势
4,10357344,真的是亚当补位
5,9664460,歌手第二期竞演排名
6,9453186,那英又紧张了
7,8387863,520的正确打开方式
8,8378156,不是你游乐王子啊
9,8359432,辽宁再胜新疆总比分2:0
10,8345504,杨丞琳歌手2024一轮游
11,8299111,腾讯视频回应庆余年2广告多
12,8281257,520礼物指南
13,8252406,官方辟谣蒙华铁路三门峡段断桥
14,8237378,歌手热梗依旧稳定输出
15,8120319,梁龙看杭盖乐队reaction
16,8048537,菲国防部长等人窜访中业岛
17,8035803,郭有才直播间菏泽文旅宣传语
18,7938478,雷军歌手摇人榜第一
19,7928312,汪苏泷血肉好听吗
20,7815931,凡希亚震撼全场
21,7729898,那英1秒钟800个表情管理
22,7699106,杭盖踢馆香缇莫
23,7698680,温精灵回应停更
24,7689685,接扇换人挑战
25,7677487,中国元素变妆来了
26,7654704,庆余年2口碑
27,7651647,郭有才被聘为菏泽文旅推荐官
28,7632756,西湖偶遇蔡依林
29,7610459,狂飙兄弟讲述连云港海鲜市场事件
30,7606270,好像搜到吴彦祖抖音号了
31,7595919,真心很贵别逢人就给
32,7595021,周杰伦福州演唱会
33,7583562,连云港通报海鲜市场鬼秤事件
34,7577347,中央督察组暗查发现被困江豚
35,7574606,被一只仓鼠的表情可怜到了
36,7573750,Beat it舞蹈挑战
37,7572256,王楚然演技
38,7568751,郭有才的复古滤镜太有才了
39,7563459,歌手第二期歌单公布
40,7556290,再听一遍明天会更好
41,7553179,庆帝的运动鞋
42,7550115,普京抵达哈尔滨
43,7549757,杭盖唱出来千军万马的气势
44,7546691,看好了我520想要这个礼物
45,7544849,这首越南神曲太夏天了
46,7542485,如何看待永劫无间称被抄袭
47,7542016,泰兰德辣妹心动告白穿搭
48,7540679,中日恢复军方交流
49,7540378,当老板到学校跟老师开会
50,7540333,瞬间配得上易烊千玺了
