index,hot,title,href
1,10770704,被雷军回复的女生找到了
2,10717782,拜登奥巴马克林顿罕见同台
3,10677827,有一种叫云南的生活
4,10554808,田志希3比2伊藤美诚
5,9893769,常驻联合国代表张军将离任回国
6,9739704,合养小火人现状
7,8676710,考完就去看世界
8,8588469,抖音在网络视听大会发布4部短剧
9,8586892,今日辟谣
10,8522322,中消协：应停用小林制药有关产品
11,8510061,被师太和独臂猴星星治愈了
12,8507115,李玟母亲要求下架AI侵权内容
13,8494239,乌军官被曝在办公室与女子热吻
14,8476569,巨流河作者齐邦媛去世
15,8455906,日本女演员自杀 生前遭霸凌
16,8421468,小米汽车F码被炒卖
17,8412477,莫斯科恐袭事件伤者增至382人
18,8399053,懂车帝全网首测小米SU7
19,8388939,雷军这次想不OK都难了
20,8381878,以军方回应士兵玩弄女性内衣
21,8380682,延安大学一考生与李大钊同名
22,8379637,女子酒店遇害750万借款未索回
23,8361646,唐嫣哽咽回应质疑
24,8355786,刘强东宣布京东企业文化升级
25,8349637,诛仙动画2开播
26,8341105,执笔大结局
27,8328608,俄再次大规模打击乌能源设施
28,8319803,奶茶小肥仔给草木人间写歌了
29,8304834,与凤行开辟仙侠新赛道
30,8295952,山东小钺钺已有轻微意识仍在ICU
31,8290878,佘诗曼新闻女王变投资女王
32,8287930,小米SU7试驾评测
33,8285563,CA8122航班亲历者发声
34,8271786,小米回应无法退定金
35,8269784,李晟达还得是魏若来杀
36,8266327,小米汽车一晚收到1亿元定金
37,8244746,如何评价小米SU7
38,8238171,哥斯拉大战金刚2刺激又解压
39,8232734,aespa新曲GetGoin
40,8225345,警号052339封存
41,8211431,人类或将迎“负闰秒”时刻
42,8199570,Magnetic舞蹈教程
43,8193451,胡歌高圆圆新片入围北影节
44,8185542,佛山冰雹
45,8159495,罗永浩谈小米SU7
46,8137353,张子枫胡先煦新片上来就结婚
47,8126919,欢乐颂5姐妹击退渣男
48,8117565,与凤行特效视觉盛宴
49,8098190,河南开封火的是细节
50,8095757,与凤行灵界遇袭
