index,hot,title,href
1,体坛,丁俊晖斯诺克英国公开赛惨遭一轮游，3-4不敌亚伦-希尔,https://www.dongqiudi.com/article/4563354
2,体坛,这头秀发不输哈兰德，NFL美洲虎四分卫：特雷弗-劳伦斯,https://www.dongqiudi.com/article/4563342
3,足球,曼城这赛季可以宣告结束了！凯恩最有机会触碰金球奖的一年？,https://n.dongqiudi.com/webapp/tops.html?id=4563341
4,足球,巴萨官方：特尔施特根已成功完成右膝髌腱受伤手术,https://www.dongqiudi.com/article/4563331
5,足球,西媒：罗德里初步检查结果为十字韧带撕裂，将前往马德里检查,https://www.dongqiudi.com/article/4563328
6,足球,足协杯奖杯巡展来济南了！,https://www.dongqiudi.com/article/4563329
7,足球,每体：巴萨在关注37岁前皇马、马竞门将阿丹,https://www.dongqiudi.com/article/4563319
8,体坛,张之臻表示赛前不立Flag，为商竣程打进成都ATP决赛鼓掌,https://www.dongqiudi.com/article/4563302
9,篮球,队史第一人！队记：猛龙将退役文斯-卡特的15号球衣,https://www.dongqiudi.com/article/4563321
10,足球,世体：37岁纳瓦斯愿意加盟巴萨，薪水不会成为问题,https://www.dongqiudi.com/article/4563296
11,足球,传闻：米兰国米考察维罗纳中场贝拉扬，他是目前意甲过人榜首,https://www.dongqiudi.com/article/4563301
12,足球,马竞官方：AZP左腿肌肉受伤，将接受物理治疗并在健身房恢复,https://www.dongqiudi.com/article/4563290
13,足球,佩尼亚鼓励特尔施特根：加油，你会在回来时更强大,https://www.dongqiudi.com/article/4563283
14,足球,记者：拜仁将与首席球探马库斯-皮拉瓦分道扬镳,https://www.dongqiudi.com/article/4563271
15,足球,利雅得胜利客战哈森姆：C罗缺席，马内、塔利斯卡出战,https://www.dongqiudi.com/article/4563152
16,足球,本赛季意甲3球1助，队报：德尚已将托万列入法国队大名单,https://www.dongqiudi.com/article/4563261
17,篮球,观战超三卫星赛厦门站，张镇麟：我攻守均衡打三人篮球有优势,https://www.dongqiudi.com/article/4563259
18,足球,Troopz：多库也干了却没有黄牌让我感到恶心！,https://www.dongqiudi.com/article/4563274
19,篮球,夸梅-布朗：布朗尼的入选不是因为他的能力，他有健康问题,https://www.dongqiudi.com/article/4563228
