index,hot,title,href
1,12552533,国乒女团决赛对阵日本
2,12193961,刘焕华举重102公斤级夺金
3,11005211,中国研发太阳能微型无人机
4,10862718,曹缘男子10米台成功卫冕
5,10156374,菲律宾军机干扰中方演训被驱离
6,10065897,中国队首获艺术体操奥运金牌
7,8926625,许昕说最后一场放开了整
8,8433815,七夕节的存在感下降了吗
9,8389632,巴西坠机全国哀悼3天
10,8330412,许昕夸赞中国队关键时候够硬
11,8320493,广西景区项目故障致1死60伤
12,8220959,七夕奇妙游
13,8061932,网红被质疑收数百万后刷单卖货
14,7848456,鹿晗七夕一早直播
15,7806140,“网红灭火器”灭火效果如何
16,7792365,见面吧趁现在
17,7791088,本周谣言
18,7777180,明星们的七夕仪式感
19,7710829,Shams：男篮金牌赛杜兰特将首发
20,7698563,别怕 我会永远在你身后
21,7687869,终于到七夕了
22,7681101,巴黎奥运会上闪耀的中国姑娘
23,7671323,庞博文版痛快2024终于来了
24,7669289,压扁的小面包有多好吃
25,7668335,七夕为什么是女性事业节
26,7663255,七夕吃什么
27,7654190,七夕 我想对你说
28,7652912,福原爱方博解说比赛哪有干饭重要
29,7647652,武僧秋风的最后一条抖音
30,7642830,这个七夕表白还是表黑
31,7639282,男生的快乐好简单
32,7631627,我开始怀疑我们的关系
33,7625674,晒出你的七夕礼物
34,7621123,今年七夕打算和谁一起过
35,7616493,第九届世界渲染大赛
36,7616238,南波万演唱会院人合唱
37,7611584,这是我能吃的七夕细糠吗
38,7610174,孙颖莎抖音小小莎
39,7609836,七夕送礼物仪式感
40,7554983,时空交错见面挑战
41,7472168,电影负负得正口碑
42,7405715,国乒女团冲击五连冠
43,7400887,这一幕秒杀所有的偶像剧
44,7372639,他说喜欢全能的我
45,7348495,TFBOYS古早模仿挑战
46,7330129,巴西一客机坠毁61人遇难
47,7304920,在王者做笨蛋宝宝
48,7257081,和阿如那学唱蒙语乌兰巴托的夜
49,7232305,七夕送自己一瓶金银花
50,7213910,这舞蹈感染力无敌了
