index,hot,title,href
1,104,统计：这社区日活人数超过100人吗？看到的回复下，截止明天下午三点,https://www.guozaoke.com/t/103802
2,102,请问家里飞来俩鸽子咋处理？（11.4～11.5，俩蛋！）,https://www.guozaoke.com/t/103619
3,90,撸大师进来,https://www.guozaoke.com/t/103640
4,69,遥遥领先耍猴到什么时候？,https://www.guozaoke.com/t/103733
5,65,斗鱼陈少杰失联,https://www.guozaoke.com/t/103728
6,65,武汉的永旺就没有拉垮的吧,https://www.guozaoke.com/t/103630
7,62,咨询个事，家有小学生宝妈请进。,https://www.guozaoke.com/t/103666
8,52,朗诗里程这是要跌破1w了？,https://www.guozaoke.com/t/103652
9,51,求证一下，是不是所有胸小的女生脾气都暴躁（特指A cup）,https://www.guozaoke.com/t/103686
10,51,有没有免费的访问外网的工具,https://www.guozaoke.com/t/103608
