index,hot,title,href
1,81,城市散步学，凝视身边的平凡时刻,https://www.kaiyanapp.com/detail.html?vid=322206
2,126,原来，在他们眼里美食竟毫无诱惑力…,https://www.kaiyanapp.com/detail.html?vid=322313
3,39,重磅来袭！2024 网飞影视剧预告混剪,https://www.kaiyanapp.com/detail.html?vid=322306
4,52,三星绝美视觉大片，宇宙迸发的颜色,https://www.kaiyanapp.com/detail.html?vid=322312
5,281,阿兹海默的世界，催泪学院派动画「忘」,https://www.kaiyanapp.com/detail.html?vid=322213
6,54,心疼摄影师，大熊猫整人行为大赏,https://www.kaiyanapp.com/detail.html?vid=319411
7,32,这年头，调酒师都成人工智能了......,https://www.kaiyanapp.com/detail.html?vid=322241
8,54,鬼畜摇滚 MV，送给这个奇怪的世界,https://www.kaiyanapp.com/detail.html?vid=322248
9,54,住在垃圾场里的家庭，正用力活着,https://www.kaiyanapp.com/detail.html?vid=322232
10,19,异形即视感，科幻恐怖短片「阿扎坎特」,https://www.kaiyanapp.com/detail.html?vid=321481
