index,hot,title,href
1,夏花生,效率翻倍！6 款不容错过的免费 AI 神器（七）,https://www.uisdc.com/aigc-tools-8
2,MiuYan 周妙妍,超多案例！画册这样改，真的变高级了！,https://www.uisdc.com/brochure-design
3,58UXD,出图效率飞起！如何用 ComfyUI 搭建 Stable Diffusion 工作流？,https://www.uisdc.com/mac-stable-diffusion
4,夏花生,最强开源模型来了！一文详解 Stable Diffusion 3 Medium 特点及用法（附模型资源包）,https://www.uisdc.com/stable-diffusion-3-medium
5,ASAK设计,完全免费！9个超好用的图片压缩工具,https://www.uisdc.com/9-compression-tool
6,夏花生,Midjourney 支持个性化微调啦！一文详解新功能 Personalization,https://www.uisdc.com/midjourney-personalization
7,姝斐suphie,4800字干货！B端弹窗设计中的11个法则,https://www.uisdc.com/b-side-popup-principle
8,夏花生,效率翻倍！6 款不容错过的免费 AI 神器（六）,https://www.uisdc.com/aigc-tools-7
9,酸梅干超人,解决世纪难题！一篇讲清移动端适配逻辑和关键方法（进阶版）,https://www.uisdc.com/obile-device-adaptation
10,张鼎_Ending,万字干货！6大章节帮你从零开始系统学配色,https://www.uisdc.com/color-matching-6
11,CANAAN,超全整理！10个字体下载网站,https://www.uisdc.com/14-font-download
12,酸梅干超人,解决世纪难题！一篇讲清移动端适配逻辑和关键方法,https://www.uisdc.com/mobile-device-adaptation
13,ZoeYZ,京东设计师的努力值，能当兄弟吗？,https://www.uisdc.com/jd-app-ui
14,夏花生,手把手教程！5步搞定超热门的AI字体海报设计,https://www.uisdc.com/ai-font-poster
15,金玉珏,保姆级教程！手把手教你用AIGC快速设计端午运营图,https://www.uisdc.com/aigc-dragon-boat-festival
16,酸梅干超人,UI设计师的困境与突破：如何在唱衰声中寻找希望？,https://www.uisdc.com/ui-design-7
17,菜心¹,实操案例！让作品集快速上档次的包装技巧,https://www.uisdc.com/packaging-design
18,夏花生,一键复刻！12 组超惊艳的 Midjourney 风格代码推荐,https://www.uisdc.com/12-midjourney-sref-random
19,陈子木,第四波！2024年5月精选实用设计工具合集,https://www.uisdc.com/2024-5-design-resources-vol4
20,智行ZXD设计中心,大厂是如何用好AI的？收下智行设计团队的AIGC实践报告,https://www.uisdc.com/zhixing-aigc-practice
21,58UXD,工具用得好，下班回家早！超好用的提高工作效率四步法！,https://www.uisdc.com/methods-for-improving-efficiency
22,酸梅干超人,国潮风的视觉界面应该怎么设计？收下这份保姆级教程！,https://www.uisdc.com/national-ui
23,菜心¹,AI又帮我做项目了，效率超高！,https://www.uisdc.com/ai-design
24,乐伊ROY,从理论到方法全掌握！如何用AI让图像高清放大？,https://www.uisdc.com/image-enhancement
25,干了这吨柠檬汁,超多实例！资深设计师如何运用5W1H分析法？,https://www.uisdc.com/5w1h
26,碧野青风,实战案例！探索中后台Web界面的宽度适配策略,https://www.uisdc.com/interface-adaptation
27,夏花生,效率翻倍！6 款不容错过的免费 AI 神器（五）,https://www.uisdc.com/aigc-tools-6
28,酸梅干超人,提升作品集最快的方式：5个要点帮你选好配图,https://www.uisdc.com/portfolio-images
29,陈子木,第三波！2024年5月精选实用设计工具合集,https://www.uisdc.com/2024-5-design-resources-vol3
30,乐伊ROY,速度更快！新版 SD WebUI Forge 保姆级安装教程,https://www.uisdc.com/sd-webui-forge
31,颜究员小Ma哥,"深度解析华晨宇的品牌宇宙：揭秘""火星""背后的创新设计",https://www.uisdc.com/huachenyu
32,夏花生,用好这 3 款 3D 建模工具，让你的 AI 出图质量轻松提升200%,https://www.uisdc.com/3d-tools
33,金玉珏,如何用MJ和SD，解锁转盘抽奖界面设计？,https://www.uisdc.com/mj-sd
34,Zhan,免费！让图片放大不失真的位图转矢量图神器 Tmttool,https://www.uisdc.com/tmttool
35,夏花生,一文详解打光神器 IC-Light！可控制光照方向和色彩氛围，免费使用,https://www.uisdc.com/ic-light
36,13号小星球,看完这篇「2024面试宝典」，你会发现自己强得可怕,https://www.uisdc.com/interview-bible-2024
37,ISUX,提高三倍效率！17个腾讯高手都在用的 Figma 插件,https://www.uisdc.com/figma-ai
38,夏花生,实现纹理素材自由！8 组纹理材质类 Midjourney 关键词,https://www.uisdc.com/texture-prompt
39,58UXD,设计师的文案加速器：5个超好用的AI写作助手工具测评,https://www.uisdc.com/ai-writing-assistant
40,土拨鼠,顶级发布会都爱用的 BentoUI 设计风格，该如何应用？,https://www.uisdc.com/bentoui-2
