index,hot,title,href
1,,探店丰田新款普拉多，店内关注的人并不多？,http://vc.yiche.com/vplay/9074594.html
2,,红旗H5满载2吨，2.0T8AT百公里综合油耗6.4L高吗,http://vc.yiche.com/vplay/9067190.html
3,,记住车上这三个隐藏点位，以后轻松远离剐蹭！,http://vc.yiche.com/vplay/9066927.html
4,,速看，6.98万，丰田锋兰达价格是否到底了？,http://vc.yiche.com/vplay/9073164.html
5,,云辇-P加持/40万智能硬派SUV 方程豹豹8抢先体验！,http://vc.yiche.com/vplay/9074609.html
6,,静态体验长安启源E07，一台可变形的全场景汽车,http://vc.yiche.com/vplay/9067004.html
7,,首试凯迪拉克全新XT5：底盘做大做强，27.99万起守住油车防线,http://vc.yiche.com/vplay/9069593.html
8,,比亚迪唐dmi风采！,http://vc.yiche.com/vplay/9071355.html
9,,轩逸经典再出新款，命名大屏版这你受得了吗,http://vc.yiche.com/vplay/9073605.html
10,,大众高尔夫诞生50周年 一起体验8代车型,http://vc.yiche.com/vplay/9076654.html
