index,hot,title,href
1,3.7万,现在医院有点黑来来额啊,http://club.kdslife.com/t_11235761.html
2,2.7万,杨浦中原老阿姨急抛，挂牌350万，中介说现在最多300万。,http://club.kdslife.com/t_11235779.html
3,2.5万,这算豪宅了吧？,http://club.kdslife.com/t_11235763.html
4,2.4万,润去美国洗碗就这水平？,http://club.kdslife.com/t_11235896.html
5,2.2万,倡议地铁取消安检,http://club.kdslife.com/t_11235784.html
6,1.8万,上海游客大呼上当，云南景区竟指骡为马,http://club.kdslife.com/t_11235830.html
7,1.7万,有句港句，上海绿牌马上要限号了,http://club.kdslife.com/t_11235996.html
8,1.5万,哈哈，罚款吧,http://club.kdslife.com/t_11235804.html
9,1.6万,我发现一个很牛B的网站 我牛B伐,http://club.kdslife.com/t_11235859.html
10,1.3万,黄晶电影里这个算难看的吧,http://club.kdslife.com/t_11235837.html
11,1.2万,深圳不是年轻人的城市么，怎么跌的比上海更厉害？？？,http://club.kdslife.com/t_11235853.html
12,1.2万,这种接触几次就没兴趣了吧,http://club.kdslife.com/t_11235954.html
13,1.1万,小米汽车已经在工信部网页上公式了。外形中规中矩。,http://club.kdslife.com/t_11235967.html
14,1.1万,海拔4250米，距离印度新德里430公里的西藏普兰机场通过验收，即将通航。,http://club.kdslife.com/t_11235764.html
15,1.3万,面试这个岗位，竟然还要笔试做考卷，一个月也就12K的低工资,http://club.kdslife.com/t_11235834.html
16,9665,当父母都离世后,http://club.kdslife.com/t_11236039.html
17,1.1万,中金也裁员了？,http://club.kdslife.com/t_11235969.html
18,9145,小杨哥演唱会成本超3000万粉丝一个亿,http://club.kdslife.com/t_11236065.html
19,1.2万,什么人会花近400万买一套7楼没电梯的30平的老破小？,http://club.kdslife.com/t_11235811.html
20,8858,大众的CEO是个公关啊？怪不得搞不好,http://club.kdslife.com/t_11235966.html
