index,hot,title,href
1,6.0万,现在医院有点黑来来额啊,http://club.kdslife.com/t_11235761.html
2,4.9万,杨浦中原老阿姨急抛，挂牌350万，中介说现在最多300万。,http://club.kdslife.com/t_11235779.html
3,4.6万,去美国洗碗就这水平？,http://club.kdslife.com/t_11235896.html
4,4.5万,有句港句，上海绿牌马上要限号了,http://club.kdslife.com/t_11235996.html
5,4.3万,这算豪宅了吧？,http://club.kdslife.com/t_11235763.html
6,3.7万,太苦，下辈子别来了。,http://club.kdslife.com/t_11236119.html
7,3.6万,倡议地铁取消安检,http://club.kdslife.com/t_11235784.html
8,3.5万,哈哈，罚款吧,http://club.kdslife.com/t_11235804.html
9,3.4万,我发现一个很牛B的网站 我牛B伐,http://club.kdslife.com/t_11235859.html
10,3.0万,上海游客大呼上当，云南景区竟指骡为马,http://club.kdslife.com/t_11235830.html
11,3.2万,这种接触几次就没兴趣了吧,http://club.kdslife.com/t_11235954.html
12,2.8万,中金也裁员了？,http://club.kdslife.com/t_11235969.html
13,2.5万,深圳不是年轻人的城市么，怎么跌的比上海更厉害？？？,http://club.kdslife.com/t_11235853.html
14,2.3万,小米汽车已经在工信部网页上公式了。外形中规中矩。,http://club.kdslife.com/t_11235967.html
15,2.4万,当父母都离世后,http://club.kdslife.com/t_11236039.html
16,2.1万,黄晶电影里这个算难看的吧,http://club.kdslife.com/t_11235837.html
17,2.2万,面试这个岗位，竟然还要笔试做考卷，一个月也就12K的低工资,http://club.kdslife.com/t_11235834.html
18,2.0万,上海如果蓝牌限行，会出现大面积退牌挤兑现象吗？,http://club.kdslife.com/t_11236120.html
19,2.2万,小镇青年初探上海，罗森打工击碎滤镜。。。。。,http://club.kdslife.com/t_11236084.html
20,2.0万,什么人会花近400万买一套7楼没电梯的30平的老破小？,http://club.kdslife.com/t_11235811.html
