index,hot,title,href
1,足球,早报：如何给新领导留一个好印象？,https://www.dongqiudi.com/article/3935065
2,足球,太阳报：格林伍德和女友回英国过圣诞，出门购物在街头手牵手,https://www.dongqiudi.com/article/3935124
3,,洛杉矶湖人 vs 波士顿凯尔特人 比赛动态,https://www.dongqiudi.com/article/3935068
4,足球,滕哈格：对球员的态度并不失望，但我们必须一同承担责任,https://www.dongqiudi.com/article/3935080
5,篮球,圣诞大战：掘金120-114勇士，约基奇26+14+8，库里低迷18分,https://www.dongqiudi.com/article/3935063
6,足球,巴萨官方晒罗克亲吻队徽视频：圣诞节我想要的只有你,https://www.dongqiudi.com/article/3935059
7,足球,内部人事调动？罗马诺：曼城正讨论从赫罗纳签下萨维奥,https://www.dongqiudi.com/article/3935058
8,足球,斯基拉：国米想租借后强制买断布坎南，已与球员达成一致,https://www.dongqiudi.com/article/3935056
9,足球,斯基拉：贝斯基愿降薪回归尤文，他并非尤文冬窗主要目标,https://www.dongqiudi.com/article/3935054
10,,NBA战报：尼克斯129-122雄鹿，布伦森38+3+6,https://www.dongqiudi.com/article/3935045
11,足球,莫雷托：斯帕莱蒂告诉博努奇，想踢欧洲杯就得回意甲,https://www.dongqiudi.com/article/3935005
12,足球,邮报：拉爵在尼斯三年换过五个教练，滕哈格的安全网正被拆除,https://www.dongqiudi.com/article/3934987
13,足球,会选哪名葡萄牙球员加入球队？字母哥：我会选GOAT，C罗,https://www.dongqiudi.com/article/3934931
14,足球,卡拉格：曼联真的很平庸，他们踢得很无聊,https://www.dongqiudi.com/article/3934915
15,足球,黄牌太多，波帅：这不是缺乏纪律，这与阅读比赛形势能力有关,https://www.dongqiudi.com/article/3934909
16,篮球,名记：追梦格林不太可能在1月初前复出，禁赛场次约11-13场,https://www.dongqiudi.com/article/3934908
17,足球,晚旗报预测阿森纳vs西汉姆联首发：赖斯战旧主，哈弗茨停赛,https://www.dongqiudi.com/article/3934900
18,足球,球探报告：诺维贝尔格莱德05前锋卢科维奇，模板淫魔/莱万,https://www.dongqiudi.com/article/3871257
19,足球,最泰安评选泰山队30年最佳阵容揭晓，王大雷领衔，四外援入,https://www.dongqiudi.com/article/3934888
20,足球,意媒：米兰想要贝蒂斯中场罗德里格斯，费用可能降至1000万欧,https://www.dongqiudi.com/article/3934882
