index,hot,title,href
1,十里村,董宇辉，有四条路可以选择,https://www.woshipm.com/?p=5959964
2,Nana,复盘：产品经理要避坑“衰退期产品”的职位,https://www.woshipm.com/?p=5959770
3,果酿,8000字干货说清楚AI产品经理必修的“神经网络”,https://www.woshipm.com/?p=5959670
4,屈太浪,16个营销洞察，你值得看一看,https://www.woshipm.com/?p=5959451
5,字母榜,俞敏洪道歉，能留住董宇辉吗？,https://www.woshipm.com/?p=5959619
6,接地气的陈老师,卷死他们，数据分析师的年终述职报告（套路+模版）,https://www.woshipm.com/?p=5959260
7,七叔创业圈子,做自媒体陷入这7个误区，别指望你能赚钱了,https://www.woshipm.com/?p=5959526
8,浅倩的哆啦咪,择业篇：哪些坑我不希望新手产品经理们再踩,https://www.woshipm.com/?p=5960012
9,未来消费,前互联网大厂人，在这些公司悄悄「上岸」,https://www.woshipm.com/?p=5960088
10,女侠的产品江湖,B2B企业定制CRM系统，从规划到上线经验总结,https://www.woshipm.com/?p=5959789
11,蛋壳粥,商城建设核心（垂直商城、平台商城、分销商城）,https://www.woshipm.com/?p=5959493
12,阿琦Aqi,给产品的3个必不可少的用户研究技巧,https://www.woshipm.com/?p=5959208
13,定焦One,轮到俞敏洪救东方甄选了,https://www.woshipm.com/?p=5959969
14,Vinky,优衣库，闯进三四线城市,https://www.woshipm.com/?p=5944169
15,南方碟道,“标签体系”建设的复盘与思考（上），以“城市治理 | 舆情监测分析业务”为例详解~,https://www.woshipm.com/?p=5958816
16,十里村,公域持续获得流量的核心框架,https://www.woshipm.com/?p=5959247
17,Vinky,抖音电商：万亿GMV的背后,https://www.woshipm.com/?p=5808091
18,产品经理周报,产品周报277期 | 苹果发布 iOS 17.2 正式版，微信短剧小程序开始收取保证金,https://www.woshipm.com/?p=5959519
19,Ruby的产品工坊,五步法助力产品经理年终高效复盘,https://www.woshipm.com/?p=5958754
20,镜观台,年底了，你准备换工作吗？,https://www.woshipm.com/?p=5959863
21,晚迟,三福百货数据分析：新时代背景下新零售百货的一般销售模式,https://www.woshipm.com/?p=5958812
22,芋艿和猫说,2024年，营销的8个趋势和解题方法,https://www.woshipm.com/?p=5958568
23,晚迟,从产品经理的角度，为淘宝做积分商城的设计,https://www.woshipm.com/?p=5958800
24,刘玮冬,女装电商创业前必看，哪种视觉流派更适合你的创业路,https://www.woshipm.com/?p=5959195
25,中海诺,情绪，群体行为的引爆点,https://www.woshipm.com/?p=5959139
26,林果,甄嬛传们走不通的文化输出之路，短剧可以吗？,https://www.woshipm.com/?p=5958739
27,白鲸出海,“狗血故事编辑器”冲击美榜，互动小说又变了？,https://www.woshipm.com/?p=5960359
28,a~hello,如何零基础搭建分布式数字身份平台,https://www.woshipm.com/?p=5956923
29,产品狗随笔,业财一体化之结算系统,https://www.woshipm.com/?p=5905725
30,腾讯ISUX,八角行为分析 — 打动用户的产品密码,https://www.woshipm.com/?p=5959171
31,小发的设计笔记,9️⃣个月设计感受：C端交互 → 车载地图交互,https://www.woshipm.com/?p=5952634
32,银杏财经,双十二手记：淘天隐匿，抖快奇袭,https://www.woshipm.com/?p=5960103
33,言成,Spotify的付费转换策略：免费用户如何成为付费用户？,https://www.woshipm.com/?p=5959293
34,字母榜,入局酒旅行业：美团的酒，抖音要干了,https://www.woshipm.com/?p=5959444
35,电商运营打工人,国内电商平台的《人》《货》《场》,https://www.woshipm.com/?p=5953226
36,宋厂长,京东百亿补贴为什么输给了拼多多？,https://www.woshipm.com/?p=5954293
37,字母榜,董宇辉粉丝“叫板”东方甄选,https://www.woshipm.com/?p=5959265
38,吴祖妹,社区营造万字总结，这才是邻里社交正确打开的姿势,https://www.woshipm.com/?p=5959475
39,人人都是产品经理,2023年度报告已送达，回顾你的高光时刻！,https://www.woshipm.com/?p=5953966
40,誓博,一文讲透SPU和SKU,https://www.woshipm.com/?p=5850460
41,小白龙Mars,校园传媒创业应该怎么搞：洞察历史走向未来,https://www.woshipm.com/?p=5959225
42,虎嗅,小红书终于开窍了,https://www.woshipm.com/?p=5958971
43,志良LAN????,下一个千亿级流量风口？电动自行车充电桩行业分析,https://www.woshipm.com/?p=5958433
44,58UXD,Z时代“梗营销”之道，品牌如何借助AI造出圈热梗？,https://www.woshipm.com/?p=5959411
45,新周刊,“看短剧充了4万元后，我妈后悔了”,https://www.woshipm.com/?p=5958989
46,娱乐硬糖,表情包暴露了你的心,https://www.woshipm.com/?p=5959253
47,白鲸出海,TikTok Shop回归印尼，开拓东南亚电商市场,https://www.woshipm.com/?p=5959439
48,最话FunTalk,小红书为啥急了,https://www.woshipm.com/?p=5958495
49,TCC翻译情报局,如何在技术时代构建有意识的用户体验,https://www.woshipm.com/?p=5958448
50,Echo 产品论,从“企业、用户与产品”的维度论述产品经理的能力模型,https://www.woshipm.com/?p=5957979
51,一刻商业,腾讯NOW直播，再被提起已是“弃子”,https://www.woshipm.com/?p=5958994
52,产品狗随笔,详解|电商平台天猫费用结算,https://www.woshipm.com/?p=5952297
53,海贝学姐,产品优化三部曲,https://www.woshipm.com/?p=5957931
54,伯安,用户行为，从感知开始,https://www.woshipm.com/?p=5958435
55,电商在线,拼多多temu，围剿美国1元店,https://www.woshipm.com/?p=5959038
56,进击的沈帅波,2023年底，一些商业观点的转变,https://www.woshipm.com/?p=5958507
57,运营派,2023年十大网络热梗，都有哪些？,https://www.woshipm.com/?p=5950636
58,空手,品牌营销的实质与底层逻辑,https://www.woshipm.com/?p=5953585
59,晏涛三寿,2023年十大营销关键词盘点！,https://www.woshipm.com/?p=5957955
60,Li 婷婷,营销策略的转折点：从流量到情感,https://www.woshipm.com/?p=5958556
61,短剑在闲逛,搜索引擎（百度）关键字搜索的需求分析和结果设计,https://www.woshipm.com/?p=5957860
62,不想延期,万字长文：浅谈“产品思维”于工作、于生活,https://www.woshipm.com/?p=5871166
63,木笔,一个故事，给你讲明白企业数字化升级,https://www.woshipm.com/?p=5953674
64,圈圈,AI 产品经理和 AIGC 产品经理有什么区别，怎么选择？,https://www.woshipm.com/?p=5955047
65,PM维他命,供应链系统中的编码和条码，你真的懂了吗？,https://www.woshipm.com/?p=5954532
66,霞光社,跨境电商年度战争：从短跑换长跑,https://www.woshipm.com/?p=5954714
67,文轩没有大脑袋,在设计时，圆角与直角该如何使用？,https://www.woshipm.com/?p=5958208
68,V2XR,空间计算时代，你还需要担心 VR 眩晕吗？,https://www.woshipm.com/?p=5939035
69,壹番财经,无人能「唤醒」双十二,https://www.woshipm.com/?p=5959084
70,老谢运营笔记,我用AI回答微信“问一问”，每天1小时，稳定涨粉30+（内附操作流程）,https://www.woshipm.com/?p=5957258
71,刘旷,大模型应用疯狂加速，洗牌却在静悄悄进行了,https://www.woshipm.com/?p=5915420
72,ToB产品佬,产品经理为什么这么火，现在不火了又怎么办,https://www.woshipm.com/?p=5956278
73,小发的设计笔记,HMI | 结合地图竞品分析，拆解车载地图交互,https://www.woshipm.com/?p=5885121
74,许与,为什么国内做不成患者管理saas产品？,https://www.woshipm.com/?p=5957133
75,AI魔法学园,2023 年的人工智能：突破性的一年，人类的一切都没有改变,https://www.woshipm.com/?p=5958612
76,接地气的陈老师,大厂都要求的“数据分析闭环”，该如何实现？,https://www.woshipm.com/?p=5907374
77,晨阳产品笔记,从产品角度分析霸王茶姬为什么会突然爆火？,https://www.woshipm.com/?p=5950643
78,张佳的流量常识,【AI公开课】ChatGPT告诉我的10个AI使用模式，覆盖几乎所有需求,https://www.woshipm.com/?p=5958503
79,克劳锐,泛财商加速增长，支付宝内容化并非“伪命题”,https://www.woshipm.com/?p=5959990
80,蛋壳粥,医药批发-B2B商城：用户需求、业务需求、品牌商需求,https://www.woshipm.com/?p=5957994
81,Tech星球,短剧变天：下架，毁约，拍摄延期观望,https://www.woshipm.com/?p=5959016
82,四千年一遇的PM,用户增长——激活&留存案例调研,https://www.woshipm.com/?p=5957097
83,陈天宇宙,一文搞懂“对账系统”,https://www.woshipm.com/?p=5938046
84,果酿,产品经理的独门技能——AI监督学习（6000字干货）,https://www.woshipm.com/?p=5952894
85,天天问,2023年互联网10大热门事件，哪一件让你印象最深刻？,https://www.woshipm.com/?p=5951920
86,吴怼怼,知乎“倒爷”，折射文字社区20年浮沉,https://www.woshipm.com/?p=5957026
87,三元方差,没有机会接触业务，怎么提高业务理解？,https://www.woshipm.com/?p=5956953
88,产品锦李,微信授权登录：从入门到精通,https://www.woshipm.com/?p=5956129
89,惊蛰研究所,“龙傲天”海外逆袭：1部剧，2个亿,https://www.woshipm.com/?p=5958582
90,刚哥,万字长文，四句口诀搞懂支付交易,https://www.woshipm.com/?p=5958829
91,大漠飞鹰CYSJ,尼尔森十大可用性原则 | 设计师需要知道的设计原则！,https://www.woshipm.com/?p=5825188
92,老谢运营笔记,我在Dou+花了18万，才搞明白Dou+到底该怎么投！（内附新号Dou+投放流程）,https://www.woshipm.com/?p=5906210
93,何杨说文案,【合集】21个顶尖文案高手写作锦囊,https://www.woshipm.com/?p=5931557
94,豆芽悟,业务流程图、数据流程图傻傻分不清,https://www.woshipm.com/?p=5850561
95,老高商业与品牌,产品如何找到购买理由,https://www.woshipm.com/?p=5875413
96,窄播,复盘拼多多：为什么能持续低价且盈利,https://www.woshipm.com/?p=5870143
97,大可,职场思考：CEO、COO、CTO全部S评价！转正答辩背后的“成功密码”,https://www.woshipm.com/?p=5881489
98,碧英数据,从方法论及业务实践过程中，总结了几点对数据分析的感悟,https://www.woshipm.com/?p=5805260
99,或或私域笔记,私域分享 | 一文告诉你，引流的背后是什么？,https://www.woshipm.com/?p=5799866
100,PM东东枪,产品经理学点技术（思维）总没有错！,https://www.woshipm.com/?p=5246950
