index,hot,title,href
1,,阿里的语雀，崩了,https://www.36kr.com/p/2487990260602760
2,,彩票店老板：买票请进，创业快逃,https://www.36kr.com/p/2487772442105989
3,,2023年了，还有大厂想做社交？,https://www.36kr.com/p/2487704062793607
4,,交多少个朋友，才能带火京东直播？,https://www.36kr.com/p/2487914226358147
5,,抖音涨粉300多万的普通大学生，被网友们当成了敌人,https://www.36kr.com/p/2487711975036806
6,,字节游戏，一次“续命”豪赌,https://www.36kr.com/p/2488271357663369
7,,何小鹏告别无为而治：失位、整改与进阶,https://www.36kr.com/p/2487708403144577
8,,「减肥神药」会成为下一个伟哥吗？｜氪金 · 大健康,https://www.36kr.com/p/2487863171897220
