index,hot,title,href
1,45,罗马的黎明时分，是一幅流动的油画,https://www.kaiyanapp.com/detail.html?vid=325658
2,181,音乐可视化前卫创意，跳动燃烧的音符,https://www.kaiyanapp.com/detail.html?vid=325774
3,54,爱情竟从天而降，比利时浪漫牛奶广告,https://www.kaiyanapp.com/detail.html?vid=325719
4,26,极度致郁，我活着就是一滩「烂泥」,https://www.kaiyanapp.com/detail.html?vid=325601
5,82,追求随心所欲的自由吧！Garmin复古广告,https://www.kaiyanapp.com/detail.html?vid=325770
6,843,中国最神秘的四合院，吃喝拉撒睡都在地下,https://www.kaiyanapp.com/detail.html?vid=325800
7,13,做人为什么这么累，要从 30 万年前说起,https://www.kaiyanapp.com/detail.html?vid=325785
8,13,格莱美电子三人组：确实感受到了压力,https://www.kaiyanapp.com/detail.html?vid=325772
9,0,戳心剧情短片，面对爱的不确定,https://www.kaiyanapp.com/detail.html?vid=325798
10,0,你有没有想过牛奶是白色，为什么奶酪是黄色？,https://www.kaiyanapp.com/detail.html?vid=325755
