index,hot,title,href
1,鹭岛生活,回娘家。。。。。,http://bbs.xmfish.com/read-htm-tid-18156370.html
2,鹭岛生活,厦门人，你家回南天了吗？好可怕,http://bbs.xmfish.com/read-htm-tid-18156388.html
3,鹭岛生活,买个电车汽车怎样，很多人都在换，我也在考虑,http://bbs.xmfish.com/read-htm-tid-18156328.html
4,鹭岛生活,失眠的第15天。。。,http://bbs.xmfish.com/read-htm-tid-18156348.html
5,鹭岛生活,[03-06]如果工资15000但是后面会经常被老板骂你会继续做下去吗,http://bbs.xmfish.com/read-htm-tid-18156585.html
6,鹭岛生活,刷公交车卡，能不能用手机刷？,http://bbs.xmfish.com/read-htm-tid-18156403.html
7,鹭岛生活,厦门岛内房价其实和深圳差不多了,http://bbs.xmfish.com/read-htm-tid-18156527.html
8,鹭岛生活,本大师掐指一算，如果你面临如下困境，说明你大运来了,http://bbs.xmfish.com/read-htm-tid-18156355.html
9,鹭岛生活,厦门地王要诞生了,http://bbs.xmfish.com/read-htm-tid-18156571.html
10,鹭岛生活,实体店你真不能怪电商抢你市场！！,http://bbs.xmfish.com/read-htm-tid-18156530.html
