index,hot,title,href
1,11096183,东北雨姐归来了
2,10901018,化妆师兔子爆改花小龙
3,10866597,各地为了端午龙舟赛有多拼
4,10846542,杨根思连被授予时代楷模称号
5,10045144,上海发布房产新政
6,9789029,以军与埃及士兵发生交火
7,8807601,范思辙算盘打到范闲大婚了
8,8600855,TES官宣xiye加入
9,8574832,网信部门曝光又一批谣言案例
10,8541587,世卫大会拒绝涉台提案
11,8485648,库里第4个孩子出生
12,8466209,一埃及士兵在与以军交火中死亡
13,8447912,安徽楼房坍塌现场发现1名失联者
14,8444352,疯狂小杨哥来央视做客了
15,8367937,高海宁因身材太好不自信
16,8367472,民警与运钞车发生枪战系谣言
17,8363037,宋轶是个小哭包吧
18,8358821,三只羊CEO辟谣小杨哥退网
19,8344523,剪断的脐带又被妈妈接上了
20,8340021,杨幂模仿郭晓婷刘诗诗聊天
21,8337768,长公主送林婉儿出嫁
22,8337583,Whataya Want from Me翻唱
23,8337500,范闲林婉儿大婚名场面
24,8334828,华春莹任外交部副部长
25,8332204,沃特斯删除球队相关动态
26,8326334,俄战略预警雷达遭袭引多方焦虑
27,8319301,董宇辉到深圳了
28,8312624,警方回应考古队遭村民殴打
29,8284601,卡卡抵达贵阳
30,8283723,广西失踪两姐妹均溺亡
31,8282935,赵丽颖把抖音拍成朋友圈
32,8279115,aespa回归
33,8253731,老师我想把肚子放到桌子上
34,8247251,庆余年2五竹出场
35,8224063,港股恒大系大涨
36,8221265,凤凰传奇版海底雨中封神
37,8220934,杨根思连的三个不相信
38,8207906,吴艳妮重庆站因伤弃赛
39,8180026,背着善宰跑第15集
40,8134718,镇江工地挖出85斤废旧炮弹
41,8131576,独行侠3:0森林狼夺赛点
42,8091070,马英九幕僚驳斥赖清德言论
43,8070216,深圳今明两天将有暴雨
44,8066182,梦之队票数
45,8036604,福州大学流浪狗回回
46,7989678,中式变装惊艳世界
47,7843014,被评论区的中式英语笑晕了
48,7785060,快乐向前冲录制多人骨折
49,7783116,这么甜的手势舞到底是谁在跳
50,7773592,致每一个IP在外的你
