index,hot,title,href
1,体坛,2023斯诺克武汉公开赛：特鲁姆普10-7逆转胜卡特，夺得冠军,https://www.dongqiudi.com/article/3784458
2,足球,曼城更新社媒☞大卫·席尔瓦精彩表现,https://n.dongqiudi.com/webapp/tops.html?id=3784451
3,足球,最低消费3:0胜东莞，2023四川九牛剑指中甲冠军!!!,https://www.dongqiudi.com/article/3784450
4,足球,备战进行时！接下来世预赛面对秘鲁，阿根廷众将今日份训练,https://www.dongqiudi.com/article/3784445
5,足球,太可惜了！与进球失之交臂，大马丁视角看梅西任意球击中立柱,https://www.dongqiudi.com/article/3784444
6,足球,沙特联赛目前市值前十的球员，曾经最高身价到过多少...,https://n.dongqiudi.com/webapp/tops.html?id=3784437
7,,猜猜谁更厉害？根据效力球队猜球员，巴尔韦德和门迪直接PK,https://www.dongqiudi.com/article/3784436
8,足球,都差一点！如果这些球都进的话，梅西被横梁和立柱拒绝的进球,https://www.dongqiudi.com/article/3784435
9,,瑞典球星伊布拉希莫维奇今天做客特伦托体育节，并且...,https://n.dongqiudi.com/webapp/tops.html?id=3784434
10,体坛,我的提词器在哪里？郑钦文夺冠后现场毫无准备演唱《经济舱》,https://www.dongqiudi.com/article/3784433
11,足球,活动丨申花家庭亲子开放日”活动今日举行！,https://www.dongqiudi.com/article/3784426
12,足球,CM：米兰将在接下来几周考虑是否一月份外租罗梅罗...,https://n.dongqiudi.com/webapp/tops.html?id=3784420
13,足球,曼联官方回顾小麦曼联精彩进球【一】,https://n.dongqiudi.com/webapp/tops.html?id=3784417
14,足球,B费：因为他世界改变了对我们的看法，很荣幸能和他一起踢球,https://www.dongqiudi.com/article/3784413
15,足球,2023中乙联赛现场观众人数统计（第21轮） ​,https://n.dongqiudi.com/webapp/tops.html?id=3784429
16,足球,2023中甲联赛现场观众人数统计（第26轮） ​,https://n.dongqiudi.com/webapp/tops.html?id=3784428
17,足球,中超第28轮前瞻丨上海申花进行媒体公开训练,https://www.dongqiudi.com/article/3784409
18,足球,前经纪人：阿扎尔在里尔时一度希望加盟阿森纳，但我否决了,https://www.dongqiudi.com/article/3784406
19,足球,向一线队看齐，马竞B队一场联赛伤退两位后防大将,https://www.dongqiudi.com/article/3784405
20,,帕尔马体育总监韦延斯接受采访表示对引援工作很满意,https://www.dongqiudi.com/article/3784404
