index,hot,title,href
1,12501855,全红婵娃娃被“没收”可爱瞬间
2,11771577,开学第一课
3,11082552,C919承运旅客突破50万人次
4,10920207,28岁机车网红三毛子车祸去世
5,10341993,英超曼联vs利物浦
6,10230692,权志龙太阳大声合体
7,9151910,JDG3:2淘汰NIP
8,9122993,T1战胜DK
9,9115561,非洲多国领导人陆续抵京
10,9085145,切尔西1:1水晶宫
11,9075030,刘谦团队腹泻事件涉事饭店停业
12,9050281,大圆哥这一次又封神了
13,9038416,警方辟谣婴儿被遗弃出租屋
14,9020449,袁隆平孙女入读中国农业大学
15,9010287,柳舟记大结局
16,8996648,郑钦文王雅繁冲击美网8强
17,8880380,俄称击落乌军158架无人机
18,8767529,曹芳复刻张智超拜佛
19,8588691,九月你好
20,8424847,北京晚霞
21,8348119,仙逆王林灭杀藤化元
22,8293121,那些去过济州岛的人嘴真严
23,8138101,见过花开就好 何必在意为谁开
24,8101027,内蒙古部分地区开始供暖
25,8005282,媒体评园长收巧克力被开除
26,7747364,这个盛李豪画得也太写实了
27,7741811,接我的退伍男孩回家了
28,7733270,王骁新剧天降八十万债务
29,7726313,用这个文案迎接九月
30,7714724,军训文艺表演吃的全是细糠
31,7710573,明年6月到9月没有假期
32,7685479,外媒评黑神话十大受苦BOSS
33,7683886,暑假的最后时刻
34,7679576,放首歌哄自己干活儿
35,7675576,第一波返校的学生开始emo了
36,7670620,牛会哞马会叫
37,7667062,收集各地干净小馆子
38,7666269,被迫营业的宝宝上线了
39,7666017,国足9月2日出征日本
40,7663972,边水往事结局解析
41,7662410,一生要出片的中国女人
42,7662279,悟空叫一声佛祖翻唱
43,7659731,i人王楚钦主动和粉丝合影
44,7658924,王者人的手势舞
45,7657216,当我和弟弟说我要结婚
46,7652921,黑神话隐藏的蛙仙人
47,7652886,明星提醒你马上开学啦
48,7650266,床：她长大了我也该退休了
49,7646088,爱吃葱和爱喝拿铁的都沉默了
50,7643290,2024广元女儿节
