index,hot,title,href
1,鹭岛生活,[12-01]80后三十几的人还不结婚的人是怎么想的,http://bbs.xmfish.com/read-htm-tid-18114137.html
2,鹭岛生活,[12-01]又被首开领翔上郡震惊到了！,http://bbs.xmfish.com/read-htm-tid-18114176.html
3,鹭岛生活,最近空的出租房又很多了,http://bbs.xmfish.com/read-htm-tid-18114247.html
4,鹭岛生活,强势的父母有多令人窒息,http://bbs.xmfish.com/read-htm-tid-18114104.html
5,鹭岛生活,不懂就问，出交通事故，对方全责，把车修好就行了吗？,http://bbs.xmfish.com/read-htm-tid-18114204.html
6,鹭岛生活,降温了，来碗鸡汤吧！今天，你被“PUA”了吗？（此汤有毒，慎用！！！）,http://bbs.xmfish.com/read-htm-tid-18114177.html
7,鹭岛生活,[12-01]当我知道电动车要停在蓝色线内后，我沉默了，随他们去吧,http://bbs.xmfish.com/read-htm-tid-18114214.html
8,鹭岛生活,孩子快一岁，市妇幼的生产经历让我抑郁至今！,http://bbs.xmfish.com/read-htm-tid-18114391.html
9,鹭岛生活,[12-01]微信好友上限约1万个，你的上限又在哪,http://bbs.xmfish.com/read-htm-tid-18114224.html
10,鹭岛生活,马不停蹄，又出来搬砖了。,http://bbs.xmfish.com/read-htm-tid-18114325.html
