index,hot,title,href
1,12008612,陈建斌回应成为抖音热门歌手
2,11706111,国足2:2新加坡
3,11467639,我国首列氢能源市域列车试跑
4,9668778,别被8小时睡眠论给骗了
5,9623188,牵手拍照教程
6,9337656,你的MBTI人格是REST
7,9162266,菲律宾34人非法登临铁线礁
8,9148789,爱我就是陪我吃饭
9,8951462,杨丽萍月亮宫被查封系谣言
10,8936460,科学家称成功清除已感染的HIV病毒
11,8817413,刘维做手术
12,8717221,武磊头球破门
13,8698385,武磊失点
14,8597420,上夜校能学到什么
15,8505028,现在班主任的要求都这么高了吗
16,8483714,预制菜不允许添加防腐剂
17,8384624,孟子义要退出华语乐坛
18,8328289,两英航空姐涉种族歧视遭解雇
19,8175971,陈漫拍摄游本昌哭了
20,8169157,中方回应美军将领“攻台”言论
21,8156976,智障女子疑遭多次强奸产子
22,8148536,今天就要吃上宁夏辣糊糊
23,8133049,街头2元10个的抄手
24,8111841,好厉害的小孩姐
25,8056472,人民网评开封王婆火出圈
26,8015157,与凤行谈恋爱八百个心眼子
27,7872354,打开春天的100种方式
28,7861188,教育局回应男生长期在女厕偷拍
29,7836446,63岁费翔晒最新照片
30,7787488,当你有个梦想做教育局局长的学生
31,7771088,杜海涛沈梦辰爆改男团
32,7625779,林更新是百乔减肥路上的绊脚石
33,7614565,雷军亲自展示小米SU7
34,7575647,与凤行会是下一个爆剧吗
35,7556211,甘肃省博物馆文创好超前
36,7548194,越南卡点舞开始玩变速了
37,7546450,螺蛳粉被曝使用增臭剂
38,7489554,其实我也很可爱
39,7483356,汉服和武汉樱花的适配度
40,7358768,娃哈哈客服回应网店销量暴降
41,7329731,3名小孩玩耍时掉化粪池离世
42,7329714,当厌蠢人有个蠢朋友
43,7322164,武氏映春出任越南国家代主席
44,7268069,碳酸星星送给你
45,7233430,王婆称说媒现场看见蹭流量就烦
46,7190199,陈晓童瑶同框好养眼
47,7170926,春天怎么能少得了野餐呢
48,7049118,他只是经过翻唱
49,7011458,与凤行这个细节好先进
50,6927210,王者荣耀新英雄祝缘
