index,hot,title,href
1,37亮,铸造传奇！陈梦生涯荣誉一览：奥运会三金、世乒赛五金、世界杯三金,https://bbs.hupu.com/627475659.html
2,50亮,赛场没有同情！想赢要靠自己去争！努力30年只为实现自己的名字,https://bbs.hupu.com/627476102.html
3,39亮,加索尔都看不下去了:还要怎样！中国游泳运动员已经接受了三倍于其他人的兴奋剂检测，只为了让其他人“放心”，尤其是美国,https://bbs.hupu.com/627471823.html
4,50亮,格林申京就是不兼容,https://bbs.hupu.com/627471709.html
5,43亮,起死回生！中国女篮占据晋级主动，如何评价今天女篮姑娘们的表现？,https://bbs.hupu.com/627472534.html
6,49亮,石宇奇爆冷出局，连续两次奥运会止步八强,https://bbs.hupu.com/627467729.html
7,22亮,格林和申京好兼容,https://bbs.hupu.com/627474064.html
8,18亮,乒乓球解说真的偏过分，陈梦得分就一声不吭，孙颖莎得分就兴奋起来了,https://bbs.hupu.com/627474466.html
9,23亮,为什么感觉陈梦夺冠大家都不开心？,https://bbs.hupu.com/627475245.html
10,9亮,孙颖莎球迷赛后破防,https://bbs.hupu.com/627475607.html
11,17亮,杰伦格林需要提升的是阅读比赛的能力,https://bbs.hupu.com/627473397.html
12,13亮,都是中国球员至于吗？,https://bbs.hupu.com/627475023.html
13,13亮,不懂就问，女乒决赛没有陈梦的球迷吗？,https://bbs.hupu.com/627474911.html
14,49亮,为什么申京受伤后，小史密斯的篮板暴跌?,https://bbs.hupu.com/627468950.html
15,50亮,看回访小贾在神经受伤后,https://bbs.hupu.com/627470281.html
16,5亮,还能再进总决赛吗？回顾从2G打到5G的男人-勒布朗詹姆斯十次总决赛高光瞬间,https://bbs.hupu.com/627473457.html
17,7亮,关于陈梦：对乒乓球来说，奥运会冠军才是硬通货，世乒赛世界杯没什么关注度,https://bbs.hupu.com/627476120.html
18,10亮,陈梦长的比孙颖莎漂亮球技也好为啥名气不行？,https://bbs.hupu.com/627474931.html
19,11亮,为啥现场清一色的孙颖莎的呐喊声，却鲜有陈梦的,https://bbs.hupu.com/627473976.html
20,9亮,不太懂乒乓球，如果马龙是乔丹的话，张继科历史地位相当于nba的谁?,https://bbs.hupu.com/627474610.html
21,10亮,为啥不给杜兰特首发？,https://bbs.hupu.com/627476330.html
22,3亮,莎莎粉丝太吵了现场，激起我的反叛欲，我支持陈梦，本是国人内战，还以为莎莎打的是小日本,https://bbs.hupu.com/627475805.html
23,4亮,美国打波多黎各,https://bbs.hupu.com/627475772.html
24,6亮,丁彦雨航曾经想打出的样子,https://bbs.hupu.com/627474701.html
25,5亮,郑钦文如果拿下金牌，历史地位与李娜比谁高,https://bbs.hupu.com/627475962.html
26,9亮,奥运会,https://bbs.hupu.com/627474136.html
27,3亮,詹姆斯的篮球生涯真的只能用完美来形容,https://bbs.hupu.com/627475603.html
28,6亮,陈梦nb,https://bbs.hupu.com/627475344.html
29,3亮,今天哪里能看球啊？,https://bbs.hupu.com/627476049.html
30,3亮,本人gay，闲来无事，各位有什么想问的吗哈哈,https://bbs.hupu.com/627475813.html
31,18亮,男篮八强对阵情况分析：美国-希腊、塞尔维亚-法国大概率八强相遇,https://bbs.hupu.com/627473022.html
32,7亮,真没想到库里fiba竟然这么厉害，果然是球队支柱,https://bbs.hupu.com/627474099.html
33,6亮,科比的篮球生涯算得上完美吗？,https://bbs.hupu.com/627474981.html
34,6亮,乒乓球界饭圈也很严重啊,https://bbs.hupu.com/627474729.html
35,7亮,哈登能否重回持球大核巅峰,https://bbs.hupu.com/627474027.html
36,4亮,【楼工团】湖人对克里斯蒂寄予厚望，他已准备好迎接挑战，完成飞跃！,https://bbs.hupu.com/627474634.html
37,10亮,跨区问一下 假如穆迪来马刺会在你刺得到好的未来吗,https://bbs.hupu.com/627474589.html
38,5亮,现场给陈梦加油声大一点，她都可能拿不了金牌,https://bbs.hupu.com/627475310.html
39,5亮,如果安吉要的是kj+索汗，咱们给吗,https://bbs.hupu.com/627474469.html
40,4亮,鹿兄们帮忙选择一下，那个更符合你的审美？,https://bbs.hupu.com/627474662.html
41,5亮,各位詹蜜怎么看把曼巴蛇纹在身上的人，要不要批斗,https://bbs.hupu.com/627474459.html
42,4亮,为什么库里能至少连续九年拿到联盟第一薪资？这算是对超级巨星一人一城的奖励吗？,https://bbs.hupu.com/627474880.html
43,7亮,勇士正在考虑和伊森·汤普森签订一份Exhibit 10合同，方便下赛季把他安排到圣克鲁兹勇士。汤普森在考虑NBA球队以及海外选择。今夏，汤普森代表勇士出战了夏季联赛。 ​​​,https://bbs.hupu.com/627473786.html
44,5亮,问个问题，为啥孙颖莎球迷比陈梦多很多呢大家更喜欢谁,https://bbs.hupu.com/627473956.html
45,15亮,已知申京上赛季获得进步最快提名，那么下赛季火箭哪位球员进步会最快呢,https://bbs.hupu.com/627471452.html
46,3亮,不懂就问，吃了兴奋剂成绩会提高很明显吗？如果篮球运动员吃了兴奋剂会怎么样？纯好奇,https://bbs.hupu.com/627474897.html
47,6亮,围绕字母哥和东契奇建队，你们选谁,https://bbs.hupu.com/627473617.html
48,5亮,【楼工团】库明加对阵猛龙24分2助攻集锦，相信他能够开发出突破传球能力！,https://bbs.hupu.com/627473542.html
49,4亮,明年我火会不会在东部前列？,https://bbs.hupu.com/627474425.html
50,4亮,我不懂，为啥有球迷就是觉得报团好看呢，，，,https://bbs.hupu.com/627473604.html
51,3亮,布斯封人之战，就看穆雷续约了,https://bbs.hupu.com/627473949.html
52,4亮,一天被骗了4回,https://bbs.hupu.com/627473904.html
53,3亮,加拿大主帅：狄龙是斗士 如果可以 希望他一辈子都在我的球队里,https://bbs.hupu.com/627475031.html
54,3亮,是不是我们错怪康纳利了？,https://bbs.hupu.com/627473713.html
55,47亮,2017-2018赛季第一场，海沃德开场5分多钟即受伤赛季报销，众球迷球员目睹惊魂一刻面露哀伤！,https://bbs.hupu.com/627467505.html
56,3亮,卡森下赛季会有多大的进步,https://bbs.hupu.com/627473549.html
57,35亮,以现在的状况来看，湖管这波操作（4800万续约范德彪）是不是亏麻了？,https://bbs.hupu.com/627472038.html
58,7亮,太阳签下泰泰了,https://bbs.hupu.com/627471963.html
59,12亮,dy为数不多夸字母的播主,https://bbs.hupu.com/627473348.html
60,4亮,弱弱的问个问题,https://bbs.hupu.com/627472626.html
