index,hot,title,href
1,94.3万,史上最强iPad发布，能取代你家电脑吗？,https://www.huxiu.com/article/2999566.html
2,81.2万,TikTok不装了,https://www.huxiu.com/article/3002520.html
3,57.5万,很多年后，百度副总裁还会记得这个五一节,https://www.huxiu.com/article/3000121.html
4,31.4万,金三银四过去了，我还在等一个offer,https://www.huxiu.com/article/2998229.html
5,28.7万,坚持买房的独立女性，现在后悔了吗？,https://www.huxiu.com/article/2996851.html
6,28.2万,一个香港投行人的失落：轻松百万年薪的时代过去了,https://www.huxiu.com/article/3001760.html
7,87.8万,这个五一，游客变抠了,https://www.huxiu.com/article/2994337.html
8,21.5万,外企打工人：听说35岁后外企又香了？,https://www.huxiu.com/article/3000644.html
9,20.6万,特斯拉大裁员后的豪赌，FSD v12是如何诞生的,https://www.huxiu.com/article/2998768.html
10,59.0万,“普通人的房子，都不太会涨”,https://www.huxiu.com/article/2995153.html
11,15.2万,失业中产卖保险：“职场难民”的妥协与挣扎,https://www.huxiu.com/article/2997840.html
12,52.2万,经济舱的座椅靠背，挂满了国内旅客的“面子”,https://www.huxiu.com/article/2996129.html
13,14.9万,四条高铁涨价背后，一本难念的基建经,https://www.huxiu.com/article/3000671.html
14,107.0万,第一批搬去新加坡的中产：没200万年薪，撑不下去,https://www.huxiu.com/article/2926966.html
15,14.2万,TikTok和字节跳动正式起诉美国政府,https://www.huxiu.com/article/3000122.html
