index,hot,title,href
1,69,骗了8年，传中建大公馆商改住！,https://www.guozaoke.com/t/112928
2,63,讨论下小学生的一年开销情况,https://www.guozaoke.com/t/113010
3,60,女方出轨离婚可以要回彩礼吗？,https://www.guozaoke.com/t/113038
4,59,我觉得我有点累，到底是我个人这样，还是同龄人都这样,https://www.guozaoke.com/t/112918
5,57,各位平时都在什么网站上看电影？,https://www.guozaoke.com/t/112809
6,54,软件园路口这么严重的事故？,https://www.guozaoke.com/t/112980
7,51,这个世界越来越癫了,https://www.guozaoke.com/t/112959
8,49,袁姓车评人回应享界官方公告,https://www.guozaoke.com/t/113023
9,47,大家对房屋体检、房屋养老金、房屋保险三项制度怎么看,https://www.guozaoke.com/t/112843
10,46,油车真的是该被淘汰了,https://www.guozaoke.com/t/112929
