index,hot,title,href
1,足球,哈萨克斯坦0-0挪威，菲利克斯-米勒错失良机,https://www.dongqiudi.com/article/4523533
2,足球,下一个神锋？谭龙社媒晒娃：我准备培养你了,https://www.dongqiudi.com/article/4523511
3,篮球,Woj：33岁中锋特里斯坦-汤普森一年合同留在骑士,https://www.dongqiudi.com/article/4523527
4,足球,埃弗顿官方：红牛成为俱乐部最新官方能量饮料合作伙伴,https://www.dongqiudi.com/article/4523496
5,体坛,萨巴伦卡确定入围WTA年终总结赛，将连续四年参加,https://www.dongqiudi.com/article/4523503
6,足球,毫无悬念，曼城官方：哈兰德当选队内8月最佳球员,https://www.dongqiudi.com/article/4523486
7,体坛,樊振东：这几年曾经历低谷，外界声音造成了一定程度的干扰,https://www.dongqiudi.com/article/4523490
8,足球,马卡谈五大联赛开赛以来表现最好前锋，哈兰德、格林伍德领衔,https://www.dongqiudi.com/article/4523406
9,足球,马竞发售欧冠第一阶段主场联票：会员专享，共一千张，最低86欧,https://www.dongqiudi.com/article/4523462
10,篮球,神仙球，中国轮椅女篮林穗玲命中一记压哨三分线“天勾”,https://www.dongqiudi.com/article/4523477
11,足球,地上足球：惨败日本，国足再次不破不立？,https://n.dongqiudi.com/webapp/tops.html?id=4523492
12,足球,刘玉建：很遗憾没在保级对手身上获胜，我们保级压力依旧很大,https://www.dongqiudi.com/article/4523450
13,足球,迪奥戈：我们球员之间默契度越来越好，很期待赛季最后几场比赛,https://www.dongqiudi.com/article/4523453
14,足球,记者：格拉利什将会在英格兰对阵爱尔兰的比赛中首发出场,https://www.dongqiudi.com/article/4523447
15,足球,津媒：孔帕尼奥受伤与水滴外场场地状况不好有关，伤情不是十分严重,https://www.dongqiudi.com/article/4523445
16,足球,巴萨官方：22岁前锋伊万-塞德里克租借加盟球队,https://www.dongqiudi.com/article/4523442
17,足球,莱万多夫斯基社媒：奋斗到底，拿下三分！,https://www.dongqiudi.com/article/4523439
18,足球,罗马诺：斯图加特此前一直对中卫托马斯-帕拉西奥斯感兴趣,https://www.dongqiudi.com/article/4523424
