index,hot,title,href
1,12157598,洛阳暴雨
2,12007143,吴艳妮12秒74夺冠
3,11903276,拉日高等级公路全线通车
4,11728620,在六月的最后一天许个愿吧
5,11094245,吴艳妮全妆跑完比赛后睫毛掉了
6,11047711,打卡深中隧道水下世界
7,9438255,这是谁梦想中的生活
8,9351535,U18中国女篮亚军 张子宇42分
9,9338225,天兵科技通报火箭坠落爆炸详情
10,9337142,杨迪的布袋去世了
11,9325972,河南巩义火箭坠落起火
12,9285278,开场轰两球 国安2:0击败泰山
13,9193168,贵阳花果园下雪系谣言
14,9185377,面筋哥女友发声
15,9135276,大哥远快乐向前冲闯关成功
16,8990777,度华年花船吻真的来了
17,8916146,花小龙带谢霆锋自律
18,8867792,李一桐回应蜈蚣事件：没事哒
19,8823132,深中通道正式通车试运营
20,8669932,邯郸警方通报村支书被杀
21,8394187,上海暴雨
22,8355737,当我得知王妈系列大结局了
23,8351354,石头剪刀布吃食物挑战
24,8349863,月薪1.2万先深造还是先赚钱
25,8346513,詹姆斯放弃5140万美元合同
26,7967727,Capper复出
27,7874881,原来徐艺洋的偶像是鹿晗
28,7860569,当我把中国车开到伊朗加油站
29,7832320,6月的最后一天
30,7814501,为巴勒斯坦准妈妈拍婚纱照
31,7807423,张子墨崩溃大哭
32,7798569,杨倩毕业了
33,7773525,周传雄每一场演唱会都有大合唱
34,7770930,终于轮到我拍装修转场了
35,7770572,被火壶表演震撼到了
36,7755316,网友拍下巩义火箭坠落瞬间
37,7741838,city梗本人告诉你什么是city
38,7735647,节奏一响纯颜卡点登场
39,7735110,内蒙古发现两种铌钪新矿物
40,7723642,珍珠学会下楼梯了
41,7712269,四象限构图法的美
42,7704321,遇到了连背影都要记录的人
43,7698255,当CF玩家第一次玩CS
44,7692655,辣妈版我的改变只需要两年
45,7692415,等你的回答舞蹈挑战
46,7686232,张凌赫 大鸟依人
47,7674464,东北馄饨有多大
48,7653777,这是什么侵略性跑姿
49,7652158,宝石老舅若月亮没来现场
50,7648290,北京大学“招生简章”来咯
