index,hot,title,href
1,鹭岛生活,这几年集美家长在教育觉醒了？,http://bbs.xmfish.com/read-htm-tid-18179424.html
2,鹭岛生活,家人们谁懂啊，满满当当的演唱会，你会不会去？,http://bbs.xmfish.com/read-htm-tid-18179444.html
3,鹭岛生活,[04-21]阳后嗅觉没了，怎么办！,http://bbs.xmfish.com/read-htm-tid-18179463.html
4,鹭岛生活,问大家一个事？为啥很多90左右30多的女人，相比同龄结婚有娃的看起来年轻很多？,http://bbs.xmfish.com/read-htm-tid-18179564.html
5,鹭岛生活,改造楼顶76平的阳台，有什么好建议吗？种什么花草比较好,http://bbs.xmfish.com/read-htm-tid-18179535.html
6,鹭岛生活,岛内有没有能修任天堂游戏机的,http://bbs.xmfish.com/read-htm-tid-18179439.html
7,鹭岛生活,一边切一边哭，一边熬制猪油，腌制尿葱头，蒜头，姜片,http://bbs.xmfish.com/read-htm-tid-18179539.html
8,鹭岛生活,三个同姓的不听我一个外姓的话，气死我了,http://bbs.xmfish.com/read-htm-tid-18179690.html
9,鹭岛生活,浅聊，“熊熊的猫猫”被永久禁言。,http://bbs.xmfish.com/read-htm-tid-18179465.html
10,鹭岛生活,练啊，教啊,http://bbs.xmfish.com/read-htm-tid-18179577.html
