index,hot,title,href
1,1.1万,特厨探店 |终于！又一家全好评餐厅——山城家常菜,http://www.acfun.cn/v/ac42872106
2,2.6万,这钢琴一看就弹的不错！★手机竖屏963★,http://www.acfun.cn/v/ac42888364
3,5451,以色列吞并加沙，美元联盟加速瓦解【岩论402期】,http://www.acfun.cn/v/ac42897776
4,5402,交通事故20231109：最新的车祸实例，助你提高安全意识,http://www.acfun.cn/v/ac42897750
5,8054,这样下去，唐僧马上要赚够劳斯莱斯去取经了！欢乐八点档-733,http://www.acfun.cn/v/ac42896625
6,4609,节目相当高雅！,http://www.acfun.cn/v/ac42761314
7,5246,厨师长一镜分享“虎皮青椒”的门门道道，收藏并学习起来,http://www.acfun.cn/v/ac42892438
8,3814,千古佳话？政治谎言？尧舜禅让，是心甘情愿的吗？【故事】02,http://www.acfun.cn/v/ac42895196
9,4461,怎么有人会说猪猪语…,http://www.acfun.cn/v/ac42896678
10,3961,当你坚持不下去时，不妨看看他的一生,http://www.acfun.cn/v/ac42896697
11,4172,有没有一种可能，他们其实是在炼丹.....,http://www.acfun.cn/v/ac42896677
12,1.3万,★求投五蕉★网络上常见的热门短视频集锦 第一千五百一十六期,http://www.acfun.cn/v/ac42894076
13,3376,【ACFUN声唱2023】云参赛2023 最终期,http://www.acfun.cn/v/ac42889613
14,1909,小黑猫出没！猫步轻悄 Like A Cat - AOA,http://www.acfun.cn/v/ac42889405
15,3556,小时候只在电视上看过片段，原来它是个13分钟的连续剧,http://www.acfun.cn/v/ac42896671
16,1940,不可以动兔兔尾巴啦｡•ˇ‸ˇ•｡Bunny Style,http://www.acfun.cn/v/ac42897859
17,4331,每个动漫的背后都是真实案例,http://www.acfun.cn/v/ac42896700
18,2536,【独家】《唐山葬》一部故事很原著，却又集齐性转，恶搞的西游漫画,http://www.acfun.cn/v/ac42898975
19,1770,すきっちゅーの！就是喜欢你！啾！,http://www.acfun.cn/v/ac42896460
20,5506,这么仙儿的吗【今天有什么好笑的 #1173】,http://www.acfun.cn/v/ac42895738
21,5317,痛经是病？找个男朋友就好了......(今日好笑开心视频：1282),http://www.acfun.cn/v/ac42897292
22,1922,【Dina小崽】我就是爱音乐，别让我停下来~,http://www.acfun.cn/v/ac42888152
23,1553,太医养女猫猫被人贩卖成侍女，凭借医术一跃成为两位妃子红人！,http://www.acfun.cn/v/ac42899227
24,2744,老虎怎么上厕所（高科技）,http://www.acfun.cn/v/ac42895197
25,1710,咿呀咿呀~owo,http://www.acfun.cn/v/ac42892664
26,2038,今日份搞笑沙雕弹弹乐视频 #1025【求弹幕回复】,http://www.acfun.cn/v/ac42892924
27,1926,【街霸6】我们AcFun有自己的高分少女,http://www.acfun.cn/v/ac42889860
28,3240,2005年春晚小品《装修》,http://www.acfun.cn/v/ac42896696
29,3967,这列货车深夜行驶时赶上了滚轴云与闪电，感觉在现场应该有人会深空巨物深海恐惧齐发了,http://www.acfun.cn/v/ac42896684
30,2725,沉浸式体验小猫咪“啊啊”叫,http://www.acfun.cn/v/ac42896621
