index,hot,title,href
1,126,大家评评理，夫妻关系问题,https://www.guozaoke.com/t/106249
2,96,社友帮忙看看情感困惑,https://www.guozaoke.com/t/106192
3,77,河南2023年GDP为59132.39亿元，被四川超过跌至全国第六,https://www.guozaoke.com/t/106196
4,72,为什么有些省整天到处嚷嚷高考对他们不公平？,https://www.guozaoke.com/t/106150
5,66,孩子各门课必看的纪录片，寒假增长知识，培养兴趣,https://www.guozaoke.com/t/106132
6,66,社友帮忙看下情感困惑-第二弹,https://www.guozaoke.com/t/106232
7,55,华师大光谷学校是37小+6初+新高中 3个学校挂一个牌子？,https://www.guozaoke.com/t/106202
8,51,武鄂黄黄城际铁路“新城快线”今起公交化运营,https://www.guozaoke.com/t/106194
9,48,哎，湖北有些人真该加油了， 与收入最相关的个税，成都一市都赶上湖北一省了,https://www.guozaoke.com/t/106269
10,48,推荐几个开着爽的suv,https://www.guozaoke.com/t/106078
