index,hot,title,href
1,111,你们见过这样的收房通知吗？中建大公馆四期商业不修且严重减配后通知提前交付。,https://www.guozaoke.com/t/103568
2,97,小米用户画像,https://www.guozaoke.com/t/103469
3,82,小米成买办了？手机圈真是恶臭难闻？,https://www.guozaoke.com/t/103496
4,66,请问家里飞来俩鸽子咋处理？,https://www.guozaoke.com/t/103619
5,66,撸大师进来,https://www.guozaoke.com/t/103640
6,61,交通事故排名第一，湖北机动车真的不让人么？,https://www.guozaoke.com/t/103594
7,58,为什么光谷和光谷东的商业起不来？,https://www.guozaoke.com/t/103574
8,56,武汉东站旁，天辰美景天成美雅，18年去看过，89平不满二毛坯中间楼层210万，现在回过头看，沧海桑田呐！,https://www.guozaoke.com/t/103556
9,54,这交付在光谷什么水平？,https://www.guozaoke.com/t/103546
10,53,相亲女因为体罚学生被停职了，她亲戚给我姐说 她心情不好不理我，该咋处理？,https://www.guozaoke.com/t/103569
