index,hot,title,href
1,足球,官方：拜仁慕尼黑签下日本国脚伊藤洋辉，合同至2028年,https://www.dongqiudi.com/article/4323999
2,足球,欧冠亚军教头下课！官方：泰尔齐奇不再执教多特蒙德,https://www.dongqiudi.com/article/4323515
3,篮球,中国篮协官方：乔尔杰维奇离任，郭士强代行男篮主教练职责,https://www.dongqiudi.com/article/4323569
4,足球,吹牛必备！欧洲杯24强，这些冷知识和八卦你知道吗？,https://www.dongqiudi.com/article/4320364
5,足球,欧洲杯大名单数据身价篇：三狮军团阵容豪华，皇马双星霸榜,https://www.dongqiudi.com/article/4323925
6,足球,2024年欧洲杯开赛在即，80后老将迎来谢幕演出,https://n.dongqiudi.com/webapp/tops.html?id=4323606
7,足球,加利亚尼：内斯塔缺乏经验？萨基去米兰前也没执教过意甲,https://www.dongqiudi.com/article/4324089
8,篮球,赫尔利：有人说我拒绝湖人是为提升在康大的待遇，我不需要,https://www.dongqiudi.com/article/4324077
9,足球,记者：切尔西不觉得没欧冠是竞争奥利塞的劣势，曼联也会行动,https://www.dongqiudi.com/article/4324086
10,足球,记者：科尔威尔将和马雷斯卡谈判，他希望获得首发位置的保证,https://www.dongqiudi.com/article/4324091
11,足球,镜报：诺丁汉森林计划在今夏送走桑加雷，预计将亏本卖出,https://www.dongqiudi.com/article/4324080
12,足球,门迪：现在不是谈论我未来的时候；姆巴佩维尼修斯都很出色,https://www.dongqiudi.com/article/4324061
13,足球,伊藤洋辉：告别并不容易，我将永远怀念在斯图加特的时光,https://www.dongqiudi.com/article/4324064
14,体坛,未能获得外卡资格，体操老将丘索维金娜正式无缘巴黎奥运会,https://www.dongqiudi.com/article/4324050
15,足球,看错线了？中冠重庆春蕾门将禁区外离谱手球，被红牌罚下,https://www.dongqiudi.com/article/4324037
16,足球,埃贝尔：伊藤洋辉拥有我们想要的一切品质，他会不断进步,https://www.dongqiudi.com/article/4324051
17,足球,36强赛黄牌将累积至18强赛，国足多名球员身背一张黄牌,https://www.dongqiudi.com/article/4324049
18,足球,基耶利尼：意大利很幸运能有斯帕莱蒂；期待斯卡马卡的表现,https://www.dongqiudi.com/article/4324020
19,足球,隆戈：亚特兰大2200万欧加奖金买断CDK，10%转会分成被移除,https://www.dongqiudi.com/article/4324043
20,足球,伊藤洋辉成斯图加特卖出第二贵的球员，仅次于帕瓦尔,https://www.dongqiudi.com/article/4324026
