index,hot,title,href
1,10865800,断眉真的要来歌手了
2,10840893,歌手2024第四期竞演
3,10491894,愿我们都能童愿成真
4,10415460,孙楠嗓子好稳
5,9587232,五月最后一天
6,9445522,当外国人看到变脸表演
7,8301882,歌手第四期竞演排名
8,8293081,戚薇再唱如果爱忘了回忆杀
9,8222285,被秦海璐保剑锋飒舞硬控了
10,8216998,那英这是又紧张了吗
11,8160497,特朗普被判有罪会影响美大选吗
12,8087427,尚雯婕说跟何洁不熟
13,8042331,今天为童年垃圾零食正名
14,8009795,重庆辟谣洪水漫过朝天门
15,7893564,江西楼房爆炸已致2死3伤
16,7707279,巴勒斯坦代表说花百年安葬遇难者
17,7671854,中国女排1:3不敌日本女排
18,7664876,汪苏泷雨天的含金量
19,7657699,证监会：许家印手段特别恶劣
20,7656019,多所高校严防大学生高考替考
21,7648173,杨幂松弛感
22,7636735,六一动漫氛围感
23,7629517,在线围观全国六一汇演
24,7612192,诺米爆红的60天
25,7610412,独行侠晋级总决赛
26,7606752,广西房屋倒塌事故致2死
27,7600251,特朗普被控34项重罪成立
28,7595342,申请加入柯南侦探团
29,7586381,熊出没祝你六一快乐
30,7581294,蜥蜴烫脚模仿大赛
31,7580862,儿童节被爱包围的瞬间
32,7580031,李瑞101比87终结Moon
33,7579416,定格在温情瞬间
34,7576541,长成自己讨厌的大人也没关系
35,7575358,浪姐直播
36,7573750,庆余年绘画大赛
37,7570968,媒体评王阳入围白玉兰
38,7565704,别忘了你对世界的初始好奇
39,7564331,还以为把九珠本人请过来了
40,7562984,半个娱乐圈都在上海了
41,7560991,没人能抵挡住最炫民族风
42,7560908,谁还不是个过期儿童了
43,7560241,六一的快乐因子已提前超标
44,7558899,也许接近理想没那么难
45,7556897,聪明宝宝花式过六一
46,7556284,这个六一爸爸好忙
47,7554211,北京晚霞
48,7550527,王者达人大型翻牌现场
49,7548924,毕业总是会有遗憾的
50,7547955,爱在日落黄昏时
