index,hot,title,href
1,足球,孙准浩：我是被迫承认指控的，希望大家相信并支持我,https://www.dongqiudi.com/article/4533932
2,体坛,重回母校，张雨霏：胜利不会像山峰上的蒲公英想摘就能摘到,https://www.dongqiudi.com/article/4534964
3,足球,TA：卢宁将和皇马续约至2028年，但这不意味着他不会离队,https://www.dongqiudi.com/article/4534959
4,体坛,演员于适任中国骑射运动中心副主任，曾为拍《封神》练习骑射,https://www.dongqiudi.com/article/4534947
5,足球,FC25沙特联能力值TOP25：内马尔第1，C罗、本泽马、坎塞洛第2,https://www.dongqiudi.com/article/4534911
6,体坛,赵心童迎解禁复出首秀？Q Tour业余巡回赛保加利亚站签表出炉,https://www.dongqiudi.com/article/4534924
7,足球,博主：某老牌球队配合庄家打出5-0，他们认为赢球就不算假球,https://www.dongqiudi.com/article/4534919
8,足球,外媒：梅西今日缺席训练，能否出战迈阿密国际周末联赛成疑,https://www.dongqiudi.com/article/4534929
9,体坛,被称为“消防奥运会”，世界消防救援锦标赛在哈尔滨落幕,https://www.dongqiudi.com/article/4534908
10,足球,马卡：卢宁和皇马就续约四个赛季达成协议,https://www.dongqiudi.com/article/4534909
11,体坛,周冠宇：即使没有与索伯车队续约，职业生涯也不会走到尽头,https://www.dongqiudi.com/article/4534882
12,足球,韩鹏飞：差点就代表国足出场了，确实遗憾，在联赛会更加努力,https://www.dongqiudi.com/article/4534901
13,足球,为汪嵩声援，尹鸿博在汪嵩的评论区留言：支持你嵩哥,https://www.dongqiudi.com/article/4534861
14,体坛,乒羽联动，乒乓球运动员徐晨皓晒视频，王昶达成合影马龙心愿,https://www.dongqiudi.com/article/4534859
15,足球,国足赛后球迷滞留地铁站迟迟无法散场，有球迷走了8公里回酒店,https://www.dongqiudi.com/article/4534869
16,足球,被禁足球员芦宁和埃沃洛均提到李帅，但后者并不在禁足名单中,https://www.dongqiudi.com/article/4534850
17,足球,科斯塔库塔谈欧冠：AC米兰的球员适用于欧洲赛场，要相信他们,https://www.dongqiudi.com/article/4534873
18,足球,费兰在国家队场均进球数0.44球，在巴萨只有0.22球,https://www.dongqiudi.com/article/4534855
19,足球,迪马济奥：国米22岁前锋萨尔切多将加盟希腊俱乐部OFI克里特,https://www.dongqiudi.com/article/4534823
20,足球,约纳坦-塔社媒：艰难的比赛，我们从阿姆斯特丹拿下了一分！,https://www.dongqiudi.com/article/4534841
