index,hot,title,href
1,138,农村无退休金的老人结局就是自杀吗？,https://www.guozaoke.com/t/114496
2,81,外包一日游,https://www.guozaoke.com/t/114405
3,80,小区停车费太贵，怎么办？,https://www.guozaoke.com/t/114458
4,53,这个工资在武汉属于什么水平,https://www.guozaoke.com/t/114373
5,52,现在一说要从一线回武汉，回复全是劝别回的，几年前都是劝回，为啥差别这么大？,https://www.guozaoke.com/t/114389
6,49,我有点迷茫了！关于楼上噪音,https://www.guozaoke.com/t/114437
7,46,种种迹象表明，三战大概率正在来临,https://www.guozaoke.com/t/114470
8,46,新手上路，需要请陪练吗？,https://www.guozaoke.com/t/114306
9,46,gap三个月了，投了很多简历,https://www.guozaoke.com/t/114315
10,42,社友们的小电驴还好吗？,https://www.guozaoke.com/t/114360
