index,hot,title,href
1,522评,刘强东内网回复员工：京东基础仍在、相信会走出谷底，希望兄弟们绝不躺平,https://m.ithome.com/html/738296.htm
2,120评,某知名品牌未上市样机被泄露，松山湖公安破获一起侵犯商业秘密案件,https://m.ithome.com/html/738295.htm
3,381评,卢伟冰评价近期新机：产品厚重极具“压手感”、设计很有“复古感”、模具“缝隙感”很强,https://m.ithome.com/html/738268.htm
4,92评,《完蛋！我被美女包围了！》是如何被“设计”出来的,https://m.ithome.com/html/738258.htm
5,252评,小米卢伟冰：Redmi 以前秉承参数领先，近期调整为“参数领先 + 体验优先”并重,https://m.ithome.com/html/738312.htm
6,97评,苹果回应封杀 Beeper Mini：保护用户的 iMessage 隐私和安全,https://m.ithome.com/html/738236.htm
7,66评,“佛罗里达小丑”再度喊话 R 星：《GTA6》用了我的外形，得赔我 200 万美元,https://m.ithome.com/html/738257.htm
8,68评,恐龙可能是导致我们活不到 200 岁的原因,https://m.ithome.com/html/738300.htm
9,101评,达人改装苹果 M3 Max MacBook Pro，将闪存容量提升至 8TB,https://m.ithome.com/html/738266.htm
10,106评,华为首家海外工厂将在法国落成，预计 2025 年底投产,https://m.ithome.com/html/738323.htm
11,149评,努比亚 Z60 Ultra 手机全球首发主摄级广角镜头，号称打破“广角无用论”,https://m.ithome.com/html/738267.htm
12,70评,宋紫薇开启理想汽车生涯首秀：OTA5.0 将在智能驾驶、智能空间和智能增程方面迎来升级,https://m.ithome.com/html/738313.htm
