index,hot,title,href
1,28.0万,光棍越来越多的今年，抓卖淫嫖娼算不算开倒车,https://www.huxiu.com/article/2547814.html
2,25.4万,欧美中产钱包，被中国骑行老板盯上,https://www.huxiu.com/article/2549582.html
3,25.3万,年轻人的结节，都是被工作“气”出来的,https://www.huxiu.com/article/2543679.html
4,87.5万,英国人集体心梗：邮局系统被一家日本公司耍了二十多年,https://www.huxiu.com/article/2544940.html
5,22.7万,安踏在下一盘很大的棋,https://www.huxiu.com/article/2546895.html
6,69.1万,央视曝光医院全链条腐败意味着什么？,https://www.huxiu.com/article/2546884.html
7,68.9万,一个山西矿工，拍出了平遥最佳电影,https://www.huxiu.com/article/2542286.html
8,19.8万,被甩卖的五星级酒店,https://www.huxiu.com/article/2548598.html
9,62.3万,这些城市，正在疯狂建地铁,https://www.huxiu.com/article/2544989.html
10,15.5万,中成药仿制大潮开启,https://www.huxiu.com/article/2548256.html
11,52.9万,超10万人爆仓，比特币跳水，发生了什么？,https://www.huxiu.com/article/2545374.html
12,52.6万,大学教师，降薪了？,https://www.huxiu.com/article/2546288.html
13,106.6万,微信终于挤进风口,https://www.huxiu.com/article/2526478.html
14,13.5万,英伟达也在下一盘AIPC的大棋,https://www.huxiu.com/article/2550141.html
15,13.1万,呼吸道疾病高发之下，又一个百亿赛道将爆发？,https://www.huxiu.com/article/2547171.html
