index,hot,title,href
1,146,养老金交够15年就可以领，又没人规定必须干到65岁，延迟退休不干不就完事了？,https://www.guozaoke.com/t/111760
2,128,武汉汽车城彻底垮塌，谁之过？,https://www.guozaoke.com/t/111797
3,96,社友们每年在娘家上花费多少钱？大家看看合理么,https://www.guozaoke.com/t/111783
4,79,其实很多人根本没搞清楚体制内的优势到底是啥,https://www.guozaoke.com/t/111726
5,72,白沙洲房子值得买吗,https://www.guozaoke.com/t/111677
6,68,巴黎奥运会会是史上最差一界吗？,https://www.guozaoke.com/t/111827
7,66,高架上看千山凌云 真的显眼包啊,https://www.guozaoke.com/t/111695
8,66,老公要和我离婚 该如何挽回,https://www.guozaoke.com/t/111817
9,63,你们第一台车，选的什么牌子？ 现在出现了哪些小问题？,https://www.guozaoke.com/t/111740
10,61,请教一下各位老哥们，土木转行去学嵌入式软件开发工程师，是否可行？,https://www.guozaoke.com/t/111704
