index,hot,title,href
1,白板产品,我们是真正的产品经理吗？,https://www.woshipm.com/?p=5927482
2,晏涛三寿,6000万会员，贡献收入96%，4000字详解孩子王会员模式,https://www.woshipm.com/?p=5927448
3,廖尔摩斯丨设计大侦探,1.4 万字拆解丨3.15 亿 Z 时代用户为何热爱哔哩哔哩,https://www.woshipm.com/?p=5927659
4,王新喜,小杨哥急了，关闭电商，会带来什么后果？,https://www.woshipm.com/?p=5927175
5,Olivia,如何利用分析工具搭建数据指标体系,https://www.woshipm.com/?p=5927391
6,观察月亮的小白羊,产品经理必备技能之「UML用例图」,https://www.woshipm.com/?p=5928825
7,文轩没有大脑袋,你按下的这个按钮，背后有哪些设计和学问？,https://www.woshipm.com/?p=5927967
8,传播体操,喊话李佳琦，是京东双十一的一场碰瓷营销,https://www.woshipm.com/?p=5927534
9,言成,AI生成的产品图：这是电商的下一个黄金时代吗？,https://www.woshipm.com/?p=5928766
10,传播体操,阿里应该战略性放弃双十一,https://www.woshipm.com/?p=5927507
11,CUPTEA,单选按钮和多选框的使用逻辑,https://www.woshipm.com/?p=5927377
12,未来消费,京东和商家打架，为什么李佳琦会被“创飞”？,https://www.woshipm.com/?p=5927781
13,烧肉女士,DAU狂跌近15%！如何快速挽救？,https://www.woshipm.com/?p=5926981
14,一条仙咸鱼,在内容社区中，用户运营的核心手段有哪些,https://www.woshipm.com/?p=5927527
15,老陈的深度思考,想做好私域运营和转化？来看看这三个要素,https://www.woshipm.com/?p=5927187
16,V2XR,Vision Pro 的多任务交互设计,https://www.woshipm.com/?p=5927979
17,临公子,上。班。舔。狗。图。鉴。,https://www.woshipm.com/?p=5927215
18,边亚南,"企业数字化转型：技术和业务的“双向奔赴""",https://www.woshipm.com/?p=5928125
19,刘玮冬,电商土老板超实用的消费者心理学，提升转化率100%！,https://www.woshipm.com/?p=5929037
20,深氪新消费,土味桃色小短剧，一年收入好几亿,https://www.woshipm.com/?p=5928775
21,表外表里,箭在弦上的美团优选,https://www.woshipm.com/?p=5927901
22,接地气的陈老师,数据分析思路，我总结了四个好用的模板,https://www.woshipm.com/?p=5927162
23,AI魔法学园,将人工智能应用到软件开发中？那你需要了解这些,https://www.woshipm.com/?p=5926911
24,雨后伊晴,从首页Banner看途木美战事：民宿市场奔涌向前,https://www.woshipm.com/?p=5927770
25,腾讯大讲堂,“损失厌恶”，学有大用,https://www.woshipm.com/?p=5928182
26,刘旷,强强联合背后，国产大模型迎来“WIntel时刻”？,https://www.woshipm.com/?p=5927214
27,aguai,隐私计算-专注隐私保护，助力数据流通,https://www.woshipm.com/?p=5920811
28,传播体操,缺乏竞争优势：京东电商之路的困境,https://www.woshipm.com/?p=5929157
29,Silence,B端产品，如何做好业务调研？,https://www.woshipm.com/?p=5926302
30,闻旅,闲鱼酒店代订如何做到“空手套白狼”？,https://www.woshipm.com/?p=5927025
31,亿邦动力,平台都在说“双11低价”，问问商家愿意吗？,https://www.woshipm.com/?p=5927769
32,寻空,消费风向突变：为何元气森林、钟薛高、花西子等头部新消费品牌开始失色？,https://www.woshipm.com/?p=5928218
33,寻空,刷短视频为啥停不下来，还越刷越累？,https://www.woshipm.com/?p=5926647
34,字母榜,交多少个朋友，才能带火京东直播？,https://www.woshipm.com/?p=5927803
35,白鲸出海,专业摄影App，一个被出海开发者占据的冷门品类？,https://www.woshipm.com/?p=5928384
36,银杏财经,知乎难做“网文抖快”,https://www.woshipm.com/?p=5928176
37,百度MEUX,案例分析：以设计为驱动，打造持续消费体验,https://www.woshipm.com/?p=5927354
38,银杏财经,盒马变革，左右互搏,https://www.woshipm.com/?p=5927371
39,定焦One,“最低价之争”，揭开双11六大趋势,https://www.woshipm.com/?p=5928860
40,财经十一人,全球最大游戏SaaS公司连亏19年教训：用To C逻辑做To B生意,https://www.woshipm.com/?p=5929080
41,卡思数据,卖惨营销，穷途末路？,https://www.woshipm.com/?p=5927757
42,三分设,产品设计流程执行终极指南,https://www.woshipm.com/?p=5927087
43,老秦,虚拟现实社交平台的崛起与未来展望,https://www.woshipm.com/?p=5922252
44,雷科技,今年双11，抖音快手不想再当配角,https://www.woshipm.com/?p=5927751
45,增长黑盒,深挖小红书带货玩法：如何打造日产500篇内容的“印钞机”？,https://www.woshipm.com/?p=5922586
46,琢磨事,AI能赚到钱了么？,https://www.woshipm.com/?p=5926986
47,产品狗随笔,业财一体化之结算系统,https://www.woshipm.com/?p=5905725
48,老司机产品经,促进付费会员转化的7个抓手,https://www.woshipm.com/?p=5926612
49,三言财经,今年双十一各家都怎么玩？电商向左，主播向右,https://www.woshipm.com/?p=5922527
50,接地气的陈老师,这是我见过最好的用户行为分析攻略,https://www.woshipm.com/?p=5924955
51,牛透社,协同软件或迎分水岭,https://www.woshipm.com/?p=5927406
52,live life,B端产品功能设计思路解析--批量导入,https://www.woshipm.com/?p=5924989
53,TCC翻译情报局,空间设计｜沉浸式体验的8条设计原则和指南,https://www.woshipm.com/?p=5927310
54,壹娱观察,双十一「低价」大战里，「高价」电商会员制怎么升级？,https://www.woshipm.com/?p=5927778
55,市值榜,开源不是活雷锋，但搭便车的机会出现了,https://www.woshipm.com/?p=5928158
56,狗阿木的产品日志,从游戏名词到电商营销，我们一起来聊聊“秒杀”,https://www.woshipm.com/?p=5924050
57,三言财经,“争吵”中开启的双十一：平台与主播对垒，头部主播间正面PK,https://www.woshipm.com/?p=5929031
58,张佳的流量常识,小红书运营利器 | 使用AI批量把公众号文章转成图片,https://www.woshipm.com/?p=5925050
59,白鲸出海,腾讯在海外的“微信梦”，Meta快做成了？,https://www.woshipm.com/?p=5927054
60,刘玮冬,普通人电商创业，最忽视也是最核心的技能是什么？10个案例说明,https://www.woshipm.com/?p=5926741
61,晏涛三寿,淘宝88VIP大升级，“硬刚”京东PLUS会员？,https://www.woshipm.com/?p=5925995
62,一个光叫走路的孩子丶,浅谈SaaS产品需求管理模型,https://www.woshipm.com/?p=5925456
63,Kuang扶正义的匡,系统重构实战：多平台电商订单履约系统设计,https://www.woshipm.com/?p=5921677
64,产品锦李,从10大管理看产品经理的日常工作——产品进度管理,https://www.woshipm.com/?p=5923315
65,海克财经,SHEIN做对了什么？,https://www.woshipm.com/?p=5926657
66,亿邦动力,AI视频爆发！一天10万条，冲进抖音快手小红书,https://www.woshipm.com/?p=5926621
67,新榜,直击双十一开局：各大主播争相竞逐，电商平台低价混战,https://www.woshipm.com/?p=5929162
68,产品狗随笔,业财一体化之支付系统上篇（用户视角）,https://www.woshipm.com/?p=5910473
69,产品狗随笔,业财一体化之会计引擎,https://www.woshipm.com/?p=5923841
70,产品狗随笔,业财一体化之电子发票管理,https://www.woshipm.com/?p=5904748
71,天眼,CRM系统中的线索评级系统该如何设计？,https://www.woshipm.com/?p=5926587
72,Sally,小红书和抖音哪个渠道起盘新品的效率更快？怎么确定产品买点让消费者快速下单？,https://www.woshipm.com/?p=5926839
73,橙子小叮当,面试离职原因 : 为何离开前公司？该诚实回答吗[离职原因范例],https://www.woshipm.com/?p=5924948
74,江鸟,设计师如何提升工作中的话语权,https://www.woshipm.com/?p=5926903
75,微果酱,流水3亿，3天涨粉100万+，短剧让用户重新爱上抖音,https://www.woshipm.com/?p=5929215
76,定焦One,10个问题，看懂大厂ESG,https://www.woshipm.com/?p=5921079
77,产品狗随笔,业财一体化之支付系统（企业视角）,https://www.woshipm.com/?p=5917932
78,产品李十三,为什么说商业思维的本质就是ROI,https://www.woshipm.com/?p=5926147
79,PM产品小6,如果你被任命为某款产品的产品经理，你的首要任务是什么？,https://www.woshipm.com/?p=5917776
80,VR陀螺,苹果Vision Pro催熟XR交互,https://www.woshipm.com/?p=5927110
81,乔志杰,如何做好B端产品经理,https://www.woshipm.com/?p=5909577
82,Mtian梦天,产品经理如何撰写一份优秀的简历,https://www.woshipm.com/?p=5925764
83,七叔创业圈子,用爆款思维做自媒体内容运营，只会让你越做越错,https://www.woshipm.com/?p=5924832
84,寻空,遥遥领先，一个华为热梗的非典型走红,https://www.woshipm.com/?p=5912442
85,互联网指北,成人“猫抓老鼠”：年轻人在“沉默社交”,https://www.woshipm.com/?p=5926056
86,言成,为何职场高手都在用四象限法则打造时间管理的金字塔？,https://www.woshipm.com/?p=5925671
87,蛋壳粥,数据分析（二）：运营模型篇,https://www.woshipm.com/?p=5919191
88,运营林同学,慎入坑！用户运营就是个营销奢侈品,https://www.woshipm.com/?p=5926121
89,明天就退休,一年赚20亿，小杨哥三只羊mcn&直播切片商业模式揭秘,https://www.woshipm.com/?p=5924614
90,Tech星球,1小时700元，年入7000万，谁在靠年轻人的焦虑赚钱,https://www.woshipm.com/?p=5925882
91,随风,传统行业数字化——医疗器械的数字化转型之路,https://www.woshipm.com/?p=5926315
92,萧羽,数据分析平台拆解——MCN数据分析平台（1/4）,https://www.woshipm.com/?p=5925486
93,月月有????吃,详解 | 支付通道与支付系统功能设计之对账,https://www.woshipm.com/?p=5924136
94,海鲜不设计,AR 交互设计 的 beta“信息素”推荐,https://www.woshipm.com/?p=5927153
95,一个摸鱼的职场人,活动配置后台怎么搭建？,https://www.woshipm.com/?p=5925096
96,炒冷饭的諸諸,我用直播间的运营技巧来打理店铺,https://www.woshipm.com/?p=5926256
97,誓博,一文讲透SPU和SKU,https://www.woshipm.com/?p=5850460
98,白高粱,视频号：半封闭状态下的关系链产品,https://www.woshipm.com/?p=4183603
99,厚厚,一文说清楚3种结构图（功能结构图、信息结构图、产品结构图）,https://www.woshipm.com/?p=5159192
100,Ella,超全面！大厂UI设计规范详解！,https://www.woshipm.com/?p=5280210
