index,hot,title,href
1,足球,官方：蒂亚戈-席尔瓦将回归弗鲁米嫩塞，双方签约至2026年,https://www.dongqiudi.com/article/4229594
2,足球,英超进行俱乐部地理位置小测试，20人中穆德里克成绩垫底,https://www.dongqiudi.com/article/4229739
3,足球,阿莱：我们不是去巴黎旅游的，唯一让我们感兴趣的是决赛门票,https://www.dongqiudi.com/article/4229744
4,篮球,新疆男篮王泉泽晒球迷辱骂挑衅视频：太不容易了，一直在骂,https://www.dongqiudi.com/article/4229751
5,足球,跟队：目前莫塔是尤文换帅唯一实质人选，孔蒂不在考虑范围内,https://www.dongqiudi.com/article/4229750
6,足球,都体：弗拉希奇赛季报销，能否出战欧洲杯还需进一步检查,https://www.dongqiudi.com/article/4229735
7,足球,图片报：科隆与莱茵能源的主场命名权赞助将延长至2029年,https://www.dongqiudi.com/article/4229711
8,足球,AC米兰本赛季12次通过角球破门，排名意甲第一,https://www.dongqiudi.com/article/4229730
9,足球,吉诺拉：我相信巴黎准备好了，现在就看球员们的临场发挥,https://www.dongqiudi.com/article/4229726
10,足球,鲁梅尼格：过分吹捧穆西亚拉有害无益；遗憾拜仁没能截胡贝林,https://www.dongqiudi.com/article/4229691
11,足球,法国名宿：今晚将会是姆巴佩在大巴黎主场的最后一场欧冠,https://www.dongqiudi.com/article/4229605
12,足球,记者：多特小将魏特延结束5小时数学考试，已登机飞往巴黎,https://www.dongqiudi.com/article/4229702
13,足球,罗体：部分尤文球迷打出标语，支持球队主帅阿莱格里留任,https://www.dongqiudi.com/article/4229703
14,足球,姆希塔良：我是“儿厂梦”；去沙特？热爱比金钱更重要,https://www.dongqiudi.com/article/4229650
15,足球,隆戈：米兰高层中富拉尼支持聘请孔塞桑，蒙卡达还谈了萨里,https://www.dongqiudi.com/article/4229573
16,足球,赫塔费主席：巴萨向我询问了格林伍德的情况，他们很欣赏他,https://www.dongqiudi.com/article/4229699
17,足球,萨卡：能够与曼城竞争是件好事，我们将它视为一个挑战,https://www.dongqiudi.com/article/4229677
18,足球,马特乌斯：拜仁不应免费放走阿拉巴；他的离开造成了后防混乱,https://www.dongqiudi.com/article/4229667
19,篮球,啊？季后赛生涯至今，约基奇还从未率队在系列赛赢过50胜球队,https://www.dongqiudi.com/article/4229652
