index,hot,title,href
1,,俞敏洪赢了，东方甄选输了,https://www.36kr.com/p/2563444551067270
2,,美国可控核聚变4次点火成功，刷新纪录登Nature！首席女科学家入选年度十大人物,https://www.36kr.com/p/2562969541305993
3,,开掉9名高管，裁1/4员工，明星无人车敲警钟,https://www.36kr.com/p/2563554206000513
4,,​中国将咖啡馆开到全球第一，泡沫将破还是厚积薄发？,https://www.36kr.com/p/2564134803301760
5,,考研上岸的人太多，宿舍不够分了,https://www.36kr.com/p/2564149643060614
6,,挥别王健林，永辉超市苦熬寒冬,https://www.36kr.com/p/2563358254292868
7,,3年拿下超百亿融资，90后医疗创业者的时代正式到来,https://www.36kr.com/p/2564088975337096
8,,小米汽车量产倒计时，雷军比许家印更懂车？,https://www.36kr.com/p/2564280166064258
