index,hot,title,href
1,5.2万,我滴妈！！！这是黄浦区公租房？？？,http://club.kdslife.com/t_11251291.html
2,4.5万,上海和平饭店1982年的账单，有懂的说说，在当时算贵吗？,http://club.kdslife.com/t_11251318.html
3,4.0万,现在俄螺斯40岁以上的人怎么找工作的？经济那样了肯定很少人能找到,http://club.kdslife.com/t_11251400.html
4,3.8万,1999，上海,http://club.kdslife.com/t_11251412.html
5,4.1万,繁花似锦，岁月如梭，青春的回忆，怀旧的情感，支持一下而立之年的宽带山。,http://club.kdslife.com/t_11251356.html
6,3.7万,国外出差旅游不换个iPhone真心不方便,http://club.kdslife.com/t_11251406.html
7,3.6万,仅退款到我头上了~！,http://club.kdslife.com/t_11251509.html
8,3.5万,外地相亲女说“上海有钱人都是外地人”呵呵,http://club.kdslife.com/t_11251315.html
9,3.7万,教师行业要过剩了。,http://club.kdslife.com/t_11251424.html
10,3.0万,最近重看呼格案 发现,http://club.kdslife.com/t_11251287.html
11,4.3万,太离谱了，大闹2小时，300名乘客凌晨被迫下飞机？！,http://club.kdslife.com/t_11251462.html
12,3.1万,蔡依林这身肌肉线条，秒杀99%tf,http://club.kdslife.com/t_11251284.html
13,2.8万,两边获利的时代要结束了,http://club.kdslife.com/t_11251657.html
14,2.7万,据说老娘舅那帮人都去繁花试镜了，最后只有阿庆美娟被王家卫选中,http://club.kdslife.com/t_11251612.html
15,2.5万,复旦少年班的物理博士在美国流浪，是被东北女人骗了,http://club.kdslife.com/t_11251379.html
16,2.4万,保剑峰那么帅，为啥挤不进一线演员,http://club.kdslife.com/t_11251351.html
17,2.5万,其实北方女人气质是不错，，秒这剧里几个上海女人,http://club.kdslife.com/t_11251403.html
18,2.3万,2024喜从天降,http://club.kdslife.com/t_11251324.html
19,2.4万,乍浦路现状,http://club.kdslife.com/t_11251376.html
20,2.1万,金山区厉害啊,http://club.kdslife.com/t_11251485.html
