index,hot,title,href
1,10.2万,开贴聊一聊我的碧池女邻居,http://club.kdslife.com/t_11248785.html
2,5.3万,昨天不小心误摸女同事PP，尴尬死了,http://club.kdslife.com/t_11248795.html
3,4.2万,好多泡澡店都不务正业,http://club.kdslife.com/t_11248939.html
4,4.1万,西安限行了,http://club.kdslife.com/t_11248898.html
5,3.4万,文庙改成这副鸟样,http://club.kdslife.com/t_11248946.html
6,3.3万,小米和都是中国公司，为什么待遇截然不同？,http://club.kdslife.com/t_11248772.html
7,3.2万,昨天看了一集《繁花》，感觉怎么怪怪得。。。。,http://club.kdslife.com/t_11249067.html
8,3.4万,山上砣中毒案居然没删。。,http://club.kdslife.com/t_11248783.html
9,2.9万,华为内部人士：PC端鸿蒙操作系统现已开发完成,http://club.kdslife.com/t_11248724.html
10,3.1万,外企撤退德国????????超市比宜德全线关门，暗示什么？,http://club.kdslife.com/t_11248726.html
11,2.5万,问界M9出了，KDS又可以开喷了。,http://club.kdslife.com/t_11248764.html
12,2.2万,看电影遇到这种不自觉的女宁咋办,http://club.kdslife.com/t_11248836.html
13,2.1万,寄生虫男主角自杀了,http://club.kdslife.com/t_11248827.html
14,2.1万,拼了，拼了，再转50万进股市,http://club.kdslife.com/t_11248824.html
15,1.9万,美元买现汇还是现钞好？打算换美元做理财了,http://club.kdslife.com/t_11248760.html
16,2.1万,我怎么就遇不到这样的眼睛黑丝妹,http://club.kdslife.com/t_11249089.html
17,1.9万,我们现在算中等收入陷阱嘛。,http://club.kdslife.com/t_11248837.html
18,1.8万,上海迪士尼热力追踪跳车女童家长：孩子下车捡发箍，3分钟车才停,http://club.kdslife.com/t_11248924.html
19,1.7万,为啥英国满大街都是上汽的车子？？,http://club.kdslife.com/t_11248813.html
20,1.8万,2023年陕西小姐评选现场，没想到这么激烈,http://club.kdslife.com/t_11248986.html
