index,hot,title,href
1,,认真说说我对待投资的态度和逻辑,http://xueqiu.com/2792218779/295452796
2,,三代制冷剂投资主逻辑,http://xueqiu.com/7336862362/295444172
3,,世界级的公司——深度分析中国海油投资价值,http://xueqiu.com/1859876917/295439561
4,,很严重， 大家做好准备吧。。。,http://xueqiu.com/8545195173/295315041
5,,我们为什么要投资？谈谈我对投资本质的理解,http://xueqiu.com/8233733182/295432845
6,,如果股市暂时没有答案,http://xueqiu.com/1643044849/295341221
7,,京东方OLED业务的江湖地位——市场篇,http://xueqiu.com/5377253668/295039724
8,,中化化肥目前估计是最低估和稳定的港股通标的了,http://xueqiu.com/4974918194/295263561
9,,低价可转债大反攻,http://xueqiu.com/6146592061/295284482
10,,2024年A股杂谈九,http://xueqiu.com/1553799558/295158581
11,,比亚迪未来3年，保守估值分析,http://xueqiu.com/3941887077/295182273
12,,对比长江电力，中国核电，三峡能源三家企业的投资价值,http://xueqiu.com/8562456917/295049837
13,,胡锡进：炒股一周年感慨,http://xueqiu.com/9325142292/295279532
14,,上市公司｜“听他们的”——韦尔股份股东大会有感,http://xueqiu.com/3199838879/295261810
15,,当下的A股市场：长期增长的沃土，决胜于耐力与远见,http://xueqiu.com/4406747817/294950849
16,,凯莱英与CXO：海外收入过大，产能过剩加剧,http://xueqiu.com/7608175162/295123756
17,,放宽条件，连续十年股息不减少的公司,http://xueqiu.com/6306866040/295028608
18,,与众不同,http://xueqiu.com/7913104177/295023687
19,,让投资进入良性循环,http://xueqiu.com/2386334596/295100845
20,,新船供应量达到128万TEU，绕开红海所需的额外船舱量估计为214万TEU,http://xueqiu.com/7659667127/295004888
