index,hot,title,href
1,6.0万,两边获利的时代要结束了,http://club.kdslife.com/t_11251657.html
2,5.8万,据说老娘舅那帮人都去繁花试镜了，最后只有阿庆美娟被王家卫选中,http://club.kdslife.com/t_11251612.html
3,4.5万,繁花女演员颜值排名,http://club.kdslife.com/t_11251651.html
4,3.4万,妇科实习生留言，三观尽毁,http://club.kdslife.com/t_11251698.html
5,2.9万,最近听说房子火速成交，房东下架惜售,http://club.kdslife.com/t_11251693.html
6,2.6万,有评论说林栋甫更适合《繁花》中爷叔的角色，你们怎么看？,http://club.kdslife.com/t_11251634.html
7,2.6万,机闹有58岁了,http://club.kdslife.com/t_11251727.html
8,2.6万,打赌了繁花结尾一定是悲剧,http://club.kdslife.com/t_11251682.html
9,2.5万,繁花里面的玲子算不算是宝总的固炮啊,http://club.kdslife.com/t_11251654.html
10,2.4万,这个女人怎么长的这么难看？？，，，以前还没这么错气,http://club.kdslife.com/t_11251649.html
11,2.3万,不要报警！！！！！！,http://club.kdslife.com/t_11251821.html
12,2.0万,口罩期间买的房子，昨天去收房了，房价跌了不说，还受一包气。,http://club.kdslife.com/t_11251635.html
13,1.9万,抖音直播刷礼物，PK…真的是畸形文化，理工男很容易上头,http://club.kdslife.com/t_11251623.html
14,2.7万,老人突然去世，不知他有多少银行账户，想去人民银行查询,http://club.kdslife.com/t_11251675.html
15,1.9万,离谱！上海一男子卖掉父母3套房，为再婚妻子还债，却发现孩子出生证明是假的,http://club.kdslife.com/t_11251691.html
16,1.9万,老爷叔乐极生悲。,http://club.kdslife.com/t_11251690.html
17,1.8万,看了繁花 我表姐可以当汪小姐原形了,http://club.kdslife.com/t_11251631.html
18,2.2万,以色列女主播,http://club.kdslife.com/t_11251799.html
19,1.8万,85后90后女性中这类占比多少,http://club.kdslife.com/t_11251645.html
20,1.7万,现在普通上海家庭一般住什么样的房子,http://club.kdslife.com/t_11251647.html
