index,hot,title,href
1,足球,英超争冠实时形势(更新中)：阿森纳0-1埃弗顿，落后曼城5分,https://www.dongqiudi.com/article/4261788
2,足球,是否就在今晚？兄弟们来圈子提前预测比分吧>>,https://www.dongqiudi.com/article/2955270
3,篮球,郭艾伦社媒评“胖猫”事件：有时间讨论别人不如好好孝敬父母,https://www.dongqiudi.com/article/4261909
4,足球,50.5码，凯塞多的吊射是自17年11月的鲁尼以来英超最远进球,https://www.dongqiudi.com/article/4261884
5,足球,凯塞多吊射距球门达50.16米，该射门的预期进球仅0.02,https://www.dongqiudi.com/article/4261892
6,足球,第103分钟33秒破门，萨马尔季奇打进意甲近20个赛季最迟进球,https://www.dongqiudi.com/article/4261872
7,足球,斯卡尔维尼，新一代意大利后防领袖,https://www.dongqiudi.com/article/4093872
8,足球,神奇不再，萨索洛在不敌卡利亚里后提前一轮降入意乙,https://www.dongqiudi.com/article/4261815
9,足球,本赛季第五人，孙兴慜英超进球、助攻均已上双,https://www.dongqiudi.com/article/4261855
10,足球,安菲尔德赛前拉起TIFO致敬渣叔，全场合唱你永远不会独行,https://www.dongqiudi.com/article/4261800
11,足球,中线超级吊射！凯塞多攻入加盟切尔西以来的处子球,https://www.dongqiudi.com/article/4261819
12,足球,足协杯第四轮对阵：铜梁龙vs山东，陕西vs亚泰,https://www.dongqiudi.com/article/4261784
