index,hot,title,href
1,141,处女应该婚前发生关系吗？,https://www.mysmth.net/nForum/article/Love/6268487
2,79,没想到民营企业对外贸顺差的贡献一直都超过了100%,https://www.mysmth.net/nForum/article/WorkLife/3412121
3,71,帝都为何一个礼让行人都执行不下去？,https://www.mysmth.net/nForum/article/AutoWorld/1944693567
4,57,我们学校已经把一些业绩不好的老师强制转岗了,https://www.mysmth.net/nForum/article/QingJiao/829253
5,48,要不要让表姐借住我给父母在县城买的房,https://www.mysmth.net/nForum/article/FamilyLife/1766427798
6,47,[团购]10.10-儿童秋衣、儿童直筒裤、男女袜子,https://www.mysmth.net/nForum/article/ADAgent_TG/1310339
7,45,屌丝看中了一套房和一辆车，都是二手的,https://www.mysmth.net/nForum/article/Age/20312154
8,44,中国电影的自由度不比韩国电影差把,https://www.mysmth.net/nForum/article/Movie/3546052
9,44,三年级孩子偷偷玩游戏,https://www.mysmth.net/nForum/article/ChildEducation/2289875
10,17,今日寒露，为水木青们吟诗一首曰《秋夜春梦》,https://www.mysmth.net/nForum/article/Single/4587131
