index,hot,title,href
1,,雪球基金评审团招募！8只滚动持有期债基邀你来测评,http://xueqiu.com/8152922548/284149650
2,,中国中免2023年年报点评,http://xueqiu.com/1784228056/284139907
3,,理解市场价格因素、思考未来商业价值因素、研判证券分析因素,http://xueqiu.com/2884740514/284079745
4,,关于估值的思考,http://xueqiu.com/8993233749/284092115
5,,张坤最新年报解读：谨慎是这个时代的投资者必备的素质,http://xueqiu.com/8233733182/284092207
6,,股息收益在A股与美股的世纪沉浮，为何曾遭集体忽视？,http://xueqiu.com/3559889031/284030736
7,,无惊无喜，23年报重点数据概述,http://xueqiu.com/3638220949/284023303
8,,低估的头部黄金矿企----山东黄金2023年报解读,http://xueqiu.com/1344684945/284016247
9,,现在是右侧的好时点吗？,http://xueqiu.com/5131964483/283884413
10,,存款利率开始倒挂,http://xueqiu.com/1558671310/283928320
11,,伊利和蒙牛的一些比较,http://xueqiu.com/2107606204/283836175
12,,对中国海油的最新看法,http://xueqiu.com/1201546096/283868431
13,,氢能走到哪一步了？,http://xueqiu.com/1570039711/283718657
14,,AS初印象&备忘录,http://xueqiu.com/8565549431/283750956
15,,我怎么看阿里最近的动作,http://xueqiu.com/9598793634/283754681
16,,慎用估值分位,http://xueqiu.com/1038878653/283747671
17,,聊聊主要红利类指数的含煤量~,http://xueqiu.com/6828304753/283623958
18,,通读比亚迪年报，有些惊喜,http://xueqiu.com/3199838879/283642394
19,,投资互联网平台公司的逻辑,http://xueqiu.com/9742512811/283709839
20,,重新关注行业龙头,http://xueqiu.com/1553799558/283654891
