index,hot,title,href
1,11770377,陕西桥梁垮塌现场搜到15具遗体
2,11544327,陈泽杯八强赛
3,11329979,稻“画”香里说丰年
4,11229666,大仙杯杨玉环一战成名
5,10547625,黄一鸣100比65张晓松
6,10415075,四川泥石流灾害搜到10具遗体
7,9318387,Uzi频繁请假
8,9301980,今年第4号台风“派比安”生成
9,9260359,邓紫棋演唱会 求婚
10,9248719,以军空袭也门荷台达
11,9208587,美国一飞机坠毁机上3人死亡
12,9207287,美国男篮险胜南苏丹
13,9201149,薛之谦韩红合唱小尖尖
14,9200876,开封城墙坍塌系谣言
15,9194799,小夭相柳手腕吻好虐
16,9181236,新白娘子传奇演唱会舞美
17,9176495,董宇辉新工区亮相
18,9176361,纯妹妹翻唱挑战
19,9157617,唐诡仵作之死观后感
20,9110606,沈腾主演电影票房破350亿
21,9092835,茶啊二中第五季
22,9067142,你比星光美丽敖瑞鹏上线
23,8994280,英官员：不对中国电动车加税
24,8938713,许海峰谈金牌捐献国博
25,8893318,明日大暑
26,8865813,回不去的童年与夏天
27,8811083,这了不起的暑假生活
28,8712095,女子被离婚7年前夫暴力殴打
29,8592729,小米MIX Flip开箱
30,8587534,不满以色列参加奥运巴黎再爆示威
31,8428826,超雄综合征不等于会暴虐犯罪
32,8372857,徐艺洋搂黄子韬嗑到了
33,8370197,抓娃娃西虹市十年仪式感
34,8324094,国家发改委紧急下达3.5亿元
35,8301959,东北雨姐吃新疆美食
36,8291661,张碧晨interstellar硬核舞台
37,8289766,对话高考复读16年的唐尚珺
38,8241907,花小龙快把陈伯练废了
39,8214688,翻烂相册也要配曾舜晞BGM
40,8207672,巴黎奥运会志愿者餐食
41,8185549,韩廷开始追妻了
42,8113577,方言版童话镇
43,8087614,狗：呦呵 告辞
44,8045023,新疆伊犁天马节
45,8040869,我只求与你共华发
46,8022385,凤凰传奇军训的风吹到了兰州
47,8008813,唐朝诡事录正常的可怕
48,7938355,少年白马醉春风师徒情好刀
49,7855502,检查出超雄综合征怎么办
50,7843118,2000年来伤医事件超400起
