index,hot,title,href
1,11720154,沙特世界杯BLG大战T1
2,11512943,夏天妹妹发视频致敬航天先驱
3,11489499,中国接任上合组织轮值主席国
4,11265445,如何预防脑膜炎
5,10650968,姜爷爷 福宝
6,10547512,花小龙对人的差别怎么那么大
7,9432392,什么是好的爱情
8,9387026,这是端木磊分磊吗
9,9281220,深中通道通车超30万车次
10,9275132,因为他善
11,9194613,方言怎么说挑战
12,9193656,苏炳添确认缺席巴黎奥运会
13,9177597,外交部回应city不city走红
14,9157877,太原胜利街被淹系谣言
15,9143869,沈阳男子持刀伤人致3死1伤
16,9120449,陈泽玩游戏被要求转人工
17,9084335,陈泽将举办英雄联盟陈泽杯
18,9042568,读书的意义在此刻具象化了
19,8881857,在毕业典礼求婚有多浪漫
20,8878787,罗马尼亚淘汰后打扫了更衣室
21,8877894,美国警察拦下一辆形似UFO的车辆
22,8852363,默杀观后感
23,8624703,绝区零全角色推荐
24,8613410,警方通报男子商场翻越扶梯坠亡
25,8597931,3.5元一杯的冰杯销量“杀疯了”
26,8580944,面筋哥完成肝移植手术苏醒
27,8553508,普京乘俄国产轿车抵达上合峰会
28,8529701,一天卖出200斤知了
29,8512030,许凯谭松韵还原婚纱跑名场面
30,8498155,大韩航空空姐行李箱内发现实弹
31,8441072,字母哥奥运会资格赛狂砍32分
32,8346924,中方回应“菲要求归还被缴武器”
33,8247773,韩廷终于知道纪星有对象了
34,8166137,白俄罗斯正式加入上合组织
35,8062649,阿里健康大药房海外店被指售假
36,7984792,执行法官里的老赖好戏精
37,7947339,韩国连续出土4把千年木犁
38,7860533,Miss向郭碧婷道歉
39,7853506,暮色回响清唱
40,7830426,爱哥的美女 你听哥说
41,7818095,这首歌的杀伤力不亚于初恋
42,7805194,原来真的一眨眼就长大了
43,7764742,铁腚的人先享受世界
44,7739923,家里的一切才是最美的乐园
45,7733809,我确定已完成全部暑假作业
46,7727255,特斯拉进江苏政府用车采购目录
47,7725434,上海热到全国第一名
48,7705159,每个人都有一个吃饭磨叽的朋友
49,7693985,网友实拍杭州树上挂满虫子
50,7691627,舞法天女模仿挑战
