index,hot,title,href
1,76,东亚都很卷的渊源是什么呢？,https://www.guozaoke.com/t/108319
2,73,堂弟昨晚烧炭ZS了,https://www.guozaoke.com/t/108344
3,68,出去玩没做攻略被骂了,https://www.guozaoke.com/t/108209
4,65,以后的独生女是不是会越来越少？,https://www.guozaoke.com/t/108151
5,61,江西文旅三年白干,https://www.guozaoke.com/t/108213
6,59,过早客论坛增强插件 —— 过早客 Plus 发布啦，走过路过，不要错过,https://www.guozaoke.com/t/108340
7,52,大家开的什么油车？,https://www.guozaoke.com/t/108229
8,51,如果我们像西方那样，强制一周工作35小时，强制带薪年休假30天必须休完，能不能解决内需不足，失业率高企的问题？,https://www.guozaoke.com/t/108288
9,49,你们后悔生娃生晚了吗？,https://www.guozaoke.com/t/108189
10,49,截至2024年4月1日，中国城市轨道交通运营及在建里程统计,https://www.guozaoke.com/t/108193
