index,hot,title,href
1,,在没有广告的情况下，网站如何盈利,http://jandan.net/p/116990
2,,希腊推出六天工作周,http://jandan.net/p/116985
3,,夜深了你还不想睡：入睡前的片刻是大脑最具创意的时间,http://jandan.net/p/116986
4,,在1783年预言黑洞的牧师,http://jandan.net/p/117000
5,,如何活到500岁,http://jandan.net/p/117009
6,,核光谱学突破可能改写自然基本常数,http://jandan.net/p/116999
7,,今日好价 0703,http://jandan.net/p/116994
8,,社交媒体可能是导致现代择偶困惑的原因,http://jandan.net/p/116998
9,,今日好价 0704,http://jandan.net/p/117003
10,,今日好价 0705,http://jandan.net/p/117012
11,,研究表明，能量饮料与酒精混合影响大脑功能,http://jandan.net/p/117020
12,,生活在清醒梦中,http://jandan.net/p/117008
13,,为什么桥梁不会下沉,http://jandan.net/p/116996
14,,阅读那些不完全理解的书的乐趣,http://jandan.net/p/117005
15,,意识之谜比我们想象的更深,http://jandan.net/p/117007
16,,今日好价 0706,http://jandan.net/p/117023
17,,如何制止童婚？惩罚丈夫、父母和婚礼宾客,http://jandan.net/p/117006
18,,忘掉健身房吧，养鸡让你更健康,http://jandan.net/p/117026
19,,阅读在复杂中消亡：在线读者偏爱简明写作,http://jandan.net/p/117018
20,,为什么癌症风险在老年时急剧下降,http://jandan.net/p/117015
21,,走倒退步有助于老年人改善平衡,http://jandan.net/p/117030
22,,建议停止使用“世纪”计时法,http://jandan.net/p/117025
23,,今日好价 0707,http://jandan.net/p/117034
24,,数字考古：挖掘数十年前的挖掘数据,http://jandan.net/p/116997
25,,新的“玻璃状凝胶”材料具有奇怪的强度、弹性和粘性,http://jandan.net/p/117019
26,,北极圈海底发现惊人的热液环境,http://jandan.net/p/117016
27,,AI虚假宣传：问题与影响,http://jandan.net/p/116988
28,,蚂蚁能为受伤同伴进行截肢手术,http://jandan.net/p/117027
29,,探索之旅：银河系磁场的神秘力量,http://jandan.net/p/117029
30,,史海钩沉：拉格啤酒酵母解密,http://jandan.net/p/117028
