index,hot,title,href
1,足球,剑南春｜阿森纳0-1纽卡遭联赛首败，戈登破门，双方屡起冲突,https://www.dongqiudi.com/article/3829043
2,足球,剑南春｜巴萨1-0客胜皇家社会，阿劳霍补时绝杀，京多安助攻,https://www.dongqiudi.com/article/3829277
3,足球,剑南春｜拜仁客场4-0大胜多特，凯恩德甲连场戴帽，于帕闪击,https://www.dongqiudi.com/article/3829029
4,足球,剑南春｜曼城6-1伯恩茅斯，多库4传1射，B席双响，福登破门,https://www.dongqiudi.com/article/3828576
5,足球,早报：赢了，谁最开心？,https://www.dongqiudi.com/article/3829351
6,足球,方镜淇：想继续留在津门虎，时间越长越好；明年希望多踢比赛,https://www.dongqiudi.com/article/3829487
7,足球,重获领先，肯尼迪爆射破门，弗鲁米嫩塞加时再次领先,https://www.dongqiudi.com/article/3829481
8,足球,反击马特乌斯和哈曼，图赫尔：存在矛盾、没有进步的球队赢了,https://www.dongqiudi.com/article/3829480
9,足球,比赛集锦：米兰0-1乌迪内斯，佩雷拉点射,https://www.dongqiudi.com/article/3829473
10,足球,解放者杯-肯尼迪加时赛建功 弗鲁米嫩塞2-1博卡首次夺冠,https://www.dongqiudi.com/article/3829471
11,足球,比赛集锦：多特0-4拜仁，凯恩德甲连场戴帽,https://www.dongqiudi.com/article/3829469
12,足球,李圣龙：不知道生涯是否还有下一个五年，但一定拼尽全力,https://www.dongqiudi.com/article/3829467
13,足球,意甲-佩雷拉电球制胜，AC米兰0比1主场负乌迪内斯,https://www.dongqiudi.com/article/3829466
14,足球,终于进了，阿德文库拉突施冷箭，博卡青年扳平比分,https://www.dongqiudi.com/article/3829465
15,足球,比赛集锦：皇家社会0-1巴萨，阿劳霍补时绝杀,https://www.dongqiudi.com/article/3829464
16,足球,讽刺内维尔批评，德赫亚维护B费：你不是合适的曼联队长,https://www.dongqiudi.com/article/3829463
17,足球,记者：瑞尔森和科曼在更衣室过道发生争执，被格纳布里分开,https://www.dongqiudi.com/article/3829462
18,足球,意甲-劳塔罗11场12球！国际米兰2比1客胜亚特兰大,https://www.dongqiudi.com/article/3829461
19,足球,葡超第10轮：沙维斯0-2本菲卡,https://n.dongqiudi.com/webapp/tops.html?id=3829459
20,足球,西甲-巴萨1-0皇社 阿劳霍补时头球绝杀京多安助攻,https://www.dongqiudi.com/article/3829457
