index,hot,title,href
1,足球,利物浦客战卢顿：戈麦斯、赫拉芬贝赫、若塔首发，迪亚斯替补,https://www.dongqiudi.com/article/3830805
2,足球,阿森纳官方：全力支持塔帅的言论；呼吁裁委会提高裁判水平,https://www.dongqiudi.com/article/3831123
3,,瓦伦西亚 vs 格拉纳达 比赛动态,https://www.dongqiudi.com/article/3831321
4,足球,记者：触发防火报警装置的是图卢兹球迷放的烟火????,https://n.dongqiudi.com/webapp/tops.html?id=3831377
5,,海登海姆vs斯图加特：泽乌考夫、克莱因丁斯特首发，努贝尔、郑优营出战,https://www.dongqiudi.com/article/3831376
6,,诺丁汉森林 vs 阿斯顿维拉 比赛动态,https://www.dongqiudi.com/article/3831142
7,足球,阎相闯谈降级：内心还是无法平复，愧对球迷这一年的支持,https://www.dongqiudi.com/article/3831367
8,,马丁内斯失误，将球扑进自家球门！曼加拉禁区外大力...,https://n.dongqiudi.com/webapp/tops.html?id=3831364
9,篮球,CBA官方公布闽浙冲突处罚：两队3名球员+1工作人员共罚20万,https://www.dongqiudi.com/article/3831355
10,,摩纳哥vs布雷斯特：巴洛贡、扎卡里亚首发，穆涅、里斯-米卢出战,https://www.dongqiudi.com/article/3831345
11,篮球,还是当教练吧！西热力江替补出场20分钟&三分5中1仅得3分,https://www.dongqiudi.com/article/3831339
12,足球,官方：路易斯-加西亚不再担任西班牙人主帅,https://www.dongqiudi.com/article/3831333
13,足球,恭喜滕佩尔曼连续两轮成为全场最佳球员！本轮面对老...,https://n.dongqiudi.com/webapp/tops.html?id=3831329
14,足球,德国杯16强对阵出炉：两组德甲内战，多特客战斯图加特,https://www.dongqiudi.com/article/3831328
15,,半场战报：沃尔夫斯堡1-1云达不莱梅，切尔尼破门，杜克施破门,https://www.dongqiudi.com/article/3831325
16,足球,这是我的年度最佳照片！嘿嘿????,https://www.dongqiudi.com/article/3831324
17,足球,替补送助攻，佩利斯特里：就是这样！我们必须继续前进！,https://n.dongqiudi.com/webapp/tops.html?id=3831304
18,足球,萨帅渐进式培养新人，广州队成功保级后遭遇4连败需认真总结,https://www.dongqiudi.com/article/3831293
19,足球,芒特社媒发文：我们坚持到了最后，朝着正确的方向迈出了一步,https://n.dongqiudi.com/webapp/tops.html?id=3831291
20,足球,前康复师谈朴成退役：如果膝盖韧带没大伤，生涯可再延长几年,https://www.dongqiudi.com/article/3831274
