index,hot,title,href
1,,AI生成的色情内容将颠覆成人行业,http://jandan.net/p/116198
2,,发霉啦：今天，牛排化冻后有些血水滴到了冰箱下面,http://jandan.net/p/116192
3,,研究发现，养猫与精神分裂症有关是真的,http://jandan.net/p/116199
4,,港股惊魂：天瑞水泥股价15分钟暴跌暴跌99%,http://jandan.net/p/116190
5,,在狗之前，狐狸可能是人类的最好朋友,http://jandan.net/p/116210
6,,车臣禁止过快或过慢的音乐，许多歌曲将被禁,http://jandan.net/p/116187
7,,降低焦虑情绪的五种科学方法,http://jandan.net/p/116201
8,,互联网死了吗,http://jandan.net/p/116188
9,,研究发现，成年人的新陈代谢并不会那么慢,http://jandan.net/p/116191
10,,新晋“超级食物”沙棘浆果,http://jandan.net/p/116219
11,,你真的还需要IPv4吗？,http://jandan.net/p/116189
12,,麻醉是如何工作的,http://jandan.net/p/116193
13,,美国参议员要求立即禁止中国电动汽车进口,http://jandan.net/p/116217
14,,今日好价 0412,http://jandan.net/p/116195
15,,军事爆炸物训练中的重复冲击波可能引发肠漏,http://jandan.net/p/116197
16,,为什么有些人总是迷路,http://jandan.net/p/116220
17,,今日好价 0415,http://jandan.net/p/116222
18,,今日好价 0411,http://jandan.net/p/116185
19,,越南地产大亨涉嫌270亿美金诈骗案被判死刑,http://jandan.net/p/116206
20,,美国：更新电线能让电网承载能力翻倍,http://jandan.net/p/116186
21,,今日好价 0414,http://jandan.net/p/116213
22,,今日好价 0413,http://jandan.net/p/116203
23,,深海生命探秘,http://jandan.net/p/116177
24,,精神分裂症致病机理揭晓：过滤与预测系统失灵,http://jandan.net/p/116200
25,,眼部感染可能比人们想象的更严重,http://jandan.net/p/116207
26,,我们正处于第六次大灭绝中吗,http://jandan.net/p/116218
27,,NASA准备将其下一代太阳帆送入深空,http://jandan.net/p/116209
28,,雇佣员工的企业主幸福感更高,http://jandan.net/p/116205
29,,微塑料可能导致心脏病,http://jandan.net/p/116215
30,,甲虫王国：种类繁多的秘密,http://jandan.net/p/116216
