index,hot,title,href
1,130,堂弟昨晚烧炭ZS了,https://www.guozaoke.com/t/108344
2,109,过早客论坛增强插件 —— 过早客 Plus 发布啦，走过路过，不要错过,https://www.guozaoke.com/t/108340
3,107,中考改革，指标到校落地,https://www.guozaoke.com/t/108360
4,96,东亚都很卷的渊源是什么呢？,https://www.guozaoke.com/t/108319
5,88,有没有一首歌你喜欢了很多年,https://www.guozaoke.com/t/108373
6,75,武汉的驾校和考试一直都是这么黑吗？,https://www.guozaoke.com/t/108362
7,66,疯了，楼上啪啪啪的声音到底是哪一户的,https://www.guozaoke.com/t/108421
8,60,如果我们像西方那样，强制一周工作35小时，强制带薪年休假30天必须休完，能不能解决内需不足，失业率高企的问题？,https://www.guozaoke.com/t/108288
9,60,你心目中关山大道最好的小区是哪个？,https://www.guozaoke.com/t/108346
10,57,家里两代中医，有需要的wx,https://www.guozaoke.com/t/108292
