index,hot,title,href
1,3.4万,结束,http://club.kdslife.com/t_11245612.html
2,2.5万,钱去哪里了？,http://club.kdslife.com/t_11245598.html
3,2.1万,妹妹玩的花是花,http://club.kdslife.com/t_11245684.html
4,2.0万,白酒业，将死在零零后手里！,http://club.kdslife.com/t_11245664.html
5,1.8万,参观香港同事350万港币新买的14平米新家。,http://club.kdslife.com/t_11245611.html
6,1.4万,上海一对母女在商场被追打。武疯子（女）,http://club.kdslife.com/t_11245729.html
7,1.3万,看阿富汗日报，全国上下很勤劳塔利班很努力廉洁的搞经济，为何还那么穷？,http://club.kdslife.com/t_11245583.html
8,1.2万,零下气温CEO实测150°电池，续航超1000km， 喷子怎么喷法？？,http://club.kdslife.com/t_11245805.html
9,1.1万,网约车司机很年轻,http://club.kdslife.com/t_11245591.html
10,9134,泰国车展，丰田预定量首次被byd击败。,http://club.kdslife.com/t_11245603.html
11,8854,现在北方零下十几度的天气，纯电车续航还有没有影响了,http://club.kdslife.com/t_11245722.html
12,8604,秦岚阿姨有排队的吗,http://club.kdslife.com/t_11245765.html
13,8317,既然房价跌不跌政策可以影响到。。。。。。,http://club.kdslife.com/t_11245592.html
14,7669,05后舔狗越来越少，是好现象,http://club.kdslife.com/t_11245590.html
15,7345,kds昔日的女神+股神，长岛冰茶怎么失踪了？,http://club.kdslife.com/t_11245617.html
16,7381,东方甄选的客户都是什么类人？,http://club.kdslife.com/t_11245666.html
17,7786,上海00后小孩是不是对精英00后小孩彻底碾压,http://club.kdslife.com/t_11245615.html
18,6664,最近2个月是消费的黄金时间,http://club.kdslife.com/t_11245621.html
19,7049,汽车出口才刚刚开始两三年，泰国汽车市场已经巨变。。。,http://club.kdslife.com/t_11245601.html
20,6461,家里用过大金中央空调的进来说说制热效果如何？,http://club.kdslife.com/t_11245618.html
