index,hot,title,href
1,37,出数据了，这次冻雨历史最大,https://www.guozaoke.com/t/106592
2,25,记者：中国足协暂停与阿根廷足协相关合作，梅西中国行不会有了,https://www.guozaoke.com/t/106599
3,24,你们有被父母催生男孩么,https://www.guozaoke.com/t/106652
4,19,结婚后两家能成为一家人吗,https://www.guozaoke.com/t/106655
5,18,有哪些菜是你无法适应的？比如崇阳的墨鱼炖鸡…,https://www.guozaoke.com/t/106658
6,17,春晚咋这多广告植入啊,https://www.guozaoke.com/t/106603
7,17,贵版今天只有我一个人上班吧,https://www.guozaoke.com/t/106636
8,16,下酒菜之争，谁是第一,https://www.guozaoke.com/t/106643
9,14,洗了个车 100，肝疼,https://www.guozaoke.com/t/106595
10,14,00年男 求各位前辈们介绍对象,https://www.guozaoke.com/t/106659
