index,hot,title,href
1,足球,多家意媒：意大利反兴奋剂检察官办公室要求对博格巴禁赛4年,https://www.dongqiudi.com/article/3896223
2,足球,球队频繁解散，中超比CBA差在哪儿？,https://www.dongqiudi.com/article/3894494
3,足球,懂球帝十周年，点击开启你的专属球迷报告,https://www.dongqiudi.com/article/3876007
4,,达马克 vs 吉达联合 比赛动态,https://www.dongqiudi.com/article/3896492
5,足球,意媒：尤文冬窗或将年轻后卫赫伊森挂牌租借，可能去格拉纳达,https://www.dongqiudi.com/article/3896556
6,足球,范戴克：马蒂普的伤病我深有体会，团队所有人都会提供帮助,https://www.dongqiudi.com/article/3896539
7,足球,官方：足总杯阿森纳vs利物浦将于北京时间1月8日0:30开球,https://www.dongqiudi.com/article/3896534
8,足球,官方：利物浦与嘉士伯续约10年，新合同至2034年,https://www.dongqiudi.com/article/3896519
9,足球,韩鹏飞：期待入选国足，但这需要连续几个赛季的稳定发挥才行,https://www.dongqiudi.com/article/3896518
10,足球,保滕先锋，麦克托米奈本赛季英超进球比曼联前锋总和还多,https://www.dongqiudi.com/article/3896514
11,足球,【有奖竞猜预告】D站十周岁回馈粉丝,https://www.dongqiudi.com/article/3896512
12,足球,库珀下课？我偏要他扛住！,https://www.dongqiudi.com/article/3896509
13,足球,维拉牛逼！赢了！赢了！彻底赢了！！,https://www.dongqiudi.com/article/3896508
14,足球,科尔威尔：VAR有点针对我，小麦进球前拉倒我了却没判犯规,https://www.dongqiudi.com/article/3896494
15,足球,记者：梅州客家将于12月25日左右收假开启冬训,https://www.dongqiudi.com/article/3896491
16,足球,埃弗拉：加纳乔、安东尼踢得好，你不能对他们说什么负面的话,https://www.dongqiudi.com/article/3896488
17,足球,记者：如果维尔纳想在冬窗转会，莱比锡愿意听取报价,https://www.dongqiudi.com/article/3896486
18,足球,每体：阿劳霍续约前曾拒绝了曼联巨额报价，曼联仍对他有意,https://www.dongqiudi.com/article/3896475
19,足球,鲁尼：贝林厄姆明年能争金球奖，希望他能帮英格兰赢欧洲杯,https://www.dongqiudi.com/article/3896469
20,足球,5场6球4助领取月最佳奖杯，罗德里戈：我现在更舒服更棒了,https://www.dongqiudi.com/article/3896451
