index,hot,title,href
1,,少量饮酒是否健康？科学观点的大翻转,http://jandan.net/p/116735
2,,为什么赌博是错的，保险却是对的,http://jandan.net/p/116764
3,,回形针简史,http://jandan.net/p/116723
4,,艺术家逃离Instagram，以免作品被Meta拿去训练,http://jandan.net/p/116743
5,,间歇性禁食与蛋白质间隔进食法有助于减肥,http://jandan.net/p/116755
6,,过度剧烈运动可能削弱免疫系统,http://jandan.net/p/116745
7,,咖啡简史,http://jandan.net/p/116763
8,,发育生物学揭示生命、智能和不朽的秘密,http://jandan.net/p/116751
9,,今日好价 0611,http://jandan.net/p/116760
10,,今日好价 0612,http://jandan.net/p/116770
11,,地壳中究竟有多少水？,http://jandan.net/p/116724
12,,巴黎100条街道禁止汽车通行，现在这座城市是骑行者天堂,http://jandan.net/p/116726
13,,伟哥改善大脑血流，或能预防痴呆,http://jandan.net/p/116741
14,,癌症治疗的新突破带来希望,http://jandan.net/p/116736
15,,今日好价 0608,http://jandan.net/p/116731
16,,今日好价 0609,http://jandan.net/p/116739
17,,科学家猜测宇宙可能像一个甜甜圈,http://jandan.net/p/116742
18,,长颈鹿颈部进化新发现颠覆认知,http://jandan.net/p/116727
19,,没有网络的世界,http://jandan.net/p/116754
20,,脑力崩溃：倦怠背后的神经科学,http://jandan.net/p/116765
21,,新理论：无质量引力或可解释暗物质之谜,http://jandan.net/p/116752
22,,今日好价 0610,http://jandan.net/p/116749
23,,谎言与数据一致性,http://jandan.net/p/116722
24,,木糖醇与心脏病和中风风险相关,http://jandan.net/p/116744
25,,绝对零度以上的原子或是一种新物质形态,http://jandan.net/p/116756
26,,无质量引力：UAH研究提出暗物质替代解释,http://jandan.net/p/116734
27,,大象也会相互叫名字,http://jandan.net/p/116766
28,,宏观秩序如何在大尺度上涌现的新数学,http://jandan.net/p/116762
29,,墨西哥发生首例H5N2禽流感致人死亡案例,http://jandan.net/p/116725
30,,罕见慢速自转射电中子星挑战现有规则,http://jandan.net/p/116733
