index,hot,title,href
1,11219774,3月起这些新规开始施行
2,9681388,人一旦沾染了班味儿
3,9499937,中国航天再添国之重器
4,9478542,年轻人节后省钱风自律
5,9439648,人长大不轻松我后来才知道
6,9412054,很多岗位都可以先进再学
7,9385329,这首诗竟出自外卖员之手
8,9379950,奋不顾身救人的大哥找到了
9,9329635,派出所车辆爆炸3人牺牲系谣言
10,9184676,宗馥莉泪别宗庆后
11,9154415,网剧唐人街探案2定档
12,9080378,湘潭打骂学生教师已被停职
13,9068105,董宇辉余华再次同框
14,9042673,范丞丞爸妈看飞驰2表情
15,9023447,四郎版身骑白马
16,8995743,亚洲首富之子举行婚前庆祝活动
17,8943670,总有一天你会出现在我身边
18,8942074,猜猜兔子爆改的是谁
19,8936340,烟火人家杀我别用亲情刀
20,8913351,吃了半天瓜原来是自己的
21,8913152,猎冰黄宗伟接阿美的原因
22,8907965,00后姑娘做TikTok主播月入2万
23,8879415,考研人的遗憾是什么
24,8839923,李若彤体验舞狮
25,8753085,王迅游荆州古城呼吁保护文物
26,8663892,狂王动画开播
27,8636689,刘能装病被谢广坤放炮吓好
28,8633420,林允素颜
29,8632463,私奔翻唱
30,8630763,男演员与猫比美照更具杀伤力
31,8608023,雷军对苹果取消造车表示震惊
32,8596397,昆明海关查获人体组织制品12件
33,8579540,凤凰传奇官宣演唱会
34,8560349,是朋友就一起跳身骑白马DJ版
35,8455114,周鸿祎解读苹果取消造车原因
36,8449613,人民日报评福建游神火出圈
37,8398658,毒角SHOW单挑王鹤棣
38,8389454,女企业家讨工程款事实必须查明
39,8340233,学会释怀自渡自愈
40,8322758,希拉里受邀参加亚洲首富儿子婚礼
41,8273736,斯特鲁斯超远三分绝杀
42,8246679,街头偶遇胶片摄影师卢昱晓
43,8222209,当男生体验簪花
44,8105326,国台办回应恶性撞船事件
45,8101813,霍建华机场喊话代拍
46,8035226,马里发生交通事故致31人死亡
47,7931165,让我家猫来挑战姚安娜演技
48,7907946,当宝宝开始尝试自己睡觉
49,7868849,杨幂8年后再配音功夫熊猫
50,7865311,浪莎否认与网红徐老太合作
