index,hot,title,href
1,鹭岛生活,[09-10]保利叁仟栋，为什么很多房子在出售？,http://bbs.xmfish.com/read-htm-tid-18241895.html
2,鹭岛生活,今晚薄饼，360元，每年都是平均数，没有精彩没有悲伤,http://bbs.xmfish.com/read-htm-tid-18241773.html
3,鹭岛生活,大家有没有听说秦皇岛清债这玩意,http://bbs.xmfish.com/read-htm-tid-18241788.html
4,鹭岛生活,前几天去漳州市区朋友家 说厦门房价,http://bbs.xmfish.com/read-htm-tid-18241951.html
5,鹭岛生活,安置房的阳台推拉门品质非常好，到无奈要敲了，这门要卖给谁,http://bbs.xmfish.com/read-htm-tid-18241784.html
6,鹭岛生活,定了，不用担心了！全国生育率上来了！ 国家解决了各种对生育不友好的政策问题啦,http://bbs.xmfish.com/read-htm-tid-18241805.html
7,鹭岛生活,现在街上怎么人越来越少了,http://bbs.xmfish.com/read-htm-tid-18241911.html
8,鹭岛生活,[09-10]说实在的我觉得教师节可以取消了~~~~~~~~~,http://bbs.xmfish.com/read-htm-tid-18241985.html
9,鹭岛生活,[09-10]中秋聊月饼，员工有没有权力分享别家公司送来的月饼呢？,http://bbs.xmfish.com/read-htm-tid-18241919.html
10,鹭岛生活,安居让人无法安居,http://bbs.xmfish.com/read-htm-tid-18241969.html
