index,hot,title,href
1,11783443,差点就被理科生浪漫到了
2,11231371,把非遗穿身上
3,11204354,乌镇峰会人形机器人扎堆
4,11093455,苹果AI到底怎么用
5,10413532,三角洲衔尾蛇攻略
6,10295184,新加坡国务资政李显龙将访华
7,9200641,以军空袭叙利亚致36死
8,9197970,70多辆小米SU7自动泊车出事故
9,9185101,四川盆地获超千亿方大气田
10,9182032,追更月度精选好内容
11,9134842,金铲铲双城传说2正式上线
12,9127437,王艺迪3:1战胜张本美和
13,9121276,2024MAMA舞台
14,9118557,中国资源循环集团发原始股不实
15,9091979,克烈抖音首播
16,9071172,锦衣之下作者蓝色狮去世
17,8908714,误杀3定档
18,8891775,王曼昱晋级女单4强
19,8825604,老挝防长热情拥抱董军
20,8483149,黑神话获金摇杆年度最佳游戏
21,8463719,普京：美国破坏了国际安全体系
22,8182317,林诗栋晋级4强
23,8156807,国足官方发布中日之战纪录片
24,8117579,A股大跌 近5000只个股下跌
25,8116952,警方通报报警人被关留置室逼和解
26,8001901,网红丐中丐夫妇车祸遇难
27,7985426,假面骑士入驻抖音
28,7909074,卫生巾新国标知情人发声
29,7907816,老头杯公开处刑Mlxg
30,7856868,T1老板爆料Zeus离队始末
31,7845313,杨子：我会不会被骂上热搜
32,7834670,胡彦斌说出了麦琳李行亮矛盾本质
33,7825916,Mata加入T1
34,7801297,十个勤天广州演唱会
35,7799260,王楚钦采访逗笑全场
36,7791315,日子怎么可能跟谁过都一样
37,7786451,永夜星河用爱实现每一个愿望
38,7774912,3米长的古代满分卷长啥样
39,7768763,00后女生爆改田园小院
40,7765837,秋去冬来手势舞
41,7753034,何以笙箫默剧情模仿挑战
42,7748518,孙宇晨花4500万买了根香蕉
43,7744158,媒体：企业请离员工私生活远一点
44,7740127,APT完了号
45,7739814,暖心暖胃的烟火小城
46,7737181,冬季韩系穿搭ootd
47,7731748,许个愿给2025年的自己
48,7725434,小八咪特效这不就有了
49,7722150,中方：对日本等9国试行免签政策
50,7721312,王者荣耀貂蝉大招调整
