index,hot,title,href
1,136,妈呀 粉董宇辉的都是啥人啊？是不是当年看《读者》那帮人？,https://www.mysmth.net/nForum/article/FamilyLife/1766527835
2,87,不想在top2高校干了，但是看到学区的事又有点犹豫,https://www.mysmth.net/nForum/article/SchoolEstate/1378146
3,75,你们说怎么分辨一个女人是不是好女人呢？,https://www.mysmth.net/nForum/article/Age/20322829
4,59,这天气才能看出ID的半隐藏门把手是业界良心,https://www.mysmth.net/nForum/article/GreenAuto/1427407
5,57,今天加油站遇到一个奇葩，也学习了新知识,https://www.mysmth.net/nForum/article/AutoWorld/1944741200
6,45,年底了，大家都有年终奖吗？,https://www.mysmth.net/nForum/article/WorkLife/3461945
7,43,美国旅行者1号飞船开始发送无法解码的数据,https://www.mysmth.net/nForum/article/Aero/417070
8,40,太阳系的承载力是多少人口？,https://www.mysmth.net/nForum/article/SF/515441
9,32,除非还想再要孩子，否则离婚后再婚的都是脑子有包,https://www.mysmth.net/nForum/article/Divorce/2056547
10,30,我宣布：英菲克的75元薄膜键盘是今年最佳键盘,https://www.mysmth.net/nForum/article/CompMarket/544311032
