index,hot,title,href
1,,发霉啦：今天，我去前夫家里接7岁的闺女,http://jandan.net/p/115822
2,,鸟山明去世了,http://jandan.net/p/115837
3,,如何打破习惯，重新发现生活中的乐趣,http://jandan.net/p/115824
4,,令人惊讶的简单方法可以从饮用水中去除微塑料,http://jandan.net/p/115818
5,,突破：预测三体混沌行为的新方法,http://jandan.net/p/115806
6,,数学家利用AI在椭圆曲线中发现了意想不到的模式,http://jandan.net/p/115815
7,,今日好价 0306,http://jandan.net/p/115813
8,,北极可能在十年内出现首个无冰日,http://jandan.net/p/115819
9,,今日好价 0307,http://jandan.net/p/115825
10,,人口萎缩的新世界,http://jandan.net/p/115844
11,,今日好价 0308,http://jandan.net/p/115836
12,,芯片巨头 ASML 可能离开荷兰,http://jandan.net/p/115829
13,,相比以前，食物的营养变少了,http://jandan.net/p/115816
14,,能否延缓衰老而不生病？,http://jandan.net/p/115834
15,,耗时140小时：德国建成欧洲最大3D打印建筑,http://jandan.net/p/115842
16,,无厘头研究：精制碳水早餐会拉低颜值,http://jandan.net/p/115830
17,,苹果封了 Epic 的开发者账号，在欧盟介入调查后准备解封,http://jandan.net/p/115851
18,,长新冠可能导致脑损伤,http://jandan.net/p/115832
19,,今日好价 0309,http://jandan.net/p/115846
20,,新型“水电池”更便宜、可回收且不会爆炸,http://jandan.net/p/115827
21,,墨西哥：美国的转基因玉米不安全,http://jandan.net/p/115841
22,,失眠、情绪障碍和生酮饮食,http://jandan.net/p/115831
23,,脑洞：把森林用作巨型中微子探测器,http://jandan.net/p/115833
24,,彗星撞击理论不会消亡,http://jandan.net/p/115817
25,,饥荒的伤痕：不仅影响今生，还会遗传后代,http://jandan.net/p/115843
26,,世界首个再生性听力药物试验成功完成,http://jandan.net/p/115820
27,,模拟禁食疗法或能延缓衰老，降低疾病风险,http://jandan.net/p/115839
28,,研究探索蜥蜴“潜水”的降温效应,http://jandan.net/p/115826
29,,脊髓实时监测给慢性疼痛带来治疗新希望,http://jandan.net/p/115840
30,,短期暴露于高浓度空气污染每年导致全球100万人死亡,http://jandan.net/p/115847
