index,hot,title,href
1,104,用数据说话，光谷四初提升最高，达到27.82%！！！,https://www.guozaoke.com/t/110982
2,88,选车了选车了，太纠结了,https://www.guozaoke.com/t/110984
3,72,武汉offer选择问题,https://www.guozaoke.com/t/111086
4,69,早高峰的地铁真让人绝望,https://www.guozaoke.com/t/111025
5,66,如果全家都不用去公司上班，你会选择住哪个城市？,https://www.guozaoke.com/t/111007
6,64,现在还有人买bba么？,https://www.guozaoke.com/t/111168
7,63,以后女朋友问我谈过几个对象怎么回答？,https://www.guozaoke.com/t/111095
8,57,2024光谷初中升学率贴,https://www.guozaoke.com/t/111014
9,51,帮娃找个大学生兼职，主要负责工作日下午陪娃玩、教说话,https://www.guozaoke.com/t/111076
10,48,发现恋爱中为对方改变自己也是很珍贵的经历？,https://www.guozaoke.com/t/111005
