index,hot,title,href
1,12043384,离线休息权入法的提案已立案
2,11316076,龙抬头的讲究大有学问
3,10402034,这些民生举措与你我有关
4,9788984,二月二庙会有多热闹
5,9680466,清明节 调休
6,9656231,春日吃花美食向导
7,9269312,外国人有多爱中国火锅
8,9230484,火车高级软卧是什么样的
9,9137545,天津辟谣五大道的马累倒了
10,9087507,明天龙抬头
11,9084327,驻俄大使谈美制裁干扰中俄经贸
12,9048901,这首BGM和春日夜景太配了
13,9024515,什么是X疾病
14,9018677,这是我的程艾影
15,8959761,宋亚东回应失利
16,8956406,高君雨发烧不退再进ICU
17,8885585,这个飞拍救球我看了无数遍
18,8752179,盘点金庸笔下的经典小说
19,8726411,全抖音翻拍檀健次张婧仪吵架
20,8671020,跟异性聊天需要注意什么
21,8617310,送你一棵爱心树
22,8609762,甘肃省委书记胡昌升谈灾后重建
23,8474973,Loveshot翻跳
24,8464836,宋亚东三回合惜败彼得严
25,8396928,免疫力低下怎么办
26,8379898,黄绮珊爆改男妆
27,8363560,尚筱菊包袱响不响全靠岳云鹏求人
28,8315602,朴综星翻唱初恋
29,8143151,霉霉演唱会现场感染力
30,8094131,董卿带儿子看展
31,8062096,业主把小区地下车位砌成房间
32,8059999,印度考场再现大规模作弊
33,7902181,“麦克阿瑟”粉丝破百万
34,7773113,云神再次回应霸哥脚本事件
35,7766429,西班牙将正式承认巴勒斯坦国
36,7723009,只求与你共华发
37,7719162,如果羊驼遇上诈骗电话
38,7651639,李宇春演唱会后劲好大
39,7643549,何超琼当模特推广贵州苗绣
40,7639180,13名未成年人骑电摩飙车被控制
41,7639162,马龙3:1胜A勒布伦
42,7616099,扭扭棒蝴蝶美到心里去了
43,7591248,石宇奇2:0战胜兹科闯进决赛
44,7409406,春天逛公园才是正经事
45,7352068,模仿知否大娘子摔跤名场面
46,7301615,巴基斯坦军队和阿富汗临时政府交火
47,7194862,ChatGPT每天耗电超50万度
48,7159706,利物浦vs曼城
49,7060130,杨鸣被李晓旭误伤
50,7049580,张国伟加盟天津队
