index,hot,title,href
1,,码农日记：只有下雨天才能用的Wi-Fi,http://jandan.net/p/116101
2,,特朗普也减肥成功了？,http://jandan.net/p/116132
3,,马斯克面临的不只是特斯拉销量下滑，还有X上泛滥的黄推,http://jandan.net/p/116120
4,,人口断崖：继黑死病后全球首次人口下降,http://jandan.net/p/116103
5,,突破性进展：新研究发现素数可以被预测,http://jandan.net/p/116126
6,,日本姓氏危机：2531年，所有人都将姓佐藤,http://jandan.net/p/116104
7,,研究发现，所有30岁以下的亿万富翁都是继承者,http://jandan.net/p/116124
8,,甄嬛也懂贝叶斯公式,http://jandan.net/p/116092
9,,研究发现，水熊虫蛋白能减缓人类衰老,http://jandan.net/p/116097
10,,生酮饮食或能改善严重精神疾病,http://jandan.net/p/116102
11,,今日好价 0403,http://jandan.net/p/116108
12,,睡眠不足：一夜老去的现代病,http://jandan.net/p/116125
13,,今日好价 0402,http://jandan.net/p/116099
14,,心盲光谱：完全“盲想”的大脑体验,http://jandan.net/p/116106
15,,如何测定你的衰老速度，以及如何减缓衰老,http://jandan.net/p/116134
16,,自我感觉年轻的人可能真的老得慢,http://jandan.net/p/116115
17,,17个未解的科学谜团,http://jandan.net/p/116133
18,,藏红花：世界上最贵的香料,http://jandan.net/p/116121
19,,今日好价 0405,http://jandan.net/p/116129
20,,今日好价 0404,http://jandan.net/p/116119
21,,今日好价 0406,http://jandan.net/p/116137
22,,AI制造的垃圾正在污染我们的文化,http://jandan.net/p/116111
23,,科幻小说与太阳之死,http://jandan.net/p/116113
24,,睡眠与主观年龄：保护睡眠以保持年轻感,http://jandan.net/p/116114
25,,消毒剂可能损害大脑关键支持细胞,http://jandan.net/p/116105
26,,永远的黑夜面：首颗确认潮汐锁定的超级地球,http://jandan.net/p/116110
27,,NASA将为月球设计新的时钟,http://jandan.net/p/116123
28,,研究发现暗能量正在减弱,http://jandan.net/p/116131
29,,我们能通过工程手段解决气候危机吗,http://jandan.net/p/116122
30,,衰老与免疫系统失衡：靶向治疗血细胞恢复年轻态,http://jandan.net/p/116130
