index,hot,title,href
1,182,与男友的关系何去何从,https://www.guozaoke.com/t/105733
2,117,”和男友关系何去何从”帖引起了我的思考和共鸣,https://www.guozaoke.com/t/105862
3,80,大哥们，第一辆车真的好难选啊,https://www.guozaoke.com/t/105902
4,76,web前端，工作两年半，不知道是继续在武汉还是去广东,https://www.guozaoke.com/t/105787
5,75,现在农村人的经济状况，很不乐观,https://www.guozaoke.com/t/105773
6,68,白沙洲的保利新武昌和光谷东的绿地国际理想城，怎么选,https://www.guozaoke.com/t/105818
7,65,为什么说深圳是美食荒漠，我咋觉得比武汉还强点,https://www.guozaoke.com/t/105828
8,63,毕业7年半收入,https://www.guozaoke.com/t/105769
9,60,去光谷东逛了逛，明白大悦城的重要性了,https://www.guozaoke.com/t/105850
10,53,撞了出租车，对方居然找我要 3000 块钱误工费,https://www.guozaoke.com/t/105730
