index,hot,title,href
1,84,看看三只羊看看斗鱼、伴伴武汉和合肥的差距,https://www.guozaoke.com/t/113566
2,69,房贷商贷还剩163万 每个月房贷7700 如履薄冰,https://www.guozaoke.com/t/113630
3,57,有没有什么车推荐,https://www.guozaoke.com/t/113518
4,57,周六晚上长江烟花秀,https://www.guozaoke.com/t/113530
5,52,40-50个W的SUV求推荐，谢谢！,https://www.guozaoke.com/t/113629
6,50,外企能不能去,https://www.guozaoke.com/t/113531
7,49,如果有庇护工签机会且单身，你会放弃目前的工作去美帝从事月薪4000刀左右的蓝领工作吗？,https://www.guozaoke.com/t/113533
8,46,大基建该停了，唯G D P论的考核制度也该熄火了,https://www.guozaoke.com/t/113427
9,45,感觉有点厌倦城市了,https://www.guozaoke.com/t/113470
10,44,为什么这么多公司搬离武汉？,https://www.guozaoke.com/t/113563
