index,hot,title,href
1,928 万热度,2024 巴黎奥运会乒乓球女团金牌赛中国队 3:0 战胜日本，取得奥运五连冠，如何评价本场比赛？,https://www.zhihu.com/question/663925402
2,856 万热度,OpenAI发布安全报告，GPT-4o失控行为首次公开，克隆人类声音、诡异尖叫引发恐慌，如何看待此事？,https://www.zhihu.com/question/663873102
3,572 万热度,7月小米SU7销量超越特斯拉登顶第一，如何看待这一成绩？,https://www.zhihu.com/question/663911064
4,356 万热度,为什么人死后尸体会变硬，超市里的肉却嫩嫩的？,https://www.zhihu.com/question/663163952
5,315 万热度,澳大利亚这个国家，体育怎么这么强？,https://www.zhihu.com/question/663744083
6,174 万热度,东方甄选主播天权称江小白不是白酒，随后发文道歉，江小白称不接受个人的、非正式道歉，如何看待此事？,https://www.zhihu.com/question/663909167
7,167 万热度,2024 巴黎奥运会男子单人 10 米台跳水决赛，中国选手曹缘夺冠，如何评价这场比赛？,https://www.zhihu.com/question/663849989
8,115 万热度,2024 巴黎奥运会艺术体操团体全能决赛，中国队艺术体操队夺冠，如何评价本场比赛她们的表现？,https://www.zhihu.com/question/663925890
9,93 万热度,美国申诉夺铜后气炸罗马尼亚，你对此事件有哪些评价？,https://www.zhihu.com/question/663701175
10,73 万热度,高合汽车母公司进入破产预重整，员工称售后与客服仍正常运行，此前高管直播带货自救，公司前景是否乐观？,https://www.zhihu.com/question/663873761
11,70 万热度,为什么遇到被「催工作」的时候，明知道可以晚些处理，但依旧为不能「立即回应」而生气和焦虑？,https://www.zhihu.com/question/663582718
12,69 万热度,如何评价凡应动画概念PV?,https://www.zhihu.com/question/663952299
13,68 万热度,为什么在人人不愿生孩子的今天，还有很多人在耗心耗时的做试管？,https://www.zhihu.com/question/604831250
14,66 万热度,整个部门的同事都在躺平，职场新人应随波逐流还是逆流而上?,https://www.zhihu.com/question/663707357
15,63 万热度,可以看看你相册里的蓝色吗？,https://www.zhihu.com/question/663670233
16,59 万热度,一人在家的时候，你会好好做饭吃饭吗？,https://www.zhihu.com/question/661391793
17,59 万热度,上海有店家将盖浇饭改叫「中式能量碗」，这样的改名合适吗？盖浇饭和能量碗你更喜欢哪种叫法？,https://www.zhihu.com/question/662487863
18,59 万热度,2024巴黎奥运会女子66kg级拳击冠军阿尔及利亚选手卡利夫因性别遭到质疑，奥组委如何定义选手性别？,https://www.zhihu.com/question/663899666
19,56 万热度,你读过最有意境的诗词有哪些?,https://www.zhihu.com/question/661734598
20,38 万热度,2024 巴黎奥运会举重男子 102 公斤级，中国选手刘焕华夺冠，如何看待本场比赛他的发挥？,https://www.zhihu.com/question/663925629
21,27 万热度,所有人都在劝别裸辞的环境下，为什么还有那么多人离职？,https://www.zhihu.com/question/662862400
22,22 万热度,你能以《七夕》为题，翰墨寄情，为中国的情人节打call么？,https://www.zhihu.com/question/663457646
23,22 万热度,如果诞生了粮食的工业化合成方法，世界会变成怎样？,https://www.zhihu.com/question/658076705
24,20 万热度,有哪些形容美女美到极致的诗句？,https://www.zhihu.com/question/659240927
25,9 万热度,古代锁子甲防御有多强？,https://www.zhihu.com/question/47731136
26,9 万热度,青岛地铁小伙被打事件出现反转，官方通报被打小伙对多名乘客进行言语滋扰已被行政拘留，此事带来哪些警示？,https://www.zhihu.com/question/663874127
27,9 万热度,如何评价温仕培执导，朱一龙主演的电影《负负得正》？,https://www.zhihu.com/question/663600911
28,8 万热度,以色列同意恢复加沙停火谈判，计划 8 月 15 日派出谈判代表团 ，谈判结果将如何影响局势走向？,https://www.zhihu.com/question/663829526
29,8 万热度,如何评价《崩坏：星穹铁道》2.4版本【日抛忆质留影计划】活动?,https://www.zhihu.com/question/663793542
30,8 万热度,全红婵跳水水花为什么那么小？年龄小体重轻有可能是主因吗？,https://www.zhihu.com/question/477828599
