index,hot,title,href
1,5472,第三届恶意代码检测挑战赛报名通道开启！等你来战,https://www.anquanke.com/post/id/292288
2,6715,阿里云成为Gartner® WAAP市场指南报告云WAAP代表厂商,https://www.anquanke.com/post/id/292320
3,7768,字节跳动安全研究团队公布大模型联邦精调最新研究进展,https://www.anquanke.com/post/id/292328
4,1.1万,6 大关键词，回顾网络安全行业的 2023！,https://www.anquanke.com/post/id/292345
5,2.0万,恶意软件能否绕过沙箱？它们是如何做到的？,https://www.anquanke.com/post/id/292342
6,1.4万,瑞典最大的连锁超市Coop再遭勒索软件团伙攻击,https://www.anquanke.com/post/id/292340
7,1.4万,IDC发布2023中国医疗行业网络安全市场洞察报告,https://www.anquanke.com/post/id/292337
8,1.4万,高通芯片漏洞可通过语音通话进行远程攻击,https://www.anquanke.com/post/id/292335
9,1.3万,攻击者滥用 Google OAuth 端点劫持用户会话,https://www.anquanke.com/post/id/292329
10,2.2万,网络安全治本之路：2023 年击败犯罪的 7 项网络行动,https://www.anquanke.com/post/id/292326
11,1.5万,Black Basta Buster：帮助勒索软件受害者的解密器,https://www.anquanke.com/post/id/292324
12,1.4万,新的 DLL 搜索顺序劫持技术以 WinSxS 文件夹为目标,https://www.anquanke.com/post/id/292321
13,2.6万,澳大利亚和新西兰领先的汽车经销商Eagers Automotive遭受网络攻击停摆,https://www.anquanke.com/post/id/292308
14,3.3万,恶意软件Meduza Stealer推出加强版,https://www.anquanke.com/post/id/292310
15,2.4万,2024 年加密领域需要注意的 5 大网络安全威胁,https://www.anquanke.com/post/id/292312
16,2.5万,云安全Google Kubernetes Engine 中的漏洞可能允许集群接管,https://www.anquanke.com/post/id/292303
17,3.8万,更改密码无济于事：新手法威胁谷歌帐户安全,https://www.anquanke.com/post/id/292301
18,3.9万,人工智能技术预测：2024 年的展望,https://www.anquanke.com/post/id/292299
19,4.3万,窃取8200 万美元—韩国区块链服务Orbit Bridge 遭受黑客攻击,https://www.anquanke.com/post/id/292297
20,2.4万,两部门印发《工业领域数据安全标准体系建设指南 (2023版)》,https://www.anquanke.com/post/id/292295
