index,hot,title,href
1,11388687,国防部：祖国统一 台湾当归
2,10610034,蛋糕鞋不就来了么
3,10406887,12306累计发售春运车票6108万张
4,9916047,过年流行梗整活不能停
5,9615064,郑钦文晋级澳网女单决赛
6,9569283,东部战区回应美舰过航台湾海峡
7,9567223,牛仔服爆改包包
8,9539324,云南镇雄山体滑坡致44人遇难
9,9332907,吃维生素C可以预防乙流吗
10,9293284,村里的年味儿也越来越浓了
11,9134297,甘雨小时候太萌了
12,9110622,这一刻幸福被具象化
13,9103141,俞敏洪倪萍冯仑为蔡磊颁奖
14,9090508,真是一场酣畅淋漓的战斗
15,9079254,韩教授称慰安妇属于卖淫女
16,9017010,许久不见杨振宁亮相抖音
17,9003873,绿皮返乡记
18,8987456,张大仙不赢不上厕所
19,8946862,臭蛋带你在广州吃喝玩乐一整天
20,8927134,胡塞武装称导弹击中美军舰
21,8921734,韩国13岁小女孩出道
22,8848515,张大大陈泽连麦
23,8745471,哈尔滨 NorthEast羽绒服
24,8732256,刘亦菲给偶遇的粉丝签名
25,8723171,国防部回应中国军力世界第三
26,8699936,昆卡原唱gidle入驻抖音
27,8655150,唐悠悠仿妆
28,8640641,第二十条赵丽颖戴耳塞原因
29,8497563,迎接龙年看我的
30,8490862,王梓薇跟着知否小桃游开封
31,8469362,为配这首歌翻遍了整个相册
32,8428345,怪不得云南每个赛季都这么强
33,8421119,田曾佩同志逝世
34,8385224,小动物保护协会关注猴子与猫事件
35,8373026,韩国门将大脚开到对面球员身上
36,8329936,最后之后翻唱挑战
37,8328169,江西新余火灾39人遇难
38,8297249,王迅带你吃成都火锅
39,8293589,霍启刚谈担任天津政协委员
40,8268673,狗狗鼠鼠一起跳舞
41,8253699,伯远吴映香新歌爱不落幕
42,8138806,原来我有一个超人爷爷
43,8086144,减重100斤的贾玲惊呆潘斌龙
44,7959595,交警回应虞书欣司机违规倒车
45,7947899,美三艘核航母集结朝鲜半岛海域
46,7912350,萌娃舞台素养满级
47,7907418,孙千魏哲鸣新剧吻戏
48,7885997,春晚经典台词挑战
49,7800975,龙年萌娃福气穿搭
50,7800448,特朗普首次回应暴瘦
