index,hot,title,href
1,,女性骑行者的隐形伤害：阴唇肿痛,http://jandan.net/p/116640
2,,安全起见，NSA建议每周重启一次手机,http://jandan.net/p/116675
3,,科学家发现了新的计数方法,http://jandan.net/p/116643
4,,史海钩沉：被遗忘的中文键盘,http://jandan.net/p/116664
5,,演员如何记住台词,http://jandan.net/p/116649
6,,睡眠质量与贫富差距,http://jandan.net/p/116674
7,,有些人对阿尔茨海默病有奇怪的抵抗力,http://jandan.net/p/116642
8,,今日好价 0530,http://jandan.net/p/116637
9,,人工智能耳机：只需看一眼就能在人群中听清特定声音,http://jandan.net/p/116630
10,,神秘的戴森球可能有另一种解释,http://jandan.net/p/116665
11,,今日好价 0531,http://jandan.net/p/116648
12,,乳制品营销扭曲了我们看待牛奶和营养的方式,http://jandan.net/p/116662
13,,世界首个牙齿再生药物将在九月进入人体试验,http://jandan.net/p/116651
14,,宇宙到底有几个洞,http://jandan.net/p/116661
15,,今日好价 0603,http://jandan.net/p/116679
16,,橙汁危机促使寻找替代水果,http://jandan.net/p/116639
17,,纹身与淋巴瘤的潜在关联,http://jandan.net/p/116631
18,,今日好价 0602,http://jandan.net/p/116670
19,,电子分数化现象引发科学家困惑,http://jandan.net/p/116653
20,,今日好价 0601,http://jandan.net/p/116658
21,,护眼妙招还是噱头？眼保健操的真相,http://jandan.net/p/116666
22,,假新闻的背后：1%用户制造了80%的谣言,http://jandan.net/p/116660
23,,素食真的能降低疾病风险吗,http://jandan.net/p/116641
24,,拥有第三只拇指并不难,http://jandan.net/p/116672
25,,TikTok被指要分离源代码，独立开发美版算法,http://jandan.net/p/116663
26,,好的睡眠能减轻孤独感,http://jandan.net/p/116652
27,,能杀死致命细菌同时保护肠道微生物群的“聪明”抗生素,http://jandan.net/p/116650
28,,研究发现，3-6岁儿童更相信机器人而非人类,http://jandan.net/p/116667
29,,酮体能提升认知功能并保护大脑吗,http://jandan.net/p/116673
30,,音乐能让食物更美味吗？,http://jandan.net/p/116638
