index,hot,title,href
1,体坛,有情人终成眷属！刘雨辰赛后成功求婚黄雅琼！,https://www.dongqiudi.com/article/4441859
2,体坛,圆梦巴黎！郑思维/黄雅琼2-0双杀韩国组合，6场一局未失强势夺金,https://www.dongqiudi.com/article/4441809
3,足球,恩德里克到底是不是“水货”?,https://www.dongqiudi.com/article/4441913
4,体坛,奥运舞台的浪漫，八年前里约奥运会秦凯也曾在此向何姿求婚,https://www.dongqiudi.com/article/4441877
5,足球,什么是鲁能泰山精神？,https://www.dongqiudi.com/article/4441900
6,体坛,圆梦巴黎，七载并肩！雅思组合正式达成大满贯成就,https://www.dongqiudi.com/article/4441850
7,足球,给国安剪了个视频,https://www.dongqiudi.com/article/4441895
8,足球,【战报丨奥斯卡破门又伤退 雄狮客场1-1战平西海岸】,https://n.dongqiudi.com/webapp/tops.html?id=4441892
9,足球,特狮：亚马尔已经很出色但还能进步；为罗贝托的情况感到难过,https://www.dongqiudi.com/article/4441826
10,足球,英媒：国米截胡影响了西汉姆，现在仍取决于万-比萨卡的决定,https://www.dongqiudi.com/article/4441832
11,篮球,西班牙男篮vs加拿大首发出炉：亚历山大、阿尔达马领衔,https://www.dongqiudi.com/article/4441863
12,足球,记者：切尔西今天将与加拉格尔谈未来，他们不想把关系弄僵,https://www.dongqiudi.com/article/4441853
13,篮球,日本男篮主帅：没实现奥运会的目标，但有很多积极的方面,https://www.dongqiudi.com/article/4441813
14,足球,官方：罗马签下上赛季西甲金靴多夫比克，他将身披11号球衣,https://www.dongqiudi.com/article/4441840
15,体坛,“雅思”组合圆梦巴黎！,https://n.dongqiudi.com/webapp/tops.html?id=4441843
16,足球,记者：博塔弗戈有意引进塞德里克，阿贾克斯等其他队也在考虑,https://www.dongqiudi.com/article/4441819
17,足球,摩洛哥国奥4-0美国国奥晋级半决赛，阿什拉夫一条龙破门,https://www.dongqiudi.com/article/4441822
18,足球,邵佳一：感谢队员们拼尽全力，他们按照我赛前的部署做得很好,https://www.dongqiudi.com/article/4441814
