index,hot,title,href
1,11100546,辽宁胜广东总比分2:2
2,11087220,皇马拜仁欧冠次回合前瞻
3,10959109,塞尔维亚热烈欢迎中国朋友
4,10758459,赵睿宣布赛季可能提前报销
5,10015314,嫦娥六号探测器近月制动
6,9763223,永辉超市涨停
7,8510950,专家：年轻人缴费为家乡父母养老
8,8491192,星穹铁道知更鸟上线
9,8482144,山东人谈山东到底穷不穷
10,8384268,范闲暴打范思辙打出新造型
11,8353983,中方回应美收紧对华为出口限制
12,8326203,“清华校庆不见国旗”系谣言
13,8323749,赵梓婷 张露文
14,8312462,600元的防攀比鞋调研引热议
15,8297773,送别青岛救人英雄王龙
16,8220906,铁路部门通报列车员称山东人穷
17,8207529,樊振东大满贯止步16强
18,8170676,先秦淑女步素是什么梗
19,8140222,爱情有完美适配吗
20,8120105,东部战区回应美舰过航台海
21,8111184,范伟为拍朝云暮雨暴瘦30斤
22,8093998,椰树涉擦边广告被罚40万
23,8069657,重庆办案民警意外火出圈
24,8060339,爱妈妈从一份告白礼开始
25,8052718,干部被妻子举报出轨长期吃空饷
26,8044757,陪你看海的人比海更温柔
27,8013550,椰树集团去年卖了50亿
28,7984091,北京进入全球最富有城市前十
29,7972237,和平精英地铁逃生模式
30,7961943,男子在串串店门口被刺身亡
31,7959983,朴灿烈将solo出道
32,7943434,林雨申新剧演霸总又欲又撩
33,7937679,Alielie发千字长文向Uzi道歉
34,7872089,你收到过高铁“漂流瓶”吗
35,7844565,救人溺亡小伙家属获100万慰问金
36,7831461,Uzi劝AJ放弃学习TheShy打法
37,7806493,湖南高院直播执行退还彩礼
38,7800668,女孩产子与闺蜜踩死婴儿获刑
39,7792712,当小孩遇到冰淇淋采访
40,7792545,驴友穿越雪山时发现遇难者
41,7784475,原来人生可以不跟着导航走
42,7774537,当我看到新款iPad Pro价格
43,7773934,近距离看福建舰有多帅
44,7765565,怨苍天变了心眼神杀挑战
45,7754396,莫文蔚盛夏的果实清唱挑战
46,7740017,小孩子能有什么烦恼
47,7696501,张雨绮连皮蛋都能代言成珠宝
48,7695032,钟楚曦新剧被霸总前任背刺
49,7689453,伸手就要
50,7681406,在这首歌里陷入爱河
