index,hot,title,href
1,11832437,人类幼崽春日撒欢计划
2,11650837,SpaceX星舰第三次试飞提前结束
3,11342515,多名外国记者即兴挑战科目三
4,9782248,为什么我们接受不了成龙变老
5,9563209,复刻霉霉巡演战袍
6,9546434,燕郊爆炸事故原因披露
7,9522324,燕郊爆炸伤者救治费用由政府统筹
8,9438564,不扫兴的男朋友被我找到咯
9,9389895,青海洪水致数十人去世系谣言
10,9373203,天水“麻辣滚烫”的热情
11,9356991,SpaceX星舰第三次试飞
12,9229804,河北燕郊爆炸与炸鸡店无关
13,9178198,李炮儿cosplay减肥法
14,9156697,一栗小莎子怀孕了
15,9041256,马斯克祝贺星舰已达到环绕速度
16,8948747,独生女举报父亲代孕生子
17,8937567,黄渤杨幂蒋欣亮相功夫熊猫4
18,8909660,315消费者权益日
19,8881988,国内驴皮报价每吨上调2万元
20,8820893,与毛孩子间的羁绊会一直延续
21,8725279,花间令首支预告
22,8687234,化妆师兔子爆改童锦程
23,8625963,美媒曝美特种部队常驻金门等地
24,8517048,星舰第三次试飞成功进入太空
25,8486016,小孩哥的名字把民警难坏了
26,8368793,歌名叫你走却句句在说别走
27,8242378,眨眼车灯转场变得离谱起来了
28,8233921,和春天跳一支舞
29,8019855,竹杖芒鞋轻胜马
30,8000908,萝卜大叔回应网友关心
31,7998227,网友实拍SpaceX星舰发射基地
32,7982467,谁懂魂穿动漫场景的含金量啊
33,7824983,明星春日花式健身指南
34,7762109,新学了几种笑声
35,7728543,宫崎骏奥斯卡获奖新片定档
36,7653904,校方回应一男子校园内裸奔
37,7645383,沙丘2带火废土风
38,7560588,王鹤润古风红衣亡国公主
39,7447823,普京：“吸血鬼舞会”要结束了
40,7410391,有时爱恨就在一瞬间
41,7406049,四个人三瓶水该怎么分
42,7384678,他们每次跳完都会互相对视一笑
43,7381023,宿迁学院通报学生不雅视频
44,7321325,真的有人可以帅一辈子
45,7301467,嗨 亲爱的大力士小姐
46,7084408,筷子走起麻辣烫吃起
47,7080434,电视剧小日子开播
48,7053392,鞠婧祎新剧演恶女
49,7043588,明星接受采访时的不同类型
50,7021200,灿烂的她刘浩存努力会看到光
