index,hot,title,href
1,14,相亲尽量避开30岁以上的,https://www.guozaoke.com/t/114205
2,11,上海松江那事儿，为啥没人站出来呢？,https://www.guozaoke.com/t/114203
3,11,明天开市，社友做好准备了吗,https://www.guozaoke.com/t/114219
4,10,无事来灌下水，看看有多少人来,https://www.guozaoke.com/t/114202
5,8,节后一定会有史诗级的暴跌,https://www.guozaoke.com/t/114206
6,8,电子地图，绝对是互联网最良心的产品,https://www.guozaoke.com/t/114220
7,7,外媒看的消息,https://www.guozaoke.com/t/114212
8,7,回乡见闻,https://www.guozaoke.com/t/114224
9,6,这一波大家几个点了，本韭35个点左右,https://www.guozaoke.com/t/114201
10,5,中国哪个省的旅游资源最丰富,https://www.guozaoke.com/t/114208
