index,hot,title,href
1,7719,《老祖宗严选 - 中华田园犬》,http://www.acfun.cn/v/ac46044691
2,4248,音乐人的事怎么能叫抄呢（第88期）,http://www.acfun.cn/v/ac46047366
3,3604,师兄别来，妹妹的丝袜破了…【金庸·岳灵珊】,http://www.acfun.cn/v/ac46045702
4,3184,隋卞一做 |我知道这个汤很简单但还是想认真的教给你！—冬瓜薏米老鸭汤,http://www.acfun.cn/v/ac46043781
5,8254,这种有女人味吗？★手机竖屏1231★,http://www.acfun.cn/v/ac46039413
6,2310,就这个修女爽！,http://www.acfun.cn/v/ac46046529
7,3001,【灼热陪玩】一起鹅鸭杀！,http://www.acfun.cn/v/ac46046043
8,2263,我爸不会做饭是种什么体验？【掌】边养娃#3,http://www.acfun.cn/v/ac46048046
9,1140,【东方】推特东方小视频选集 第191期,http://www.acfun.cn/v/ac46045540
10,6297,大王，该上早朝了！,http://www.acfun.cn/v/ac46043507
11,1129,【AC独家】厨娘鹤｜用六盒虾尾做虾尾拌面（视频末有小彩蛋）,http://www.acfun.cn/v/ac46048297
12,5475,★求投五蕉★网络上常见的热门短视频集锦 第一千八百八十七期,http://www.acfun.cn/v/ac46036033
13,2077,蒋天养霸气执掌洪兴，东星耀阳就凭你也想翻天《古惑仔4》陈浩南最大靠山出现！,http://www.acfun.cn/v/ac46047574
14,3040,韩服王者的饭菜果然与众不同！韩服最强王者组下饭集锦#11,http://www.acfun.cn/v/ac46045527
15,1655,如果可以【翻唱】,http://www.acfun.cn/v/ac46048146
16,3093,捏到软柿子啦【今天有什么好笑的 #1643】,http://www.acfun.cn/v/ac46047471
17,1372,这首歌居然和粤语这么适配？！粤语版《空の箱》填词翻唱！哭泣少女乐队【ACFUN声唱云参赛2024】,http://www.acfun.cn/v/ac45991201
18,1873,这是我见到的最干净的印度食物了,http://www.acfun.cn/v/ac46046308
19,2311,叮夜叮不咚，鞋又鞋不会,http://www.acfun.cn/v/ac46046200
20,1796,人工降雨,http://www.acfun.cn/v/ac46046209
21,2013,小区的年轻妈妈们晒背,http://www.acfun.cn/v/ac46046177
22,1780,你笑是什么意思,http://www.acfun.cn/v/ac46046313
23,3329,她还在那里吗？欢乐八点档-1000,http://www.acfun.cn/v/ac46042561
24,1681,将军，虎父无犬子啊，将军！,http://www.acfun.cn/v/ac46046239
25,1545,怎么办？看完这个汗流浃背了啊兄弟们！,http://www.acfun.cn/v/ac46048060
26,1275,你的清纯女孩计划【0803高坂穗乃果生贺】,http://www.acfun.cn/v/ac46046061
27,1155,理想中的小偶像！AKB48-借口而已Maybe / 言い訳Maybe,http://www.acfun.cn/v/ac46044753
28,1068,吉他弹唱|英国国歌（误）《Don t look back in anger》——Oasis,http://www.acfun.cn/v/ac46045719
29,1715,这难道就是失传已久的打鼠棒法？,http://www.acfun.cn/v/ac46046242
30,2617,羽毛球 混合双打 决赛 中国VS韩国（单身狗被暴击嘞——,http://www.acfun.cn/v/ac46045637
