index,hot,title,href
1,足球,中超球队亚冠两连败！申花全场0射正0-3柔佛新山，特谢拉伤退,https://www.dongqiudi.com/article/4581750
2,足球,20分钟连丢三球，十人海港0-3浦项铁人，亚冠遭遇两轮不胜,https://www.dongqiudi.com/article/4581538
3,体坛,爆冷！王楚钦1-3丹麦选手林德，止步WTT中国大满贯男单32强,https://www.dongqiudi.com/article/4581692
4,足球,十一假期第一天双双0-3…大家觉得中超谁能顺利出线？,https://www.dongqiudi.com/article/4581802
5,足球,特奥告别格列兹曼：很高兴能和你一起踢球，谢谢你！,https://www.dongqiudi.com/article/4582049
6,电竞,麒麟向世界！LNG官宣S14出征海报&出征大名单：Scout在列,https://www.dongqiudi.com/article/4582006
7,体坛,WTT中国大满贯第3日综述：王楚钦爆冷出局，其余名将悉数晋级,https://www.dongqiudi.com/article/4582055
8,足球,默尼耶：战皇马要把简单的事做好，做这些不需成为C罗或梅西,https://www.dongqiudi.com/article/4582039
9,篮球,Shams：火箭与前CBA福建男篮外援梅克签下一份Exhibit 10合同,https://www.dongqiudi.com/article/4582015
10,足球,英媒：纽卡仍对埃弗顿前锋勒温感兴趣，有意在冬窗签下他,https://www.dongqiudi.com/article/4582008
11,足球,英媒：曼联渴望击败利物浦、切尔西，引进富勒姆后卫罗宾逊,https://www.dongqiudi.com/article/4582010
12,篮球,西蒙斯谈崔永熙：他人非常好，在健身房训练很刻苦,https://www.dongqiudi.com/article/4581981
13,足球,埃梅里：很高兴能在主场面对拜仁，希望我们能享受明天的比赛,https://www.dongqiudi.com/article/4582005
14,足球,英媒：利物浦计划明年一月签穆德里克，并愿意报价3000万镑,https://www.dongqiudi.com/article/4582003
15,体坛,辛纳：中国会有更多优秀球员出现；对阵阿尔卡拉斯将非常艰难,https://www.dongqiudi.com/article/4581974
16,足球,卡拉格：本赛季安菲尔德球场的气氛有时候不是很好,https://www.dongqiudi.com/article/4581977
17,足球,图片报：拜仁前锋哈里-凯恩已经恢复集体训练,https://www.dongqiudi.com/article/4581983
18,体坛,斯诺克国锦赛：傅家俊5-2领先被吕昊天逆转，塞尔比晋级,https://www.dongqiudi.com/article/4581964
19,足球,里肯：我和沙欣都出自俱乐部青训，这可能只有多特蒙德能做到,https://www.dongqiudi.com/article/4581949
