index,hot,title,href
1,11833105,2024年研考国家线发布
2,11677107,李炮儿再次挑战减肥
3,11063324,川西气田全面建成投产
4,10451019,云南打歌舞已经出国了
5,10195841,朱梓骁被纪凌尘气肿了
6,10172680,无限超越班名场面模仿秀
7,9682499,彭于晏少林分晏
8,9568617,起猛了刘浩存旺仔小乔合唱了
9,9388586,公园挖树搞植树节系谣言
10,9367270,当朋友说拍完这段手势舞就出门
11,9318991,男子中14.6万彩票被传中了500万
12,9265017,千万别让自媒体博主待在老家
13,9184779,人民网评点读机女孩事件
14,9135234,当你有只臭美小狗
15,9128742,KO甩棍男的外卖小哥回应了
16,9128397,被沙丘美学暴击
17,9109026,小日子还没播就已经上头了
18,9016035,pay姐面具手势舞上大分
19,8797693,唐艺昕曾拒绝过张若昀求婚
20,8699478,晴天回应为家乡人民放烟花
21,8682583,考研国家线波动分析
22,8670454,吴克群镜头下熬夜长沙另一面
23,8648572,农村断缴城乡居民医保背后
24,8636514,檀健次张婧仪吵架的梗过不去了
25,8576715,莫言说我和古尔纳不会失业
26,8477137,粤语有多有梗
27,8473498,明星镜头下的小确幸
28,8450129,向往的生活里小羊小不点去世
29,8402535,官方通报“点读机女孩”事件
30,8369302,一猫就是千军万马
31,8326692,在外互助父母条约
32,8318097,黑车变道与白车并行时突然开车门
33,8296454,无聊就啃个菠萝吧
34,8271319,网友自制“巴黎世家胶带手镯”
35,8195643,JN.1系列变异株成主要流行株
36,8162586,萌娃怎么证明自己真睡着了
37,7938493,香港双婴命案婴儿无出生记录
38,7924088,为啥女生找对象在意男生身高
39,7901786,我们普通且热烈地活着
40,7868882,跟着抖音大口嗦面
41,7838629,眨眼车灯转场
42,7770248,爷爷送了我一只陪考小狗
43,7708181,幸福这门课今年拿了满分
44,7687661,小徐考研成绩超国家线66分
45,7601566,深深的话我们浅浅说
46,7595828,姚安娜老师对不起
47,7575905,卓沅：种下一片希望
48,7545186,10万亿资产跳水
49,7515752,欢迎来到大学宿舍拍摄现场
50,7510669,爸爸癌症去世3岁儿子患白血病
