index,hot,title,href
1,11441009,铁路部门优化车票改签规则
2,11178166,贾玲减肥100斤
3,10523063,第九届亚冬会吉祥物亮相
4,9869035,田姥姥和山东姥姥的Battle
5,9681347,曝爱泼斯坦找17岁少女陪侍王子
6,9552166,国际劳工组织：全球失业率将上升
7,9515450,谁丢了一只大金毛
8,9514055,姐的rap真不是盖的
9,9463346,云南辟谣摩托车撞电动车致9死
10,9365934,这样的老手艺已经不多了
11,9357857,我国在海上发射一箭三星
12,9216688,哈尔滨冰王座登场
13,9183333,玩家历经8853次挑战击败BOSS
14,9149327,全网期待陈泽首播
15,9142121,小伙在北极偶遇四川老乡
16,9074095,日本地震灾区收到大量过期物资
17,9074061,国风美人遇水则变
18,8952095,贾玲回忆24岁突击减肥
19,8913370,孙千魏哲鸣新剧19层定档
20,8854858,歌者终于找到了跑不了的听众
21,8831571,24年过个24K年
22,8781979,娄艺潇千户苗寨民族风大片
23,8763828,IU粉发造型
24,8731145,丸子就是我的互联网女儿
25,8673437,李若彤体验内蒙古传统服饰
26,8617138,王源环球人物专栏暂停
27,8499771,为了河南文旅小豫米操碎了心
28,8498182,老人女儿回应张馨予买气球
29,8467505,电影动物园里贾冰被熊咬了
30,8461027,李世贵被查
31,8424174,大学生德华是什么梗
32,8417980,胡锡进：萝莉岛坑美媒不敢跳
33,8416351,远渡美国的三轮上牌照了
34,8152038,我的娱乐圈干饭搭子
35,8106724,照亮大家的2024
36,8020234,教育局回应学生趴桌午睡收费
37,7987689,如何看待本科生回炉读职校
38,7947837,火车秒变“电影院”
39,7935799,吃顿宝总泡饭吧
40,7908230,我取快递的穿搭
41,7906964,台抗议民众齐喊民进党下台
42,7906135,董勇：没想到靠唱安妮出圈
43,7885922,侦察英雄到处都是心眼子
44,7885413,董宇辉说好的教育是让孩子做自己
45,7864802,小孩哥也拒绝不了怀里的小猫咪
46,7817569,人一瘦就压不住福
47,7808612,周迅公司申请好多人商标
48,7782029,外交部：美方应慎重处理涉台问题
49,7756133,中国第25个GDP万亿城市
50,7709292,伦纳德说降薪为能留下哈登乔治
