index,hot,title,href
1,足球,阿根廷新一期大名单：梅西缺席，劳塔罗、恩佐在列,https://www.dongqiudi.com/article/4480383
2,足球,反转了？王涛重提梅西香港事件真相，我懂球迷热议中>>,https://www.dongqiudi.com/article/4480229
3,足球,莱切vs亚特兰大：拉菲亚、尼古拉-克尔斯托维奇首发，德凯特拉雷、帕萨利奇出战,https://www.dongqiudi.com/article/4480693
4,足球,记者：那不勒斯租借+3000万欧强制买断费报价卢卡库将被拒绝,https://www.dongqiudi.com/article/4480668
5,足球,斯基拉：尤文在等待卡卢卢明天的最终答复,https://www.dongqiudi.com/article/4480649
6,篮球,哈登中国行在成都吃火锅，并与杨毅&王猛&徐静雨&周玲安合影,https://www.dongqiudi.com/article/4480653
7,足球,官方：巴萨签下赫罗纳21岁边锋奥斯卡-乌雷尼亚,https://www.dongqiudi.com/article/4480643
8,足球,奥萨苏纳总监：想在拜仁成名不容易，希望萨拉戈萨能恢复状态,https://www.dongqiudi.com/article/4480625
9,体坛,拉沃尔杯名单：纳达尔和阿卡领衔欧洲队，美国4人入选世界队,https://www.dongqiudi.com/article/4480566
10,足球,勒伯夫：恩佐是对曼城表现最差的球员，感觉他没有准备好战斗,https://www.dongqiudi.com/article/4480620
11,足球,中乙第19轮观众人数：泰山B队2059人最多，黑马青年仅83人,https://www.dongqiudi.com/article/4480583
12,足球,罗马诺：切尔西即将完成菲利克斯的交易，谈判已进入最后阶段,https://www.dongqiudi.com/article/4480604
13,足球,德天空：巴萨已明确通知京多安，他需在今夏离队,https://www.dongqiudi.com/article/4480599
14,足球,英媒：维拉愿意放阿莱士-莫雷诺离队，诺丁汉森林等队有意,https://www.dongqiudi.com/article/4480596
15,足球,马奎尔：我们想再赢得一座奖杯，想在上赛季的基础上继续进步,https://www.dongqiudi.com/article/4480574
16,足球,超喜欢这件复古拜仁,https://www.dongqiudi.com/article/4480603
17,足球,皇家社会主席：如果阿森纳对梅里诺的报价不错，我们就会答应,https://www.dongqiudi.com/article/4480582
18,足球,罗马诺：尤文正在推动卡卢卢的转会谈判，各方在继续讨论,https://www.dongqiudi.com/article/4480558
19,足球,科尔威尔：现在需要耐心并继续努力，相信我们会不断进步,https://www.dongqiudi.com/article/4480555
