index,hot,title,href
1,足球,又一超长合约！官方：热刺与帕普-萨尔续约至2030年,https://www.dongqiudi.com/article/3949836
2,足球,巴黎人报：阿什拉夫将在法超杯后前往摩洛哥队报到,https://www.dongqiudi.com/article/3949851
3,足球,吉鲁：我很关注统计数据；未来？我的注意力不会超过这赛季,https://www.dongqiudi.com/article/3949840
4,足球,邮报：南安普顿对利物浦21岁小将法比奥-卡瓦略有意,https://www.dongqiudi.com/article/3949834
5,足球,罗马诺：雷吉隆预计冬窗再次租借离开热刺，多特在关注他,https://www.dongqiudi.com/article/3949833
6,足球,萨拉赫：我想拿非洲杯冠军；利物浦有球员能做我正在做的事情,https://www.dongqiudi.com/article/3949832
7,足球,你也是二次元？索兰克模仿《咒术回战》五条悟无量空处,https://www.dongqiudi.com/article/3949829
8,足球,青训出品，曼联12月最佳球员候选：加纳乔、埃文斯、梅努,https://www.dongqiudi.com/article/3949828
9,足球,记者谈国足加练：输球加练没问题，但也要做好沟通并调整思路,https://www.dongqiudi.com/article/3949827
10,足球,金玟哉当选2023年度韩国足球先生，拜仁官方发文：恭喜你获奖,https://www.dongqiudi.com/article/3949823
11,足球,罗马诺：曼联冬窗可能租借前锋，舒波-莫廷是他们的现实选择,https://www.dongqiudi.com/article/3949815
12,足球,邮报：曼联希望奥纳纳留队出战热刺，正与喀麦隆谈判,https://www.dongqiudi.com/article/3949814
13,足球,曼晚：曼联没有明确的比赛风格，滕哈格犯了和索帅一样的错误,https://www.dongqiudi.com/article/3949811
14,体坛,网球联合杯1/4决赛对阵：中国vs波兰，郑钦文将挑战斯瓦泰克,https://www.dongqiudi.com/article/3949808
15,足球,德泽尔比：很惊讶三笘薰进亚洲杯名单，队医说他得休养4-6周,https://www.dongqiudi.com/article/3949807
16,足球,晚旗报：多特已就马特森转会与切尔西谈判，蓝军要价3000万镑,https://www.dongqiudi.com/article/3949805
17,足球,体图：弗罗因德将会负责拜仁冬窗转会，夏窗则可能换成艾贝尔,https://www.dongqiudi.com/article/3949795
18,篮球,深圳男篮主帅：明明是裁判自己犯错，非要把错误放在我们身上,https://www.dongqiudi.com/article/3949790
19,足球,记者：拉特克利夫将与曼联各部门开会，了解俱乐部运营情况,https://www.dongqiudi.com/article/3949787
20,,赫塔费vs巴列卡诺：格林伍德、马约拉尔首发，勒热纳、埃斯皮诺出战,https://www.dongqiudi.com/article/3949785
