index,hot,title,href
1,12131088,原神原宇宙放映节
2,12106581,不吃晚饭能减肥吗
3,11486964,把青春华章写在祖国大地上
4,11435126,看完大秀我悟了秋季穿搭秘籍
5,10709682,刀郎成都演唱会
6,10671760,不同民族的新娘婚服
7,9511098,赵丽颖飞天视后
8,9494573,中日减持美债意味着什么
9,9438911,2024飞天星光颁奖
10,9376627,雷佳音飞天视帝
11,9323196,狂飙剧组亮相飞天奖红毯
12,9278340,河南vs成都蓉城 球迷冲突
13,9170222,杨超越说没有圈外朋友
14,8928331,“桂林将撤销城管局”是谣言
15,8921668,用实况图记录日常碎片
16,8871393,江西新余39死火灾调查结果公布
17,8646591,黄轩官宣
18,8539503,当Faker发错私信给Caps
19,8323287,林俊杰青岛演唱会
20,8047180,第34届飞天奖红毯
21,8037030,江西3名副部因39死火灾被问责
22,7995028,2024年法考
23,7771111,iPhone 16 Pro Max测评
24,7768582,那些年我们爱过的时尚爆改好物
25,7745204,永劫无间手游S2赛季前瞻
26,7740405,我和你最天生一对
27,7738703,蒋奇明原声我先用了
28,7734725,太阳下去明天依旧爬上来
29,7727047,我的青春没有售价
30,7719872,蔡徐坤赵露思同框看秀
31,7703099,降温穿搭来咯
32,7699455,梅德韦杰夫获新职 负责征兵
33,7692709,重庆终于下雨了
34,7686455,Ditto手势舞
35,7669844,黎真主党高级领导人遇袭身亡
36,7660369,镜头反转记录我和好朋友
37,7656212,GAI康康合唱兰花草
38,7652335,邓紫棋演唱会遇大雨
39,7651315,原来小狗坐车也会变憔悴
40,7649000,肉：我太难了
41,7648595,随心所欲太贵了
42,7645691,计算机二级
43,7641661,小狗吹风就是在刷短视频
44,7641095,累了就把心事放一放
45,7640757,反差氛围感转场拿捏
46,7638776,欧文再现经典招牌过人动作
47,7631537,赵奕欢方圆痞幼同框
48,7624118,申花2:1逆转津门虎 于汉超绝杀
49,7621859,我的生活费都在吃吃吃
50,7619200,美国总统选举开启提前投票
