index,hot,title,href
1,"28,223",六大低估值行业潜力十足 机构看好15家公司未来3年前景,https://finance.sina.com.cn/stock/relnews/cn/2024-10-11/doc-incscaaf1825403.shtml
2,"19,686",韩江获诺贝尔文学奖，她的作品有哪些已被引进国内？,https://finance.sina.com.cn/wm/2024-10-11/doc-incsavun8252698.shtml
3,"17,083",A股，尾盘发生了什么？可能与一则消息有关,https://finance.sina.com.cn/stock/roll/2024-10-11/doc-incseiwf1481508.shtml
4,"15,044",中一签赚11万？有人已血亏，最高四天跌超80%！集运期货爆发，19cm涨停！,https://finance.sina.com.cn/stock/zqgd/2024-10-11/doc-incsecpw7672280.shtml
5,"13,044",必须高度警惕的信号！一夜之间，近50只A股公告遭减持，该怎么看？,https://finance.sina.com.cn/stock/stockzmt/2024-10-11/doc-incscsxx1499635.shtml
6,"13,034",风暴眼｜买股还是买房？有人重仓地产股1天赚1200万，有人股市血赚800万又买房,https://finance.sina.com.cn/stock/wbstock/2024-10-11/doc-incseivr1288500.shtml
7,"10,000",10月11日操盘必读：影响股市利好或利空消息,https://finance.sina.com.cn/stock/cpbd/2024-10-11/doc-incscnsa8407138.shtml
8,"9,870",这类资产，异军突起！下一阶段主线在哪？,https://finance.sina.com.cn/money/fund/jjdt/2024-10-11/doc-incscsya7807095.shtml
9,"7,563",吴清将出席2024金融街论坛年会开幕式并发表主旨演讲,https://finance.sina.com.cn/jjxw/2024-10-11/doc-incscxfw8259552.shtml
10,"7,205",王健林担保也跳票？永辉超市：出售万达商管股权又没收到款 将提起仲裁,https://finance.sina.com.cn/roll/2024-10-11/doc-incschkh8039388.shtml
