index,hot,title,href
1,7175,第一届主题歌接龙【琉存琉念】,http://www.acfun.cn/v/ac42580334
2,2.5万,请问嫂子有男朋友吗？欢乐八点档-700,http://www.acfun.cn/v/ac42577064
3,4481,《鲜花》,http://www.acfun.cn/v/ac42580080
4,4386,《将进酒》,http://www.acfun.cn/v/ac42577591
5,6244,哈哈哈哈哈哈我不行了，听完已经会唱了,http://www.acfun.cn/v/ac42577345
6,3146,【嘉也子】温润旗袍  烟雨行舟,http://www.acfun.cn/v/ac42578419
7,5265,"快速看完一局韩服王者斗殴局#531 Teddy, PlanB, 小超梦, Guti, Diable",http://www.acfun.cn/v/ac42579110
8,6452,傲世群雄！！！★手机竖屏934★,http://www.acfun.cn/v/ac42579639
9,1371,【东方】推特东方小视频选集 第151期,http://www.acfun.cn/v/ac42567808
10,5038,大哥这生意做的贴心，一听500预算吃鸡，立马给安排分期服务,http://www.acfun.cn/v/ac42577250
11,3381,号称十月霸权的狩龙人到底好看不？为了拯救爱人，满级大佬重回一周目新手村！,http://www.acfun.cn/v/ac42579239
12,6041,头一次吃了有文化的亏,http://www.acfun.cn/v/ac42577351
13,6213,没找到工作好可以这样生存，网友总结的一份流浪攻略,http://www.acfun.cn/v/ac42577350
14,5835,作业写完了吗！......(今日好笑开心视频：1251),http://www.acfun.cn/v/ac42578998
15,2346,【难忘今宵】超大型合唱！大家在一起真的都太棒啦！,http://www.acfun.cn/v/ac42584197
16,6880,舞统台湾了。。。,http://www.acfun.cn/v/ac42577354
17,5038,价值1400的CF被找回，线下真实竟然当面跑了，结局令人舒适,http://www.acfun.cn/v/ac42577278
18,4916,行行出状元，铺床都可以这么优雅,http://www.acfun.cn/v/ac42577356
19,2390,整个餐厅都是下三路为主题！今天就给大家整个全鞭宴！,http://www.acfun.cn/v/ac42584209
20,1353,【cc君】jazz改编版aoa短裙,http://www.acfun.cn/v/ac42542094
21,4564,强迫症患者能坚持到第几个,http://www.acfun.cn/v/ac42577285
22,4280,海鲜店老板手把手教你怎么剥皮皮虾，学起来,http://www.acfun.cn/v/ac42577273
23,4803,坏了！这个老外已经把中国人的核心科技给学走了,http://www.acfun.cn/v/ac42577277
24,7979,小伙子干的漂亮！！真解气,http://www.acfun.cn/v/ac42577355
25,5396,超千万播放，16岁高中生讲解四维世界,http://www.acfun.cn/v/ac42577349
26,4699,哈哈哈哈哈哈哈真的太喜欢看这种烂梗了,http://www.acfun.cn/v/ac42577265
27,1659,爱的天国,http://www.acfun.cn/v/ac42579949
28,5654,一名韩国女主播直播时碰巧记录下了逃离曼谷枪击案现场的画面……,http://www.acfun.cn/v/ac42577334
29,4339,全红婵陈芋汐平地入水，这水花是真的吗,http://www.acfun.cn/v/ac42577218
30,5033,现在动手成本太高了，能动口绝不动手，后备箱放一大瓶矿泉水，当拿出来那一刻，就让对方知道他已经输了,http://www.acfun.cn/v/ac42577323
