index,hot,title,href
1,265,浪漫与赤诚，加州的夏天永不落幕,https://www.kaiyanapp.com/detail.html?vid=319178
2,336,脑洞创意大片，意面起源于宇宙大爆炸,https://www.kaiyanapp.com/detail.html?vid=320527
3,250,时代终结，Netflix 最后的 DVD 狂欢,https://www.kaiyanapp.com/detail.html?vid=320465
4,394,奥斯卡提名定格动画，「兽性」与压抑,https://www.kaiyanapp.com/detail.html?vid=320457
5,168,脑洞创意广告，解锁在月球上弹钢琴,https://www.kaiyanapp.com/detail.html?vid=320314
6,209,百万博主骑行混剪，上演自行车花式大秀,https://www.kaiyanapp.com/detail.html?vid=320458
7,126,催泪公益广告，她们急需更多时间,https://www.kaiyanapp.com/detail.html?vid=320193
8,109,猎奇科普：机器人能否通过人机身份验证,https://www.kaiyanapp.com/detail.html?vid=320289
9,181,超多绝美镜头，治愈 MV「不会游泳的鱼」,https://www.kaiyanapp.com/detail.html?vid=320473
10,123,一果多用，专家解释佛手柑为什么卖得贵,https://www.kaiyanapp.com/detail.html?vid=320531
