index,hot,title,href
1,,惯性思维不可取：揭秘“五大行”的暴涨之谜！——兼谈国内股市十大热门消费股,http://xueqiu.com/9363345092/299022416
2,,A股遍地黄金，满眼机会20240727,http://xueqiu.com/1553799558/299004961
3,,认怂，知止,http://xueqiu.com/6038415265/299007312
4,,中远海控和马士基的对比,http://xueqiu.com/7045644041/298948698
5,,创新药的投资逻辑,http://xueqiu.com/5672579962/299002223
6,,价值如何战胜了成长？,http://xueqiu.com/1340904670/298986677
7,,基金重仓股的下降螺旋,http://xueqiu.com/3559889031/298699324
8,,定性分析中国核电的投资价值,http://xueqiu.com/3480266212/298744264
9,,康方生物和SMMT的冰与火之歌,http://xueqiu.com/2693678800/298835540
10,,杭州银行2024半年度业绩快报简评：一如既往地优秀,http://xueqiu.com/2466842102/298817968
11,,当五粮液的股价回到了五年前,http://xueqiu.com/7368170779/298887454
12,,大宗超级周期系列（4）大涨前，还是要走完最后一波下跌,http://xueqiu.com/6087293231/298887856
13,,股市至暗时刻，聊几个分享,http://xueqiu.com/1643044849/298890336
14,,向伟大的投资者学习,http://xueqiu.com/9927088462/298782060
15,,不要轻易接飞刀！,http://xueqiu.com/8687456694/298823764
16,,告别了3年，今天又开始买入招行,http://xueqiu.com/6146592061/298814838
17,,消费品投资的两个小窍门,http://xueqiu.com/3840065805/298790298
18,,平煤股份：2024年半年度经营数据,http://xueqiu.com/6014436876/298741778
19,,A股杀跌最后一个阶段，巴哥同你们一同穿越股市周期,http://xueqiu.com/1929796343/298725487
20,,沪深300追涨杀跌？策略指数能治这病！（07.25）,http://xueqiu.com/9391624441/298721293
