index,hot,title,href
1,11731813,许家印拟被终身证券市场禁入
2,11634404,为正规淀粉肠发声
3,11299434,中国大市场正在成为世界大机遇
4,11279944,我用什么把你留住翻唱
5,10084865,证监会拟对许家印罚款4700万
6,9854788,带家人来福建体验簪花吧
7,9570944,开封王婆说媒现场太顶了
8,9544894,北京沙尘蓝色预警
9,9503018,“雅江山火救援力量撤出”不实
10,9479241,撒个娇差点变流浪猫了
11,9161789,外交部发言人上新
12,9153939,饲养员用铁锨驱打大熊猫被辞退
13,9141009,甘肃麻辣烫三件套
14,9125398,当我和我爸太熟
15,9099464,夫宇淀粉肠公开生产流程
16,9074040,孩子和妈妈的对话
17,9037612,en版若梦终于来了
18,8963561,中华娘穿搭
19,8907429,哒哒哒哒哒哒挑战
20,8876242,狗狗金子的弟弟们有名字了
21,8738778,三只羊就梅菜扣肉事件致歉
22,8718347,卢伟冰开小米SU7现身
23,8670141,方圆谈和痞幼友情
24,8624663,你猜是姜文还是姜武入驻抖音
25,8561387,官方通报13岁在校生猥亵女生
26,8551635,用CCD拍油菜花好有生命力
27,8530398,德善啊剧本不是告诉你了吗
28,8516529,黄轩为家乡甘肃打call
29,8404723,当中华小子小虎发型照进现实
30,8393669,用外语唱知否有多烫嘴
31,8360355,在韩国吃泡面能多有仪式感
32,8352673,瓷器厂vs杭州闪电虎鲸
33,8346758,开封王婆回应走红
34,8328816,与凤行不按套路出牌
35,8176215,在医院割颈自杀规培生家属发声
36,8168823,俄罗斯猫猫挡弹片救下主人
37,8161435,恒大地产被证监会罚款41.75亿
38,7914532,春天又该健身了
39,7866463,马斯克AI大模型Grok开源
40,7750020,同学这个称呼就要不属于我了
41,7746015,林依晨你翻唱
42,7722700,张睿是来无限超越班吃饭的
43,7702419,天水不止有麻辣烫
44,7701913,没有什么阻挡着未来
45,7651571,带火天水麻辣烫的女孩找到了
46,7632681,建议张慧雯最近避避风头
47,7622708,穿薄荷曼波跳曼波
48,7620132,环卫工捡30万“现金”后续
49,7510670,我的人生现状
50,7470419,李兰迪崩溃了我也崩溃了
