index,hot,title,href
1,11702045,教资人的精神状态之面试
2,11607237,当峨眉派女弟子走入校园
3,10988060,预防诺如病毒“五要五不要”
4,10473615,韩国国防部长递交辞呈
5,9928793,春节申遗成功
6,9522081,琼瑶儿子发声
7,8453849,医生谈如何做好老人临终关怀
8,7923727,爷爷还挺会修行李箱
9,7820902,永夜星河庆功宴
10,7809487,立刻回到你的世界
11,7790658,作家琼瑶轻生离世
12,7789227,二月红求的东西逐渐离谱
13,7788929,孙颖莎林诗栋看梁靖崑采访的反应
14,7784232,新疆滑雪场从洗手间接水系谣言
15,7776293,火影手游百战佩恩全技能爆料
16,7772351,冯绍峰婚内婚外的演技
17,7766538,夏弃疾拍的田嘉瑞黑蛇味儿对了
18,7754040,万物皆可AI羊毛卷
19,7742079,这就是学音乐的魅力吧
20,7740417,京西有条文化带
21,7737907,迪丽热巴ELLE2025开年刊
22,7736885,曼联vs阿森纳前瞻
23,7735970,欢迎来到贵哈顿
24,7735260,范尼执教蓝狐首秀开门红
25,7733772,权志龙新歌被KBS判为不合格
26,7732715,欢迎来到我的城市
27,7731222,奥斯卡若续约需接受降薪
28,7728392,BGM一响就到贵阳了
29,7713877,武磊赴意大利疗伤
30,7710350,库里看上了毒角Show的爆米花
31,7699226,或许是因为有你在我身边
32,7694131,杜兰特伤退
33,7693847,用喜报的方式讲述伤心事
34,7693369,蓝心羽巡演
35,7680112,用沈腾王安宇当头像壁纸
36,7679803,烟花转场挑战我先拍了
37,7673880,晒出你的冬日穿搭
38,7673403,有照片就能随地大小唱
39,7670584,尖叫之夜主打passion
40,7669180,下个月就过年了
41,7667233,我妈当年怎么看上我爸的
42,7662747,香奈儿大秀 灯光
43,7656726,徐明浩新歌MV
44,7656407,富贵女人谁不爱啊
45,7654710,华为Mate 70系列评测
46,7651296,时间的参照物是养大的小孩
47,7647561,在刀郎演唱会合唱有多投入
48,7646477,沉浸式穿越历史给我看哭了
49,7643325,琼瑶经典剧集回顾
50,7639996,用FallingU开启幸福模式
