index,hot,title,href
1,5.8万,上海小公司正在注销,http://club.kdslife.com/t_11275028.html
2,4.7万,有多少会日语失业躺平在家的？,http://club.kdslife.com/t_11274882.html
3,4.6万,今年上海的就业形势真的差吗？疫情不是没了？,http://club.kdslife.com/t_11274989.html
4,4.5万,沪常高速第二根车道开125码，碰到赤佬了,http://club.kdslife.com/t_11274923.html
5,4.4万,价格出来了,http://club.kdslife.com/t_11275105.html
6,3.5万,这两种身材究竟哪一种更好？,http://club.kdslife.com/t_11275010.html
7,3.4万,有没有觉得这两年车模的质量越来越高了,http://club.kdslife.com/t_11274942.html
8,3.0万,全宇宙第二大苹果店在上海开了、上海爱苹果、苹果爱上海,http://club.kdslife.com/t_11274931.html
9,2.8万,同事21年买的嘉定新房，400万，出租只有3700，租售比连1％都到不了,http://club.kdslife.com/t_11275017.html
10,2.7万,昨天和相亲女在一起全程不用我动手，算什么水平？,http://club.kdslife.com/t_11274962.html
11,2.6万,互联网大厂的收入太水了..,http://club.kdslife.com/t_11274941.html
12,2.6万,私人飞机乘务员是什么东西？每次小费才几百到一千,http://club.kdslife.com/t_11274892.html
13,2.4万,贵州发现金字塔群,http://club.kdslife.com/t_11274891.html
14,2.0万,流行大概会轮回的。,http://club.kdslife.com/t_11274958.html
15,2.1万,问界M9被撞断轴,http://club.kdslife.com/t_11274938.html
16,2.1万,这个河南租客不停诅咒上海房价暴跌,http://club.kdslife.com/t_11274927.html
17,1.9万,低增长趋势下，通缩其实比通胀好,http://club.kdslife.com/t_11274965.html
18,1.8万,12岁男孩杀害4岁女童已正常上学！,http://club.kdslife.com/t_11274996.html
19,1.9万,小伙光天化日熟妇,http://club.kdslife.com/t_11275057.html
20,1.9万,谁懂？在小私企工作的，做到几岁退休或去做外卖算是跑赢了平均数？可知足吗？,http://club.kdslife.com/t_11274878.html
