index,hot,title,href
1,11911470,金价为何暴涨暴跌
2,11775930,第11批在韩志愿军烈士遗骸回国
3,11543349,绿色农业“链”上先进制造
4,11457467,俄方回应美或在日部署中程导弹
5,10840200,南方的冬天到底有多冷
6,10635814,奶奶的爱都藏在面里
7,9409844,年轻人玩非遗用料就是猛
8,9208492,下雪了怎么能少了打雪仗
9,9196597,看不懂四大名著就上抖音
10,9183303,麦琳李行亮和好
11,9178863,警方调查5人地铁站肢体冲突
12,9130002,马斯克宣布进军游戏业
13,9121964,王者荣耀元歌玩法升级
14,9040149,“国开先行”APP系假冒
15,9015667,玉麒麟S1mple直播收徒夜
16,9000063,Daeny加入iG
17,8968836,杨子自称愿净身出户
18,8764827,再听一次叶嘉莹的诗词课吧
19,8683639,2.3万乌克兰大学生被开除
20,8664261,哈登出战三节轰43分
21,8236789,中方代表回击美方
22,8167889,蓝战非探索南极
23,8109105,谁懂权志龙这个笑啊
24,7962425,婚内婚外开播
25,7859435,我是刑警首播观后感
26,7815593,萧炎进行曲
27,7812309,以喜欢的方式去生活吧
28,7806009,女大学生在校被划伤遭学校拉黑
29,7805160,提升衣品的冬季穿搭公式
30,7794801,跑马拉松的人嘴可真严啊
31,7788140,假装给女朋友打电话
32,7778435,终于能懂苹果的电影模式了
33,7772056,麦琳承认自己是妈味老婆
34,7753620,一路繁花官宣嘉宾阵容
35,7751565,东北数学符号读法教学
36,7748158,国乒出发成都混合团体世界杯
37,7746918,只倾听不评判挑战
38,7745222,终于把一个嗷嗷待哺的婴儿养大了
39,7741314,再见爱人还是第一季正常
40,7738744,陈慧娴梅艳芳隔空对望
41,7737860,儿童发热该如何正确处理
42,7737221,杜兰特崔永熙拥抱致意
43,7731741,我收藏的冬天
44,7720976,乌克兰能源设施遭大规模袭击
45,7720297,湖人119:101大胜马刺
46,7719914,肖战不要回头
47,7713438,红米K80Pro测评
48,7703793,跟赵露思新剧学纯黑穿搭
49,7703548,陪我过个冬翻唱
50,7688017,沙一汀普通女孩
