index,hot,title,href
1,1.7万,前端做了快两年了，盘点一下我的前端技术栈,https://juejin.im/post/7313042225863426102
2,1.8万,作为曾经新东方的技术人，说说我跟孙东旭的两三事,https://juejin.im/post/7313839469047971876
3,1.3万,分裂的国产自研手机系统，究竟苦了谁,https://juejin.im/post/7313042225864540214
4,1.1万,行情太差，我被裁了,https://juejin.im/post/7314474878476877860
5,1.0万,8年前端，32岁，2023年终总结,https://juejin.im/post/7312848658717704227
6,9655,前端是怎么解析Excel、PDF、Word、PPT等文件的？,https://juejin.im/post/7313048171797544997
7,9289,在互联网卷累了？如不试试国企吧！——在5A级景区写代码是一种什么的体验 II,https://juejin.im/post/7313766185198485531
8,8741,寒冬，拒绝薪资倒挂,https://juejin.im/post/7314263159116628009
9,7849,写 Vue 我建议非必要别用 watch,https://juejin.im/post/7314860085931065359
10,8415,开源不挣钱？这个项目上线半年月入超 30w,https://juejin.im/post/7313979468879183882
11,7579,ref 还是 reactive，这是个问题,https://juejin.im/post/7313549609179447306
12,6700,圣诞节快到了，用ThreeJS给女朋友写了一个圣诞树????，她很开心,https://juejin.im/post/7314189771378065443
13,6581,当接口要加入新方法时，我后悔没有早点学设计模式了,https://juejin.im/post/7313418992310976549
14,7666,媲美GPT4，一键搭建谷歌 Gemini,https://juejin.im/post/7313242038559457306
15,6589,"Flutter到鸿蒙,不是有手就行吗? (下拉刷新)",https://juejin.im/post/7313161940283998260
16,5777,???? 分手、黑中介、中毒、亲人接连去世、丢失爱串、边缘化｜2023年终总结,https://juejin.im/post/7314207903414796299
17,7199,听说蚂蚁的职级调整了,https://juejin.im/post/7313979404993069094
18,5325,还在封装 xxxForm，xxxTable 残害你的同事？试试这个工具,https://juejin.im/post/7315242945454735414
19,6016,推荐给前端开发的 5 款 Chrome 扩展 ????,https://juejin.im/post/7313557322596466727
20,6168,周记：我看到的普通开发者退路、市值1800亿的公司CEO公开场合喷一个大学生、东方甄选这波给我看麻了,https://juejin.im/post/7313242064195469321
