index,hot,title,href
1,5.6万,窗外,http://club.kdslife.com/t_11241290.html
2,4.6万,吓一大跳  以后不敢坐飞机了吧,http://club.kdslife.com/t_11241422.html
3,3.8万,安徽男子捡到女大学生手机后向其要价千元,http://club.kdslife.com/t_11241302.html
4,3.8万,如今的文庙，已经……,http://club.kdslife.com/t_11241419.html
5,3.8万,是不是年纪大了，口味就不一样了,http://club.kdslife.com/t_11241348.html
6,3.4万,AI变脸已经可以实时了？,http://club.kdslife.com/t_11241360.html
7,3.6万,自助餐偷了20瓶饮料的新闻没有人说吗,http://club.kdslife.com/t_11241365.html
8,3.0万,什么古代百万大军，不过日本村战水平罢了！,http://club.kdslife.com/t_11241359.html
9,3.0万,王石的老婆什么都蹭呀…,http://club.kdslife.com/t_11241556.html
10,3.0万,奚梦瑶是上南新村出来的 嫁入豪门后越来越嗲了,http://club.kdslife.com/t_11241500.html
11,2.6万,迫于压力，南通机场应该取消,http://club.kdslife.com/t_11241321.html
12,2.4万,四川路人气那么差，怎么还在造大商场？,http://club.kdslife.com/t_11241444.html
13,2.2万,戒撸之后怎么保持阴阳平衡？,http://club.kdslife.com/t_11241327.html
14,2.1万,女人交往了两个月，大大皮了才知道我没婚房没正当工作，怎么办呀,http://club.kdslife.com/t_11241459.html
15,2.0万,现在手里有500万ST,http://club.kdslife.com/t_11241291.html
16,2.2万,开始起诉老破小物业了，关于老破小停车问题,http://club.kdslife.com/t_11241469.html
17,2.1万,现在谈女朋友真的很烧钱。,http://club.kdslife.com/t_11241447.html
18,2.0万,月薪2万 一年个税三万，这不就是不婚罚款吗？子女教育买房了减税,http://club.kdslife.com/t_11241341.html
19,1.9万,二手油车真的也在狂降价。。。保值率不谈了，跟电车差不多,http://club.kdslife.com/t_11241342.html
20,2.0万,70%上海人住的房子，地段好配药方便,http://club.kdslife.com/t_11241337.html
