index,hot,title,href
1,134,不再讨论,https://www.guozaoke.com/t/113355
2,85,同济的医生都这个样吗？,https://www.guozaoke.com/t/113260
3,71,人到中年，怎么缓解对父母的愧疚感,https://www.guozaoke.com/t/113233
4,69,本来对路虎女打人的事件将信将疑，结果刚刚一个通告，我彻底相信了,https://www.guozaoke.com/t/113226
5,65,深圳打工6年的仔想回武汉买房，求建议,https://www.guozaoke.com/t/113301
6,64,黑叔叔又收获满满,https://www.guozaoke.com/t/113338
7,56,怒砸8500亿修运河，内陆会崛起么？,https://www.guozaoke.com/t/113333
8,54,日俄要开战了？,https://www.guozaoke.com/t/113249
9,51,《易车圈速榜》秦L开赛道比34C快,https://www.guozaoke.com/t/113257
10,50,有没有董哥说一下为啥苹果只要求腾讯交苹果税,https://www.guozaoke.com/t/113264
