index,hot,title,href
1,足球,申花2-0三镇，姜至鹏、鲍亚雄直红，马莱莱建功，马纳法伤退,https://www.dongqiudi.com/article/4432910
2,体坛,第60次“德纳决”横扫纳达尔，德约晋级巴黎奥运网球男单16强,https://www.dongqiudi.com/article/4432802
3,足球,中超球迷冲突频发，你觉得他们是足球流氓吗？我懂热议中>>,https://www.dongqiudi.com/article/4432377
4,足球,精神小伙，佩德里晒短发造型：信守承诺,https://www.dongqiudi.com/article/4433194
5,足球,天空：富勒姆已与阿森纳就史密斯-罗的转会达成原则性协议,https://www.dongqiudi.com/article/4433195
6,足球,德天空：巴黎对基米希的兴趣是切实的，若报价合适拜仁愿放人,https://www.dongqiudi.com/article/4433177
7,足球,拜仁官方：新援帕利尼亚将于周二晚11点出席亮相发布会,https://www.dongqiudi.com/article/4433166
8,足球,德天空：拜仁高层希望先卖人再签杜埃，巴黎正在全力追逐球员,https://www.dongqiudi.com/article/4433159
9,足球,英媒：利物浦将埃因霍温中场费尔曼视为引援目标,https://www.dongqiudi.com/article/4433146
10,足球,斯基拉：乌迪内斯门将西尔维斯特里即将加盟卡利亚里,https://www.dongqiudi.com/article/4433143
11,篮球,李月汝砍31分15篮板，曾放弃400万国内合同两度加盟海外联盟,https://www.dongqiudi.com/article/4433158
12,足球,德天空：阿森纳在关注萨内，但萨内目前的趋势是留队并续约,https://www.dongqiudi.com/article/4433149
13,足球,战报 | 七月收官战 武汉三镇负于上海申花,https://www.dongqiudi.com/article/4433151
14,体坛,英国“蛙王”皮蒂感染新冠，百米蛙泳决赛前已感到不适,https://www.dongqiudi.com/article/4433091
15,体坛,射箭男团铜牌战：中国队2-6不敌土耳其队，最终排名第四,https://www.dongqiudi.com/article/4433102
16,足球,意媒：根特19岁边锋费尔南德斯-帕尔多已经被推荐给罗马,https://www.dongqiudi.com/article/4433118
17,足球,惬意的退役生活，郜林和彭伟国一起踢业余比赛并参加赛后聚餐,https://www.dongqiudi.com/article/4433073
18,足球,官方：热刺前锋布赖恩-希尔租借加盟赫罗纳一年,https://www.dongqiudi.com/article/4433094
19,足球,贝里瓦尔：比苏马告诉我要像训练那样踢球，库卢是我的大哥哥,https://www.dongqiudi.com/article/4433076
20,足球,一段意想不到的奇妙足球之旅，感受天津球迷的激情,https://www.dongqiudi.com/article/4433096
