index,hot,title,href
1,12亮,中国神话海外出圈 ，据说，今天不少外国网友都在打听一只“猴子”的身世~！,https://bbs.hupu.com/627683507.html
2,24亮,哈登给乔治传了不少好球,https://bbs.hupu.com/627683342.html
3,15亮,『姚基金慈善赛』这张截图 看懂了嘛,https://bbs.hupu.com/627683442.html
4,17亮,花式吊打！卫冕冠军骑士队74-103狂输17马刺29分！大卫李，好样儿的！,https://bbs.hupu.com/627683373.html
5,15亮,2k25能力值：格林84范弗利特84,https://bbs.hupu.com/627684494.html
6,13亮,错哥那群球迷是真恶心啊,https://bbs.hupu.com/627683967.html
7,11亮,姚基金上半场，估计也是全场的数据,https://bbs.hupu.com/627683916.html
8,5亮,第一次现场看哈登打球，虽然只认真打了两节，但很满足了,https://bbs.hupu.com/627684793.html
9,10亮,三年了为什么不看好杰伦格林的未来发展？,https://bbs.hupu.com/627683635.html
10,6亮,自从1980年以来，NBA还没有白人球员拿到过得分王，东契奇是第一个！,https://bbs.hupu.com/627684246.html
11,3亮,不懂就问老詹凭什么能当上奥运会美国代表队旗手？,https://bbs.hupu.com/627684967.html
12,7亮,应该说经过上赛季的历练，库明加才真正找准了自己的定位,https://bbs.hupu.com/627684503.html
13,6亮,【小石匠】切特·霍姆格伦：我和文班亚马之间没有存在任何分歧与过节,https://bbs.hupu.com/627683727.html
14,9亮,如果当时太阳保留艾顿会不会好很多,https://bbs.hupu.com/627683467.html
15,6亮,友善跨区，问一下关于球队对华的态度,https://bbs.hupu.com/627684059.html
16,6亮,！！！姚基金上半场，估计也是全场的数据！！！,https://bbs.hupu.com/627684252.html
17,3亮,我和欧文打百分，他先让我99分，然后欧文不能进三分线，我可以打过欧文吗,https://bbs.hupu.com/627684598.html
18,3亮,下赛季真火蜜应该关注的东西,https://bbs.hupu.com/627683652.html
19,5亮,为什么浓眉会连一个DPOY都拿不到？,https://bbs.hupu.com/627684130.html
20,40亮,"在静易墨大神最新评级中，在普通开发手类别中，格林是t4.5级。T4/T4.5:一般进攻开发手, 优质拼图。与拖哈，布兰登米勒，巴特雷，凯尔登约翰逊，卡姆托马斯一档。",https://bbs.hupu.com/627680873.html
21,4亮,如果现在你是太阳经理，凯尔特人想用塔图姆交易杜兰特，你会同意吗？,https://bbs.hupu.com/627684493.html
22,4亮,【一图流】联盟里哪些球队进攻端最能拉开空间？火箭真的堵住了外线突破路径？,https://bbs.hupu.com/627683461.html
23,5亮,答应我，下次别整这活动了。,https://bbs.hupu.com/627683857.html
24,4亮,下赛季火箭队应该还是在附加赛徘徊,https://bbs.hupu.com/627683571.html
25,4亮,上赛季护框表现，凯尔特人独一档！,https://bbs.hupu.com/627684125.html
26,6亮,你能想到今年小牛欧文走的比太阳杜兰特远吗,https://bbs.hupu.com/627683676.html
27,4亮,选巅峰小卡还是杜兰特,https://bbs.hupu.com/627684139.html
28,3亮,哪位JR能够组一支球队击败他们！,https://bbs.hupu.com/627684464.html
29,3亮,火箭上赛季护框表现排在联盟中上，凯尔特人独一档！,https://bbs.hupu.com/627684115.html
30,4亮,詹姆斯和乔丹全方面属性对比,https://bbs.hupu.com/627683618.html
31,15亮,2024年4.12这场打爵士的比赛发生了什么，格林怎么发挥成这样？谁来说说,https://bbs.hupu.com/627682382.html
32,4亮,嫂子昨晚上强度了,https://bbs.hupu.com/627683434.html
33,10亮,加鲁巴正式重返皇马，晒球衣,https://bbs.hupu.com/627681582.html
34,3亮,理性分析，为什么保罗历史地位比威斯布鲁克高,https://bbs.hupu.com/627683775.html
35,3亮,哈登状态不错啊,https://bbs.hupu.com/627683364.html
36,3亮,姚基金比赛可以看出中国球员水平多烂了,https://bbs.hupu.com/627683624.html
37,30亮,火箭队团聚于洛杉矶！参加JG的商业代言活动,https://bbs.hupu.com/627678009.html
38,30亮,乌杜卡，是不是优秀的主教练,https://bbs.hupu.com/627680286.html
39,18亮,奥尼尔东游之后科比单核带队三年两次首轮一次钓鱼是什么水平,https://bbs.hupu.com/627683146.html
40,50亮,Sam vecenie：我把格林排在联盟24岁及以下球员中第26位，火箭队内第五,https://bbs.hupu.com/627674479.html
41,3亮,今晚姚基金大战黑悟空？？,https://bbs.hupu.com/627682735.html
42,44亮,理性讨论，如果没有詹姆斯，科比的荣誉能否成为历史第二人,https://bbs.hupu.com/627680948.html
43,41亮,2019年东决G3决胜剪辑版！双方肉搏到双加时伦纳德率领猛龙捍卫主场绝境重生,https://bbs.hupu.com/627676785.html
44,30亮,理性讨论，为什么06年世锦赛美国会输给希腊,https://bbs.hupu.com/627681560.html
45,9亮,这我真不觉得中国明星队有啥丢脸的，对面打的很认真,https://bbs.hupu.com/627683135.html
46,10亮,哈登跟乔治互动了嘛？,https://bbs.hupu.com/627682824.html
47,5亮,登哥库兹马连线,https://bbs.hupu.com/627683232.html
48,7亮,登哥罚球现场在喊MVP！,https://bbs.hupu.com/627683046.html
49,5亮,在音符看球的真逆天,https://bbs.hupu.com/627683226.html
50,50亮,詹韦巅峰对决！2006年詹姆斯47分VS韦德44分,https://bbs.hupu.com/627678613.html
51,4亮,话说历史上有老詹这种在总决赛对位人数据频频上涨的超级巨星吗？,https://bbs.hupu.com/627683270.html
52,21亮,哈登还有没有可能回火箭？,https://bbs.hupu.com/627679986.html
53,19亮,23届新秀赛季平均每场破坏球权排名前三，斑马，阿门，奥萨,https://bbs.hupu.com/627678202.html
54,4亮,你船还不换小马哥，准的一批！！,https://bbs.hupu.com/627683088.html
55,5亮,哈不攻你打呀,https://bbs.hupu.com/627683091.html
56,4亮,人人裤子吗，又帅又能打,https://bbs.hupu.com/627683252.html
57,4亮,这个中国明星队丢大脸了啊，美国明星队真上身体，哈哈哈，好看,https://bbs.hupu.com/627683079.html
58,48亮,保罗距离goat级别的控卫能力上到底差了什么？,https://bbs.hupu.com/627679500.html
59,5亮,想知道为什么大家都笑话普拉姆利,https://bbs.hupu.com/627683033.html
60,7亮,鉴于目前塔图姆纯实力大于杜兰特已经无需讨论，那么双探花vs布克+杜兰特，先得100分定胜负，结果会如何？,https://bbs.hupu.com/627682769.html
