index,hot,title,href
1,鹭岛生活,[04-26]保商房取消回购了？,http://bbs.xmfish.com/read-htm-tid-18181931.html
2,鹭岛生活,[04-26]很烦经济行情不好工资打了半折。,http://bbs.xmfish.com/read-htm-tid-18182056.html
3,鹭岛生活,给个心安理得的理由躺平,http://bbs.xmfish.com/read-htm-tid-18181936.html
4,鹭岛生活,总是活得很累，想起父母总是亏欠，睡不着了,http://bbs.xmfish.com/read-htm-tid-18181941.html
5,鹭岛生活,本周末来厦门翔安看张学友演唱会，你不得不知道的事,http://bbs.xmfish.com/read-htm-tid-18181998.html
6,鹭岛生活,借警寻妻，卧槽，又多了一个成语,http://bbs.xmfish.com/read-htm-tid-18182101.html
7,鹭岛生活,周五200多斤安溪土猪肉到货,http://bbs.xmfish.com/read-htm-tid-18181964.html
8,鹭岛生活,这个房价能买吗？,http://bbs.xmfish.com/read-htm-tid-18182142.html
9,鹭岛生活,[04-26]我当版主期间，是没努力付出吗？所以荣誉版主没了吗？,http://bbs.xmfish.com/read-htm-tid-18181934.html
10,鹭岛生活,[04-26]就这样擦肩而过的运气啊！！！！！！！！！！！！,http://bbs.xmfish.com/read-htm-tid-18182118.html
