index,hot,title,href
1,132.0万,老挝，一个国家的财富被洗劫而空,https://www.huxiu.com/article/3542955.html
2,56.9万,“股市是我的提款机”，“股神奶奶”预言中国股市上万点不是梦,https://www.huxiu.com/article/3535056.html
3,54.5万,日本面临最大危机,https://www.huxiu.com/article/3537781.html
4,47.0万,机酒大跳水，为何依然吸引不来年轻人？,https://www.huxiu.com/article/3533957.html
5,64.9万,抠门年轻人，盯上始祖鸟平替,https://www.huxiu.com/article/3546813.html
6,41.5万,风力发电机必须有叶片？不是，我的世界观被刷新了,https://www.huxiu.com/article/3538440.html
7,37.8万,年轻人整顿婚礼：不接亲、没仪式，放个短片就干饭,https://www.huxiu.com/article/3539462.html
8,35.0万,30多年经验的老股民说A股：热市场，冷思考,https://www.huxiu.com/article/3541975.html
9,32.2万,阿联酋，中国老板的快乐福地？,https://www.huxiu.com/article/3541430.html
10,39.6万,通缩时代，日本中产勒紧裤腰带,https://www.huxiu.com/article/3544953.html
11,30.6万,房贷利率降了，提前还贷的人怎么样了？,https://www.huxiu.com/article/3533425.html
12,28.9万,在日本，有多少钱才能算“富裕层”呢？,https://www.huxiu.com/article/3533160.html
13,32.1万,史上最大的一笔风险投资，跌跌撞撞地来了,https://www.huxiu.com/article/3544006.html
14,34.6万,缺钱缺片，民营“五大”放弃国庆档,https://www.huxiu.com/article/3529295.html
15,25.9万,港股大逆转，还要继续冲？,https://www.huxiu.com/article/3537775.html
