index,hot,title,href
1,2461 万热度,2026 世界杯亚洲区预选赛，国足 0:3 完败韩国，孙兴慜独造三球，韦世豪伤退，如何评价本场比赛？,https://www.zhihu.com/question/631145827
2,524 万热度,斗鱼发布公告，公司 CEO 陈少杰于 11 月 16 日左右被成都警方逮捕，哪些信息值得关注？,https://www.zhihu.com/question/631187791
3,169 万热度,国内油价迎来「四连跌」，加满一箱油将省 13.5 元，油价继续下跌原因有哪些？或带来哪些影响？,https://www.zhihu.com/question/631084362
4,113 万热度,2023年注会CPA考试成绩已出，你有哪些想说的话？,https://www.zhihu.com/question/631144022
5,91 万热度,当向心理咨询师表达出我内心十分阴暗的一面， TA 会因此对我有评判吗？,https://www.zhihu.com/question/630971795
6,88 万热度,如何看待华为的25000转电机，现在在全世界上能排到什么位置？,https://www.zhihu.com/question/630542344
7,72 万热度,可以分享一下读过的最有感触的句子吗？,https://www.zhihu.com/question/630967147
8,58 万热度,俄方称「俄中贸易本币结算率已达 95%」，这意味着什么？,https://www.zhihu.com/question/631094107
9,55 万热度,缅北相关地方执法部门共向我方移交电信网络诈骗犯罪嫌疑人 3.1 万名，对于打击缅北电诈有何影响？,https://www.zhihu.com/question/631101831
10,40 万热度,怎么去释怀过去呢？,https://www.zhihu.com/question/630234157
11,27 万热度,教育的本质是筛选还是育人？,https://www.zhihu.com/question/626236405
12,20 万热度,重庆二手房成交量上涨，挂牌量超 24 万套创新高，业主​不再纠结几万块的砍价，只求尽快成交，如何解读？,https://www.zhihu.com/question/631087206
13,20 万热度,人活着最重要的是什么呢?,https://www.zhihu.com/question/631146282
14,17 万热度,化肥为什么被称为“土地鸦片”？,https://www.zhihu.com/question/581578476
15,14 万热度,为什么长江英文是The Changjiang River……这不是翻译过来成长江江了嘛？,https://www.zhihu.com/question/631002890
16,12 万热度,广州土拍不再限价，黄埔区近 40 亿元新挂牌宅地将采用「价高者得」，意味着什么？如何影响房地产市场？,https://www.zhihu.com/question/631138576
17,10 万热度,对于家长来说，有必要给儿童房安装护眼吸顶灯吗？,https://www.zhihu.com/question/629459274
18,7 万热度,中央气象台连发暴雪、寒潮、大风预警，多地将降温，局地最低温将降至 -30℃ 以下，哪些信息值得关注？,https://www.zhihu.com/question/631087161
19,5.6 万热度,现在的你，有什么新的人生感悟吗？,https://www.zhihu.com/question/629987778
20,5.5 万热度,随着科技发达大家对生活质量十分重视，你觉得什么样的厨房能满足你对生活的「高要求」？,https://www.zhihu.com/question/631129388
21,5.5 万热度,身边有一个素食者是什么感受？,https://www.zhihu.com/question/309489608
22,5.5 万热度,河南周口联通发声明称已成立工作专班对「周口联通工程师因未完成推销被辞退」进行调查。有哪些信息值得关注？,https://www.zhihu.com/question/630920509
23,5.5 万热度,在单位老遇到不公正的待遇，抗争过却没结果，身心俱疲厌倦上班，该怎么办？,https://www.zhihu.com/question/630020679
24,5.5 万热度,可以看看你手机里的天空吗？,https://www.zhihu.com/question/630815364
25,5.5 万热度,网传鸿蒙系统明年将不兼容安卓，业内人士称内部确实有这计划，如何看待此事？若实行会带来哪些影响？,https://www.zhihu.com/question/630916032
26,5.4 万热度,新手司机，不敢上路怎么办？,https://www.zhihu.com/question/629166213
27,5.4 万热度,大家买车，是颜值优先，还是智能优先？,https://www.zhihu.com/question/630581658
28,5.4 万热度,小米 Q3 调整后净利润 60 亿元，全球智能手机出货量为 4180 万台，哪些信息可关注？,https://www.zhihu.com/question/630980124
29,5.4 万热度,在岸、离岸人民币对美元汇率双双升破 7.14 ，如何看待本轮人民币汇率持续反弹？,https://www.zhihu.com/question/631102196
30,5.4 万热度,如何评价《无所畏惧》大结局？你满意吗？,https://www.zhihu.com/question/631011603
31,5.4 万热度,有哪些素颜涂也没压力的口红色号？,https://www.zhihu.com/question/562436305
32,5.4 万热度,2024 年艺考已陆续开考，「艺考文化课成绩门槛提高；大幅压缩校考规模」，新一轮艺考还有哪些变化？,https://www.zhihu.com/question/630943982
33,5.4 万热度,如何看待青岛爸爸在家长会表示相信「学渣儿子」会成为栋梁之才？有一个松弛感的家长是怎样的体验？,https://www.zhihu.com/question/630932539
34,5.3 万热度,为什么现在带《原神》节奏重心在剧情上？,https://www.zhihu.com/question/629521955
35,5.3 万热度,北证 50 指数一度涨 11%，成交额突破 100 亿元，创下指数设立以来的历史天量，发生了什么？,https://www.zhihu.com/question/631147440
36,5.3 万热度,中国与沙特签署双边本币互换协议，规模为 500 亿元人民币/260 亿沙特里亚尔，将产生哪些影响？,https://www.zhihu.com/question/630967921
37,5.3 万热度,有没有形容风的诗词?,https://www.zhihu.com/question/630920155
38,5.3 万热度,因为同事关系比较差，逐渐有「厌班」感受，怎么办？,https://www.zhihu.com/question/630020793
39,5.3 万热度,加沙地带已有约 1.15 万人死亡，加沙城和加沙地带北部所有医院停止服务，目前情况如何？,https://www.zhihu.com/question/630516927
40,5.3 万热度,拜登称「相信巴以人质换停火协议即将达成」，如何看待美方就人质问题不断放风？后续将如何发展？,https://www.zhihu.com/question/631085061
41,5.3 万热度,外媒「哈马斯领导人称与以色列『接近达成』停火协议」，哪些信息值得关注？完全达成停火协议的可能性大吗？,https://www.zhihu.com/question/631102272
42,5.3 万热度,历时 18 个月，融创中国境外债务完成重组，整体化解约 900 亿元债务风险，哪些信息值得关注？,https://www.zhihu.com/question/631087236
43,5.3 万热度,蔚来换电业务首个合作对象为长安汽车，联合研发换电车型 2025 年上市，如何评价二者的合作？,https://www.zhihu.com/question/631122541
44,5.3 万热度,《甄嬛传》中有哪些经不起推敲的地方？,https://www.zhihu.com/question/628371919
45,5.3 万热度,为什么 Loopy、玲娜贝尔等萌系表情包都无法摆脱被玩坏的宿命？如何避免表情包被误用或过度使用？,https://www.zhihu.com/question/630934608
46,5.3 万热度,监管部门拟定「房企白名单」，含约 50 家不同所有制的国内房企，要求满足其正常融资需求，透露哪些信息？,https://www.zhihu.com/question/631041193
47,5.3 万热度,去年有 9 个省份的人口出生率超过 8‰，有 20 个省份人口自然增长率为负，哪些信息值得关注？,https://www.zhihu.com/question/631012102
48,5.3 万热度,遥感研一，河海大学，基于深度学习多源变化检测方向，现在有点迷茫，不知道以后就业会怎么样？,https://www.zhihu.com/question/626237208
49,5.2 万热度,对于《葬送的芙莉莲》动画中的魔族你有哪些看法？,https://www.zhihu.com/question/629361147
50,5.2 万热度,为什么说脑子越用越好使?,https://www.zhihu.com/question/630629640
