index,hot,title,href
1,鹭岛生活,[10-20]老师让我家孩子去辅导班上的后进生，我能替孩子拒绝吗？,http://bbs.xmfish.com/read-htm-tid-18091987.html
2,鹭岛生活,马上到3000点了，要不要梭哈,http://bbs.xmfish.com/read-htm-tid-18091988.html
3,鹭岛生活,[10-20]被坑263.。大家别上当。,http://bbs.xmfish.com/read-htm-tid-18092077.html
4,鹭岛生活,漳州港别墅现在可能也就100多万。,http://bbs.xmfish.com/read-htm-tid-18092119.html
5,鹭岛生活,居住证还需要办理吗,http://bbs.xmfish.com/read-htm-tid-18092203.html
6,鹭岛生活,妈宝男到底好不好？万一他妈妈是个知书达理的好女子呢？,http://bbs.xmfish.com/read-htm-tid-18091963.html
7,鹭岛生活,欠信用卡两万五的，三年变四万多。,http://bbs.xmfish.com/read-htm-tid-18092223.html
8,鹭岛生活,不是说现在小孩减负了吗？怎么放学路上都在写作业？,http://bbs.xmfish.com/read-htm-tid-18092230.html
9,鹭岛生活,[10-20]国贸大厦二楼维修电脑手机黑店,http://bbs.xmfish.com/read-htm-tid-18092037.html
10,鹭岛生活,中国有没有研究人体特异功能的机构,http://bbs.xmfish.com/read-htm-tid-18092082.html
