index,hot,title,href
1,篮球,中国女篮59-81溃败塞尔维亚小组赛两连败！李梦10分,https://www.dongqiudi.com/article/4437666
2,足球,二进宫，记者：加利亚多将再次执教河床，下周一上任,https://www.dongqiudi.com/article/4437945
3,足球,法媒：RB莱比锡有意欧塞尔中卫马迪乌-凯塔，但面临多队竞争,https://www.dongqiudi.com/article/4437940
4,足球,跟队：曼城因近两赛季与开球延迟有关的22起违规被罚209万镑,https://www.dongqiudi.com/article/4437937
5,电竞,VCTCN官方：康康荣膺赛季最佳选手，EDG＆FPX多人入选最佳阵,https://www.dongqiudi.com/article/4437906
6,体坛,奥运八强战不敌郑钦文，科贝尔打完职业生涯最后一战,https://www.dongqiudi.com/article/4437929
7,足球,记者：吴兴涵、廖力生参加了合练，崔康熙还没有归队的迹象,https://www.dongqiudi.com/article/4437913
8,足球,记者：马竞有意朗格莱，已与球员经纪人和巴萨谈转会,https://www.dongqiudi.com/article/4437934
9,足球,晚旗报：莱斯特城接触乔丹-阿尤，水晶宫愿意放走这位老将,https://www.dongqiudi.com/article/4437930
10,篮球,李梦：自己也在逐步适应比赛强度，下一场比赛没有退路,https://www.dongqiudi.com/article/4437936
11,足球,霍尔：我想拥有像坎特一样的生涯；马雷斯卡希望我们踢得积极,https://www.dongqiudi.com/article/4437911
12,足球,Here we go！罗马诺：内维斯加盟巴黎，费用6000万+1000万欧,https://www.dongqiudi.com/article/4437915
13,足球,天空体育：西汉姆联与利兹联就萨默维尔的签约进行了深入谈判,https://www.dongqiudi.com/article/4437903
14,篮球,塞尔维亚男篮vs波多黎各首发出炉：约基奇领衔,https://www.dongqiudi.com/article/4437917
15,足球,金玟哉：首个德甲赛季很艰难，新赛季必须做得更好,https://www.dongqiudi.com/article/4437905
16,足球,德天空：多特已与曼城就扬-科托转会达成全面协议,https://www.dongqiudi.com/article/4437901
17,电竞,无畏契约2024全球冠军赛将于8月1日开赛，FPX首日亮相迎战TH,https://www.dongqiudi.com/article/4437847
18,足球,遗憾因伤缺席与热刺比赛，林加德晒与孙兴慜合照,https://www.dongqiudi.com/article/4437882
