index,hot,title,href
1,11823250,G2夺BLAST世界总决赛冠军
2,11772260,神十八乘组将于4日凌晨返回
3,11677815,神十八与空间站组合体成功分离
4,11056296,大连英博冲超成功
5,10488785,曼联vs切尔西
6,10446561,郑钦文4日晚对战莱巴金娜
7,9280611,开封大学生开始反击了
8,9239320,发型师晓华走红后的愿望
9,9224226,7:59和8:00的男生
10,9211495,百大红人变装上新啦
11,9189113,开封多个景区对大学生免单
12,9188069,半个抖音都在应援珠帘玉幕
13,9188046,跟着无人机去旅行
14,9187342,景区辟谣男子跳伞开伞失败
15,9172310,云之羽剧组在永夜星河团建
16,9167057,姿态谈BLG输T1
17,9144039,虞书欣丁禹兮片场自拍
18,9135785,金晨反复撤回嘴里羊排
19,9090287,山城小栗旬直播间被抓包
20,9079385,美国大选临近民调结果如何
21,9075074,米切尔绝杀雄鹿
22,9071075,郑钦文回应再战萨巴伦卡失利
23,8935642,大梦归离山神爷爷下线大虐
24,8924056,时髦又实穿的秋冬鞋子分享
25,8835888,慕声下意识的细节最戳人
26,8828293,梅西将出席巴萨125周年庆
27,8807275,淘宝买茅台不支持7天无理由退货
28,8677459,贾冰自曝是卧底但没人信
29,8662388,主办方否认王心凌演出提前离场
30,8544116,央视记者对话山取颜料师
31,8209936,滑雪可以提上日程了
32,8151953,西安马拉松男子冠军诞生
33,8125416,只管出发 家乡永远在你身后
34,8084209,孙滢皓好有种
35,8076211,永夜星河祛班味神器
36,8018392,Oops My Baby手势舞
37,7990164,珠帘玉幕塑造女性力量
38,7952944,好团圆中式家长好真实
39,7853005,赵露思给韩安冉发语音
40,7836002,还是加里奥
41,7809748,全网老公都在回答吃几个瑞士卷
42,7806161,苹果香憋笑挑战
43,7806105,单车到开封
44,7797399,爱你老妈明天见
45,7796829,包破防公式是什么梗
46,7796184,有的人五官一般但合起来绝了
47,7781971,奶龙也燃起来了
48,7750316,勇士加时战胜火箭
49,7743528,巴以冲突已致加沙地带43314死
50,7737473,如何看王健林出售海外资产
