index,hot,title,href
1,,90万鹤岗人，养出一个东北胖东来,https://www.36kr.com/p/2568567991444864
2,,一场投资人对2023的大总结,https://www.36kr.com/p/2568605228852872
3,,融资157亿，蔚来赢得加时丨焦点分析,https://www.36kr.com/p/2567368216274565
4,,刚刚，苏州又诞生一个明星IPO,https://www.36kr.com/p/2568480234382982
5,,以前没人要的咖啡渣，现在成了“香饽饽”？,https://www.36kr.com/p/2568353137075841
6,,聚焦汽车软件中间件平台，弋途科技完成云启资本领投数千万元融资｜36氪首发,https://www.36kr.com/p/2569010658059648
7,,一斤10元，草莓价格大跳水,https://www.36kr.com/p/2568387762070915
8,,争夺白牌，才是阿里京东的命运之战,https://www.36kr.com/p/2568993548658052
