index,hot,title,href
1,Mtian梦天,产品经理职业规划,https://www.woshipm.com/?p=5924928
2,PM产品小6,一文告诉你，做PMS产品经理你得懂什么,https://www.woshipm.com/?p=5931923
3,一年,在线教育大厂-腾讯课堂宣布停止运营，网易云课堂的产品分析,https://www.woshipm.com/?p=5930634
4,白鲸出海,18亿潜在用户的“小众”交友App，到底有多赚,https://www.woshipm.com/?p=5931942
5,产品狗随笔,返利管理系统建设指南,https://www.woshipm.com/?p=5928134
6,芒果手握,自己从0到1探索电商系统搭建——订单业务的逆向逻辑梳理,https://www.woshipm.com/?p=5930270
7,酸梅干超人,深度分析 C 端设计的发展趋势,https://www.woshipm.com/?p=5932171
8,何杨说文案,【合集】21个顶尖文案高手写作锦囊,https://www.woshipm.com/?p=5931557
9,老虎讲运营,在网购中，评价的作用有多大？,https://www.woshipm.com/?p=5931259
10,陆玖财经,活跃在小红书的“知乎倒爷”,https://www.woshipm.com/?p=5932396
11,未来消费,全网都在喊“最低价”，竟然还是拼多多最便宜？,https://www.woshipm.com/?p=5932102
12,三水一点艮,公司没钱，预算猛降，B端市场人除了离职还能怎么办？,https://www.woshipm.com/?p=5932543
13,产品李十三,为什么说商业思维的本质就是ROI,https://www.woshipm.com/?p=5926147
14,B端产品周翔,产品经理结构化思考：更适合产品经理的双钻（菱）模型,https://www.woshipm.com/?p=5931223
15,新周刊,我在网上编故事，月入十几万,https://www.woshipm.com/?p=5932112
16,蓝媒汇,盒马卷山姆，卷到了京东的地盘上,https://www.woshipm.com/?p=5932146
17,胖福馒头,A16Z创始人：创业中唯一重要的因素,https://www.woshipm.com/?p=5929728
18,产品狗随笔,业财一体化之支付系统上篇（用户视角）,https://www.woshipm.com/?p=5910473
19,大仁哥,日更10个公众号经验总结，一文全面解读公众号流量推荐机制！,https://www.woshipm.com/?p=5932632
20,言成,AI正在重塑SaaS：你准备好跟上这场技术风暴了吗？,https://www.woshipm.com/?p=5932645
21,jenson,入手充电运营平台（国内）建设：运营商账单/发票/结算,https://www.woshipm.com/?p=5931851
22,Smart的笔记宝盒,WhatsApp Business为什么会被封号？该如何解决,https://www.woshipm.com/?p=5932476
23,誓博,「凑单」功能分析,https://www.woshipm.com/?p=5931491
24,镜观台,那些网红市集，成了摊主“收割机”,https://www.woshipm.com/?p=5932304
25,刺猬公社,抢单也要开外挂？隐秘的外卖外挂江湖,https://www.woshipm.com/?p=5931609
26,和出此严,大厂产品经验：你得让用户“再认”，而不是让他回忆,https://www.woshipm.com/?p=5931586
27,陈昱志Yeutz,服务设计｜跨学科合作的共创框架,https://www.woshipm.com/?p=5929653
28,接地气的陈老师,搭建数据指标体系，掌握这三个流程最管用！,https://www.woshipm.com/?p=5931151
29,海克财经,山姆“拿捏”年轻人？,https://www.woshipm.com/?p=5931118
30,运营林同学,用户运营，一个无限接近产品经理的运营岗,https://www.woshipm.com/?p=5930276
31,芒果手握,竞品到底如何分析才能有效指导我们的产品设计？,https://www.woshipm.com/?p=5853231
32,杨帆,职场干货：关于岗位&行业选择策略,https://www.woshipm.com/?p=5932655
33,见实,同一时间，各大平台公告自媒体前台实名,https://www.woshipm.com/?p=5932630
34,产品狗随笔,业财一体化之合同管理系统,https://www.woshipm.com/?p=5921420
35,定焦One,全网最低价，“逼疯”买家和卖家,https://www.woshipm.com/?p=5932615
36,李斯克在未来,名创优品：我的黄金私域时代,https://www.woshipm.com/?p=5930832
37,道乐研究院,基金投顾如何通过内容与用户建立持续信任关系？,https://www.woshipm.com/?p=5932316
38,郑火火,太牛了！这个品牌328个粉丝承载32亿的销量,https://www.woshipm.com/?p=5931393
39,江鸟,如何提升设计的还原度？从这2方面入手！,https://www.woshipm.com/?p=5931376
40,三元方差,数据分析：略懂业务等于不懂,https://www.woshipm.com/?p=5930853
41,TCC翻译情报局,了解用户的阅读习惯，对设计的产出有多重要？,https://www.woshipm.com/?p=5932158
42,老谢运营笔记,刚刚！我又被动引流了300精准客户！研究了14年的引流玩法，还是百度霸屏更“香”……,https://www.woshipm.com/?p=5928884
43,TCC翻译情报局,空间设计｜沉浸式体验的8条设计原则和指南,https://www.woshipm.com/?p=5927310
44,李斯克在未来,万字长文 | 私域流量从用户留存到价值挖掘,https://www.woshipm.com/?p=5928608
45,新播场,突发！视频号关停弹幕互动玩法，原因为何？,https://www.woshipm.com/?p=5932555
46,DoNews,当零售战火烧向山姆后院,https://www.woshipm.com/?p=5931519
47,七叔创业圈子,「对标账号」抄得好，赚钱少不了,https://www.woshipm.com/?p=5929674
48,新智元,GPT-4V连小学生都不如？最新基准测试错误率竟高达90%：红绿灯认错、勾股定理也不会,https://www.woshipm.com/?p=5931690
49,刺猬公社,AI与恶的距离,https://www.woshipm.com/?p=5930766
50,定焦One,“全网最低价”，谁说了算？,https://www.woshipm.com/?p=5931146
51,产品狗随笔,业财一体化之电子发票管理,https://www.woshipm.com/?p=5904748
52,新智元,马库斯锐评GPT-5！急需新范式，OpenAI并无优势,https://www.woshipm.com/?p=5932506
53,刘佩龙,谈谈用研价值最大化的组织架构,https://www.woshipm.com/?p=5931027
54,首席商业评论,想爆火纯靠投流？小程序短剧并不是“暴富神话”,https://www.woshipm.com/?p=5929633
55,陈天宇宙,万字解析“通道系统设计”,https://www.woshipm.com/?p=5930974
56,白板产品,我们是真正的产品经理吗？,https://www.woshipm.com/?p=5927482
57,窄播,奢侈品降速分化，电商能抓什么机会,https://www.woshipm.com/?p=5932445
58,锌刻度,超5亿人“上头”，“抖快号”和“爱优腾”再战微短剧,https://www.woshipm.com/?p=5931637
59,科技新知,BAT地图新战争：大模型、流量与生态重构,https://www.woshipm.com/?p=5931191
60,Super黄,会读：这款AI阅读助理，能否升职为阅读总监？,https://www.woshipm.com/?p=5932415
61,文轩没有大脑袋,你按下的这个按钮，背后有哪些设计和学问？,https://www.woshipm.com/?p=5927967
62,表外表里,1158万年轻人“脱虚向实”：逃离大厂，涌入制造业,https://www.woshipm.com/?p=5930571
63,李斯克在未来,瑞幸！开始做私域吧！,https://www.woshipm.com/?p=5929887
64,产品锦李,从10大管理看产品经理的日常工作——产品进度管理,https://www.woshipm.com/?p=5923315
65,小雨杂谈,大厂产品的用户研究怎么做？分享5个方法,https://www.woshipm.com/?p=5885691
66,大力哥呀,被浪潮卷起的产品经理，须苦练看不见的基本功,https://www.woshipm.com/?p=5930715
67,新莓daybreak,即时零售的战火，随时准备重燃,https://www.woshipm.com/?p=5931526
68,互联网产品经理Mik,我所了解的机器视觉检测产品应用（1）,https://www.woshipm.com/?p=5931408
69,产品狗随笔,业财一体化之会计引擎,https://www.woshipm.com/?p=5923841
70,休克文案,“摆烂”营销——品牌年轻化的流量密码,https://www.woshipm.com/?p=5929565
71,零态LT,“电商五国”开卷双11：低价已非绝对武器,https://www.woshipm.com/?p=5931051
72,wen,一文带你解读推荐系统的核心设计思路（无公式）,https://www.woshipm.com/?p=5930218
73,芒果手握,自己从0到1探索电商系统搭建——订单业务的正向逻辑梳理,https://www.woshipm.com/?p=5930134
74,接地气的陈老师,这是我见过最好的用户行为分析攻略,https://www.woshipm.com/?p=5924955
75,志忠（运营）,从熟悉到上手，如何半路接手一个项目？,https://www.woshipm.com/?p=5929978
76,接地气的陈老师,数据分析思路，我总结了四个好用的模板,https://www.woshipm.com/?p=5927162
77,PM产品小6,如果你被任命为某款产品的产品经理，你的首要任务是什么？,https://www.woshipm.com/?p=5917776
78,老司机产品经,通过功能场景，引领付费会员转化：直击痛点，挠中痒点，畅享爽点,https://www.woshipm.com/?p=5929028
79,寻空,消费风向突变：为何元气森林、钟薛高、花西子等头部新消费品牌开始失色？,https://www.woshipm.com/?p=5928218
80,橙子小叮当,面试优缺点：要怎么回复？10种回答范例与3大原则，精准掌握HR偏好,https://www.woshipm.com/?p=5929346
81,定焦One,在抖音追小说，养肥了谁？,https://www.woshipm.com/?p=5930487
82,观察月亮的小白羊,产品经理必备技能之「UML用例图」,https://www.woshipm.com/?p=5928825
83,松果财经,双11价格博弈之下，电商大战走向何方？,https://www.woshipm.com/?p=5932697
84,乔志杰,如何做好B端产品经理,https://www.woshipm.com/?p=5909577
85,ice,十六番旅游app产品分析,https://www.woshipm.com/?p=5842442
86,烧肉女士,广告归因：用户究竟是从哪儿来的？,https://www.woshipm.com/?p=5926948
87,定焦One,秋招上岸大厂，应届生有多拼？,https://www.woshipm.com/?p=5930366
88,郑火火,霸王茶姬：互联网思维践行到极致的消费品,https://www.woshipm.com/?p=5897316
89,誓博,一文讲透SPU和SKU,https://www.woshipm.com/?p=5850460
90,新品略财观,被炒至1999元一桶，山姆泡面桶爆火的背后更值得关注,https://www.woshipm.com/?p=5860178
91,吴怼怼,蓝领互联网没有江湖，只有生活,https://www.woshipm.com/?p=5137132
92,两条人PM,视频搜索——视频平台、搜索引擎下的功能初探,https://www.woshipm.com/?p=5459091
93,汪仔7120,闲鱼竞品分析,https://www.woshipm.com/?p=4812192
94,白高粱,视频号：半封闭状态下的关系链产品,https://www.woshipm.com/?p=4183603
95,PM_COOL,企业架构概述及业务架构详解,https://www.woshipm.com/?p=5408487
96,PM老潘,【2万字】完整产品经理面试50题及回答实例（上）,https://www.woshipm.com/?p=5297149
97,无,米家竞品分析,https://www.woshipm.com/?p=5330238
98,厚厚,一文说清楚3种结构图（功能结构图、信息结构图、产品结构图）,https://www.woshipm.com/?p=5159192
99,Ella,超全面！大厂UI设计规范详解！,https://www.woshipm.com/?p=5280210
100,PM维他命,手把手教学 | B端产品经理简历撰写指南（含专业话术+多套虚拟简历模板）,https://www.woshipm.com/?p=5233033
