index,hot,title,href
1,,为什么男士衬衫钮扣在右边，而女士在左边,http://jandan.net/p/116531
2,,地球自转限制了相机防抖的性能,http://jandan.net/p/116509
3,,互联网的马桶理论：快速获取信息未必是好事,http://jandan.net/p/116537
4,,网络情人节，如何向她交出满分答卷？,http://jandan.net/p/116508
5,,突破性进展：HIV 疫苗诱发关键抗体,http://jandan.net/p/116520
6,,今日好价 0520,http://jandan.net/p/116535
7,,隐形杀手：健身补剂的健康风险,http://jandan.net/p/116540
8,,全身麻醉是如何影响大脑的,http://jandan.net/p/116551
9,,今日好价 0521,http://jandan.net/p/116546
10,,首次实验证实黑洞周围存在“死亡漩涡”,http://jandan.net/p/116521
11,,不要再寻找创业合伙人,http://jandan.net/p/116523
12,,恐怖航班：飞机遭遇严重气流颠簸，一人死亡多人受伤,http://jandan.net/p/116558
13,,今日好价 0518,http://jandan.net/p/116517
14,,记忆超凡：无法遗忘一切的人,http://jandan.net/p/116519
15,,今日好价 0522,http://jandan.net/p/116555
16,,酮症饮食诱导多器官p53依赖性细胞衰老,http://jandan.net/p/116530
17,,计算机科学家发明高效计数新方法,http://jandan.net/p/116513
18,,离奇曲率颠覆 50 年几何猜想,http://jandan.net/p/116514
19,,首次成功复活冷冻人脑组织,http://jandan.net/p/116527
20,,今日好价 0519,http://jandan.net/p/116526
21,,加州试行按里程计费取代燃油税,http://jandan.net/p/116529
22,,观鸟能改善心理健康，增强幸福感,http://jandan.net/p/116541
23,,使用胶带疗法对比冷冻疗法治疗寻常疣的有效性,http://jandan.net/p/116549
24,,科学家警告：气候变化加剧脑部疾病恶化,http://jandan.net/p/116522
25,,肠道菌群的组成可能影响决策,http://jandan.net/p/116550
26,,心脏也会影响心理健康,http://jandan.net/p/116539
27,,迷幻剂可能是对抗顽疾疼痛的新希望,http://jandan.net/p/116528
28,,阳光暴露减少死亡风险，但增加皮肤癌风险,http://jandan.net/p/116536
29,,AI声音侵权：声优起诉声音克隆公司,http://jandan.net/p/116538
30,,3M高管与科学家关于PFAS化学物质的斗争,http://jandan.net/p/116548
