index,hot,title,href
1,足球,剑南春｜曼联3-0埃弗顿，加纳乔惊天倒钩，拉师傅马夏尔建功,https://www.dongqiudi.com/article/3873040
2,足球,剑南春｜尤文1-1国米，弗拉霍维奇破门，劳塔罗扳平,https://www.dongqiudi.com/article/3873325
3,足球,剑南春｜皇马3-0加的斯，罗德里戈两射一传，贝林厄姆建功,https://www.dongqiudi.com/article/3873148
4,足球,剑南春｜维拉客场2-1送热刺三连败，沃特金斯、保-托雷斯建功,https://www.dongqiudi.com/article/3872685
5,足球,早报：横跨12年的飞身一跃,https://www.dongqiudi.com/article/3873391
6,足球,跟队记者：卡马尔达在首秀之后带着点心来训练基地感谢队友,https://www.dongqiudi.com/article/3873488
7,足球,意大利国家德比劳塔罗进球，尤文图斯1比1国际米兰！,https://www.dongqiudi.com/article/3873475
8,足球,加纳乔惊天倒钩，拉什福德点射破门，埃弗顿0比3曼联！,https://www.dongqiudi.com/article/3873474
9,足球,迪巴拉传射卢卡库助攻，罗马3比1乌迪内斯！,https://www.dongqiudi.com/article/3873473
10,足球,卡维利亚：我能踢很多位置，今天没射门但这也是我的特点,https://www.dongqiudi.com/article/3873472
11,足球,贝林厄姆复出破门，加的斯0比3皇马！,https://www.dongqiudi.com/article/3873470
12,足球,致敬偶像+复刻名宿！燃情重温加纳乔&C罗&鲁尼惊世倒钩,https://www.dongqiudi.com/article/3873469
13,足球,头号迷弟！加纳乔赛后Ins晒出对比C罗倒钩照片,https://n.dongqiudi.com/webapp/tops.html?id=3873466
14,足球,太阳报：瓜迪奥拉违规停车三小时被罚款60英镑,https://www.dongqiudi.com/article/3873462
15,足球,强势反弹，曼联在11月的三轮英超联赛中取得全胜,https://www.dongqiudi.com/article/3873442
16,足球,21年前的今天：亨利欧冠唯一一次戴帽，助阿森纳胜罗马,https://www.dongqiudi.com/article/3869211
17,,NBA战报：雄鹿108-102开拓者，字母哥33+16+6,https://www.dongqiudi.com/article/3873439
18,足球,阿莱格里：目标仍是争四；今天更重要的是不输而不是赢,https://www.dongqiudi.com/article/3873437
19,足球,法媒：尤文总监抵达英伦，见托马斯&菲利普斯&赫伊别尔经纪人,https://www.dongqiudi.com/article/3873436
20,足球,小因扎吉：尤文很强，我们接受平局；米兰和那不勒斯也能争冠,https://www.dongqiudi.com/article/3873426
