index,hot,title,href
1,118,大哥们，第一辆车真的好难选啊,https://www.guozaoke.com/t/105902
2,105,一点人生的思考,https://www.guozaoke.com/t/105954
3,84,我觉得对象对我要求太多，是正常的吗？,https://www.guozaoke.com/t/106033
4,77,回武汉vs留深圳？,https://www.guozaoke.com/t/105990
5,64,通过比较湖北、武汉、上海的数据，分析湖北的交通事故为何高居全国第一,https://www.guozaoke.com/t/105977
6,53,环境不好，待机三个月了，趁这段时间开发了个项目，帮忙用户+1,https://www.guozaoke.com/t/106006
7,45,A股正在经历新一轮的股灾,https://www.guozaoke.com/t/105962
8,44,年前请部门同事搞集体活动，除了吃饭外还有啥别的好选项？请大家集思广益，谢谢！,https://www.guozaoke.com/t/105934
9,44,办了个新ETC，在顺丰运输的过程中扣了200多高速费,https://www.guozaoke.com/t/105951
10,44,大家物业费都是多少钱一平?有成功降物业费的小区吗?,https://www.guozaoke.com/t/105961
