index,hot,title,href
1,48亮,麦迪面对杜兰特，最后时刻两次单打阿杜，一次助攻终结比赛,https://bbs.hupu.com/627367029.html
2,34亮,️兄弟们 东契奇这种球太多了 请问翻腕了吗？违例了吗？？谢谢解答,https://bbs.hupu.com/627371511.html
3,18亮,乌度卡：谢泼德能洞察对手对他采取的策略并继续打出正确的比赛，这种能力很难教,https://bbs.hupu.com/627371681.html
4,24亮,一招一式，堪比历史第二,https://bbs.hupu.com/627366849.html
5,15亮,格林效率低是个人的能力原因还是承担大量球权导致的？,https://bbs.hupu.com/627372190.html
6,8亮,录取通知书刚到和矿区老哥们分享一下,https://bbs.hupu.com/627371528.html
7,10亮,真心想知道的一件事情，一个喜欢打篮球的会真的不喜欢科比吗？,https://bbs.hupu.com/627372865.html
8,11亮,蒙特谈到劳里·马尔卡宁和犹他爵士队希望与圣安东尼奥马刺队而不是金州勇士队做生意,https://bbs.hupu.com/627372528.html
9,11亮,这只凯尔特人是历史级别球队吗,https://bbs.hupu.com/627372900.html
10,5亮,太期待奥运开幕式字母入场了,https://bbs.hupu.com/627371965.html
11,30亮,克里斯保罗21年季后赛次轮对战掘金精彩表现,https://bbs.hupu.com/627366726.html
12,6亮,爵士记者：蒙特谈到劳里·马尔卡宁和犹他爵士队希望与圣安东尼奥马刺队而不是金州勇士队做生意,https://bbs.hupu.com/627372866.html
13,3亮,托尼帕克精彩篮下终结,https://bbs.hupu.com/627372087.html
14,5亮,别要马卡了，伤筋动骨,https://bbs.hupu.com/627372854.html
15,5亮,科比生涯最强系列赛是哪一轮？,https://bbs.hupu.com/627372954.html
16,5亮,谷爱凌和詹姆斯合影,https://bbs.hupu.com/627372023.html
17,9亮,库里难掩兴奋，勇登埃菲尔铁塔,https://bbs.hupu.com/627371962.html
18,6亮,【弗雷德·范弗利特】23-24赛季精彩集锦（MaxaMillion711）,https://bbs.hupu.com/627371778.html
19,4亮,发现了一个可怕的数据，哈登职业生涯场均24.1分，16.2次出手，平均一次出手差不多1.49分。看了一圈几乎没有比他高的,https://bbs.hupu.com/627372157.html
20,7亮,这是真的吗？格兰特！,https://bbs.hupu.com/627372150.html
21,5亮,很明显格林说的那笔交易是维金斯换大洛,https://bbs.hupu.com/627372333.html
22,4亮,传交易伦纳德，不知道真假,https://bbs.hupu.com/627372673.html
23,7亮,马刺新秀胡安与巴萨男篮签约3年，还有希望登录NBA不？,https://bbs.hupu.com/627371435.html
24,7亮,分享高阶数据来源,https://bbs.hupu.com/627372630.html
25,5亮,哈登下赛季数据预测,https://bbs.hupu.com/627371774.html
26,6亮,库明加与另外四位21级新秀高阶数据对比，他能否同样获得顶薪？,https://bbs.hupu.com/627371583.html
27,3亮,老詹被称篮球goat的原因？请看VCR,https://bbs.hupu.com/627372604.html
28,4亮,郎朗发了和老詹的合照,https://bbs.hupu.com/627371759.html
29,5亮,马刺麦迪指导年轻的伦纳德训练中距离跳投,https://bbs.hupu.com/627372010.html
30,4亮,求此人成分,https://bbs.hupu.com/627372097.html
31,3亮,关于续约,https://bbs.hupu.com/627371766.html
32,3亮,格兰特降价了，弗兰克还不冲？？？？,https://bbs.hupu.com/627372061.html
33,5亮,21年这样的选秀大年. 窝火得到一个次顶薪，准明星（目前），二当家级别球员-申京，算私通 及格吗？,https://bbs.hupu.com/627371977.html
34,6亮,维金斯来雷霆？,https://bbs.hupu.com/627371345.html
35,4亮,不吹不黑，就实力而论，巅峰乔丹和巅峰杜兰特单挑谁会赢,https://bbs.hupu.com/627372276.html
36,3亮,底薪贝兹利其实可以再试试,https://bbs.hupu.com/627372252.html
37,4亮,罗伯特-科温顿居然到现在还没有球队签约！,https://bbs.hupu.com/627371859.html
38,12亮,扎心了！美媒打趣：雷霆曾拥有那么多球星仍未夺冠,https://bbs.hupu.com/627369641.html
39,3亮,这种人可以归结为串子,https://bbs.hupu.com/627371918.html
40,3亮,勇士爵士拉公牛三方交易马卡是否可行？,https://bbs.hupu.com/627371366.html
41,4亮,理性讨论，99-14年的马刺哪年最强？,https://bbs.hupu.com/627371521.html
42,4亮,不是，前几天咋了区里，好久没看了,https://bbs.hupu.com/627371357.html
43,13亮,申京的数据和表现绝对值顶薪，但火箭不一定把他视作基石，所以还没给顶薪,https://bbs.hupu.com/627370240.html
44,50亮,匿名湖人球员：特权和双标让球队的气氛异常紧张,https://bbs.hupu.com/627363482.html
45,19亮,中国野球网红马师傅 吴悠 陈一帆法国街头接波什么水平？,https://bbs.hupu.com/627370020.html
46,46亮,马龙、加内特、诺维茨基、字母哥，哪个大前锋打球最干净？,https://bbs.hupu.com/627368297.html
47,10亮,Siegel评价各球队休赛期自由市场运作，独行侠唯一一个a+,https://bbs.hupu.com/627371236.html
48,15亮,李凯尔顶级野球局,https://bbs.hupu.com/627371210.html
49,8亮,格林和申京的续约还是明年夏天让市场来定吧,https://bbs.hupu.com/627370238.html
50,34亮,贾米森谈科比。,https://bbs.hupu.com/627365254.html
51,8亮,书包杜活该单身,https://bbs.hupu.com/627370536.html
52,43亮,老婆第三次胎停，很压抑，换小号发泄一下,https://bbs.hupu.com/627365585.html
53,6亮,从一项高阶数据看，阿门下赛季正常情况下会独领风骚。,https://bbs.hupu.com/627371238.html
54,50亮,如果巅峰期的麦迪和伦纳德打一场百分大战，谁会取胜？,https://bbs.hupu.com/627367356.html
55,4亮,对于申京和格林续约的基本判断,https://bbs.hupu.com/627370235.html
56,28亮,即使遭遇网爆，我也不会停止为老詹发声，我相信时间会证明一切，你可以不喜欢他，但不用诋毁,https://bbs.hupu.com/627370300.html
57,38亮,一个伦纳德6年球迷关于19年猛龙夺冠含金量的证明贴（欢迎来辩）,https://bbs.hupu.com/627368899.html
58,3亮,远古时代张伯伦！,https://bbs.hupu.com/627371104.html
59,26亮,个人觉得真正公平也能反应球员个人能力的21世纪mvp评选,https://bbs.hupu.com/627370221.html
60,11亮,有老球迷概括一下马努的球风吗？,https://bbs.hupu.com/627371287.html
