index,hot,title,href
1,,科学家揭示两种最佳降血压运动,http://jandan.net/p/116562
2,,互联网的马桶理论：快速获取信息未必是好事,http://jandan.net/p/116537
3,,全身麻醉是如何影响大脑的,http://jandan.net/p/116551
4,,恐怖航班：飞机遭遇严重气流颠簸，一人死亡多人受伤,http://jandan.net/p/116558
5,,隐形杀手：健身补剂的健康风险,http://jandan.net/p/116540
6,,太热了：热昏的墨西哥吼猴从树上掉下摔死,http://jandan.net/p/116559
7,,你在阅读时脑海里也有个“声音”吗？,http://jandan.net/p/116570
8,,今日好价 0521,http://jandan.net/p/116546
9,,全球数千万人不知自己感染了丙肝,http://jandan.net/p/116561
10,,换头手术：科幻还是未来,http://jandan.net/p/116569
11,,今日好价 0522,http://jandan.net/p/116555
12,,观鸟能改善心理健康，增强幸福感,http://jandan.net/p/116541
13,,今日好价 0523,http://jandan.net/p/116568
14,,今日好价 0524,http://jandan.net/p/116577
15,,使用胶带疗法对比冷冻疗法治疗寻常疣的有效性,http://jandan.net/p/116549
16,,为什么树懒动作这么慢？,http://jandan.net/p/116571
17,,肠道菌群的组成可能影响决策,http://jandan.net/p/116550
18,,菲亚特将推出新版500e电动车,http://jandan.net/p/116560
19,,什么是湍流？,http://jandan.net/p/116580
20,,心脏也会影响心理健康,http://jandan.net/p/116539
21,,史无前例的巴西洪灾造成数百万人受灾,http://jandan.net/p/116557
22,,今日好价 0525,http://jandan.net/p/116588
23,,人类基因组中的病毒DNA与主要精神疾病有关,http://jandan.net/p/116572
24,,3M高管与科学家关于PFAS化学物质的斗争,http://jandan.net/p/116548
25,,AI声音侵权：声优起诉声音克隆公司,http://jandan.net/p/116538
26,,这三个策略可以改善癌症患者的预后,http://jandan.net/p/116583
27,,相比人类，我们更像尼安德特人,http://jandan.net/p/116579
28,,常规鱼油补充剂可能增加首次心脏病和中风风险,http://jandan.net/p/116563
29,,把癌症视为生态系统可能带来更有效的治疗方法,http://jandan.net/p/116582
30,,3万年的历史证明：磨难能增强人类社会的韧性,http://jandan.net/p/116581
