index,hot,title,href
1,A西红柿炒鸡蛋,1.2W字，详细说清楚“华为财务体系”是什么,https://www.woshipm.com/?p=5892693
2,一更讲产品,小众陌生人社交App：爱聊、觅伊、他趣竞品分析,https://www.woshipm.com/?p=5436412
3,李子木说运营,6000字长文，解析2024年小红书运营趋势,https://www.woshipm.com/?p=6017034
4,Super黄,Kimi Chat如何一步步破圈？带给AI的启示,https://www.woshipm.com/?p=6018735
5,地瓜,美团骑手转职指南,https://www.woshipm.com/?p=6019169
6,观海日记,互联网医院：线上预约挂号,https://www.woshipm.com/?p=6018484
7,天天问,B站的2024，先抓住普通人,https://www.woshipm.com/?p=6017085
8,洪草莓,“改版后，我让注册率暴涨了80%”,https://www.woshipm.com/?p=6018630
9,王智远,估值20亿的kimi-Chat真香,https://www.woshipm.com/?p=5943055
10,靠谱的阿星,2024年，5个普通人年入1000万以内的创业机会,https://www.woshipm.com/?p=5984094
11,彬哲,【万字干货】电商平台电子面单服务设计及运营,https://www.woshipm.com/?p=6018900
12,Echo 产品论,2万字大模型调研：横向对比文心一言、百川、Minimax、通义千问、讯飞星火、ChatGPT,https://www.woshipm.com/?p=5994261
13,人人都是产品经理,C端产品经理：为用户需求而生,https://www.woshipm.com/?p=6005957
14,菜根老谭,消息通知产品设计背后的思考过程,https://www.woshipm.com/?p=6018326
15,奇偶派,AI大模型哪家强？七大维度横评四款主流大模型！,https://www.woshipm.com/?p=5988831
16,解码Decode,有多少人想和AI谈一场“电子恋爱”,https://www.woshipm.com/?p=6018711
17,XXXC.,竞品分析报告：得物App&识货App,https://www.woshipm.com/?p=6017217
18,晓峰的运营增长,万字全解母婴运营全景策略：全域聚客，私域经营,https://www.woshipm.com/?p=6017744
19,奇偶派,文生视频时代已到，百度、讯飞、字节谁能率先做出“国产Sora”？,https://www.woshipm.com/?p=5998549
20,一点财经编辑部,2024：存量时代，内容平台如何“发新芽”？,https://www.woshipm.com/?p=6018355
21,最话FunTalk,腾讯狂敲“上瘾代码”,https://www.woshipm.com/?p=6018553
22,VMIC UED,评论区设计的三个维度、九个考量点,https://www.woshipm.com/?p=6009513
23,TOP君,短剧凶猛：一场拼多多式的胜利,https://www.woshipm.com/?p=6018225
24,多纳卡米大王,直男需要什么？男性内容社区竞品分析报告,https://www.woshipm.com/?p=6008563
25,差评,实测文心一言4.0，真的和GPT-4相差无几了吗？,https://www.woshipm.com/?p=5923786
26,西边一山,探索之旅：产品经理如何构建和驾驭产品路线图的艺术,https://www.woshipm.com/?p=6008342
27,牛透社,“烧钱”落幕，SaaS 续费“觉醒”,https://www.woshipm.com/?p=6018091
28,挖塘人,小红书怎么运营？最新实操方法来了！,https://www.woshipm.com/?p=5859562
29,寻空,小米汽车为什么迟迟不公布价格？,https://www.woshipm.com/?p=6017874
30,飞娱财经,剪映会成为下一款超级APP吗？,https://www.woshipm.com/?p=6016838
31,增长黑盒,我们花一个月时间研究了视频号：用数据打破你的四个偏见,https://www.woshipm.com/?p=5890404
32,查理运营启示录,2024，让用户教我做增长（5000字干货解读）,https://www.woshipm.com/?p=6015833
33,布兰德老白,万字解析 | 2024年品牌KOC营销全域打法,https://www.woshipm.com/?p=6009392
34,晨阳产品笔记,从产品角度分析霸王茶姬为什么会突然爆火？,https://www.woshipm.com/?p=5950643
35,查理运营启示录,腾讯用研实战策略全解析,https://www.woshipm.com/?p=6007734
36,南方碟道,智能客服产品调研（上）：客服行业分析及“在线客服机器人”产品调研分享,https://www.woshipm.com/?p=6013959
37,传媒1号,视频号内测短剧挂链，短剧+微信将如何改变「潮水的方向」,https://www.woshipm.com/?p=6018118
38,在野在也,Sora官方技术报告详解｜从模型能力到原理剖析的深度解读,https://www.woshipm.com/?p=5997306
39,差评,各大App的分享链接，正在偷窥你的朋友圈,https://www.woshipm.com/?p=6018039
40,布兰德老白,万字解析 | 品牌在抖音破圈到收割的完整闭环,https://www.woshipm.com/?p=5992887
41,橙子小叮当,面试优缺点：要怎么回复？10种回答范例与3大原则，精准掌握HR偏好,https://www.woshipm.com/?p=5929346
42,人人都是产品经理,AI学习圈：人工智能+时代已来,https://www.woshipm.com/?p=5997158
43,Blues,引爆流量的秘密：用AIGC解读 120 条爆款短视频“黄金三秒”的心理学秘密,https://www.woshipm.com/?p=6012657
44,Super黄,万字长文：为什么AI陪伴产品都想抄星野？,https://www.woshipm.com/?p=5946439
45,布兰德老白,万字解析 | 如何在小红书通过人本营销实现全域转化,https://www.woshipm.com/?p=5995703
46,Super黄,Perplexity：用答案引擎挑战Google | 万字长文,https://www.woshipm.com/?p=5990752
47,V2XR,空间计算时代，你还需要担心 VR 眩晕吗？,https://www.woshipm.com/?p=5939035
48,晏涛三寿,小红书、视频号、抖音流量算法机制，建议收藏！,https://www.woshipm.com/?p=5865982
49,ice,十六番旅游app产品分析,https://www.woshipm.com/?p=5842442
50,大仁哥,日更10个公众号经验总结，一文全面解读公众号流量推荐机制！,https://www.woshipm.com/?p=5932632
51,誓博,一文讲透SPU和SKU,https://www.woshipm.com/?p=5850460
52,价值星球Planet,字节终于等来了“豆包”,https://www.woshipm.com/?p=5892899
53,尼莫点,产品生命周期看懂这些，你就是产品达人,https://www.woshipm.com/?p=5890582
54,白高粱,视频号：半封闭状态下的关系链产品,https://www.woshipm.com/?p=4183603
55,坤少说,“数电票”为什么是数字商业“药引子”？,https://www.woshipm.com/?p=5866508
56,产品人卫朋,华为流程体系：IFS 财经流程,https://www.woshipm.com/?p=5868589
57,江河聊营销,研究100+小红书热门标题，我总结小红书标题的万能公式,https://www.woshipm.com/?p=5498171
58,fado,社交电商——小红书竞品分析,https://www.woshipm.com/?p=5796321
59,观察月亮的小白羊,5个品牌案例，帮你快速搞懂「商业模式画布」！,https://www.woshipm.com/?p=5862114
60,宿言本言,小红书营销全攻略，从平台特性到营销技巧！,https://www.woshipm.com/?p=5864485
61,晏涛三寿,2023小红书的7种变现方式,https://www.woshipm.com/?p=5799414
62,产品海豚湾,产品拆解：飞书多维表格怎么用？,https://www.woshipm.com/?p=5791246
63,Carrey,得物产品分析报告——社区孵化出的潮流先锋,https://www.woshipm.com/?p=5774456
64,芋艿和猫说,关于种草营销的一切：抖音、小红书、B站、微信、知乎、微博,https://www.woshipm.com/?p=5582733
65,产品人卫朋,华为IPD流程体系：集成产品开发框架,https://www.woshipm.com/?p=5654766
66,庄俊小红书营销,小红书爆文密码 | 一月爆款笔记案例解析,https://www.woshipm.com/?p=5740307
67,PM维他命,手把手教学 | B端产品经理简历撰写指南（含专业话术+多套虚拟简历模板）,https://www.woshipm.com/?p=5233033
68,张在旺,如何写一份靠谱的竞品分析报告？,https://www.woshipm.com/?p=5672064
69,庄俊小红书营销,小红书爆文拆解：12个案例来分析如何打造互动量40万+的笔记,https://www.woshipm.com/?p=5707559
70,佳佳原创,Team Up，Price Down——拼多多跨境电商Temu产品分析,https://www.woshipm.com/?p=5715372
71,产品人卫朋,华为销售体系 | 销售管理：LTC流程体系详解,https://www.woshipm.com/?p=5695738
72,SUSU的每日思考,在这个时代背景下，我们普通人应该怎样赚大钱,https://www.woshipm.com/?p=5644869
73,小谭小谭永远不烦,运动健身类APP竞品分析：Keep VS 悦跑圈 VS 咕咚,https://www.woshipm.com/?p=5681521
74,空白女侠,麦肯锡、高盛分析师必备：如何快速分析一个行业,https://www.woshipm.com/?p=5518563
75,挖塘人,视频号运营攻略：从起号到变现,https://www.woshipm.com/?p=5574089
76,不抄私域,什么是私域都不懂，你就敢去做私域？,https://www.woshipm.com/?p=5380729
77,PM老潘,【2万字】完整产品经理面试50题及回答实例（上）,https://www.woshipm.com/?p=5297149
78,大白,携程、去哪儿竞品分析报告,https://www.woshipm.com/?p=5334100
79,G_Shuai,企业架构概述及业务架构详解,https://www.woshipm.com/?p=5408487
80,江寒,别闹了，真正赚钱的方法没人愿意分享,https://www.woshipm.com/?p=5230601
81,魏翻番,一个月涨粉14万，抖音从0到1起号不完全复盘,https://www.woshipm.com/?p=5242679
82,厚厚,一文说清楚3种结构图（功能结构图、信息结构图、产品结构图）,https://www.woshipm.com/?p=5159192
83,pm老潘,完整产品经理面试50题及回答实例（下）,https://www.woshipm.com/?p=5299254
84,汪仔7120,闲鱼竞品分析,https://www.woshipm.com/?p=4812192
85,庄俊小红书营销,小红书品牌营销（三）：拆解了小红书500篇爆文，我们总结出这些套路——细战略,https://www.woshipm.com/?p=5057505
86,老虎讲运营,小红书运营技巧,https://www.woshipm.com/?p=5190176
87,A林深不见鹿,5000字干货：抖音短视频运营整体策划方案，看完你就学会了,https://www.woshipm.com/?p=4264080
88,旦旦大宝贝,小红书：用户运营策略分析报告,https://www.woshipm.com/?p=4478240
89,十里村,10种最有效的引流方法,https://www.woshipm.com/?p=4694520
90,汪仔6642,线上健身的运转逻辑：KEEP产品分析,https://www.woshipm.com/?p=4428233
91,产品小朋友,朴朴产品分析报告 | 朴朴一下，如何更好更快？,https://www.woshipm.com/?p=4401780
92,思考君村村,结构化思维 | 干货！一文讲清楚必学的思维方式,https://www.woshipm.com/?p=4431417
93,袁玲玲,运营必看：9个维度拆解视频号爆款运营方案、增长策略、数据分析、流量变现全攻略（下）,https://www.woshipm.com/?p=4432247
94,薛老板,产品经理面试高频20题及答案,https://www.woshipm.com/?p=4328970
95,一言论电商,小白想要做电商运营？这几点基本功要掌握,https://www.woshipm.com/?p=4243247
96,产品天团,PRD：Keep需求文档,https://www.woshipm.com/?p=4143186
97,阿境,万字长文 | 产品经理面试大全（建议收藏）,https://www.woshipm.com/?p=4105385
98,Shawshaw,竞品分析报告 | 高德地图 vs 百度地图 vs 腾讯地图,https://www.woshipm.com/?p=3867852
99,Chancy喵,产品分析 | 小红书，如何打造内容电商的商业模式壁垒？,https://www.woshipm.com/?p=3716748
100,一只帅鸽,成功上岸腾讯运营，教你如何写校招简历？,https://www.woshipm.com/?p=3762663
