index,hot,title,href
1,1036 万热度,俄罗斯总统普京将对华进行国事访问，哪些信息值得关注？,https://www.zhihu.com/question/655970802
2,655 万热度,如何看待央媒点评《歌手 2024》「当歌手没捷径，菜就多练」？,https://www.zhihu.com/question/655947612
3,612 万热度,针对黄岩岛，央视一天内连发三条重要消息 ，哪些信息值得关注？,https://www.zhihu.com/question/655956374
4,326 万热度,如何看待小米汽车（SU7）5月第2周交付1099辆，连续四周销量下滑？,https://www.zhihu.com/question/655968416
5,298 万热度,湖北一警车高速上截停小车，男子亮证后质问「为什么不避让」，当地称「正核实 」，哪些细节值得关注？,https://www.zhihu.com/question/655969530
6,121 万热度,到底是什么人热衷于成立业主委员会，对业主有什么好处？,https://www.zhihu.com/question/650029148
7,116 万热度,詹姆斯之子布朗尼联合试训部分数据揭晓， 如何评价他的动静态天赋?,https://www.zhihu.com/question/655968717
8,106 万热度,《大明王朝1566》，为什么五位徽商明知道接手沈一石作坊可能会赔本还要和郑泌昌何茂才签约?,https://www.zhihu.com/question/655120673
9,103 万热度,古代丫鬟每天都做些什么？,https://www.zhihu.com/question/655804874
10,96 万热度,阿里发布2024财年Q4及全年财报，数据显示阿里重回健康增长轨道，还有哪些信息值得关注？,https://www.zhihu.com/question/656002813
11,93 万热度,报道称「日企纷纷返聘老员工，丰田将返聘年龄上限调至 70 岁」，如何看待此事？会带来哪些影响？,https://www.zhihu.com/question/655847154
12,84 万热度,孩子写作业时磨蹭、发呆、爱玩怎么办？,https://www.zhihu.com/question/655908762
13,81 万热度,如何评价《鸣潮》引擎负责人在游戏快发布的时候离职？,https://www.zhihu.com/question/655815101
14,77 万热度,中国传统武术到底能不能实战？,https://www.zhihu.com/question/651185892
15,76 万热度,如何评价今天Open AI刚发布的GPT-4o?,https://www.zhihu.com/question/655917290
16,70 万热度,文学作品里有哪些野味美食？,https://www.zhihu.com/question/655914829
17,65 万热度,如何评价2024年4月米哈游《原神》4.6赛诺传说任务《金狼之章 第二幕》？,https://www.zhihu.com/question/653945048
18,63 万热度,初学者怎么入门大语言模型（LLM）？,https://www.zhihu.com/question/644285055
19,58 万热度,烧烤店用玉米作燃料，那么为什么一面是我们需要大量进口玉米，一面却是玉米没人要？,https://www.zhihu.com/question/655223548
20,58 万热度,比亚迪回应车辆漏电致人住院，称或因车主突然发病手脚麻木，误以为触电，电动车漏电可能性有多大？,https://www.zhihu.com/question/655966462
21,57 万热度,2024 季中冠军赛 G2 3:0 淘汰 TES，如何评价这场比赛？,https://www.zhihu.com/question/655975032
22,57 万热度,十万人民币和一只对你绝对忠诚的皮卡丘，你选哪一个？,https://www.zhihu.com/question/655335420
23,56 万热度,时隔三年，美国散户带头大哥基思·吉尔回归，游戏驿站一度大涨超 110%，散户「大战」华尔街会再上演吗？,https://www.zhihu.com/question/655949227
24,56 万热度,财政部将于 17 日招标首发 400 亿元人民币 30 年期特别国债，哪些信息值得关注？,https://www.zhihu.com/question/655852253
25,56 万热度,猫咪对自己的颜值高低，是否是有意识的？,https://www.zhihu.com/question/652392924
26,56 万热度,骑行通勤后工作无法集中注意力怎么办？,https://www.zhihu.com/question/653937625
27,55 万热度,《英雄联盟》里很多角色都很坏很邪恶，为什么还称呼他们为英雄呢？,https://www.zhihu.com/question/655547828
28,55 万热度,我国科学家发现银河系晕里的巨大磁环，这一发现具有哪些意义？,https://www.zhihu.com/question/656000512
29,55 万热度,王毅同韩国外长举行会谈，哪些信息值得关注？,https://www.zhihu.com/question/655947476
30,55 万热度,麦当劳回应「过期食材换签继续卖」，将加强操作规范的落实执行，如何看待此事？食品安全如何保障？,https://www.zhihu.com/question/655842171
31,55 万热度,北京天空「绽放」绝美晚霞，你拍到了吗？可以分享一下吗？,https://www.zhihu.com/question/656007025
32,55 万热度,国家疾控局称我国本土已监测到 KP.2 新冠变异株，此前已在美国蔓延，会引发新一轮传染高峰吗？,https://www.zhihu.com/question/655965887
33,55 万热度,为什么山东人个子高的很多，和当地的饮食习惯有关吗？,https://www.zhihu.com/question/515136736
34,55 万热度,西安科技大学通报教师更改考试成绩「更改成绩无效，多人被给予处分」，如何看待此事处理方式？带来哪些警示？,https://www.zhihu.com/question/655972200
35,55 万热度,猫咪不喜欢被人摸「脚」，有什么原因？,https://www.zhihu.com/question/651356900
36,55 万热度,与上司意见不合时，我该怎么做？,https://www.zhihu.com/question/655415475
37,55 万热度,追尾自燃，高速误刹车，智能驾驶是否过度被夸大和营销？新能源汽车的安全性该如何保障？,https://www.zhihu.com/question/655954504
38,54 万热度,夏季运动健身期间，你「防暑降温」的措施有哪些？,https://www.zhihu.com/question/654845019
39,54 万热度,如何理解《庆余年》中的「叶轻眉」这一角色？,https://www.zhihu.com/question/655984635
40,54 万热度,为什么有些文物会让人感到震撼?,https://www.zhihu.com/question/655912182
41,54 万热度,目前哪些职业可以从35岁开始并且越老越吃香？,https://www.zhihu.com/question/654926521
42,54 万热度,教育部发文，整治挤占「课间十分钟」，严禁教师漠视纵容学生欺凌，将带来哪些改变？,https://www.zhihu.com/question/655960473
43,54 万热度,为什么日本当年同时向多国开战，当时的日本是什么心态？,https://www.zhihu.com/question/655063882
44,54 万热度,日元这轮暴跌会跌到多少？,https://www.zhihu.com/question/654475693
45,54 万热度,都说国货更懂国人肤质，有哪些口碑优质的国货护肤品、护肤成分推荐？,https://www.zhihu.com/question/655260039
46,54 万热度,《儒林外史》主要讲了什么，讽刺了什么？,https://www.zhihu.com/question/655848715
47,53 万热度,吃得苦中苦，真的可成为人上人吗？,https://www.zhihu.com/question/650818321
48,53 万热度,在市井街巷穿梭时的哪些画面与见闻，安抚了你的焦虑感？,https://www.zhihu.com/question/654357478
49,53 万热度,北齐的灭亡是从哪一步开始无可救药的？,https://www.zhihu.com/question/655616684
50,53 万热度,21世纪之后还诞生过哪些全球公认的名画作品？,https://www.zhihu.com/question/655670347
