index,hot,title,href
1,11477987,国家森防指办工作组到达贵州
2,11217549,张颂文新剧猎冰开播
3,11099862,火到海外的中国年俗
4,11079366,当萌娃穿马面裙
5,10653341,贵州山火有多严重
6,9771137,当美术生遇上他不听命于杜康
7,9742675,雨姐BGM也不能改变的一些事
8,9424850,起猛了红山动物园办演唱会了
9,9348842,“节后离婚比结婚的多”系谣言
10,9239098,致敬贵州山火中的逆行者
11,9145277,贾玲导演好会拿捏细节
12,9051416,熬夜的蝴蝶效应
13,8986729,被2亿人围观的机械舞教程来了
14,8968732,上海暴雨
15,8685230,武汉史诗般极致的雪景
16,8659105,女子遭奸杀14年后真凶落网
17,8597679,惠英红新片用爱治愈刘浩存
18,8453208,一些奇怪的收集癖好
19,8411183,节后开工下午茶
20,8399301,抖音达人呼吁关注贵州山火
21,8311973,猜猜这是谁的爆改
22,8306250,汽车玻璃结冰怎么办
23,8278705,这就是公共交通的意义
24,8263270,en新歌错觉宿命感拉满
25,8228900,属于广东人的饮料
26,8104936,生还渔民揭露渔船倾覆真相
27,8003332,烟火人家镜头下的女性角色
28,8002195,英文版知否
29,7983340,夏克立再次否认家暴黄嘉千
30,7982837,是谁推到任敏这块棉花了
31,7928229,贵阳山火系男子焚烧杂草引发
32,7842149,当我返校时爸妈的反应
33,7781896,龙年首虎胡强被查
34,7765912,湖北多地迎暴雪
35,7727018,南来北往制片人评价白敬亭
36,7719208,赵丽颖范伟时隔17年二搭
37,7693400,无限超越班官宣定档
38,7644227,飞驰2刘昊然抡大锤自带bgm
39,7637219,周杰伦的青花瓷唱的就是它们吧
40,7560619,女生回应在长沙火车站被偷拍
41,7560062,刘能住院赵四崩溃了
42,7556499,妈妈一怒之下撤回一个儿子
43,7550614,周雨彤意大利旅行明信片
44,7401321,郑州东站
45,7387687,看社火我们是认真的
46,7355234,小伙雪中骑车获冰冻发型
47,7319134,湖南多所学校推迟开学
48,7261878,时代少年团心跳怦怦舞
49,7100260,台方称急着救人忘了录像遭质疑
50,7084767,小麦穗长得像谁
