index,hot,title,href
1,11505802,天水麻辣烫把锅煮烂了
2,10656095,地磁暴是否会影响人体健康
3,10300855,春日赏花地图请收好
4,9911065,浙江多地突降冰雹
5,9888692,外交部回应巴拉圭总统涉台言论
6,9538781,李炮儿勇闯刘畊宏直播间
7,9522296,安理会通过决议要求加沙停火
8,9497336,这属于街头爆改MVP了
9,9429557,医保局回应农村出现退保潮
10,9418932,和尚爸爸回应养孩子现状
11,9361326,王者荣耀全新分路段位系统
12,9353441,中了天水苹果的毒
13,9306639,一代人有一代人的动物世界
14,9302078,挑战张元英转圈
15,9179308,小米汽车官方App上架
16,9161283,初中生办婚宴 家长被批评教育
17,9157968,王婆请假两天李婆接力
18,9126161,央视给追风者打call了
19,9107146,乐器版有人钢枪有人伏地
20,9094224,王树国任福耀科技大学校长
21,9087716,俄残疾男子恐袭中为女友挡枪
22,9086617,警方回应女孩偷东西被训后跳楼
23,9084052,上海时装周女明星新中式造型
24,9062128,烟雨海棠
25,8996955,董宇辉麦家知音再相遇
26,8992239,国足主帅：主场必胜新加坡
27,8967780,美学者称世界三极是中美俄
28,8967650,养老金并轨意味着什么
29,8964578,中方回应中国籍邮轮红海遭袭
30,8946180,舌尖上的薄荷曼波
31,8938464,把春天溺在花海里
32,8898732,俄恐袭4名嫌犯身份公布
33,8898347,阿里1688全面接入淘宝
34,8868171,易鹏飞受贿超8千万被判无期
35,8858934,永劫无间手游实机演示
36,8782443,好像看到平行时空里的李子维
37,8779042,法国将反恐警戒级别升至最高
38,8766018,遭幼师殴打男童父母已赶回家
39,8758094,义乌冰雹多辆车窗被砸穿
40,8729112,小米汽车价格三天后公布
41,8721989,中学女生高度统一的发型
42,8652692,爸爸躺着也中枪
43,8641636,瑙鲁总统：和中国能学很多东西
44,8548136,莫斯科恐袭3名嫌疑人认罪
45,8486871,波兰：俄导弹侵犯波兰领空
46,8453834,梁咏琪演唱会丈夫上台为其庆生
47,8451269,学校回应门卫撂倒外卖员
48,8393542,SEN马德里大师赛夺冠
49,8348312,孙颖莎祝贺孙铭阳
50,8344319,甘肃文旅跟追风者的适配度
