index,hot,title,href
1,足球,2024村超决赛阶段今日开战，水木年华现场献唱,https://www.dongqiudi.com/article/4101524
2,篮球,WCBA全明星星锐赛：南区77-76险胜北区，刘禹彤空砍22分,https://www.dongqiudi.com/article/4101513
3,足球,每体：巴萨总监德科向范布隆克霍斯特打听了魏费尔,https://www.dongqiudi.com/article/4101511
4,,南特vs斯特拉斯堡：穆萨-西索科、拉冯首发，加梅罗、安德雷-桑托斯出战,https://www.dongqiudi.com/article/4101505
5,,半场战报：美因茨1-0波鸿，伯卡特点射破门,https://www.dongqiudi.com/article/4101474
6,足球,进球机器！凯恩攻入德甲第31球，打破个人联赛单赛季进球纪录,https://www.dongqiudi.com/article/4101243
7,,半场战报：沃尔夫斯堡1-1奥格斯堡,https://www.dongqiudi.com/article/4101469
8,,半场战报：海登海姆0-1门兴格拉德巴赫，哈克破门,https://www.dongqiudi.com/article/4101468
9,足球,半场战报：拜仁2-1达姆施塔特，凯恩传射，穆西亚拉破门,https://www.dongqiudi.com/article/4101465
10,,半场战报：柏林联合0-0云达不莱梅,https://www.dongqiudi.com/article/4101464
11,足球,澳波回应热刺季票涨价：这是个难题，球迷应该被允许表达感受,https://www.dongqiudi.com/article/4101452
12,足球,两夺亚洲杯冠军！卡塔尔队长海多斯宣布从国家队退役,https://www.dongqiudi.com/article/4101450
13,体坛,短道速滑世锦赛女子500米：范可新、王晔无缘A组决赛,https://www.dongqiudi.com/article/4101436
14,足球,【皇马专栏组】 第三期????踝关节扭伤III,https://www.dongqiudi.com/article/4101428
