index,hot,title,href
1,,七天1个亿，带货一姐换人了,https://www.36kr.com/p/2485632457349252
2,,快手不需要“分歧终端机”了,https://www.36kr.com/p/2485320950962313
3,,一家600亿独角兽宣布破产,https://www.36kr.com/p/2485288905021317
4,,上海很多老破大，已经卖不掉了！,https://www.36kr.com/p/2486328034350982
5,,手机“钉子户”的由来,https://www.36kr.com/p/2485632742741888
6,,钟薛高，祸起萧墙,https://www.36kr.com/p/2486372063614856
7,,我们也许不再需要购物节来刺激消费了,https://www.36kr.com/p/2485342281523077
8,,GPT-4不知道自己错了，LLM新缺陷曝光，自我纠正成功率仅1%，LeCun马库斯惊呼越改越错,https://www.36kr.com/p/2485105634793608
