index,hot,title,href
1,几何小姐姐,百度为何如此焦虑？,https://www.woshipm.com/?p=6047463
2,Aine,营销5.0时代，企业的痛如何解？,https://www.woshipm.com/?p=6045106
3,D.lemon,功能设计之搜索背后的逻辑处理,https://www.woshipm.com/?p=6047131
4,一个符号工作室,从百度璩静事件，谈谈全员营销的四大困境与思考,https://www.woshipm.com/?p=6047603
5,剁椒TMT,对话了10+品牌主，我们聊了聊小红书为何“种草难”,https://www.woshipm.com/?p=6047509
6,陈天宇宙,万字：“清算、结算、清结算”的区别,https://www.woshipm.com/?p=6046875
7,好夕雷,从面试官视角出发，聊聊产品经理的面试攻略,https://www.woshipm.com/?p=6047592
8,设计师Ksss,解锁HMI设计规范,https://www.woshipm.com/?p=6047888
9,人人都是产品经理,谁是最佳“AI Agent创想家”？钉钉AI助理众测大赛结果出炉！,https://www.woshipm.com/?p=6045556
10,定焦One,又土又丑的黏土AI，为什么火了？,https://www.woshipm.com/?p=6046543
11,申悦,怎么设计大模型产品，才能真正结合业务，让用户感受到价值？,https://www.woshipm.com/?p=6047781
12,Tech星球,腾讯连推两款新产品轻团、N1，社交之战再次打响,https://www.woshipm.com/?p=6048203
13,晓峰的运营增长,私域增长时，“筛选流量”比“培育用户”更重要？,https://www.woshipm.com/?p=6048020
14,纸皮小火车,万字拆解钉钉AI助理丨如何拥有一个勤劳、聪明、睿智以及无所不能的私人助理？,https://www.woshipm.com/?p=6047202
15,果酿,转型AI必看：NLP技术结合AI推动教育创新,https://www.woshipm.com/?p=6047393
16,肥柴周,聊聊数据产品和目标借款人,https://www.woshipm.com/?p=6047293
17,解码Decode,Sora的最强竞争对手，来自中国,https://www.woshipm.com/?p=6046845
18,哈哈的鲸鱼,企业支付结算数字化建设思考,https://www.woshipm.com/?p=6041220
19,刘志兴,存量客户激活，银行常见的企微客户添加路径,https://www.woshipm.com/?p=6048201
20,菜鸟店小二,大模型在智能客服领域的应用思考,https://www.woshipm.com/?p=6047161
21,Gump,我们应该如何做参与式观察？,https://www.woshipm.com/?p=6047959
22,徐大小姐,电商平台的会员运营设计方法,https://www.woshipm.com/?p=6046415
23,用户在左 体验在右,真实用研人故事：离开一线大厂，成为了互联网精英们的分水岭,https://www.woshipm.com/?p=6046511
24,闯爷,零售业数字化运营经验分享：揭秘门店运营线上线下协同增长的成功实践,https://www.woshipm.com/?p=6046003
25,Echo 产品论,2万字大模型调研：横向对比文心一言、百川、Minimax、通义千问、讯飞星火、ChatGPT,https://www.woshipm.com/?p=5994261
26,刀哥,产品经理到底如何做需求分析？看看这篇万字深度解析！,https://www.woshipm.com/?p=5910201
27,Gump,用户访谈时，为什么不能问建议,https://www.woshipm.com/?p=6046109
28,武林,做To G产品得要会“玩”概念,https://www.woshipm.com/?p=6045660
29,Gump,为什么不能问为什么？,https://www.woshipm.com/?p=6046104
30,大俗大雅,策略产品经理子方向：数据策略产品,https://www.woshipm.com/?p=5529910
31,VR陀螺,从苹果春季发布会中，我们找到了Vision Pro真正的应用场景,https://www.woshipm.com/?p=6048232
32,Super黄,生产力工具大比拼！能打的海螺AI也该出来好好亮相了！,https://www.woshipm.com/?p=6048130
33,申悦,告别AI焦虑，普通人快速上手AI大模型的3个关键能力,https://www.woshipm.com/?p=6045801
34,Aine,钉钉 AI 助理：打造新时代普惠AI,https://www.woshipm.com/?p=6047128
35,黄锐,我们离AGI还有多远？,https://www.woshipm.com/?p=6043463
36,Monolith砺思,月之暗面杨植麟：创新、长期、第一性,https://www.woshipm.com/?p=6045664
37,Darcy,AI落地，板上「钉钉」,https://www.woshipm.com/?p=6047122
38,大灰熊,如何搭建用户运营体系，提升用户活跃效益？,https://www.woshipm.com/?p=6039659
39,边亚南,小米汽车SU7发布会PPT逻辑拆解：雷军如何讲好卖车这件事？,https://www.woshipm.com/?p=6024548
40,霞光社,在线教育出海掘金，攥紧AI,https://www.woshipm.com/?p=6048167
41,李子木说运营,自媒体人必备：文心一言、Kimi等4款AI大模型测评对比及推荐,https://www.woshipm.com/?p=6040171
42,最话FunTalk,滴滴又开始搞旅游了,https://www.woshipm.com/?p=6045756
43,野马范,万字详解版 | 新手如何系统拆解品牌营销案例？,https://www.woshipm.com/?p=6044383
44,耳海听潮,数据治理：企业信息化的核心基础性工作,https://www.woshipm.com/?p=6044189
45,Gump,用户访谈时，为什么不能问是非题？,https://www.woshipm.com/?p=6046099
46,产品参赵,大厂也Bug，产品经理这么干，漂亮！,https://www.woshipm.com/?p=6045533
47,灰度认知社,品类营销的底层逻辑,https://www.woshipm.com/?p=6042223
48,逸轩,采购管理系统BIP系统规划,https://www.woshipm.com/?p=6042149
49,王智远,火爆的AI Agent，到底是什么？,https://www.woshipm.com/?p=6044834
50,橙子小叮当,面试优缺点：要怎么回复？10种回答范例与3大原则，精准掌握HR偏好,https://www.woshipm.com/?p=5929346
51,我是产品张,马斯洛理论与商业：探索需求层次理论与价值创造,https://www.woshipm.com/?p=6045462
52,零度Pasca,《如何废掉一个产品经理？》,https://www.woshipm.com/?p=6042790
53,rorain,怎样搭建广告联盟（一）,https://www.woshipm.com/?p=6044925
54,陈天宇宙,一文搞懂“备付金核算”，及“清结算”的全局账务处理,https://www.woshipm.com/?p=6046715
55,誓博,一文讲透SPU和SKU,https://www.woshipm.com/?p=5850460
56,Echo 产品论,深度体验测评：值得买科技旗下‘小值’AI购物助手的实战表现与产品洞察,https://www.woshipm.com/?p=6045839
57,Pai爷运营,视频号直播间用户路径及两大关键模型,https://www.woshipm.com/?p=6044098
58,字母榜,月之暗面撞上算力墙？,https://www.woshipm.com/?p=6046271
59,差评,实测文心一言4.0，真的和GPT-4相差无几了吗？,https://www.woshipm.com/?p=5923786
60,郭静,微信公众号全面“今日头条化”，自媒体将迎来“第二春”？,https://www.woshipm.com/?p=6045468
61,李子木说运营,6000字长文，解析2024年小红书运营趋势,https://www.woshipm.com/?p=6017034
62,接地气的陈老师,解读数据，我发现了超好用的七步标准法,https://www.woshipm.com/?p=6043488
63,数据干饭人,如何解决数据指标口径不统一的问题？,https://www.woshipm.com/?p=6045531
64,觅云人,“涨租效应”，是如何将创业个体的利润吃干净的？,https://www.woshipm.com/?p=6045614
65,奇偶派,AI大模型哪家强？七大维度横评四款主流大模型！,https://www.woshipm.com/?p=5988831
66,芋艿和猫说,你没听过的小红书营销方法论,https://www.woshipm.com/?p=6037404
67,雷峰网,大众宣布裁员，员工离职奖励38.8万，赔偿金另外算；华为内部权力重新分配？知情人士回应；胖猫事件闹大，多品牌紧急致歉,https://www.woshipm.com/?p=6044539
68,壹叁零壹,135477六个数字：初识精益生产,https://www.woshipm.com/?p=6046267
69,字母榜,抖音小程序，只能靠短剧？,https://www.woshipm.com/?p=6045591
70,吴之猫,HIS产品设计手册-急诊系统设计要点,https://www.woshipm.com/?p=6045442
71,彬哲,当产品小组长这三年——心智成熟之旅,https://www.woshipm.com/?p=6002786
72,yzl,PRD：B端PRD—在线教育CRM系统,https://www.woshipm.com/?p=6023517
73,不留遗憾,管理后台基础功能-用户管理,https://www.woshipm.com/?p=6039662
74,腾讯大讲堂,产品经理必看：一文秒懂数据埋点,https://www.woshipm.com/?p=5954767
75,人人都是产品经理,AI学习圈：学会AI，掌握先进生产力,https://www.woshipm.com/?p=5997158
76,晏涛三寿,小红书、视频号、抖音流量算法机制，建议收藏！,https://www.woshipm.com/?p=5865982
77,尼莫点,产品生命周期看懂这些，你就是产品达人,https://www.woshipm.com/?p=5890582
78,增长黑盒,我们花一个月时间研究了视频号：用数据打破你的四个偏见,https://www.woshipm.com/?p=5890404
79,挖塘人,小红书怎么运营？最新实操方法来了！,https://www.woshipm.com/?p=5859562
80,橙子小叮当,面试离职原因 : 为何离开前公司？该诚实回答吗[离职原因范例],https://www.woshipm.com/?p=5924948
81,markzou,企业架构11——SOP（标准作业程序）,https://www.woshipm.com/?p=5869641
82,张在旺,如何写一份靠谱的竞品分析报告？,https://www.woshipm.com/?p=5672064
83,白高粱,视频号：半封闭状态下的关系链产品,https://www.woshipm.com/?p=4183603
84,产品乱弹,万字长文：深入浅出RBAC权限设计,https://www.woshipm.com/?p=5576757
85,黄锐,旅游产业元宇宙：数字化旅游（三）——完结篇,https://www.woshipm.com/?p=5633110
86,厚厚,一文说清楚3种结构图（功能结构图、信息结构图、产品结构图）,https://www.woshipm.com/?p=5159192
87,创意召唤,妈呀，母亲节的话题营销这么做我是真的服！,https://www.woshipm.com/?p=5427056
88,无,米家竞品分析,https://www.woshipm.com/?p=5330238
89,汪仔7120,闲鱼竞品分析,https://www.woshipm.com/?p=4812192
90,PM维他命,手把手教学 | B端产品经理简历撰写指南（含专业话术+多套虚拟简历模板）,https://www.woshipm.com/?p=5233033
91,Ella,超全面！大厂UI设计规范详解！,https://www.woshipm.com/?p=5280210
92,产品天团,PRD：Keep需求文档,https://www.woshipm.com/?p=4143186
93,lemon,大厂常用的几种灰度发布方案,https://www.woshipm.com/?p=4381854
94,阿境,深度拆解：分销体系的概念、模式及体系搭建,https://www.woshipm.com/?p=3962930
95,宛苏,KANO模型：产品人必懂的需求分析法,https://www.woshipm.com/?p=3209305
96,Hiphop村,画了多年的流程图，你真的画规范了吗？,https://www.woshipm.com/?p=2329530
97,微笑花儿,从产品角度，聊聊To C/To B/To G是什么,https://www.woshipm.com/?p=2188278
98,那只猫的鱼,快速学习时序图：时序图简介、画法及实例,https://www.woshipm.com/?p=607593
99,小圣,产品流程设计：如何绘制业务流程图？,https://www.woshipm.com/?p=675174
100,Jenskee,四种App弹窗设计：Toast、Dialog、Actionbar 和 Snackbar,https://www.woshipm.com/?p=429007
