index,hot,title,href
1,885,忽明忽暗的悲观主义，关于生活的自白,https://www.kaiyanapp.com/detail.html?vid=321927
2,272,从白天到黑夜，川流不息的城市韵律,https://www.kaiyanapp.com/detail.html?vid=321745
3,265,佳能丝滑转场，隐藏在魔幻现实下的人生,https://www.kaiyanapp.com/detail.html?vid=323335
4,402,GoPro 雪域激情，来场刺激的追逐游戏吧,https://www.kaiyanapp.com/detail.html?vid=323355
5,476,让人懵逼的创意之「骑马扣篮挑战赛」,https://www.kaiyanapp.com/detail.html?vid=323336
6,259,全程高燃，实验动画电影「江户朋克」,https://www.kaiyanapp.com/detail.html?vid=323351
7,178,地炉烤全猪，脆皮叉烧好吃秘诀大公开！,https://www.kaiyanapp.com/detail.html?vid=323126
8,178,先锋设计师上世纪的家，领先时代100年,https://www.kaiyanapp.com/detail.html?vid=323266
9,171,乐队录音花絮，搁这儿唱谁都想吼一嗓子,https://www.kaiyanapp.com/detail.html?vid=323352
10,408,每天10亿杯，从山羊嘴里诞生的咖啡传奇,https://www.kaiyanapp.com/detail.html?vid=321521
