index,hot,title,href
1,400评,苹果：所有在中国大陆合法销售的 iPhone 15 /Pro 系列手机均为中国组装,https://m.ithome.com/html/729955.htm
2,195评,《流浪地球 3》定档预告发布：2027 年上映，与华为、小米等合作探索电影工业化,https://m.ithome.com/html/729824.htm
3,278评,《流浪地球 3》前进三发布会今日下午 1 点举行，定档 2027 年大年初一上映,https://m.ithome.com/html/729779.htm
4,274评,小米 Redmi Note 12 Turbo 手机推出 16GB+256GB 版：第二代骁龙 7+，到手价 1699 元,https://m.ithome.com/html/729923.htm
5,201评,小米汽车更多细节、白车身外形轮廓曝光：配备自家音响、无框车门,https://m.ithome.com/html/729862.htm
6,557评,华为 Mate 20、P30 等 12 款手机明年一季度升级鸿蒙 HarmonyOS 4,https://m.ithome.com/html/729770.htm
7,307评,小鹏汽车官方回应 P5 老车主“联名维权”：补偿 2 万元代金券,https://m.ithome.com/html/729890.htm
8,193评,小鹏汽车内部人士回应 P5 老车主“联名维权” ：在讨论解决方案,https://m.ithome.com/html/729705.htm
9,200评,vivo X100 Pro 手机外观及拍摄样张公布，橙、蓝配色 + 曲面屏设计,https://m.ithome.com/html/729748.htm
10,93评,蔚来李斌回应裁员传闻：公司将减少 10% 左右的岗位,https://m.ithome.com/html/729907.htm
11,132评,华为、赛力斯联合设计，问界 M9 车型订单突破 20000 台,https://m.ithome.com/html/729768.htm
12,140评,消息称 vivo X100 系列手机首发与宁德新能源合作研发的最新大电池,https://m.ithome.com/html/729726.htm
