index,hot,title,href
1,1354 万热度,离岸人民币一度大涨 460 点，升破 7.18 关口，本月已升值 1400 点，未来走势如何？,https://www.zhihu.com/question/630914919
2,330 万热度,消息称鸿蒙系统明年将不兼容安卓，华为相关人士表示「未来为三个各自独立的操作系统」，哪些信息值得关注？,https://www.zhihu.com/question/630967225
3,258 万热度,中国与沙特签署双边本币互换协议，规模为 500 亿元人民币/260 亿沙特里亚尔，将产生哪些影响？,https://www.zhihu.com/question/630967921
4,87 万热度,OpenAI 创始人奥特曼、布罗克曼将加入微软，OpenAI 董事会拟聘请新 CEO，如何看待此事？,https://www.zhihu.com/question/630954702
5,76 万热度,为什么今年冬天的时尚趋势与往年不同，流行「不露腿穿搭」？,https://www.zhihu.com/question/629461368
6,66 万热度,报道称本轮巴以冲突是有记录以来「对记者来说最致命的冲突」，至少 48 名记者丧生，哪些信息值得关注？,https://www.zhihu.com/question/630939321
7,59 万热度,宁德时代斥资 1.88 亿元实施首次回购，释放了什么信号？,https://www.zhihu.com/question/630916813
8,59 万热度,你最近明白了什么人生感悟？,https://www.zhihu.com/question/581445210
9,58 万热度,推荐一本书，分享书中你最喜欢的一句或一段话?,https://www.zhihu.com/question/627419965
10,57 万热度,Loopy 表情包是如何在社交媒体上爆火的？敏感害羞+阴阳怪气的职场表情包背后体现了怎样的职场心理？,https://www.zhihu.com/question/630933849
11,57 万热度,国产恐怖游戏《吃香》已上线 Steam，如何评价这款游戏？,https://www.zhihu.com/question/627716548
12,55 万热度,汽车里的哪些功能，用了就回不去了？,https://www.zhihu.com/question/388466129
13,53 万热度,RNG 电子竞技俱乐部官宣 Letme 回归，对此你有什么想说的？,https://www.zhihu.com/question/630960339
14,49 万热度,C #编程的技术难点有什么？,https://www.zhihu.com/question/630654631
15,43 万热度,职场上如何做到不过分放大负面情绪，远离「职场心霾」？,https://www.zhihu.com/question/630020804
16,43 万热度,「阿根廷特朗普」米莱当选新总统，曾称「炸掉」本国央行、全面美元化，哪些信息值得关注？,https://www.zhihu.com/question/630914974
17,43 万热度,离职一年多了，前公司打电话让回去重新交接，我该怎么办？,https://www.zhihu.com/question/621484533
18,39 万热度,处于职业倦怠期的上班族，该如何保持工作活力？,https://www.zhihu.com/question/630020807
19,38 万热度,从管理者的角度，如何帮助下属调整好上班心态，驱散「职场心霾」？,https://www.zhihu.com/question/630020709
20,30 万热度,不开心的友谊，值不值得珍惜？,https://www.zhihu.com/question/630826442
21,30 万热度,23-24 赛季 NBA火箭 104:105 湖人，如何评价这场比赛？,https://www.zhihu.com/question/630910412
22,30 万热度,义和团对洋人的原始仇恨从何而来？,https://www.zhihu.com/question/629941884
23,30 万热度,马尔代夫政府正式要求印度从马尔代夫撤军，如何看待此事？后续会如何发展？,https://www.zhihu.com/question/630824072
24,30 万热度,如果用一个关键词概括你 2023 年的职场，你的答案会是什么？为什么？,https://www.zhihu.com/question/630285228
25,30 万热度,你认为，哪个字、哪个词最能代表你的 2023 年？,https://www.zhihu.com/question/630947727
26,30 万热度,官方：中国女足主帅水庆霞离任，因带队未获得奥运会参赛资格，如何评价她的带队能力？,https://www.zhihu.com/question/630962565
27,30 万热度,Sam Altman离开OpenAI的真实原因是什么？,https://www.zhihu.com/question/630655912
28,30 万热度,你在跑步训练过程中走过最大的弯路是什么？,https://www.zhihu.com/question/630163150
29,29 万热度,如何让家里的猫猫感到不孤单？,https://www.zhihu.com/question/628257415
30,29 万热度,《宁安如梦》中姜雪宁这一世不是皇后，为何还是未能和白月光张遮在一起？,https://www.zhihu.com/question/629730027
31,29 万热度,戈为什么会兴盛?,https://www.zhihu.com/question/34016440
32,29 万热度,你用过时间最长的数码产品是哪个？,https://www.zhihu.com/question/628086117
33,29 万热度,你家里有哪些运动健身器材已经在吃灰？,https://www.zhihu.com/question/630059705
34,29 万热度,单反，微单相机为什么注定是一个昂贵的消费品？,https://www.zhihu.com/question/627391405
35,29 万热度,假如果郡王没事，甄嬛会选择假死，放弃一切跟他走吗？,https://www.zhihu.com/question/628863219
36,29 万热度,如何评价大卫·芬奇执导的电影《杀手》？,https://www.zhihu.com/question/629728346
37,29 万热度,c++程序员如何处理内存碎片？,https://www.zhihu.com/question/630126692
38,29 万热度,如果结果正义和程序正义只能二选一，那该如何抉择，为什么？,https://www.zhihu.com/question/530882027
39,29 万热度,德约科维奇在2023年ATP年终总决赛的决赛中，第七次赢得冠军，成为当之无愧的GOAT，你怎么看？,https://www.zhihu.com/question/630895681
40,29 万热度,微软称 OpenAI 创始人 Sam Altman、Greg Brockman 将加入，带来哪些影响？,https://www.zhihu.com/question/630962018
41,29 万热度,奥特曼重返 OpenAI 谈判受阻，撤换董事会成员成最大阻碍，结局会如何？如何看待这场博弈？,https://www.zhihu.com/question/630899961
42,29 万热度,11 月 20 日沪指放量涨 0.46%，农业、汽车等板块走强，机器人概念爆发，如何看待今日行情？,https://www.zhihu.com/question/630905812
43,29 万热度,2023年底，车企为何集中开始推出B级轿车？,https://www.zhihu.com/question/630582462
44,29 万热度,11 月 LPR 报价出炉，1 年期和 5 年期利率均维持不变，如何解读？哪些信息值得关注？,https://www.zhihu.com/question/630905850
45,29 万热度,「蹭老式」消费火起来，年轻人为啥爱上老年消费？这是什么社会现象？,https://www.zhihu.com/question/622703592
46,28 万热度,「蓝白合」人选搭配难产，朱立伦称 22 日是「最后机会」，这个组合有哪些痛点？还能「合」下去吗？,https://www.zhihu.com/question/630915249
47,28 万热度,如果你现在辞职，你的工作会被迅速取代吗？,https://www.zhihu.com/question/630915227
48,28 万热度,为什么原子选择八电子稳定构型?,https://www.zhihu.com/question/463340996
49,28 万热度,肌肉量对老人很关键，如何敦促家里老人做力量训练？,https://www.zhihu.com/question/630163197
50,28 万热度,负面情绪都是积攒到一定程度爆发出来的吗？,https://www.zhihu.com/question/334651133
