index,hot,title,href
1,足球,山东首回合1-2横滨水手，陈蒲凌空斩，崔康熙染黄，石柯伤退,https://www.dongqiudi.com/article/4079567
2,足球,崔康熙谈判罚：如果一些事情一直在发生，那就不是偶然了,https://www.dongqiudi.com/article/4079657
3,足球,官方：贝林厄姆因不尊重裁判被停赛2场，被罚600欧元,https://www.dongqiudi.com/article/4079439
4,足球,主场1-2不敌横滨水手，大家对球队今天的发挥满意吗？,https://www.dongqiudi.com/article/2924540
5,足球,哥本哈根总监：没人能想到我们在和拜仁与曼联的小组拿到第二,https://www.dongqiudi.com/article/4079918
6,足球,回声报：利物浦考虑聘请伯恩茅斯体育总监理查德-休斯,https://www.dongqiudi.com/article/4079916
7,足球,距离复出又近一步，金斯利-科曼恢复有球训练,https://www.dongqiudi.com/article/4079915
8,足球,奥尔莫：巴萨缺少关键球员很难联赛夺冠；希望佩德里早日康复,https://www.dongqiudi.com/article/4079912
9,足球,英媒：皇家社会要续租蒂尔尼，维拉和凯尔特人想要他,https://www.dongqiudi.com/article/4079910
10,足球,世体：菲利克斯和坎塞洛想留在巴萨，门德斯已和拉波尔塔会面,https://www.dongqiudi.com/article/4079905
11,足球,英媒：罗伊斯被推荐给了西汉姆联,https://www.dongqiudi.com/article/4079902
12,足球,阿莱士-加西亚：不后悔曾公开示好巴萨，但时间并不恰当,https://www.dongqiudi.com/article/4079901
13,足球,皇社官方回应种族歧视中国博主事件：会根据画面去寻找该球迷,https://www.dongqiudi.com/article/4079893
14,足球,官方：瓦伦西亚与后防新星莫斯克拉续约至2026年,https://www.dongqiudi.com/article/4079885
15,足球,王大雷：真的有点可惜，还有90分钟，也许我们可能创造奇迹,https://www.dongqiudi.com/article/4079880
16,足球,名记：斯图加特要买断昂达夫，他会入选德国队大名单,https://www.dongqiudi.com/article/4079879
17,足球,官方：布努当选沙特联2月最佳门将,https://www.dongqiudi.com/article/4079875
18,足球,他终于要回来了！利物浦官方更新社媒：萨拉赫已恢复合练,https://www.dongqiudi.com/article/4079868
19,足球,阿拉伯资金进入米兰会带来什么？皮奥利：我回答不了,https://www.dongqiudi.com/article/4079866
20,足球,沙特媒体：马宁将执法亚冠1/4决赛次回合吉达联合vs新月,https://www.dongqiudi.com/article/4079853
