index,hot,title,href
1,july,#woshiPM训练营#广州站-EPM队,https://www.woshipm.com/?p=109324
2,rock07,#woshiPM训练营#广州站-石头队,https://www.woshipm.com/?p=108675
3,老陈的深度思考,传统生意以及门店如何做引流，让你的业绩翻倍,https://www.woshipm.com/?p=5916034
4,硅星人,拼多多真香的年轻人，正在悄悄流入抖音直播间,https://www.woshipm.com/?p=5915903
5,天下网商,我在国庆靠“替人买单”赚钱，8天流水十几万,https://www.woshipm.com/?p=5916594
6,ToB老人家,产品经理拯救不了失败的产品,https://www.woshipm.com/?p=5916189
7,一直在迭代的PM,生活中哪些体验很好，但容易被忽略的小设计,https://www.woshipm.com/?p=5915761
8,墨饕,好久没网购，收藏夹去哪了？,https://www.woshipm.com/?p=5916041
9,菜根老谭,产品经理该不该设计数据库表？,https://www.woshipm.com/?p=5915620
10,ToB老人家,ChatGPT时代：所有SaaS都值得重做一遍,https://www.woshipm.com/?p=5915249
11,jenson,充电站点运营解决方案（1）,https://www.woshipm.com/?p=5915391
12,小朋友,躲猫猫：共享定位下的多人运动新游戏,https://www.woshipm.com/?p=5912842
13,郑火火,产品营销启示录：不同视角下的《杭州亚运会》,https://www.woshipm.com/?p=5915881
14,tomato,价格管理（一）：产品定价背后的决策机制,https://www.woshipm.com/?p=5915318
15,定焦One,打工人的八天假，比上班还累,https://www.woshipm.com/?p=5915691
16,老陈的深度思考,AI带来的赚钱机会，以及利用AI工具提升数倍工作效率,https://www.woshipm.com/?p=5916033
17,老付说运营,4天41万浏览，一篇非典型小红书笔记的拆解,https://www.woshipm.com/?p=5913844
18,L.Hwang,IAM是什么以及要怎么设计？,https://www.woshipm.com/?p=5914930
19,寻空,遥遥领先，一个华为热梗的非典型走红,https://www.woshipm.com/?p=5912442
20,up咆哮姐,品牌在不同发展阶段，如何做消费者沟通,https://www.woshipm.com/?p=5916265
21,刘佩龙,中国市场调研后2.0时代的困境与机会,https://www.woshipm.com/?p=5916152
22,零态LT,2023，社交进入大变革时代,https://www.woshipm.com/?p=5915962
23,一只鸡腿,什么是“货架思维”？,https://www.woshipm.com/?p=5914868
24,元旦GC,制作一套表情包的全流程（— 。—）,https://www.woshipm.com/?p=5915821
25,执坚果,科技公司的业务定位、商业模型和产品设计,https://www.woshipm.com/?p=5914923
26,黑人阿狸,小众产品如何通过互联网破圈，实现大众化消费增长,https://www.woshipm.com/?p=5913199
27,谈擎说AI,自动驾驶的丁字路口,https://www.woshipm.com/?p=5916163
28,老秦Talk,实时物理模拟技术在XR体验中的重要性与应用,https://www.woshipm.com/?p=5915683
29,运营林同学,想要转型用户运营？两招教你精准避坑！,https://www.woshipm.com/?p=5916175
30,白鲸出海,全球流量Top50的“AI网站”出炉：C端用户都愿意用AI干什么？,https://www.woshipm.com/?p=5916499
31,刘旷,大模型应用疯狂加速，洗牌却在静悄悄进行了,https://www.woshipm.com/?p=5915420
32,十里村,吃瓜群如何一个月赚5万？,https://www.woshipm.com/?p=5915726
33,灯衍,老板让我写个营销方案，对标疯狂星期四,https://www.woshipm.com/?p=5914886
34,没汤圆啦,以BOSS直聘为例，探讨招聘平台为什么这么难用？,https://www.woshipm.com/?p=5915256
35,三爷茶馆,中台产品经理宝典连载02：如何判断什么企业需要中台？,https://www.woshipm.com/?p=5558555
36,白鲸出海,下载一万次、营收千万元的生意？,https://www.woshipm.com/?p=5915838
37,接地气的陈老师,十大数据分析模型之一：矩阵模型,https://www.woshipm.com/?p=5915940
38,Sally,小红书种草带不来转化？从3个互动量过5w的国货品牌了解种草效率的4大因素,https://www.woshipm.com/?p=5913769
39,王智远,找到单点，击穿它,https://www.woshipm.com/?p=5916197
40,差评,时隔13年，美团又成了所有大厂的“瓜分对象”,https://www.woshipm.com/?p=5915570
41,magbox勇,分析：证券和基金清算、交收和结算业务模式,https://www.woshipm.com/?p=5916156
42,在线支付,支付通道的定义,https://www.woshipm.com/?p=5915758
43,十里村,回县城能赚钱的10个生意,https://www.woshipm.com/?p=5916608
44,人人都是产品经理,ChatGPT的创业机会,https://www.woshipm.com/?p=5913310
45,产品大峡谷,胖东来不是在卖商品，而是在做产品,https://www.woshipm.com/?p=5916232
46,又见智能商业,从一碗米线，聊聊产品爆火的逻辑,https://www.woshipm.com/?p=5914756
47,光波,MarTech​-CDP实战手册：CDP交付阶段-行为事件规划（十一）,https://www.woshipm.com/?p=5914912
48,显微故事,国庆长假返乡，我发现了独居老人直播间的“秘密”,https://www.woshipm.com/?p=5915661
49,柳星聊产品,得到APP，它有什么值得我们去使用呢？,https://www.woshipm.com/?p=5915791
50,TCC翻译情报局,案例研究｜为无虐待主义消费者设计APP（上）,https://www.woshipm.com/?p=5915913
51,忻芸,如何进行数据埋点设计？,https://www.woshipm.com/?p=5914279
52,伍德安思壮,产品管理者如何管理好团队？,https://www.woshipm.com/?p=5914525
53,Ruby的产品工坊,新体验VS旧体验：如何用简单公式优化产品决策？,https://www.woshipm.com/?p=5916277
54,柳星聊产品,容忍度低，才是产品经理的必备素质！,https://www.woshipm.com/?p=5915788
55,胡先务,1张报表，玩转数据分析，撬动存量转化！,https://www.woshipm.com/?p=5076806
56,蓝莲花zx,职业晋升：产品经理如何持续提升认知？,https://www.woshipm.com/?p=5916198
57,师天浩,《埃隆·马斯克传》：世界上最伟大的“产品经理”，世界上最懂“人设”的舆论大师,https://www.woshipm.com/?p=5916140
58,产品锦李,当产品经理老了：关于产品适老化设计的探讨,https://www.woshipm.com/?p=5916691
59,壹DU财经,拼多多，你为什么学不会？,https://www.woshipm.com/?p=5915392
60,光锥智能,开源大模型正在“杀死”闭源？,https://www.woshipm.com/?p=5916112
61,小i产品库,需求与痛点的区别以及如何引领产品设计新方向,https://www.woshipm.com/?p=5916169
62,表外表里,Costco成功学陷阱：低价只是幻影,https://www.woshipm.com/?p=5913094
63,亿邦动力,天猫亿级大卖家，跑去印尼开工厂，去了才发现……丨东南亚出海洞察,https://www.woshipm.com/?p=5914604
64,刘旷,抢跑搜索大模型，百度、昆仑万维“秋色平分”,https://www.woshipm.com/?p=5916254
65,Super黄,AI智能涌现：为何普通人都值得理解Ta？,https://www.woshipm.com/?p=5916323
66,烧包鹿,网购时的匿名评价，原来并没真的匿名,https://www.woshipm.com/?p=996637
67,产品小明,别再“借鉴”了！教你如何打造独创新品，突破复制产品的壁垒,https://www.woshipm.com/?p=5915801
68,光子星球,巨头“拾荒”元宇宙,https://www.woshipm.com/?p=5916663
69,刀法研究所,品牌这么做，才算真正用对小红书,https://www.woshipm.com/?p=5915042
70,汪浩,数据分析，如何评估活动的好坏？,https://www.woshipm.com/?p=5914875
71,加饭,智能座舱之语音TTS,https://www.woshipm.com/?p=5916025
72,不能再斗蟋蟀了,霸占TA的屏幕——「贴贴」用户分析报告,https://www.woshipm.com/?p=5914686
73,光子星球,To C大模型，亏钱也得干,https://www.woshipm.com/?p=5915527
74,张佳的流量常识,私域业务的这4个环节，可以直接上AI了,https://www.woshipm.com/?p=5908001
75,定焦One,“换房旅游”，没火起来,https://www.woshipm.com/?p=5914855
76,窄播,从「搭子」理解小红书的社交逻辑,https://www.woshipm.com/?p=5914732
77,新智元,MIT惊人证明：大语言模型就是「世界模型」,https://www.woshipm.com/?p=5914999
78,未来消费,最懂旅游的年轻人，迷上了逛菜市场,https://www.woshipm.com/?p=5914778
79,壹娱观察,关于买手电商这件事，小红书还要学会抖快哪些建设路径？,https://www.woshipm.com/?p=5915526
80,大仓鼠,PRD需求文档 | 实例撰写指南,https://www.woshipm.com/?p=5911833
81,霞光社,包车出海，一门难做的生意,https://www.woshipm.com/?p=5915275
82,又见智能商业,龙门石窟与洛邑古城中的产品表达,https://www.woshipm.com/?p=5914903
83,硬核老麻花,小红书酒鬼活动运营拆解，如何利用线上内容短期提升线下门店营收？,https://www.woshipm.com/?p=5914154
84,差评,十块钱买三个面包，新的薅羊毛方式让我找着了,https://www.woshipm.com/?p=5914575
85,奇偶派,抖音的「本地进击」序曲,https://www.woshipm.com/?p=5915299
86,科技新知,大厂搜索之困：超越AI的难题,https://www.woshipm.com/?p=5913661
87,蓝莲花zx,AI产品经理 | 入行AI的必备知识,https://www.woshipm.com/?p=5909904
88,Morketing,不会联名，挤不进消费市场的“大山”,https://www.woshipm.com/?p=5915095
89,洪强,如何用管理项目的方式管理个人任务,https://www.woshipm.com/?p=5914022
90,柠檬饼干净又卫生,风控系统的建设，具体怎么做？,https://www.woshipm.com/?p=5914202
91,霞光社,北美爆火的“狼人”短剧，来自中国APP,https://www.woshipm.com/?p=5914803
92,商隐社,小红书能打破高逼格社区的商业化魔咒吗？,https://www.woshipm.com/?p=5914985
93,吴之猫,B端产品需求文档模板,https://www.woshipm.com/?p=5881959
94,Ruby的产品工坊,压箱底技巧！产品经理做竞品分析的正确姿势！,https://www.woshipm.com/?p=5913604
95,品玩,24小时直播干饭，流浪猫版的楚门世界,https://www.woshipm.com/?p=5914534
96,知之为之之,聚焦新模式：互联网平台付费会员商业化探索,https://www.woshipm.com/?p=5914701
97,王智远,从作品到产品的过程,https://www.woshipm.com/?p=5914500
98,Kuang扶正义的匡,提升B端产品易用性：搭建帮助体系,https://www.woshipm.com/?p=5908777
99,OK,如何从0-1搭建清算系统、提升清结算准确性,https://www.woshipm.com/?p=5913955
100,量子位,微软写了份GPT-4V说明书：提示词demo示例一应俱全,https://www.woshipm.com/?p=5915348
