index,hot,title,href
1,106,请教一下近两年结婚的朋友们,https://www.guozaoke.com/t/110235
2,103,大家好，想咨询一下武汉的【相亲市场】和【Java就业市场】的行情,https://www.guozaoke.com/t/110135
3,81,买房后续（240605），堂弟刚刚上车虹桥西了————上海郊区还是光谷东,https://www.guozaoke.com/t/110155
4,69,谈恋爱不要送贵重礼品,https://www.guozaoke.com/t/110167
5,58,胡塞武装到底打中航母了没？,https://www.guozaoke.com/t/110139
6,57,女征男，走过路过不要错过,https://www.guozaoke.com/t/110141
7,56,卖车啦卖车啦，卖了回家躺平啦,https://www.guozaoke.com/t/110277
8,53,选择大于努力：张雪峰的高考选择工具3小时进账2个亿,https://www.guozaoke.com/t/110290
9,48,社友对当年高考最印象深刻的记忆是啥,https://www.guozaoke.com/t/110180
10,43,2024年了   还有人在说电车不如油车,https://www.guozaoke.com/t/110188
