index,hot,title,href
1,6.8万,公司43岁女同事，一家四口卖房回安徽了。。。,http://club.kdslife.com/t_11239887.html
2,5.9万,靠利息养老的想法要破灭了！,http://club.kdslife.com/t_11239835.html
3,5.1万,胡锡进呼吁各地撤下过度安检,http://club.kdslife.com/t_11239847.html
4,5.1万,昨晚路过南京西路捡漏,http://club.kdslife.com/t_11239923.html
5,4.5万,曾志伟下狠手了,http://club.kdslife.com/t_11239865.html
6,4.1万,有人扒出亮亮丽君的真相出来了,http://club.kdslife.com/t_11239931.html
7,3.4万,39岁失业了，没结婚，还能翻身吗？,http://club.kdslife.com/t_11239945.html
8,3.0万,为什么上海人当年计划生育很积极，而现在开放二胎三胎却不积极呢,http://club.kdslife.com/t_11239856.html
9,3.0万,大米国空运创了新高,http://club.kdslife.com/t_11239828.html
10,3.2万,不出所料，希望有关部门继续介入给大众一个真相,http://club.kdslife.com/t_11239834.html
11,2.6万,科学的尽头就是玄学，这个说法靠谱吗？,http://club.kdslife.com/t_11239821.html
12,2.5万,碧云这么惨？,http://club.kdslife.com/t_11240128.html
13,2.4万,我认为注射死刑比枪决痛苦一万倍,http://club.kdslife.com/t_11240028.html
14,2.4万,陈慧琳唱的对,http://club.kdslife.com/t_11239827.html
15,2.2万,83年的，这个社保缴费年限和金额，算不算很低的？没人更低了吧？,http://club.kdslife.com/t_11239863.html
16,2.3万,要是上海从没拆迁，，，穷苦人家应该很多吧,http://club.kdslife.com/t_11239913.html
17,2.3万,从宁波首富到破产仅247天,http://club.kdslife.com/t_11240085.html
18,2.1万,是不是只有国企事业单位才有补充公积金,http://club.kdslife.com/t_11239814.html
19,2.1万,地铁上遇到这种怕热的女生怎么办？,http://club.kdslife.com/t_11240061.html
20,2.1万,从种种迹象表明未来很长一段时间里通胀都很难有大的起色了！,http://club.kdslife.com/t_11239848.html
