index,hot,title,href
1,397,【2024春节】解题领红包活动开始喽，解出就送论坛币！,https://www.52pojie.cn/thread-1889163-1-1.html
2,35,VMwareI虚拟机黑群晖DSM 7.2.1原生支持8路摄像头,https://www.52pojie.cn/thread-1889255-1-1.html
3,22,办公/屏幕 护眼工具  CareUEyes v2.2.12.0/2024.02.01,https://www.52pojie.cn/thread-1889248-1-1.html
4,18,把文字保存为图片，再把图片OCR成文字，于是问题来了,https://www.52pojie.cn/thread-1889201-1-1.html
5,9,假如桌面右下角的弹窗通知，接入各种实用功能会如何？,https://www.52pojie.cn/thread-1889254-1-1.html
6,6,哪位有收藏小甲鱼解析PE文件的Delphi源码？,https://www.52pojie.cn/thread-1889168-1-1.html
7,4,先拜个年，各位大神问下KTV点播机的问题,https://www.52pojie.cn/thread-1889167-1-1.html
8,4,突发其想，大佬们有空开发个电子鞭炮烟花啊，安卓单机,https://www.52pojie.cn/thread-1889195-1-1.html
9,4,下载知网文章请求帮帮忙,https://www.52pojie.cn/thread-1889230-1-1.html
10,3,求下载优酷视频,https://www.52pojie.cn/thread-1889164-1-1.html
11,3,腾讯文档无权限,https://www.52pojie.cn/thread-1889174-1-1.html
12,3,求猫叔：21天低强度无跑跳高效减脂,https://www.52pojie.cn/thread-1889183-1-1.html
13,3,求爱奇艺三天卡会员，私我！！！！！,https://www.52pojie.cn/thread-1889189-1-1.html
14,3,安卓能用的，桌面上鱼游来游去的屏保，或养鱼的小游戏，单机,https://www.52pojie.cn/thread-1889202-1-1.html
15,3,易语言源码，文件更新下载器，下载下来得文件有问题，求修复,https://www.52pojie.cn/thread-1889207-1-1.html
