index,hot,title,href
1,,新科大满贯加身！樊振东4-1力克莫雷加德摘得乒乓球男单金牌,https://www.dongqiudi.com/article/4446370
2,足球,雪佛龙｜国安2-1终结申花开季不败纪录，王子铭补时绝杀,https://www.dongqiudi.com/article/4446409
3,体坛,德约2-0阿尔卡拉斯网球男单夺金，实现职业生涯金满贯！,https://www.dongqiudi.com/article/4446552
4,足球,斯基拉：两家外国俱乐部询问了米利克的情况，但他更愿意留队,https://www.dongqiudi.com/article/4446676
5,篮球,中国三人男篮12-21法国无缘附加赛，结束奥运征程！,https://www.dongqiudi.com/article/4446682
6,足球,德天空：多特愿意花2500万欧买拜尔，计划在下周采取行动,https://www.dongqiudi.com/article/4446671
7,足球,曼联小将本内特：能获得出场时间很好，我会铭记这一段经历,https://www.dongqiudi.com/article/4446683
8,体坛,张之臻：感谢王欣瑜，希望下届我还能摇到那么棒的队友,https://www.dongqiudi.com/article/4446685
9,体坛,一切都值了！德约为奥运会放弃法网做手术，最终修成正果,https://www.dongqiudi.com/article/4446670
10,足球,罗马诺：埃默松的交易未来几天完成，热刺将开始找新的右边卫,https://www.dongqiudi.com/article/4446673
11,足球,客场1-1绝平南通，王上源发文：在逆境中团队才能更好的成长,https://www.dongqiudi.com/article/4446652
12,足球,南基一：虽然长处没有完全发挥出来，但也拿到了宝贵的一分,https://www.dongqiudi.com/article/4446656
13,足球,官方：前阿森纳、里尔边锋尼古拉-佩佩以自由身加盟黄潜,https://www.dongqiudi.com/article/4446659
14,体坛,37岁74天，德约成网球回归奥运后最年长单打冠军得主,https://www.dongqiudi.com/article/4446663
15,体坛,国家的英雄，德约科维奇斩获塞尔维亚历史上奥运网球首金,https://www.dongqiudi.com/article/4446644
16,体坛,金满贯,https://n.dongqiudi.com/webapp/tops.html?id=4446658
17,足球,柯蒂斯-琼斯：我可以进球、助攻并帮助球队；很期待新赛季,https://www.dongqiudi.com/article/4446618
18,足球,苏亚雷斯：球员打出了我最满意的比赛，我们永远全力争胜,https://www.dongqiudi.com/article/4446636
