index,hot,title,href
1,12084644,肖国栋击败斯佳辉夺冠
2,11597006,郑钦文晋级武网决赛
3,11498610,我国成功回收首颗可重复使用卫星
4,11424671,王楚钦亚锦赛止步8强
5,10631177,林诗栋蒯曼混双夺冠
6,10594141,2024抖音美好奇妙夜晚会
7,9456834,东北雨姐道歉
8,9400009,各国干净饮食大赏
9,9395660,伊朗总统希望尽快与俄签约
10,9278600,辽宁男篮揭幕战逆转浙江
11,9273279,姜杰受贿超2.25亿被判死缓
12,9227064,国家奖学金奖励名额翻倍
13,9190240,存量房贷下调最全解读来了
14,8993894,专家：A股回调有利于牛市走更远
15,8813741,河南一事业单位招录300人不实
16,8647247,东北雨姐虚假宣传被罚165万元
17,8511717,奇妙夜全员走花路下班
18,8373476,披哥五公杜海涛李佳琦淘汰
19,8270316,刀郎演唱会南京站
20,8153799,国家助学金升至每年3700元
21,7965831,k总花小龙奇妙夜后台直播
22,7841470,赵露思魅惑黑天鹅
23,7816275,国乒女单无缘亚锦赛四强
24,7788966,这是代表我青春的画面
25,7784183,萨巴伦卡逆转高芙晋级决赛
26,7782554,76人不敌森林狼
27,7773140,现在轮到黄晓明的名场面了
28,7757117,一觉醒来怎么都会控火术了
29,7736170,卡拉永远OK氛围感慢动作
30,7715144,北京偶遇K总王不染
31,7713627,多家银行25日起调整存量房贷利率
32,7713068,国乒男双皆止步8强
33,7711097,俄坦克工厂员工被判叛国罪
34,7699412,许昕3:2战胜刘家良
35,7698242,超绝电音卡点运镜
36,7682003,人生啊真是匆匆
37,7676962,原来昙花一现是真的
38,7676242,付辛博得过抑郁症
39,7671786,美式复古卫衣和秋天太配了
40,7662500,小孩姐也拒绝不了甄嬛传
41,7654902,夏志远催婚鹿晗
42,7652914,奶牛猫之歌
43,7648079,相遇的意义到底是什么
44,7641140,JENNIE新歌我先跳了
45,7640356,武艺有点脾气但不多
46,7627370,露思新歌封面怎么拍都有面
47,7622399,相思遥古风舞蹈挑战
48,7615228,总有人喜欢素面朝天爱笑的你
49,7611741,北风北风变成了赛跑的小孩
50,7610222,书页转场挑战
