index,hot,title,href
1,2.8万,居然还有这种学校,http://club.kdslife.com/t_11234343.html
2,2.7万,秋悲！！！！！！,http://club.kdslife.com/t_11234493.html
3,2.6万,KTV夜场衰退厉害,http://club.kdslife.com/t_11234308.html
4,1.9万,田子坊死了笔笔挺了。,http://club.kdslife.com/t_11234516.html
5,1.6万,林瑞阳又回归拉？不算传销了,http://club.kdslife.com/t_11234284.html
6,1.7万,长宁的天山河畔，仁恒河滨以前是天原化工厂........,http://club.kdslife.com/t_11234385.html
7,1.5万,河南惊恐血案！男上楼砍邻居 父死母残儿毁容,http://club.kdslife.com/t_11234386.html
8,1.7万,现在上海的房租是跌了还是涨了？,http://club.kdslife.com/t_11234314.html
9,1.2万,“你拍的不算！”上海一闯红灯男子被判全责，当街耍无赖，民警：男人该敢作敢当！,http://club.kdslife.com/t_11234429.html
10,1.2万,高层住宅，天天受罪,http://club.kdslife.com/t_11234529.html
11,1.4万,这个古灵精怪的美女xs主播嗲伐？,http://club.kdslife.com/t_11234448.html
12,1.1万,这次大牛市真的来了,http://club.kdslife.com/t_11234560.html
13,1.1万,一直认为上海不堵，今天醒悟了,http://club.kdslife.com/t_11234476.html
14,1.0万,一天到晚说经济不好，出国都是爆买，日本珠宝展国人爆买！,http://club.kdslife.com/t_11234489.html
15,1.0万,上汽智己宣扬包饺子是什么意思?,http://club.kdslife.com/t_11234438.html
16,9987,巴拿马77岁大学教授遇环保人士堵路，掏枪射杀2人，淡定拆除路障,http://club.kdslife.com/t_11234471.html
17,1.1万,宝马在国内也蛮拼的 ， 老版的仪表盘也不用了,http://club.kdslife.com/t_11234268.html
18,1.0万,全世界为何东亚人最卷？,http://club.kdslife.com/t_11234344.html
19,9893,50-70岁这个年龄段的人最崇洋媚外！,http://club.kdslife.com/t_11234468.html
20,9729,感觉以后上海小姑娘被十八线小镇作题家盯上的概率不小,http://club.kdslife.com/t_11234306.html
