index,hot,title,href
1,184,世界尽头，遗世仙境，感受北欧之美,https://www.kaiyanapp.com/detail.html?vid=320338
2,110,唯美影视混剪，青春期的恋爱真的好好磕,https://www.kaiyanapp.com/detail.html?vid=319028
3,123,墨西哥航空脑洞广告，蜥蜴骑上金雕,https://www.kaiyanapp.com/detail.html?vid=320320
4,82,吸血鬼拍 Vlog，简直是我梦想的生活！,https://www.kaiyanapp.com/detail.html?vid=320374
5,39,新款Apple Watch，目测已放弃韩国市场,https://www.kaiyanapp.com/detail.html?vid=320318
6,109,交通公益广告「路」，别让等待成为遗憾,https://www.kaiyanapp.com/detail.html?vid=320319
7,45,在美国狂坐72小时火车，我终于悟了...,https://www.kaiyanapp.com/detail.html?vid=319066
8,109,小众宝藏音乐人，从少年嘴里听出了沧桑,https://www.kaiyanapp.com/detail.html?vid=320399
9,68,新西兰最奢华民宿，大概是住不起的样子,https://www.kaiyanapp.com/detail.html?vid=318915
10,93,我一生最有成就感的事：照顾94岁父亲离世,https://www.kaiyanapp.com/detail.html?vid=320396
