index,hot,title,href
1,538 万热度,张艺谋已经 73 岁了，在导演界也是天花板级别的存在，他已经功成名就了，为啥他还在不断努力拍电影？,https://www.zhihu.com/question/624711628
2,179 万热度,「挖呀挖」黄老师五场直播销售额超百万，网红鹿哈自曝「带货七个月赚 3500 万」，哪些信息值得关注？,https://www.zhihu.com/question/625102048
3,176 万热度,为什么TVB的电视剧一眼就能看出来？,https://www.zhihu.com/question/323209204
4,152 万热度,我今年三十了，男朋友人品很好但经济条件一般。可经济条件跟人品我都想要，怎么平衡？,https://www.zhihu.com/question/624623991
5,142 万热度,一颗金丝楠木能卖到上亿，树苗一株才10元左右，为什么没人肯种？,https://www.zhihu.com/question/617358912
6,138 万热度,以色列正式向哈马斯宣战，这意味着什么？会带来哪些影响？,https://www.zhihu.com/question/625185576
7,133 万热度,杭州亚运会闭幕式有哪些精彩瞬间？本届亚运会给你留下了怎样的印象？,https://www.zhihu.com/question/624855009
8,115 万热度,怎么感觉 24 秋招比 23 秋招环境更差了？,https://www.zhihu.com/question/618357219
9,101 万热度,如何评价哈马斯此次袭击以色列的军事装备、战术？和历次巴以冲突相比有什么不同？,https://www.zhihu.com/question/625106636
10,86 万热度,虚幻引擎对非游戏应用要收费啦，你怎么看?,https://www.zhihu.com/question/624884825
11,83 万热度,巴以冲突会否牵制美国对俄乌战局的干预精力？俄乌战争进程会因此生变吗？,https://www.zhihu.com/question/625094165
12,79 万热度,浙江国祥 IPO 暂停，原定于 9 号申购，上交所表示「将对其开展专项核查」，哪些信息值得关注？,https://www.zhihu.com/question/625131567
13,74 万热度,如果你是孙悟空，你的老板资金链断了，你会拔根汗毛变出钱，给他救急吗？,https://www.zhihu.com/question/624027358
14,56 万热度,强行装逼失败是种怎样的体验？,https://www.zhihu.com/question/29352954
15,56 万热度,巴以冲突为何再起？是否与以色列近年来过度压制巴勒斯坦的生存空间有关？,https://www.zhihu.com/question/625097253
16,55 万热度,想看看各位网友们随手一拍却很惊艳的照片，有吗有吗？,https://www.zhihu.com/question/545454775
17,52 万热度,外交部回应「巴以冲突升级」，称根本出路在于落实「两国方案」，建立独立的巴勒斯坦国，透露哪些信息？,https://www.zhihu.com/question/625102612
18,50 万热度,23-24 赛季英超伯恩利 1:4 切尔西，如何评价这场比赛？,https://www.zhihu.com/question/625039198
19,44 万热度,美职联：迈阿密国际 0:1 辛辛那提无缘季后赛，梅西替补出场 45 分钟，如何评价本场比赛？,https://www.zhihu.com/question/625095577
20,24 万热度,你读博是为了什么？,https://www.zhihu.com/question/620652413
21,18 万热度,短途游/出差化妆包里应该带哪些必备品？,https://www.zhihu.com/question/622787640
22,18 万热度,如何评价恐怖电影《回应我》？,https://www.zhihu.com/question/621995048
23,18 万热度,如果猫咪的小伙伴去世了，留下来的猫猫会伤心吗?,https://www.zhihu.com/question/624807459
24,17 万热度,古希腊在环地中海的殖民据点，为什么消失得这么彻底？,https://www.zhihu.com/question/624650044
25,17 万热度,今年国庆节后A股行情会如何表现？,https://www.zhihu.com/question/624996988
26,17 万热度,为啥猫有时候看着很「可爱」，有时候看着很「臭脸」？,https://www.zhihu.com/question/622606973
27,17 万热度,可以分享一下有生命力的照片或背景图吗？,https://www.zhihu.com/question/624607243
28,17 万热度,女大学生应该用什么颜色的化妆包比较好呢？,https://www.zhihu.com/question/327002575
29,17 万热度,离职将近两个月，在新公司一直无法适应，想回前公司却无法说服自己，好纠结怎么办？,https://www.zhihu.com/question/624651218
30,17 万热度,杭州亚运会中国代表团共获 201 枚金牌，破单届金牌数纪录，哪块金牌让你印象深刻？,https://www.zhihu.com/question/625027374
31,17 万热度,如何评价《他从火光中走来》大结局？,https://www.zhihu.com/question/624901050
32,17 万热度,世界上是否不存在悖论，所谓的悖论只是由于语序的不严谨而造成得逻辑上的自相矛盾？,https://www.zhihu.com/question/563509842
33,16 万热度,孩子要去上大学了，用2千多元的手机很丢人吗？,https://www.zhihu.com/question/616927172
34,16 万热度,哪些照片可以证明你和猫的关系很铁？,https://www.zhihu.com/question/618851076
35,16 万热度,今年双十一想买台 4K 高刷电竞显示器，3000 元预算有推荐吗？,https://www.zhihu.com/question/621674273
36,16 万热度,只看电影的话，AR 和 VR 选哪个？,https://www.zhihu.com/question/623987453
37,16 万热度,以军继续空袭加沙地带哈马斯目标，双方死亡人数已超 400 人，局势可能如何发展？,https://www.zhihu.com/question/625082833
38,16 万热度,2024 考研大纲有哪些值得关注的变化？考生该如何应对？,https://www.zhihu.com/question/623303375
39,16 万热度,人在职场，你认为一个领导的岗位价值是什么？,https://www.zhihu.com/question/624900794
40,16 万热度,运动健身最好晚上在几点之前，不会太影响睡眠？,https://www.zhihu.com/question/621507881
41,16 万热度,入职第一天发现加班强度很大且氛围不好，但薪资待遇高于行业平均水平，要不要离职?,https://www.zhihu.com/question/622558906
42,16 万热度,男朋友因为我奶奶用了他杯子跟我吵架，这种情况怎么办呢？,https://www.zhihu.com/question/618848739
43,16 万热度,有人说有线耳机过时了，真的吗，为什还有那么多人使用有线耳机?,https://www.zhihu.com/question/622156075
44,16 万热度,通过互联网大厂筛选的简历，大概长什么样？,https://www.zhihu.com/question/622553874
45,15 万热度,媒体批当下甜宠剧「有的剧能不能别太性缘脑？干点啥都要谈恋爱」，如何看待此评论？,https://www.zhihu.com/question/625127834
46,15 万热度,央行黄金储备连续 11 个月增持，黄金储备首次站上 7000 万盎司，透露了哪些信息？,https://www.zhihu.com/question/625102080
47,15 万热度,日常上班通勤，你的化妆包里都装了哪些必备好物？,https://www.zhihu.com/question/614533709
48,15 万热度,你反复去过三次以上的旅行地是哪里？,https://www.zhihu.com/question/624680480
49,15 万热度,为什么高血压的症状越来越年轻化，作为年轻人该如何预防？,https://www.zhihu.com/question/624997396
50,15 万热度,面试过程中，当出现哪些话语时，表明面试实际已经结束了？,https://www.zhihu.com/question/622555887
