index,hot,title,href
1,147,都有哪些在欧美是高级享受、在国内却稀松平常的事情？,https://www.mysmth.net/nForum/article/Oversea/4213079
2,130,中国哪个城市最宜居,https://www.mysmth.net/nForum/article/Geography/571235
3,111,谷歌弒妻嫌犯陈立人 优秀小公民 十佳少年 华罗庚一等 清华毕业,https://www.mysmth.net/nForum/article/FamilyLife/1766597464
4,61,小米汽车必然低价，不然就换牌子,https://www.mysmth.net/nForum/article/GreenAuto/1460703
5,59,打了个专车，司机喷了一路新能源,https://www.mysmth.net/nForum/article/AutoWorld/1944770738
6,55,有人收到过类似敲诈短信吗,https://www.mysmth.net/nForum/article/Age/20335372
7,49,北京到沈阳开车中间在哪停一晚比较好？,https://www.mysmth.net/nForum/article/AutoTravel/13648224
8,47,薪酬保密的意义是什么？全社会都公开薪酬是不是更好？,https://www.mysmth.net/nForum/article/WorkLife/3496069
9,38,问一下深圳的同学们,https://www.mysmth.net/nForum/article/Shenzhen/167108
10,37,求推荐即热式小厨宝,https://www.mysmth.net/nForum/article/CouponsLife/4474348
