index,hot,title,href
1,144,优秀女生真诚征友,https://www.guozaoke.com/t/109998
2,115,比亚迪油耗都1.88了，还有谁能一战？,https://www.guozaoke.com/t/109906
3,76,感觉增程就是最好的混动模式,https://www.guozaoke.com/t/109909
4,74,找个91年/94年的人生伴侣~非诚勿扰,https://www.guozaoke.com/t/110008
5,73,萝卜快跑导致堵车遭大量投诉,https://www.guozaoke.com/t/109898
6,68,相亲有感而发：年龄是对方的最小问题【女拳勿入】,https://www.guozaoke.com/t/110051
7,67,武汉大学研究生 顾某  选调分配  甘肃嘉峪关,https://www.guozaoke.com/t/109939
8,59,中国城市航空客流量：「九省通衢」武汉十名开外，「蜀道难」成都排名第三,https://www.guozaoke.com/t/109930
9,54,要到结婚了又有些犹豫了是什么心理？,https://www.guozaoke.com/t/109915
10,54,今年西瓜咋出道就崩盘了,https://www.guozaoke.com/t/110038
