index,hot,title,href
1,25,你们有被父母催生男孩么,https://www.guozaoke.com/t/106652
2,24,武汉要发展，但为何武汉楼市还不降价？,https://www.guozaoke.com/t/106693
3,22,结婚后两家能成为一家人吗,https://www.guozaoke.com/t/106655
4,19,有哪些菜是你无法适应的？比如崇阳的墨鱼炖鸡…,https://www.guozaoke.com/t/106658
5,18,00年男 求各位前辈们介绍对象,https://www.guozaoke.com/t/106659
6,18,你们同学聚会都是谁买单,https://www.guozaoke.com/t/106673
7,16,下酒菜之争，谁是第一,https://www.guozaoke.com/t/106643
8,15,春节见闻& 男生 秃+肥 太普遍了,https://www.guozaoke.com/t/106676
9,15,是否应该再来一次三线建设？,https://www.guozaoke.com/t/106706
10,14,婆婆在的情况下，老公在家里穿内裤到处晃，我非常膈应,https://www.guozaoke.com/t/106696
