index,hot,title,href
1,足球,U21国足2-1越南U21，何小珂绝杀，艾菲尔丁建功，鲍世蒙送礼,https://www.dongqiudi.com/article/4518401
2,足球,“我的孩子练球五年，为什么拿不到一级证”,https://www.dongqiudi.com/article/4517726
3,足球,记者：奥塔门迪很有可能担任阿根廷队本期队长,https://www.dongqiudi.com/article/4518568
4,足球,拉波尔特看到我拿的曼城球衣最后还签了个14号上去,https://www.dongqiudi.com/article/4518523
5,足球,但是真的喜欢达巴，希望能纪念一下这个小将????,https://www.dongqiudi.com/article/4518521
6,足球,我觉得有些人真的没有弄清楚奇尔克泽和莫塔的关系,https://www.dongqiudi.com/article/4518517
7,足球,安菲尔德茶话室 ｜ 罗伯逊：纵有千万川,https://www.dongqiudi.com/article/4518512
8,足球,官方：德温特退出比利时队集训名单，狼堡后卫博尔瑙入替,https://www.dongqiudi.com/article/4518503
9,足球,卡萨多：弗里克是一位非常亲密的教练；我的榜样一直是哈维,https://www.dongqiudi.com/article/4518501
10,足球,“越吹”说话？自世预赛耻辱输球后，各级国字号四杀越南,https://www.dongqiudi.com/article/4518497
11,篮球,过去5个赛季NBA替补总得分排名：克拉克森居首，蒙克第二,https://www.dongqiudi.com/article/4518494
12,足球,巴黎欧冠名单：登贝莱领衔，若昂-内维斯、李刚仁在列,https://www.dongqiudi.com/article/4518478
13,,官方：金球奖候选名单将于北京时间9月5日0:20开始揭晓,https://www.dongqiudi.com/article/4518476
14,足球,拜仁欧冠名单：凯恩领衔，帕利尼亚、奥利塞在列,https://www.dongqiudi.com/article/4518472
15,足球,曼城欧冠名单：哈兰德领衔，京多安、萨维尼奥在列,https://www.dongqiudi.com/article/4518463
16,足球,足协裁判评议：辽宁铁人手球未判点是误判，但VAR角度有限,https://www.dongqiudi.com/article/4518452
17,足球,西媒：亚马尔上轮联赛后感到不适，今日接受检查他没有受伤,https://www.dongqiudi.com/article/4518455
18,足球,利物浦欧冠名单：萨拉赫领衔，基耶萨在列,https://www.dongqiudi.com/article/4518445
19,足球,阿森纳欧冠名单：萨卡领衔，梅里诺、斯特林在列,https://www.dongqiudi.com/article/4518436
20,体坛,价值260多万，内蒙古奥运冠军李倩、杨家玉获得169㎡住房,https://www.dongqiudi.com/article/4518437
