index,hot,title,href
1,足球,懂球帝&All Football 2023年度MVP揭晓：哈兰德高票当选！,https://www.dongqiudi.com/article/3960809
2,足球,懂球帝2023年度最佳11人：哈兰德领衔曼城四人，姆巴佩入选,https://www.dongqiudi.com/article/3960820
3,足球,国足将士们准备好了吗？国足首战对手塔吉克斯坦队抵达卡塔尔,https://www.dongqiudi.com/article/3961461
4,足球,索内斯：哈弗茨又胆小又没侵略性，搞不懂阿森纳为什么买他,https://www.dongqiudi.com/article/3961445
5,足球,罗马诺：没有卡塞米罗未来的新消息，但我知道他的工资很高,https://www.dongqiudi.com/article/3961442
6,足球,新帅会说中文？专门对球迷喊话？欲知详情，来听三镇...,https://n.dongqiudi.com/webapp/tops.html?id=3961437
7,足球,球队动态 | 武汉三镇收队开启备战 新帅带队完成首训,https://www.dongqiudi.com/article/3961435
8,足球,贝巴：曼联只剩足总杯冠军可争取，夺冠能挽救这个赛季,https://www.dongqiudi.com/article/3961434
9,篮球,曾凡博：我不觉得是教练的问题，我能做的就是自己表现好一点,https://www.dongqiudi.com/article/3961423
10,足球,皇马西超杯大名单：贝林厄姆领衔，维尼修斯，克罗斯回归,https://www.dongqiudi.com/article/3961407
11,篮球,主场蒙羞，北京男篮主场输球超过30分，上次距今已4674天,https://www.dongqiudi.com/article/3961391
12,足球,罗马诺：维尔纳今晚抵达热刺，买断条款为1800万-1900万欧,https://www.dongqiudi.com/article/3961390
13,篮球,虾仁猪心！西热力江将自己换下场时，向全场北京球迷鞠躬致谢,https://www.dongqiudi.com/article/3961387
14,篮球,北汽男篮溃败南京！球迷：张云松下课！亚当斯你丫是美国人吗,https://www.dongqiudi.com/article/3961374
15,足球,邮报：皇马看上埃弗顿中卫布兰斯韦特，热刺和曼联也有意,https://www.dongqiudi.com/article/3961368
16,足球,多特官方：瓦茨克将于2025年卸任俱乐部CEO,https://www.dongqiudi.com/article/3961362
17,篮球,北汽主帅乔里欧：向球迷们致歉，但大家还是想去拼想赢比赛的,https://www.dongqiudi.com/article/3961355
18,足球,德天空：拜仁已正式报价韦德拉奥果，转会费约1500万欧,https://www.dongqiudi.com/article/3961354
19,篮球,这才叫外援！布莱克尼爆砍42分，北汽双外援合计仅得到19分,https://www.dongqiudi.com/article/3961335
20,足球,豫媒：李玮锋要求若下午训练中午全队必须统一就餐，严禁外卖,https://www.dongqiudi.com/article/3961319
