index,hot,title,href
1,,发霉啦：今天，我去前夫家里接7岁的闺女,http://jandan.net/p/115822
2,,鸟山明去世了,http://jandan.net/p/115837
3,,如何打破习惯，重新发现生活中的乐趣,http://jandan.net/p/115824
4,,顶尖癌研机构数据造假，引发科学界诚信危机,http://jandan.net/p/115800
5,,令人惊讶的简单方法可以从饮用水中去除微塑料,http://jandan.net/p/115818
6,,突破：预测三体混沌行为的新方法,http://jandan.net/p/115806
7,,数学家利用AI在椭圆曲线中发现了意想不到的模式,http://jandan.net/p/115815
8,,今日好价 0305,http://jandan.net/p/115802
9,,今日好价 0306,http://jandan.net/p/115813
10,,北极可能在十年内出现首个无冰日,http://jandan.net/p/115819
11,,今日好价 0307,http://jandan.net/p/115825
12,,扁豆：从默默无闻到人类文明基石,http://jandan.net/p/115807
13,,今日好价 0308,http://jandan.net/p/115836
14,,触控泛滥：欧洲安全机构拟降级无实体按键车,http://jandan.net/p/115803
15,,相比以前，食物的营养变少了,http://jandan.net/p/115816
16,,为什么在月球上直立着陆这么难,http://jandan.net/p/115804
17,,芯片巨头 ASML 可能离开荷兰,http://jandan.net/p/115829
18,,能否延缓衰老而不生病？,http://jandan.net/p/115834
19,,意外发现：减肥可能增加患癌风险,http://jandan.net/p/115808
20,,无厘头研究：精制碳水早餐会拉低颜值,http://jandan.net/p/115830
21,,长新冠可能导致脑损伤,http://jandan.net/p/115832
22,,“AI将终结癌症”：这个说法同时误解了AI和医疗,http://jandan.net/p/115799
23,,新型“水电池”更便宜、可回收且不会爆炸,http://jandan.net/p/115827
24,,数学中的诗意，诗歌中的数学,http://jandan.net/p/115805
25,,失眠、情绪障碍和生酮饮食,http://jandan.net/p/115831
26,,彗星撞击理论不会消亡,http://jandan.net/p/115817
27,,脑洞：把森林用作巨型中微子探测器,http://jandan.net/p/115833
28,,世界首个再生性听力药物试验成功完成,http://jandan.net/p/115820
29,,研究探索蜥蜴“潜水”的降温效应,http://jandan.net/p/115826
30,,世界变得越来越热，早产风险急剧上升,http://jandan.net/p/115821
