index,hot,title,href
1,足球,国足客战泰国大名单：武磊领衔，蒋光太伤缺，徐浩峰入选,https://www.dongqiudi.com/article/3851727
2,足球,早报：中泰对决，一战定乾坤？,https://www.dongqiudi.com/article/3851689
3,,五大联赛本赛季评分最高的球员,https://www.dongqiudi.com/article/3851807
4,,WhoScored英超新援最佳阵容：切尔西三人入...,https://n.dongqiudi.com/webapp/tops.html?id=3851805
5,,图片报柏林联合方面的消息源表示，前沃尔夫斯堡、法...,https://n.dongqiudi.com/webapp/tops.html?id=3851804
6,,澳大利亚主帅格雷厄姆-阿诺德：伊兰昆达还有一条艰...,https://n.dongqiudi.com/webapp/tops.html?id=3851803
7,足球,朱艺：迎战泰国，中国队将身穿绿色球衣,https://www.dongqiudi.com/article/3851801
8,足球,萨哈：安东尼那两招已经被对手摸透，他必须踢得更多样化才行,https://www.dongqiudi.com/article/3851795
9,,葡萄牙男模团已抵达列支敦士登,https://n.dongqiudi.com/webapp/tops.html?id=3851786
10,,和偶像相互传球是什么感受？梅西与昔日偶像艾马尔一起训练,https://www.dongqiudi.com/article/3851783
11,足球,奥亚萨瓦尔：我会建议队友，有机会的话欧洲杯和奥运会都要去,https://www.dongqiudi.com/article/3851780
12,,世界冠军????????,https://n.dongqiudi.com/webapp/tops.html?id=3851775
13,,图片丨盘点球员“戴帽”的照片！,https://n.dongqiudi.com/webapp/tops.html?id=3851774
14,,卡马文加在国家队在与登贝莱的接触后痛苦倒地法国国...,https://n.dongqiudi.com/webapp/tops.html?id=3851773
15,,????今夏至今身价涨幅榜：弗格森居首，多库、贝林、西...,https://n.dongqiudi.com/webapp/tops.html?id=3851771
16,足球,可爱不？巴顿和爱妻游香港迪士尼，扮成穿曼联球衣的玲娜贝尔,https://www.dongqiudi.com/article/3851768
17,,图评丨罗纳尔多、内马尔、恩德里克的前56场比赛数...,https://n.dongqiudi.com/webapp/tops.html?id=3851767
18,,【视频重译】日本青训教材《防守反击》第3章：高位...,https://n.dongqiudi.com/webapp/tops.html?id=3851766
19,,马塞洛：梅西在比赛中不说话，我也尽量不和他说话，...,https://n.dongqiudi.com/webapp/tops.html?id=3851765
20,,世预赛亚洲区第二阶段C组第1轮，中国男足客场对阵...,https://n.dongqiudi.com/webapp/tops.html?id=3851758
