index,hot,title,href
1,,好书推荐：10本有史以来最好的商业书籍,https://www.36kr.com/p/2436086316094080
2,,五一档两天破8亿：有小惊喜，没有王炸,https://www.36kr.com/p/2759465338370817
3,,一位85后女二代接班,https://www.36kr.com/p/2758498302688007
4,,美国酝酿AI「登月计划」，陶哲轩领衔62页报告重磅发布,https://www.36kr.com/p/2756925535828737
5,,2024，它们排队退市,https://www.36kr.com/p/2758164778203911
6,,奥特曼本人确认：神秘gpt2不是GPT-4.5,https://www.36kr.com/p/2759715893197824
7,,南通首富，十万火急,https://www.36kr.com/p/2758804217139844
8,,价格越卷越疯，月薪几万不敢买瑜伽裤和冲锋衣,https://www.36kr.com/p/2758779907767296
