index,hot,title,href
1,ISUX,提高三倍效率！17个腾讯高手都在用的 Figma 插件,https://www.uisdc.com/figma-ai
2,MiuYan 周妙妍,14个排版微调技巧，瞬间提高两倍设计感！,https://www.uisdc.com/layout-design-tips-2
3,碧野青风,UI设计进阶干货！盒模型间距设计指南,https://www.uisdc.com/box-model-spacing
4,飞波,永久免费可商用！手写毛笔风格的飞波正点体 （已打包）,https://www.uisdc.com/feibo-font
5,陈子木,超全合集！2024 年 UX/UI 设计师都必须尝试的 21 款 AI 工具,https://www.uisdc.com/2024-ai-tools-designer-must-try
6,夏花生,自媒体小白必看！5 招教你轻松做出好看又吸睛的内容封面,https://www.uisdc.com/cover-design-2
7,百度MEUX,AIGC大厂实战！百度二十四节气卡设计升级完整复盘,https://www.uisdc.com/ai-baidu-24-solar-terms
8,张家彬,超多案例！如何让平面设计作品摆脱平庸？,https://www.uisdc.com/poster-design-39
9,夏花生,想让图像快速矢量化？3款免费工具帮你轻松搞定！,https://www.uisdc.com/jpg-to-svg
10,NIC,如何搭建日产20000张图的AIGC工具？完整流程来了！,https://www.uisdc.com/aigc-generation-tool
11,夏花生,设计素材不用愁！7组高质量劳动节主题 Midjourney 提示词,https://www.uisdc.com/midjourney-52
12,张鼎_Ending,18000字干货！写给设计师的版式设计基础知识,https://www.uisdc.com/layout-design-23
13,弗西西丁的AI练习册,爆肝整理！如何用AIGC轻松搞定春季运营海报设计？,https://www.uisdc.com/midjourney-spring-poster
14,Shirley_雪,让学习效率翻倍！设计师必备的知识库搭建指南,https://www.uisdc.com/knowledge-base-system
15,ISUX,腾讯专家7600字力作！如何用「八角行为分析法」轻松打动用户？,https://www.uisdc.com/octalysis
16,京东JellyDesign,大厂 AIGC 提速案例！京东保险UED 项目设计总结,https://www.uisdc.com/jd-ued-aigc
17,姝斐suphie,B端和C端产品有哪些区别？高手总结了这10条！,https://www.uisdc.com/b-and-c-difference-2
18,酸梅干超人,B 端设计飞升，从学习组件设计开始,https://www.uisdc.com/b-end-component-design
19,夏花生,设计素材不用愁！6 组高质量插画类 Midjourney 提示词,https://www.uisdc.com/midjourney-51
20,柴林,产品要不要做设计改版？来看总监的分析！,https://www.uisdc.com/design-redesign
21,黑马青年,用一个实战案例，帮你学会UI设计界面优化思路！,https://www.uisdc.com/ui-interface-design-2
22,百度MEUX,如何做好标签体系设计？收下大厂高手总结！,https://www.uisdc.com/tag-design-3
23,Tomda,7000字干货！写给新手的设计系统入门指南,https://www.uisdc.com/design-system-6
24,张鼎_Ending,超详细干货！设计师应该懂的设计细节,https://www.uisdc.com/design-details-3
25,应骏,求职季福利！UI/UX作品集保姆级设计指南,https://www.uisdc.com/ui-ux-portfolio
26,言川Artie,万字教程！奶奶看了都会的 ComfyUI 入门教程,https://www.uisdc.com/comfyui-3
27,夏花生,效率翻倍！5 款不容错过的免费 AI 神器（三）,https://www.uisdc.com/aigc-tools-4
28,视研设,平面高手出品！用一篇文章教会你素材选择,https://www.uisdc.com/poster-design-36
29,NIC,超详细！写给设计师的LoRa模型训练SOP,https://www.uisdc.com/lora-model-training-sop
30,夏花生,DomoAI 6大新功能详解！可自动扣除背景，支持人物一键跳舞,https://www.uisdc.com/domoai-2
31,姝斐suphie,10个动效细节剖析，看看高手是如何做设计的！,https://www.uisdc.com/10-ui-ux-design-17
32,京东JellyDesign,如何用AIGC加速设计？来看京东3C数码年货节设计复盘（上）,https://www.uisdc.com/aigc-3c
33,京东JellyDesign,京东实战案例！CRM移动端视觉全新升级完整复盘,https://www.uisdc.com/jdl-crm
34,陈子木,第一波！2024年4月精选实用设计工具合集,https://www.uisdc.com/2024-4-design-resources-vol1
35,京东JellyDesign,大厂实战案例！京东B端智能客服IP设计复盘,https://www.uisdc.com/b-end-ip-design-2
36,西城门设计,超多案例！常见的B端弹窗样式设计总结,https://www.uisdc.com/b-end-popup-window
37,Alibaba Design,钉钉AIGC实践！如何用AI一键设计工作台应用图标？,https://www.uisdc.com/aigc-dingding
38,猫仔MAoMAo,10分钟速成！Midjourney 网页版操作指南,https://www.uisdc.com/midjourney-alpha
39,快手电商设计中心,大厂实战案例！AIGC在快手电商设计中的应用,https://www.uisdc.com/aigc-kuaishou
40,菜心¹,用多个实战案例，帮你掌握配色的三个要点！,https://www.uisdc.com/color-matching-5
