index,hot,title,href
1,,脑组织可能是马拉松选手的燃料,http://jandan.net/p/117266
2,,没品笑话集：斯诺克传奇 雷·里尔顿去世，享年91,http://jandan.net/p/117279
3,,冥想和正念也有不为人知的负面影响,http://jandan.net/p/117267
4,,男女疼痛体验或有不同,http://jandan.net/p/117264
5,,令人惊讶的发现：糖凝胶可促进毛发再生,http://jandan.net/p/117297
6,,不只是人类，动物老了也会改变社交习惯,http://jandan.net/p/117293
7,,荷兰免疫学家的使命：复兴被遗忘的救命抗癌药,http://jandan.net/p/117261
8,,落水自救的生存技巧,http://jandan.net/p/117270
9,,今日好价 0730,http://jandan.net/p/117278
10,,生成式AI让电网不堪重负,http://jandan.net/p/117253
11,,是的，我们仍然需要工作,http://jandan.net/p/117258
12,,今日好价 0731,http://jandan.net/p/117286
13,,今日好价 0801,http://jandan.net/p/117291
14,,“大氧化事件”：地球历史上的关键转折,http://jandan.net/p/117292
15,,CRT显示器对像素艺术的影响,http://jandan.net/p/117305
16,,到处都是寄生虫，为什么很少有人研究它们,http://jandan.net/p/117307
17,,史海钩沉：可口可乐里的可卡因,http://jandan.net/p/117306
18,,创造力从根本上来自记忆,http://jandan.net/p/117294
19,,今日好价 0802,http://jandan.net/p/117302
20,,双靶抗生素或让细菌抗药性难以为继,http://jandan.net/p/117255
21,,缺乏锕-225阻碍癌症治疗进展,http://jandan.net/p/117260
22,,今日好价 0803,http://jandan.net/p/117312
23,,新冠疫情增加糖尿病风险,http://jandan.net/p/117259
24,,数字孪生：医生现在可以看到你的“虚拟分身”,http://jandan.net/p/117252
25,,强迫症神经特征在大脑中被发现,http://jandan.net/p/117268
26,,基因研究揭示猴面包树的古老起源,http://jandan.net/p/117296
27,,膳食纤维对高脂饮食小鼠代谢稳态的影响,http://jandan.net/p/117295
28,,新型败血症检测方法有望缩短等待时间,http://jandan.net/p/117263
29,,大脑“恐惧回路”运作原理的新发现,http://jandan.net/p/117308
30,,正念训练如何助力顶尖运动员,http://jandan.net/p/117269
