index,hot,title,href
1,足球,胜利vs布赖代合作：C罗领衔，马内、奥塔维奥、B罗首发出战,https://www.dongqiudi.com/article/4467466
2,足球,冲击沙超杯决赛名额，进圈为胜利加油>>,https://www.dongqiudi.com/article/3202036
3,篮球,纽约市长，特雷-杨：纽约球迷超有趣，有个小女孩对我竖中指,https://www.dongqiudi.com/article/4467587
4,足球,罗马诺：2000万+浮动，米兰提高对福法纳报价，但摩纳哥要更多,https://www.dongqiudi.com/article/4467579
5,足球,什琴斯尼告别尤文：很高兴也很荣幸代表你们征战,https://www.dongqiudi.com/article/4467572
6,足球,巴顿感慨：球队从一开始连比赛服都没有，到现在一步一步很稳定,https://www.dongqiudi.com/article/4467570
7,足球,每体：巴萨不会引进克罗地亚35岁老将佩里西奇,https://www.dongqiudi.com/article/4467565
8,足球,斯基拉：萨瓦将在欧协联资格赛后离开克卢日签约乌迪内斯,https://www.dongqiudi.com/article/4467546
9,足球,Here we go！罗马诺：巴黎签下19岁前锋杜埃，转会费近6000万欧,https://www.dongqiudi.com/article/4467559
10,足球,每个内拉们送一句话给这个男人吧,https://www.dongqiudi.com/article/4467542
11,足球,浙江队是浙江的球队不是杭州的球队,https://www.dongqiudi.com/article/4467541
12,足球,泰山U12比赛惊现感人一幕，看完我流泪了,https://www.dongqiudi.com/article/4467540
13,足球,关于传闻的改名问题,https://www.dongqiudi.com/article/4467539
14,足球,徐正源：累到快要窒息的时候，请坚持过去,https://www.dongqiudi.com/article/4467538
15,足球,格老师告诉你什么叫体面。,https://www.dongqiudi.com/article/4467537
16,足球,霍依伦VS齐尔克泽，及曼联新赛季中锋位置的讨论,https://www.dongqiudi.com/article/4467534
17,足球,英媒：维拉蒂被推荐给多支英超球队，他可能回欧洲踢球,https://www.dongqiudi.com/article/4467527
18,足球,新赛季正式归来之前????与球迷的一些互动,https://n.dongqiudi.com/webapp/tops.html?id=4467532
19,足球,奥尔莫遇上弗里克，巴萨新赛季面临不小挑战,https://www.dongqiudi.com/article/4467060
20,篮球,名记：帕蒂-米尔斯一年330万美元加盟爵士，合同为全额保障,https://www.dongqiudi.com/article/4467514
