index,hot,title,href
1,足球,早报：我射正一次能进俩,https://www.dongqiudi.com/article/3809586
2,足球,剑南春｜热刺客场2-1水晶宫迎联赛4连胜，孙兴慜连场建功,https://www.dongqiudi.com/article/3809555
3,足球,图片报：佩雷茨不想只是担任拜仁第三门将，可能寻求外租,https://www.dongqiudi.com/article/3809668
4,足球,网传迈阿密的对手换成梅州？茹子楠：要是真的，踢完退役都行,https://www.dongqiudi.com/article/3809664
5,足球,记者：申花昨晚抵达天津，巴索戈随队出征，崔麟继续因伤缺席,https://www.dongqiudi.com/article/3809636
6,生活,我的天！贝里奇！居然在ins认证了我送的熊！,https://n.dongqiudi.com/webapp/tops.html?id=3809204
7,生活,咱这才艺去利物浦卖艺应该饿不死吧[滑稽][滑稽]...,https://n.dongqiudi.com/webapp/tops.html?id=3809623
8,足球,米兰为皮奥利颁发200场奖章，CEO富拉尼：希望5月能庆祝夺冠,https://www.dongqiudi.com/article/3809620
9,足球,记者：莱比锡在谈南特左后卫梅兰，球员也被推荐给巴黎,https://www.dongqiudi.com/article/3809614
10,足球,全身心投入备战，意媒：小因扎吉不出席本轮对罗马赛前发布会,https://www.dongqiudi.com/article/3809609
11,足球,澳波：比赛就像考试球员要自己答题，我只提供解决问题的工具,https://www.dongqiudi.com/article/3809604
12,足球,整活儿失败，国米球迷带三万哨子嘘卢卡库遭安全部门禁止,https://www.dongqiudi.com/article/3809600
13,足球,被卡拉格调戏称模仿瓜帅，澳波：内维尔在瓦伦模仿他结果怎样,https://www.dongqiudi.com/article/3809598
14,足球,孙兴慜：我有经验所以还不能说会夺冠；凯恩比我高一个层次,https://www.dongqiudi.com/article/3809595
15,足球,澳波：热刺球迷遭受过相当大的痛苦，我不会抑制他们梦想冠军,https://www.dongqiudi.com/article/3809587
16,足球,维卡里奥：95分钟丢球有点伤心；我们不必过多关注积分榜,https://www.dongqiudi.com/article/3809583
17,足球,皇马公布国家德比海报：贝林厄姆单挑菲利克斯,https://www.dongqiudi.com/article/3809575
18,足球,热刺vs水晶宫球员评分：麦迪逊7.5分，沃德6.2分,https://www.dongqiudi.com/article/3809567
19,足球,赖斯：希望加盟阿森纳产生重大影响，就像范戴克在利物浦那样,https://www.dongqiudi.com/article/3809566
20,足球,水晶宫vs热刺全场数据：射门数13-10，射正数3-1,https://www.dongqiudi.com/article/3809560
