index,hot,title,href
1,,穿袜子做运动，会让人更爽,http://jandan.net/p/116048
2,,光环褪去：风投们对OpenAI的Sam Altman失去耐心,http://jandan.net/p/116043
3,,怀孕会让人变老，还是更年轻？,http://jandan.net/p/116045
4,,专家解析巴尔的摩桥梁坍塌原因,http://jandan.net/p/116059
5,,澳大利亚碳信用项目：一场巨大的骗局,http://jandan.net/p/116058
6,,波音死亡的告密者说出了真相：以安全换利益,http://jandan.net/p/116054
7,,今日好价 0329,http://jandan.net/p/116061
8,,当新员工拿更高薪水时，表现最好的老员工最先辞职,http://jandan.net/p/116079
9,,在中情局的冷战计划里，曾打算用流浪猫作为间谍,http://jandan.net/p/116052
10,,最早预言黑洞的人,http://jandan.net/p/116072
11,,印度摩天楼顶的空中豪宅,http://jandan.net/p/116055
12,,固话正在消失，但对一些人来说它们是生命线,http://jandan.net/p/116057
13,,今日好价 0328,http://jandan.net/p/116051
14,,社会结构可能是人类淘汰尼安德特人的关键,http://jandan.net/p/116042
15,,学历越高越长寿？研究揭示教育与衰老的新关联,http://jandan.net/p/116081
16,,今日好价 0330,http://jandan.net/p/116065
17,,喷墨打印技术不只是可以用来打印纸张,http://jandan.net/p/116053
18,,不到三个小时发现49个新星系,http://jandan.net/p/116041
19,,今日好价 0331,http://jandan.net/p/116083
20,,肠道菌群与抗生素：发现缺失的拼图,http://jandan.net/p/116044
21,,太阳有意识吗？,http://jandan.net/p/116067
22,,孩子们能放下手机吗？,http://jandan.net/p/116078
23,,他汀类药物有助于对抗牙周病,http://jandan.net/p/116038
24,,易碎的记忆：DNA损伤修复是记忆形成关键,http://jandan.net/p/116071
25,,南极洲解冻：地球冰箱亮起红灯,http://jandan.net/p/116069
26,,回春免疫系统：抗体疗法让老龄鼠免疫力年轻化,http://jandan.net/p/116070
27,,第六感：人体健康的重要伙伴,http://jandan.net/p/116080
28,,犹他州率先通过AI法规,http://jandan.net/p/116068
29,,引力波或助人类生命诞生,http://jandan.net/p/116077
30,,DNA“粘合剂”助力高效转化二氧化碳,http://jandan.net/p/116076
