index,hot,title,href
1,,必选消费品中的高股息大蓝筹,http://xueqiu.com/9769652619/291936051
2,,中短期资金互道再见,http://xueqiu.com/8258019402/292035675
3,,业绩高、波动低，全最最硬的优质资产！,http://xueqiu.com/3644637995/291912710
4,,三年，沪深300指数的两个极端,http://xueqiu.com/6828304753/291886797
5,,如果港股低估，那么港交所是否值得投资？,http://xueqiu.com/1643044849/291994496
6,,2024年股东大会行之2023年度茅台股东大会,http://xueqiu.com/7563820738/291871681
7,,医药股投资的优先级,http://xueqiu.com/3727797950/291933911
8,,新城控股23年股东大会见闻,http://xueqiu.com/8932423869/291908532
9,,【围棋十诀】中蕴藏的投资智慧,http://xueqiu.com/8869975766/291772805
10,,自由现金流的朴素本质,http://xueqiu.com/1197490371/291758384
11,,赛力斯问界周销量拐点在即,http://xueqiu.com/6843441724/291825722
12,,猪价接下来会如何演绎？,http://xueqiu.com/5434366543/291815521
13,,简评比亚迪DM五代技术和双车发布会，谈一下感想,http://xueqiu.com/7898126766/291762684
14,,2024年对投资的最新思考,http://xueqiu.com/4556118930/291779379
15,,福寿园2024 股东会见闻和万字股东问答实录,http://xueqiu.com/7815672011/291751847
16,,爱尔眼科 2023 年度股东大会分享,http://xueqiu.com/3439096517/291749594
17,,关于本轮猪周期，部分问题的剖析,http://xueqiu.com/7288375846/291536879
18,,特变电工输变电板块资料梳理,http://xueqiu.com/2048687254/291546704
19,,视频号未来3年能为腾讯控股贡献多少业绩增长,http://xueqiu.com/7889199778/291706906
20,,汹涌澎湃的港股全面牛市已经到来，我们该如何把握这个大机会？,http://xueqiu.com/4348548174/291642554
