index,hot,title,href
1,50亮,好家伙，这中国行，给欧文干成流水线了,https://bbs.hupu.com/628057591.html
2,17亮,(ꐦÒ‸Ó)你个老六,https://bbs.hupu.com/628062817.html
3,50亮,以前觉得欧文很傻，现在觉得是我傻,https://bbs.hupu.com/628053668.html
4,50亮,美媒：伊森是火箭队最被低估的新秀，你认可嘛？,https://bbs.hupu.com/628055986.html
5,39亮,锁子哥出息了，居然让车神出视频喷他菜,https://bbs.hupu.com/628061537.html
6,9亮,一个视频让刺蜜见识一下阿门汤普森的天赋,https://bbs.hupu.com/628063052.html
7,14亮,为什么不看好伊森？,https://bbs.hupu.com/628062728.html
8,10亮,烤肉姐什么意思,https://bbs.hupu.com/628062107.html
9,30亮,如果在《灌篮高手》里选五个高中生组成一个最强阵容，是哪五个人？,https://bbs.hupu.com/628059976.html
10,7亮,烤肉姐的意思应该是小卡缺席训练营，而不是被交易,https://bbs.hupu.com/628062679.html
11,8亮,唉，下赛季怎么办？登哥的连续季后赛记录怕是也要断了,https://bbs.hupu.com/628062167.html
12,50亮,险胜大梦！JRs评选历史34号GOAT：沙奎尔-奥尼尔,https://bbs.hupu.com/628055155.html
13,4亮,兰德尔本人对于出任五号位非常自信,https://bbs.hupu.com/628063637.html
14,9亮,烤肉姐的坏消息和之前快船有意莺歌的消息结合,https://bbs.hupu.com/628061972.html
15,4亮,想看一下穷人接触不到的图片,https://bbs.hupu.com/628063090.html
16,5亮,马刺王朝，邓肯和波波谁更重要？,https://bbs.hupu.com/628063622.html
17,4亮,【存档】SLAM杂志六次历史TOP50球员排名整理,https://bbs.hupu.com/628062819.html
18,3亮,nba哪些事事实上真的发生了，可总有人不信,https://bbs.hupu.com/628063764.html
19,50亮,30天30队前瞻：波士顿凯尔特人——以不变应万变，目标卫冕总冠军,https://bbs.hupu.com/628053292.html
20,6亮,科比08和11年没夺冠最大的罪臣是家嫂还是别人,https://bbs.hupu.com/628063588.html
21,5亮,恩子感觉要终老费城了,https://bbs.hupu.com/628062525.html
22,5亮,近5年没有获得提前续约合同的前三顺位新秀,https://bbs.hupu.com/628061936.html
23,4亮,杜兰特恐怖的地方在于，只要让他空降总亚军球队，立马就能带队夺冠,https://bbs.hupu.com/628063003.html
24,5亮,小卡可能又受伤了，烤肉姐直播说快船媒体日可能会说,https://bbs.hupu.com/628062144.html
25,3亮,怎么还有说乔治上赛季刷数据抢球权的,https://bbs.hupu.com/628062903.html
26,3亮,聊一聊大家的小怪癖,https://bbs.hupu.com/628062735.html
27,3亮,欧文是那种让人讨厌不起来的球员，之前只知道他球风干净，最近越来越有好感了,https://bbs.hupu.com/628062004.html
28,5亮,老张和库里攻坚二选一只能选一个，你选谁？,https://bbs.hupu.com/628061944.html
29,4亮,文班能打破几个队史纪录,https://bbs.hupu.com/628061929.html
30,3亮,恩比德3年1.93亿美元留在76人,https://bbs.hupu.com/628062108.html
31,12亮,上赛季，杰伦格林的防守意识是有问题的。这个问题在后半段得到了一定程度改正。希望即将到来的赛季，这个问题得到彻底改正。,https://bbs.hupu.com/628060478.html
32,24亮,好家伙 车神新一期视频疯狂拷打锁汉啊,https://bbs.hupu.com/628061496.html
33,24亮,申京和斯科拉谁更厉害。,https://bbs.hupu.com/628058784.html
34,13亮,【经典时刻回顾】东契奇最后时刻扳平或绝杀出手尝试回顾：他的关键时刻表现怎么,https://bbs.hupu.com/628057621.html
35,7亮,预测阿门、小贾与伊森新赛季数据,https://bbs.hupu.com/628059767.html
36,8亮,说出你认为的火箭队一年后的先发阵容,https://bbs.hupu.com/628060643.html
37,6亮,麦迪尴尬了，四大分卫三个全退球衣了，就剩他,https://bbs.hupu.com/628061465.html
38,4亮,火箭队教练组在联盟里什么水平？,https://bbs.hupu.com/628060324.html
39,3亮,火箭最后一个名额，博班和考文顿二选一，你选谁？,https://bbs.hupu.com/628061208.html
40,3亮,做为火箭球迷，是不是应该给自家球员投票呢。,https://bbs.hupu.com/628060908.html
41,27亮,想不明白一个事格林作为一个低效球员,https://bbs.hupu.com/628057336.html
42,17亮,纳什在小牛最后一场季后赛还能贡献24+7+14的豪华数据，为什么库班还要放走他，纳什不去太阳，西部就少一支豪强。,https://bbs.hupu.com/628061111.html
43,19亮,热火队史第一人韦德，在NBA21世纪的历史地位能排前5吗？,https://bbs.hupu.com/628060805.html
44,22亮,我说假如，科比08年夺冠，形成三连冠，拥有两个三连冠，将会排在第几？,https://bbs.hupu.com/628060476.html
45,3亮,常规操作,https://bbs.hupu.com/628061861.html
46,15亮,大新闻！烤肉姐直播说下周二左右，快船会官方宣布“坏消息”。,https://bbs.hupu.com/628061047.html
47,7亮,是库里成就了杜兰特多一点，还是杜兰特成就库里多一点,https://bbs.hupu.com/628061644.html
48,11亮,美媒专家（Dan Favale）模拟太阳、公牛、火箭三方交易,https://bbs.hupu.com/628061250.html
49,15亮,烤肉姐报道:快船有个坏消息，不知道是啥,https://bbs.hupu.com/628060535.html
50,16亮,【休赛期数据贴-017】NBA近十年榜眼在第三赛季的高阶数据表现情况,https://bbs.hupu.com/628056683.html
51,8亮,哈登真的不借钱给霍华德吗？,https://bbs.hupu.com/628061246.html
52,49亮,请大家看一下，这球算走步吗,https://bbs.hupu.com/628053582.html
53,4亮,2016年的骑士欧文是真是老二吗？为什么勇士球迷都说当年看到欧文拿球就瑟瑟发抖呢？,https://bbs.hupu.com/628061440.html
54,9亮,看了快船五年球了，我真受不了这打击了。,https://bbs.hupu.com/628060892.html
55,15亮,申京像不像生涯前期的霍福德，也是攻强守弱,https://bbs.hupu.com/628057436.html
56,5亮,今天惊喜地收到了谢泼德的回信和签名,https://bbs.hupu.com/628057392.html
57,5亮,巅峰对比，谁才是真正的得分王？,https://bbs.hupu.com/628061392.html
58,6亮,坏消息,https://bbs.hupu.com/628061006.html
59,4亮,勇士新赛季首发是谁呀，想了半天中锋还是卢尼，他还能称得起吗？,https://bbs.hupu.com/628061190.html
60,11亮,伊森受伤前已经比新秀赛季中投好多了 有几场比赛是靠他第四节发挥赢下来了 下赛季要是给首发给时间 场均16+10+3+2+1问题不大 要是能保持健康应该是火箭这堆小年轻里面进步最大的一位了,https://bbs.hupu.com/628056863.html
