index,hot,title,href
1,11274887,全球发音震撼麦迪
2,11114436,由小米SU7看中国汽车市场价格战
3,11107042,2024中国网络媒体论坛
4,10555463,当我给外国人展示机械簪花
5,9852263,上海时装周新中式风
6,9746248,不同歌星的演唱会公式
7,8549293,这是一场特殊的爆改
8,8522433,樊振东2:4爆冷不敌雨果
9,8484212,重庆辟谣一储户被“抢杀”
10,8455555,这些短视频收割方式要警惕
11,8421750,回春丹 从痛苦中开出鲜花
12,8415157,俄方：恐袭嫌疑人欲到基辅领赏
13,8411666,万达将获约600亿元投资
14,8408373,雷军为张颂文准备了SU7
15,8354546,小米汽车狂飙24小时
16,8348620,家庭版张元英转圈
17,8347974,赵奕欢加盟无限超越班
18,8343607,魏若来娃娃亲找上门了
19,8341678,金刚和小金刚究竟什么关系
20,8333377,与凤行观后感
21,8328876,陈震回应视频争议
22,8313515,当美国室友第一次吃淀粉肠
23,8299255,王婆上台有多难
24,8295161,邓紫棋合肥演唱会
25,8292737,李铁被曝曾在更衣室骂队友
26,8286169,泽连斯基对和谈松口
27,8277866,沈璃战死
28,8275581,白鹿奔跑吧给Fate打歌
29,8272609,王者黄盾不死流曹操打法
30,8271161,王婆哭了
31,8214034,俄格鲁乌特种部队上校死于恐袭
32,8182098,王菲李嫣机场同框
33,8170970,江西致2死4伤肇事司机被抓
34,8140239,终于等到行止冰封东海
35,8114648,斗破苍穹萧炎众人遭遇空间风暴
36,8101353,鞠婧祎红衣卧底舞
37,8083320,闪电击中广州塔
38,8071629,王婆怒斥男子浪费时间
39,8060771,光刻机巨头阿斯麦计划搬离荷兰
40,8055696,行止的爱拿得出手
41,8038778,代号鸢周年庆
42,8018454,厦门民房发生火灾致4死
43,8000726,甜的是孙千陈靖可忙的是何老师
44,7997143,山东小钺钺已有轻微意识仍在ICU
45,7957866,路真真换男友吧
46,7945888,红衣醉开播
47,7939432,九龙城寨古天乐气场两米八
48,7929964,韦世豪新发色亮相发布会
49,7881551,诛仙动画2开播
50,7802999,灵岩也挑战张元英转圈了
