index,hot,title,href
1,11712224,全面禁燃烟花爆竹不合法
2,11423304,中国小姐申请出战
3,11369073,中国首艘大洋钻探船试航
4,11166999,大学老师课堂演示催眠术
5,10979496,李善均去世现场曝光
6,10930318,梅尼耶哥们是海王
7,10861339,甘荣坤受贿1.66亿被判无期
8,10705375,第一次感受到鹅的尴尬
9,10264684,捐赠震区羽绒服被倒卖为谣言
10,9845085,论狗子的模仿能力有多强
11,9649728,猫咪以为自己叫天猫精灵
12,9378725,小狗乖乖
13,9369797,母女酒吧点一杯酒被嫌弃太少
14,9303557,猫猫：我就爱吃手抓饭
15,9258047,河南14岁初中生校内坠亡
16,9189586,刘德华邀梁朝伟听演唱会
17,9004935,一首歌告别2023
18,8973498,周海媚死因公布
19,8919015,3娃非亲生案女方母亲发声
20,8910075,刘美含短剧跨年夜陌生女人登门
21,8839454,京东也将支持仅退款
22,8772465,解锁天天跺脚生闷气
23,8670955,大合唱版西楼儿女
24,8643559,关晓彤cos孙尚香
25,8624972,林俊杰回应粉丝用筋膜枪抢票
26,8543901,赵露思回应半夜看锅包肉大战
27,8449312,薛之谦请卖画救母女孩看演唱会
28,8410162,2023为自己代言打歌大赛
29,8296567,荣耀Magic 6搭载卫星通信
30,8252658,iQOO Neo9新机发布
31,8181082,胡静推荐云南美食
32,8159323,跟着董宇辉在抖音学习
33,8105095,董宇辉新账号粉丝数破百万
34,8058736,小时候做过的丢人事
35,8013184,电影三大队成年人的酒桌好唏嘘
36,7977753,这是真的篮球宝贝
37,7968021,程雨杉拥抱妈妈解开心结
38,7962436,你肯定觉得我的2023没意思
39,7940723,谁才是三星堆面具的主人
40,7843950,媒体：借口安全禁放烟花是一刀切
41,7808486,媒体评董宇辉新号涨粉百万
42,7779740,当代大学生期末考试现状
43,7756116,新鲜感只有一年吗
44,7742843,这样看潜行一定行
45,7738956,2023年度十个健康谣言
46,7735496,下次见面就是2024年了
47,7651679,繁花开播
48,7599371,毛毛姐陪阿姨回老家了
49,7528478,李善均生平回顾
50,7495201,校长用银杏叶堆出龙形图案
