index,hot,title,href
1,161,万般皆是命 半点不由人,https://www.guozaoke.com/t/106981
2,128,婆婆很bt，还要同住，该咋办！？,https://www.guozaoke.com/t/106908
3,110,我说把家里的车卖给老丈人，我老婆说我算计他爸。,https://www.guozaoke.com/t/106907
4,85,这两场大雪，东湖高新是不是躺平了？,https://www.guozaoke.com/t/106920
5,71,当下的社保养老金制度合理吗？,https://www.guozaoke.com/t/107003
6,62,不是四驱车就自觉点别上路了嘛,https://www.guozaoke.com/t/106875
7,61,真诚咨询，各位已婚人士的老婆都在干什么？,https://www.guozaoke.com/t/106889
8,60,为什么退休金不一样，大家恨财富分配方式，姚安娜靠背景做自己不擅长的事，大家很宽容？,https://www.guozaoke.com/t/107065
9,58,985码农过年回家，光环逐渐褪去,https://www.guozaoke.com/t/106900
10,57,如果房地产一直萎靡不振甚至继续下跌，经济会好起来吗？,https://www.guozaoke.com/t/107025
