index,hot,title,href
1,72,跟不礼让行人车主和交警杠上了,https://www.guozaoke.com/t/107163
2,69,诚心问下各位，你愿意把房子加上老婆的名字吗？,https://www.guozaoke.com/t/107221
3,63,佛祖岭周边三大商业项目,https://www.guozaoke.com/t/107106
4,63,为什么现在还有人买油车？,https://www.guozaoke.com/t/107231
5,62,有给孩子打过生长激素的吗？,https://www.guozaoke.com/t/107081
6,62,问问大家，女生32岁年薪30万在光谷片区属于什么水平？,https://www.guozaoke.com/t/107099
7,57,自爆一下吧，开车方面我是个低素质的,https://www.guozaoke.com/t/107165
8,48,裁员担忧了半年，成喜事了。,https://www.guozaoke.com/t/107173
9,47,信号塔对小区有影响么？怎么解决这个问题,https://www.guozaoke.com/t/107216
10,46,在武汉开一家麦当劳要多少钱？,https://www.guozaoke.com/t/107207
