index,hot,title,href
1,3609,狮子连弹放手一搏！志乃实力深不可测 - 火影忍者第6期,http://www.acfun.cn/v/ac46289086
2,8926,★求投五蕉★网络上常见的热门短视频集锦 第一千九百八十八期,http://www.acfun.cn/v/ac46287813
3,5107,油亮白丝/旗袍玉兔~广寒宫~秋天快乐【巫小萤】,http://www.acfun.cn/v/ac46288175
4,3620,黑神话夺冠！IGN玩不起了！【绅批】,http://www.acfun.cn/v/ac46291376
5,1.3万,她真的很会！！！★手机竖屏1283★,http://www.acfun.cn/v/ac46287504
6,6613,★求投五蕉★网络上常见的热门短视频集锦 第一千九百八十九期,http://www.acfun.cn/v/ac46289225
7,3878,来自山东女孩的压迫感！欢乐八点档-1052,http://www.acfun.cn/v/ac46290155
8,3900,麦 克 雷【今天有什么好笑的 #1695】,http://www.acfun.cn/v/ac46290008
9,1522,这不是你女朋友吗~,http://www.acfun.cn/v/ac46287503
10,1783,独断万古单挑王？我就不信字母哥到了2K25中还能天下无敌？,http://www.acfun.cn/v/ac46289861
11,1258,夏天拜拜要永远在一起哦【落落】,http://www.acfun.cn/v/ac46290630
12,1737,第一次吃全驴宴！竟然还有炭烤驴肉串？！,http://www.acfun.cn/v/ac46289153
13,1447,这款街机游戏出现在1991年还是太抽象了一点！,http://www.acfun.cn/v/ac46291406
14,1653,翻唱：再见往事,http://www.acfun.cn/v/ac46289315
15,1418,中世纪街溜子模拟器来也！顶级历史游戏超神归来？【一周动力】9月第四周,http://www.acfun.cn/v/ac46288684
16,2011,过程和内容不重要，大家喜欢就好,http://www.acfun.cn/v/ac46288092
17,1498,美体紧身衣，果然还是金发辣妹会穿……,http://www.acfun.cn/v/ac46267472
18,2469,少数民族太慷慨了,http://www.acfun.cn/v/ac46289362
19,1273,月牙骨怎么做好吃？大厨教你酒店特色做法，香辣过瘾，越吃越上瘾,http://www.acfun.cn/v/ac46291086
20,1371,【奥雷】香港娱乐圈有多肮脏？这部电影或许能给你答案！《艺坛照妖镜》,http://www.acfun.cn/v/ac46291490
21,1234,中古英语七曜日凭什么是这个顺序,http://www.acfun.cn/v/ac46290656
22,1191,关于被同学发现当V并被问“脚臭主播”这件事,http://www.acfun.cn/v/ac46291054
23,1370,【何止】中途停拍，票房惨淡，这国产电影被严重低估了《一江春水》,http://www.acfun.cn/v/ac46290543
24,1396,每天一遍，烦恼再见”,http://www.acfun.cn/v/ac46289117
25,1109,【小子贼疯】Ghost Swing（cover : YELLOW黄宣）,http://www.acfun.cn/v/ac46291688
26,1117,在华外国人出点事就要痛骂义和团，究竟什么人这么恨义和团？,http://www.acfun.cn/v/ac46288157
27,1185,cos食铁兽去看食铁兽啦,http://www.acfun.cn/v/ac46290862
28,1051,【尘白禁区MMD/4k60帧】拜托了，沈河大佬！,http://www.acfun.cn/v/ac46289997
29,1663,加拿大博主：在中国最奢华城市尝试不食猪族人餐厅 | 上海EP12 维吾尔餐厅,http://www.acfun.cn/v/ac46287955
30,1039,“杨幂”也来唱「可怜」啦,http://www.acfun.cn/v/ac46291491
