index,hot,title,href
1,133,不再讨论,https://www.guozaoke.com/t/113355
2,83,同济的医生都这个样吗？,https://www.guozaoke.com/t/113260
3,66,黑叔叔又收获满满,https://www.guozaoke.com/t/113338
4,62,怒砸8500亿修运河，内陆会崛起么？,https://www.guozaoke.com/t/113333
5,61,深圳打工6年的仔想回武汉买房，求建议,https://www.guozaoke.com/t/113301
6,60,论坛大家第一次报警是因为什么事情？解决了吗？,https://www.guozaoke.com/t/113290
7,50,大公馆商业地块,https://www.guozaoke.com/t/113372
8,48,有没有董哥说一下为啥苹果只要求腾讯交苹果税,https://www.guozaoke.com/t/113264
9,47,《易车圈速榜》秦L开赛道比34C快,https://www.guozaoke.com/t/113257
10,46,大基建该停了，唯G D P论的考核制度也该熄火了,https://www.guozaoke.com/t/113427
