index,hot,title,href
1,5.2万,当时听邻居说的，晚上根本睡不着，过了一周才缓过来,http://club.kdslife.com/t_11324050.html
2,4.2万,纳斯达克崩了，快逃命啊！,http://club.kdslife.com/t_11323794.html
3,4.1万,南京的姑娘颜值都可以啊,http://club.kdslife.com/t_11323846.html
4,4.6万,危险了。。。,http://club.kdslife.com/t_11324124.html
5,3.4万,胡牌要结束了？？？？,http://club.kdslife.com/t_11323985.html
6,3.3万,江苏真是地狱模式,http://club.kdslife.com/t_11324169.html
7,3.5万,郎朗老婆什么情况？假的？,http://club.kdslife.com/t_11323929.html
8,3.2万,才知道，公司里面有个76年小姑娘还单身呢,http://club.kdslife.com/t_11323955.html
9,3.0万,上海马路上几乎8成的外卖电瓶车最高速度50km左右，这已经比国标翻倍不止了,http://club.kdslife.com/t_11323910.html
10,2.9万,中本电力没进，却能进复旦附中,http://club.kdslife.com/t_11323964.html
11,3.3万,霉霉来上海？,http://club.kdslife.com/t_11323802.html
12,2.7万,谁知道以前的警校生是怎么入警的？,http://club.kdslife.com/t_11323968.html
13,2.5万,抖音被骗600的经历，希望各位警惕,http://club.kdslife.com/t_11323992.html
14,2.5万,理性讨论，巴尔加斯是否已经超过了胡尔克？,http://club.kdslife.com/t_11323791.html
15,2.5万,老实人混得不好的原因可能有以下几点,http://club.kdslife.com/t_11323793.html
16,2.4万,这下好玩了,http://club.kdslife.com/t_11323922.html
17,2.5万,老爹刚走不久娃哈哈公主就要退位了,http://club.kdslife.com/t_11324002.html
18,2.4万,虹口的学渣最最幸福,http://club.kdslife.com/t_11324070.html
19,2.4万,出大事了，你们公司电脑挂了吗,http://club.kdslife.com/t_11324363.html
20,2.3万,上海平均工资13617，有多少TF达标了？,http://club.kdslife.com/t_11324076.html
