index,hot,title,href
1,12628170,三只羊被罚没6894.91万元
2,12211298,外资抄底中国资产
3,11879470,钻地7000米能看到什么
4,11645319,德里克罗斯宣布退役
5,10740739,如鸢攻略
6,10515190,如何把握房地产行业底部反转
7,9300434,抖音学霸们开始哄我学习了
8,9292766,三只羊回应被罚
9,9228926,李雪琴首映礼咋就跪下了
10,9037902,五角大楼回应中国发射洲际导弹
11,8817093,五哈5官宣
12,8649998,韩媒称韩国已被中国超越
13,8463609,像风一样地自由出走
14,8371392,重庆沙坪坝突发7级地震系谣言
15,7801263,沈梦辰吃瓜王嘉尔
16,7757310,东北雨姐道歉
17,7741533,秋季风衣穿搭大赏
18,7737436,如何看待火箭军发射洲际弹道导弹
19,7710907,原来我们都到了可以自驾游的年纪
20,7690069,杨紫现身成都出席活动
21,7686068,三角洲全球FPS全明星赛
22,7680355,Faker获赠名人堂定制款奔驰
23,7676588,用公路旅行丈量这个世界
24,7669155,CBA俱乐部杯抽签：辽京疆同组
25,7667663,叮崽摇舞蹈挑战
26,7662422,失眠飞行舞挑战
27,7654447,三角洲行动今日上线
28,7649434,这小猫谁养谁不迷糊啊
29,7646351,用刀郎的歌记录中年生活
30,7645672,周楷恒直播回应柯冉离队
31,7644902,这一刻感受到自律的杀伤力
32,7642887,黄龄成伴唱了
33,7642597,胡冰卿新片爆改粉发病娇女
34,7641024,我会让你一直等着
35,7639669,人民币汇率大涨如何影响普通人
36,7639017,吃完了也就下班了
37,7637157,拜拜哈哈超甜手势舞
38,7633428,三折叠怎么折玩梗大赛
39,7630243,旷个课全网都知道了
40,7628636,火箭军发射洲际弹道导弹图片公布
41,7624143,明明深爱着你
42,7624075,打卡国庆旅行第一站
43,7621636,大兴安岭秋意渐浓美如画
44,7619983,穿着雅丹风我上班都硬气了
45,7612599,我本千金开播
46,7537310,天津这个地方太复杂了
47,7536360,吃货的国庆美食清单
48,7456035,整个评论区都在给视频找BGM
49,7387430,跟着沙威玛一起说多国语言
50,7382655,外交部提醒近期暂不前往黎巴嫩
